00:24:31.259735 Loopback, skipCount 0,  invalid (256)
00:24:31.920228 IP ip136.ip-94-23-149.eu.9100 > 192.168.75.233.42066: Flags [P.], seq 3036600766:3036601302, ack 910366283, win 501, options [nop,nop,TS val 1407619781 ecr 1246236678], length 536
00:24:31.920276 IP 192.168.75.233.42066 > ip136.ip-94-23-149.eu.9100: Flags [.], ack 536, win 2565, options [nop,nop,TS val 1246242613 ecr 1407619781], length 0
00:24:32.786498 IP 192.168.75.233.59254 > bns1.hananet.net.domain: 56610+ PTR? 233.75.168.192.in-addr.arpa. (45)
00:24:32.787990 IP bns1.hananet.net.domain > 192.168.75.233.59254: 56610 NXDomain 0/0/0 (45)
00:24:32.788169 IP 192.168.75.233.38399 > bns1.hananet.net.domain: 64494+ PTR? 136.149.23.94.in-addr.arpa. (44)
00:24:32.789828 IP bns1.hananet.net.domain > 192.168.75.233.38399: 64494 1/0/0 PTR ip136.ip-94-23-149.eu. (79)
00:24:33.807721 IP 192.168.75.233.56005 > bns1.hananet.net.domain: 20922+ PTR? 82.163.220.210.in-addr.arpa. (45)
00:24:33.808997 IP bns1.hananet.net.domain > 192.168.75.233.56005: 20922 1/0/0 PTR bns1.hananet.net. (75)
00:24:35.855501 IP 192.168.75.233.47872 > we.love.servers.at.ioflood.net.https: Flags [.], ack 1740116576, win 24570, options [nop,nop,TS val 1441497636 ecr 3006314008], length 0
00:24:36.011416 IP we.love.servers.at.ioflood.net.https > 192.168.75.233.47872: Flags [.], ack 1, win 501, options [nop,nop,TS val 3006324249 ecr 1441467138], length 0
00:24:36.747850 IP 192.168.75.233.35004 > 104.16.218.109.https: Flags [P.], seq 1576135286:1576135325, ack 607731668, win 501, options [nop,nop,TS val 141235881 ecr 3268191400], length 39
00:24:36.748008 IP 192.168.75.233.35004 > 104.16.218.109.https: Flags [P.], seq 39:63, ack 1, win 501, options [nop,nop,TS val 141235881 ecr 3268191400], length 24
00:24:36.748034 IP 192.168.75.233.35004 > 104.16.218.109.https: Flags [F.], seq 63, ack 1, win 501, options [nop,nop,TS val 141235881 ecr 3268191400], length 0
00:24:36.749144 IP ip136.ip-94-23-149.eu.9100 > 192.168.75.233.42066: Flags [P.], seq 536:1072, ack 1, win 501, options [nop,nop,TS val 1407624610 ecr 1246242613], length 536
00:24:36.749174 IP 192.168.75.233.42066 > ip136.ip-94-23-149.eu.9100: Flags [.], ack 1072, win 2573, options [nop,nop,TS val 1246247442 ecr 1407624610], length 0
00:24:36.758428 IP 104.16.218.109.https > 192.168.75.233.35004: Flags [.], ack 64, win 9, options [nop,nop,TS val 3268244542 ecr 141235881], length 0
00:24:36.759112 IP 104.16.218.109.https > 192.168.75.233.35004: Flags [F.], seq 1, ack 64, win 9, options [nop,nop,TS val 3268244543 ecr 141235881], length 0
00:24:36.759136 IP 192.168.75.233.35004 > 104.16.218.109.https: Flags [.], ack 2, win 501, options [nop,nop,TS val 141235892 ecr 3268244543], length 0
00:24:36.879723 IP 192.168.75.233.49923 > bns1.hananet.net.domain: 3641+ PTR? 186.161.189.107.in-addr.arpa. (46)
00:24:36.881077 IP bns1.hananet.net.domain > 192.168.75.233.49923: 3641 1/0/0 PTR we.love.servers.at.ioflood.net. (90)
00:24:36.881293 IP 192.168.75.233.47648 > bns1.hananet.net.domain: 61065+ PTR? 109.218.16.104.in-addr.arpa. (45)
00:24:36.882819 IP bns1.hananet.net.domain > 192.168.75.233.47648: 61065 NXDomain 0/0/0 (45)
00:24:37.804653 ARP, Request who-has 192.168.75.233 tell DASAN_H660N.domain.name, length 46
00:24:37.804665 ARP, Reply 192.168.75.233 is-at 70:85:c2:d2:8f:44 (oui Unknown), length 28
00:24:37.903881 IP 192.168.75.233.34070 > bns1.hananet.net.domain: 6693+ PTR? 1.75.168.192.in-addr.arpa. (43)
00:24:37.905055 IP bns1.hananet.net.domain > 192.168.75.233.34070: 6693* 1/0/0 PTR DASAN_H660N.domain.name. (80)
00:24:41.241088 IP 146.66.152.53.https > 192.168.75.233.56377: Flags [P.], seq 767223110:767223201, ack 2370800294, win 5279, options [nop,nop,TS val 1740250241 ecr 3869172459], length 91
00:24:41.241134 IP 192.168.75.233.56377 > 146.66.152.53.https: Flags [.], ack 91, win 32406, options [nop,nop,TS val 3869190985 ecr 1740250241], length 0
00:24:41.280087 Loopback, skipCount 0,  invalid (256)
00:24:41.901855 IP lb-140-82-113-26-iad.github.com.https > 192.168.75.233.44140: Flags [P.], seq 4227765363:4227765404, ack 4007992815, win 143, options [nop,nop,TS val 4238811929 ecr 4265887236], length 41
00:24:41.902896 IP 192.168.75.233.44140 > lb-140-82-113-26-iad.github.com.https: Flags [P.], seq 1:46, ack 41, win 501, options [nop,nop,TS val 4265947232 ecr 4238811929], length 45
00:24:41.999781 IP 192.168.75.233.33154 > bns1.hananet.net.domain: 38323+ PTR? 53.152.66.146.in-addr.arpa. (44)
00:24:42.001211 IP bns1.hananet.net.domain > 192.168.75.233.33154: 38323 NXDomain 0/0/0 (44)
00:24:42.001487 IP 192.168.75.233.39402 > bns1.hananet.net.domain: 60743+ PTR? 26.113.82.140.in-addr.arpa. (44)
00:24:42.002975 IP bns1.hananet.net.domain > 192.168.75.233.39402: 60743 1/0/0 PTR lb-140-82-113-26-iad.github.com. (89)
00:24:42.009043 IP 192.168.75.233.49529 > bns1.hananet.net.domain: 10236+ A? alive.github.com. (34)
00:24:42.009058 IP 192.168.75.233.49529 > bns1.hananet.net.domain: 24289+ AAAA? alive.github.com. (34)
00:24:42.016800 IP bns1.hananet.net.domain > 192.168.75.233.49529: 10236 2/0/0 CNAME live.github.com., A 140.82.112.26 (69)
00:24:42.016855 IP bns1.hananet.net.domain > 192.168.75.233.49529: 24289 1/1/0 CNAME live.github.com. (137)
00:24:42.018193 IP 192.168.75.233.55635 > bns1.hananet.net.domain: 48397+ A? alive.github.com. (34)
00:24:42.018210 IP 192.168.75.233.55635 > bns1.hananet.net.domain: 40462+ AAAA? alive.github.com. (34)
00:24:42.018960 IP bns1.hananet.net.domain > 192.168.75.233.55635: 48397 2/0/0 CNAME live.github.com., A 140.82.112.26 (79)
00:24:42.019136 IP bns1.hananet.net.domain > 192.168.75.233.55635: 40462 1/0/0 CNAME live.github.com. (63)
00:24:42.021801 IP 192.168.75.233.44876 > lb-140-82-112-26-iad.github.com.https: Flags [S], seq 723886037, win 64240, options [mss 1460,sackOK,TS val 3303720539 ecr 0,nop,wscale 7], length 0
00:24:42.099956 IP lb-140-82-113-26-iad.github.com.https > 192.168.75.233.44140: Flags [.], ack 46, win 143, options [nop,nop,TS val 4238812127 ecr 4265947232], length 0
00:24:42.102699 IP lb-140-82-113-26-iad.github.com.https > 192.168.75.233.44140: Flags [P.], seq 41:65, ack 46, win 143, options [nop,nop,TS val 4238812130 ecr 4265947232], length 24
00:24:42.102726 IP lb-140-82-113-26-iad.github.com.https > 192.168.75.233.44140: Flags [F.], seq 65, ack 46, win 143, options [nop,nop,TS val 4238812130 ecr 4265947232], length 0
00:24:42.102876 IP 192.168.75.233.44140 > lb-140-82-113-26-iad.github.com.https: Flags [P.], seq 46:70, ack 66, win 501, options [nop,nop,TS val 4265947432 ecr 4238812130], length 24
00:24:42.102906 IP 192.168.75.233.44140 > lb-140-82-113-26-iad.github.com.https: Flags [F.], seq 70, ack 66, win 501, options [nop,nop,TS val 4265947432 ecr 4238812130], length 0
00:24:42.212839 IP lb-140-82-112-26-iad.github.com.https > 192.168.75.233.44876: Flags [S.], seq 2224619822, ack 723886038, win 65535, options [mss 1436,sackOK,TS val 3641870385 ecr 3303720539,nop,wscale 10], length 0
00:24:42.212918 IP 192.168.75.233.44876 > lb-140-82-112-26-iad.github.com.https: Flags [.], ack 1, win 502, options [nop,nop,TS val 3303720730 ecr 3641870385], length 0
00:24:42.216650 IP 192.168.75.233.44876 > lb-140-82-112-26-iad.github.com.https: Flags [P.], seq 1:518, ack 1, win 502, options [nop,nop,TS val 3303720734 ecr 3641870385], length 517
00:24:42.298388 IP lb-140-82-113-26-iad.github.com.https > 192.168.75.233.44140: Flags [R], seq 4227765429, win 0, length 0
00:24:42.411831 IP lb-140-82-112-26-iad.github.com.https > 192.168.75.233.44876: Flags [P.], seq 1:2849, ack 518, win 66, options [nop,nop,TS val 3641870584 ecr 3303720734], length 2848
00:24:42.411907 IP 192.168.75.233.44876 > lb-140-82-112-26-iad.github.com.https: Flags [.], ack 2849, win 496, options [nop,nop,TS val 3303720929 ecr 3641870584], length 0
00:24:42.411918 IP lb-140-82-112-26-iad.github.com.https > 192.168.75.233.44876: Flags [P.], seq 2849:3499, ack 518, win 66, options [nop,nop,TS val 3641870584 ecr 3303720734], length 650
00:24:42.411933 IP 192.168.75.233.44876 > lb-140-82-112-26-iad.github.com.https: Flags [.], ack 3499, win 491, options [nop,nop,TS val 3303720929 ecr 3641870584], length 0
00:24:42.426839 IP 192.168.75.233.44876 > lb-140-82-112-26-iad.github.com.https: Flags [P.], seq 518:582, ack 3499, win 501, options [nop,nop,TS val 3303720944 ecr 3641870584], length 64
00:24:42.427122 IP 192.168.75.233.44876 > lb-140-82-112-26-iad.github.com.https: Flags [P.], seq 582:1709, ack 3499, win 501, options [nop,nop,TS val 3303720944 ecr 3641870584], length 1127
00:24:42.617351 IP lb-140-82-112-26-iad.github.com.https > 192.168.75.233.44876: Flags [P.], seq 3499:3578, ack 582, win 66, options [nop,nop,TS val 3641870790 ecr 3303720944], length 79
00:24:42.617394 IP lb-140-82-112-26-iad.github.com.https > 192.168.75.233.44876: Flags [P.], seq 3578:3657, ack 582, win 66, options [nop,nop,TS val 3641870790 ecr 3303720944], length 79
00:24:42.617896 IP 192.168.75.233.44876 > lb-140-82-112-26-iad.github.com.https: Flags [.], ack 3657, win 501, options [nop,nop,TS val 3303721135 ecr 3641870790], length 0
00:24:42.618740 IP lb-140-82-112-26-iad.github.com.https > 192.168.75.233.44876: Flags [P.], seq 3657:4200, ack 1709, win 68, options [nop,nop,TS val 3641870791 ecr 3303720944], length 543
00:24:42.622604 IP 192.168.75.233.44876 > lb-140-82-112-26-iad.github.com.https: Flags [P.], seq 1709:2080, ack 4200, win 501, options [nop,nop,TS val 3303721140 ecr 3641870791], length 371
00:24:42.744448 IP 192.168.75.233.42066 > ip136.ip-94-23-149.eu.9100: Flags [P.], seq 1:537, ack 1072, win 2573, options [nop,nop,TS val 1246253437 ecr 1407624610], length 536
00:24:42.814449 IP lb-140-82-112-26-iad.github.com.https > 192.168.75.233.44876: Flags [P.], seq 4200:4273, ack 2080, win 70, options [nop,nop,TS val 3641870987 ecr 3303721140], length 73
00:24:42.855856 IP 192.168.75.233.44876 > lb-140-82-112-26-iad.github.com.https: Flags [.], ack 4273, win 501, options [nop,nop,TS val 3303721373 ecr 3641870987], length 0
00:24:42.919497 IP 192.168.75.233.43250 > bns1.hananet.net.domain: 52226+ A? p2p-seo1.discovery.steamserver.net. (52)
00:24:42.930220 IP bns1.hananet.net.domain > 192.168.75.233.43250: 52226 4/0/0 A 146.66.152.44, A 146.66.152.38, A 146.66.152.39, A 146.66.152.43 (116)
00:24:43.008922 IP ip136.ip-94-23-149.eu.9100 > 192.168.75.233.42066: Flags [.], ack 537, win 501, options [nop,nop,TS val 1407630870 ecr 1246253437], length 0
00:24:43.023911 IP 192.168.75.233.36255 > bns1.hananet.net.domain: 4238+ PTR? 26.112.82.140.in-addr.arpa. (44)
00:24:43.069541 IP bns1.hananet.net.domain > 192.168.75.233.36255: 4238 1/0/0 PTR lb-140-82-112-26-iad.github.com. (89)
00:24:46.095497 IP 192.168.75.233.47872 > we.love.servers.at.ioflood.net.https: Flags [.], ack 1, win 24570, options [nop,nop,TS val 1441507876 ecr 3006324249], length 0
00:24:46.247692 IP we.love.servers.at.ioflood.net.https > 192.168.75.233.47872: Flags [.], ack 1, win 501, options [nop,nop,TS val 3006334485 ecr 1441467138], length 0
00:24:48.323830 IP 192.168.75.233.38781 > bns1.hananet.net.domain: 22783+ A? securepubads.g.doubleclick.net. (48)
00:24:48.325283 IP bns1.hananet.net.domain > 192.168.75.233.38781: 22783 1/0/0 A 142.251.222.34 (64)
00:24:48.326111 IP 192.168.75.233.57910 > nrt13s72-in-f2.1e100.net.https: Flags [S], seq 119185260, win 64240, options [mss 1460,sackOK,TS val 4100636342 ecr 0,nop,wscale 7], length 0
00:24:48.328223 IP 192.168.75.233.55398 > 104.16.218.109.https: Flags [P.], seq 2755788774:2755788883, ack 1619001147, win 2430, options [nop,nop,TS val 141247461 ecr 89202910], length 109
00:24:48.362827 IP nrt13s72-in-f2.1e100.net.https > 192.168.75.233.57910: Flags [S.], seq 92338961, ack 119185261, win 65535, options [mss 1412,sackOK,TS val 410614038 ecr 4100636342,nop,wscale 8], length 0
00:24:48.362869 IP 192.168.75.233.57910 > nrt13s72-in-f2.1e100.net.https: Flags [.], ack 1, win 502, options [nop,nop,TS val 4100636379 ecr 410614038], length 0
00:24:48.365546 IP 192.168.75.233.57910 > nrt13s72-in-f2.1e100.net.https: Flags [P.], seq 1:676, ack 1, win 502, options [nop,nop,TS val 4100636382 ecr 410614038], length 675
00:24:48.365697 IP 192.168.75.233.57910 > nrt13s72-in-f2.1e100.net.https: Flags [P.], seq 676:682, ack 1, win 502, options [nop,nop,TS val 4100636382 ecr 410614038], length 6
00:24:48.365718 IP 192.168.75.233.57910 > nrt13s72-in-f2.1e100.net.https: Flags [P.], seq 682:852, ack 1, win 502, options [nop,nop,TS val 4100636382 ecr 410614038], length 170
00:24:48.379237 IP 104.16.218.109.https > 192.168.75.233.55398: Flags [.], ack 109, win 11, options [nop,nop,TS val 89235478 ecr 141247461], length 0
00:24:48.400908 IP nrt13s72-in-f2.1e100.net.https > 192.168.75.233.57910: Flags [.], ack 676, win 262, options [nop,nop,TS val 410614076 ecr 4100636382], length 0
00:24:48.401029 IP nrt13s72-in-f2.1e100.net.https > 192.168.75.233.57910: Flags [.], ack 682, win 262, options [nop,nop,TS val 410614077 ecr 4100636382], length 0
00:24:48.401033 IP nrt13s72-in-f2.1e100.net.https > 192.168.75.233.57910: Flags [.], ack 852, win 262, options [nop,nop,TS val 410614077 ecr 4100636382], length 0
00:24:48.406387 IP 104.16.218.109.https > 192.168.75.233.55398: Flags [P.], seq 1:85, ack 109, win 11, options [nop,nop,TS val 89235505 ecr 141247461], length 84
00:24:48.406419 IP 192.168.75.233.55398 > 104.16.218.109.https: Flags [.], ack 85, win 2430, options [nop,nop,TS val 141247539 ecr 89235505], length 0
00:24:48.406466 IP 104.16.218.109.https > 192.168.75.233.55398: Flags [P.], seq 85:1221, ack 109, win 11, options [nop,nop,TS val 89235505 ecr 141247461], length 1136
00:24:48.406471 IP 192.168.75.233.55398 > 104.16.218.109.https: Flags [.], ack 1221, win 2452, options [nop,nop,TS val 141247540 ecr 89235505], length 0
00:24:48.406473 IP 104.16.218.109.https > 192.168.75.233.55398: Flags [P.], seq 1221:1252, ack 109, win 11, options [nop,nop,TS val 89235505 ecr 141247461], length 31
00:24:48.406477 IP 192.168.75.233.55398 > 104.16.218.109.https: Flags [.], ack 1252, win 2452, options [nop,nop,TS val 141247540 ecr 89235505], length 0
00:24:48.437046 IP nrt13s72-in-f2.1e100.net.https > 192.168.75.233.57910: Flags [P.], seq 1:769, ack 852, win 262, options [nop,nop,TS val 410614113 ecr 4100636382], length 768
00:24:48.437077 IP 192.168.75.233.57910 > nrt13s72-in-f2.1e100.net.https: Flags [.], ack 769, win 501, options [nop,nop,TS val 4100636453 ecr 410614113], length 0
00:24:48.437091 IP nrt13s72-in-f2.1e100.net.https > 192.168.75.233.57910: Flags [P.], seq 769:831, ack 852, win 262, options [nop,nop,TS val 410614113 ecr 4100636382], length 62
00:24:48.437095 IP 192.168.75.233.57910 > nrt13s72-in-f2.1e100.net.https: Flags [.], ack 831, win 501, options [nop,nop,TS val 4100636453 ecr 410614113], length 0
00:24:48.437137 IP nrt13s72-in-f2.1e100.net.https > 192.168.75.233.57910: Flags [P.], seq 831:862, ack 852, win 262, options [nop,nop,TS val 410614113 ecr 4100636382], length 31
00:24:48.437142 IP 192.168.75.233.57910 > nrt13s72-in-f2.1e100.net.https: Flags [.], ack 862, win 501, options [nop,nop,TS val 4100636453 ecr 410614113], length 0
00:24:48.437784 IP 192.168.75.233.57910 > nrt13s72-in-f2.1e100.net.https: Flags [P.], seq 852:936, ack 862, win 501, options [nop,nop,TS val 4100636454 ecr 410614113], length 84
00:24:48.438481 IP 192.168.75.233.57910 > nrt13s72-in-f2.1e100.net.https: Flags [P.], seq 936:967, ack 862, win 501, options [nop,nop,TS val 4100636455 ecr 410614113], length 31
00:24:48.474223 IP nrt13s72-in-f2.1e100.net.https > 192.168.75.233.57910: Flags [.], ack 967, win 262, options [nop,nop,TS val 410614150 ecr 4100636454], length 0
00:24:48.872083 IP 192.168.75.233.55398 > 104.16.218.109.https: Flags [P.], seq 109:345, ack 1252, win 2452, options [nop,nop,TS val 141248005 ecr 89235505], length 236
00:24:48.883822 IP 104.16.218.109.https > 192.168.75.233.55398: Flags [.], ack 345, win 11, options [nop,nop,TS val 89235982 ecr 141248005], length 0
00:24:48.889943 IP 192.168.75.233.55398 > 104.16.218.109.https: Flags [P.], seq 345:381, ack 1252, win 2452, options [nop,nop,TS val 141248023 ecr 89235982], length 36
00:24:48.896433 IP 104.16.218.109.https > 192.168.75.233.55398: Flags [.], ack 381, win 11, options [nop,nop,TS val 89235995 ecr 141248023], length 0
00:24:48.966591 IP 192.168.75.233.46044 > bns1.hananet.net.domain: 48471+ A? namu.wiki. (27)
00:24:48.966613 IP 192.168.75.233.46044 > bns1.hananet.net.domain: 43371+ AAAA? namu.wiki. (27)
00:24:48.968364 IP bns1.hananet.net.domain > 192.168.75.233.46044: 48471 2/0/0 A 104.16.218.109, A 104.16.219.109 (59)
00:24:48.968391 IP bns1.hananet.net.domain > 192.168.75.233.46044: 43371 2/0/0 AAAA 2606:4700::6810:db6d, AAAA 2606:4700::6810:da6d (83)
00:24:48.969366 IP 192.168.75.233.55398 > 104.16.218.109.https: Flags [P.], seq 381:457, ack 1252, win 2452, options [nop,nop,TS val 141248102 ecr 89235995], length 76
00:24:48.969431 IP 192.168.75.233.55398 > 104.16.218.109.https: Flags [P.], seq 457:492, ack 1252, win 2452, options [nop,nop,TS val 141248102 ecr 89235995], length 35
00:24:48.970090 IP 192.168.75.233.55398 > 104.16.218.109.https: Flags [P.], seq 492:638, ack 1252, win 2452, options [nop,nop,TS val 141248103 ecr 89235995], length 146
00:24:48.970111 IP 192.168.75.233.55398 > 104.16.218.109.https: Flags [P.], seq 638:1568, ack 1252, win 2452, options [nop,nop,TS val 141248103 ecr 89235995], length 930
00:24:48.970167 IP 192.168.75.233.55398 > 104.16.218.109.https: Flags [.], seq 1568:2956, ack 1252, win 2452, options [nop,nop,TS val 141248103 ecr 89235995], length 1388
00:24:48.970169 IP 192.168.75.233.55398 > 104.16.218.109.https: Flags [P.], seq 2956:4344, ack 1252, win 2452, options [nop,nop,TS val 141248103 ecr 89235995], length 1388
00:24:48.970176 IP 192.168.75.233.55398 > 104.16.218.109.https: Flags [.], seq 4344:5732, ack 1252, win 2452, options [nop,nop,TS val 141248103 ecr 89235995], length 1388
00:24:48.970177 IP 192.168.75.233.55398 > 104.16.218.109.https: Flags [P.], seq 5732:7120, ack 1252, win 2452, options [nop,nop,TS val 141248103 ecr 89235995], length 1388
00:24:48.970212 IP 192.168.75.233.55398 > 104.16.218.109.https: Flags [.], seq 7120:8508, ack 1252, win 2452, options [nop,nop,TS val 141248103 ecr 89235995], length 1388
00:24:48.970214 IP 192.168.75.233.55398 > 104.16.218.109.https: Flags [P.], seq 8508:9896, ack 1252, win 2452, options [nop,nop,TS val 141248103 ecr 89235995], length 1388
00:24:48.977808 IP 104.16.218.109.https > 192.168.75.233.55398: Flags [.], ack 457, win 11, options [nop,nop,TS val 89236076 ecr 141248102], length 0
00:24:48.977837 IP 192.168.75.233.55398 > 104.16.218.109.https: Flags [.], seq 9896:11284, ack 1252, win 2452, options [nop,nop,TS val 141248111 ecr 89236076], length 1388
00:24:48.977840 IP 192.168.75.233.55398 > 104.16.218.109.https: Flags [P.], seq 11284:12672, ack 1252, win 2452, options [nop,nop,TS val 141248111 ecr 89236076], length 1388
00:24:48.977859 IP 104.16.218.109.https > 192.168.75.233.55398: Flags [.], ack 492, win 11, options [nop,nop,TS val 89236076 ecr 141248102], length 0
00:24:48.977869 IP 192.168.75.233.55398 > 104.16.218.109.https: Flags [P.], seq 12672:13069, ack 1252, win 2452, options [nop,nop,TS val 141248111 ecr 89236076], length 397
00:24:48.977898 IP 104.16.218.109.https > 192.168.75.233.55398: Flags [.], ack 638, win 12, options [nop,nop,TS val 89236076 ecr 141248103], length 0
00:24:48.979843 IP 104.16.218.109.https > 192.168.75.233.55398: Flags [.], ack 1568, win 12, options [nop,nop,TS val 89236078 ecr 141248103], length 0
00:24:48.979876 IP 104.16.218.109.https > 192.168.75.233.55398: Flags [P.], seq 1252:1287, ack 1568, win 12, options [nop,nop,TS val 89236078 ecr 141248103], length 35
00:24:48.979882 IP 192.168.75.233.55398 > 104.16.218.109.https: Flags [.], ack 1287, win 2452, options [nop,nop,TS val 141248113 ecr 89236078], length 0
00:24:48.983483 IP 104.16.218.109.https > 192.168.75.233.55398: Flags [.], ack 4344, win 13, options [nop,nop,TS val 89236082 ecr 141248103], length 0
00:24:48.983499 IP 104.16.218.109.https > 192.168.75.233.55398: Flags [.], ack 7120, win 13, options [nop,nop,TS val 89236082 ecr 141248103], length 0
00:24:48.983509 IP 104.16.218.109.https > 192.168.75.233.55398: Flags [.], ack 9896, win 14, options [nop,nop,TS val 89236082 ecr 141248103], length 0
00:24:48.984365 IP 104.16.218.109.https > 192.168.75.233.55398: Flags [.], ack 12672, win 15, options [nop,nop,TS val 89236083 ecr 141248111], length 0
00:24:48.994909 IP 104.16.218.109.https > 192.168.75.233.55398: Flags [P.], seq 1287:1863, ack 13069, win 15, options [nop,nop,TS val 89236093 ecr 141248111], length 576
00:24:48.994932 IP 192.168.75.233.55398 > 104.16.218.109.https: Flags [.], ack 1863, win 2475, options [nop,nop,TS val 141248128 ecr 89236093], length 0
00:24:49.035631 IP 104.16.218.109.https > 192.168.75.233.55398: Flags [P.], seq 1863:1978, ack 13069, win 15, options [nop,nop,TS val 89236134 ecr 141248128], length 115
00:24:49.035673 IP 192.168.75.233.55398 > 104.16.218.109.https: Flags [.], ack 1978, win 2475, options [nop,nop,TS val 141248169 ecr 89236134], length 0
00:24:49.035752 IP 104.16.218.109.https > 192.168.75.233.55398: Flags [.], seq 1978:3426, ack 13069, win 15, options [nop,nop,TS val 89236134 ecr 141248128], length 1448
00:24:49.035768 IP 192.168.75.233.55398 > 104.16.218.109.https: Flags [.], ack 3426, win 2498, options [nop,nop,TS val 141248169 ecr 89236134], length 0
00:24:49.035793 IP 104.16.218.109.https > 192.168.75.233.55398: Flags [.], seq 3426:7770, ack 13069, win 15, options [nop,nop,TS val 89236134 ecr 141248128], length 4344
00:24:49.035809 IP 192.168.75.233.55398 > 104.16.218.109.https: Flags [.], ack 7770, win 2565, options [nop,nop,TS val 141248169 ecr 89236134], length 0
00:24:49.035835 IP 104.16.218.109.https > 192.168.75.233.55398: Flags [P.], seq 7770:10715, ack 13069, win 15, options [nop,nop,TS val 89236134 ecr 141248128], length 2945
00:24:49.035849 IP 192.168.75.233.55398 > 104.16.218.109.https: Flags [.], ack 10715, win 2611, options [nop,nop,TS val 141248169 ecr 89236134], length 0
00:24:49.035853 IP 104.16.218.109.https > 192.168.75.233.55398: Flags [P.], seq 10715:10746, ack 13069, win 15, options [nop,nop,TS val 89236134 ecr 141248128], length 31
00:24:49.035865 IP 192.168.75.233.55398 > 104.16.218.109.https: Flags [.], ack 10746, win 2611, options [nop,nop,TS val 141248169 ecr 89236134], length 0
00:24:49.167659 IP 192.168.75.233.40041 > bns1.hananet.net.domain: 23535+ PTR? 34.222.251.142.in-addr.arpa. (45)
00:24:49.176159 IP bns1.hananet.net.domain > 192.168.75.233.40041: 23535 1/0/0 PTR nrt13s72-in-f2.1e100.net. (83)
00:24:49.282480 IP 192.168.75.233.52353 > bns1.hananet.net.domain: 33253+ A? i.namu.wiki. (29)
00:24:49.282491 IP 192.168.75.233.52353 > bns1.hananet.net.domain: 60134+ AAAA? i.namu.wiki. (29)
00:24:49.283431 IP bns1.hananet.net.domain > 192.168.75.233.52353: 33253 2/0/0 A 104.16.218.109, A 104.16.219.109 (61)
00:24:49.283486 IP bns1.hananet.net.domain > 192.168.75.233.52353: 60134 2/0/0 AAAA 2606:4700::6810:db6d, AAAA 2606:4700::6810:da6d (85)
00:24:49.448706 IP 192.168.75.233.55398 > 104.16.218.109.https: Flags [P.], seq 13069:13504, ack 10746, win 2611, options [nop,nop,TS val 141248582 ecr 89236134], length 435
00:24:49.449283 IP 192.168.75.233.55398 > 104.16.218.109.https: Flags [P.], seq 13504:13869, ack 10746, win 2611, options [nop,nop,TS val 141248582 ecr 89236134], length 365
00:24:49.449434 IP 192.168.75.233.55398 > 104.16.218.109.https: Flags [P.], seq 13869:14200, ack 10746, win 2611, options [nop,nop,TS val 141248582 ecr 89236134], length 331
00:24:49.449705 IP 192.168.75.233.55398 > 104.16.218.109.https: Flags [P.], seq 14200:14530, ack 10746, win 2611, options [nop,nop,TS val 141248583 ecr 89236134], length 330
00:24:49.454871 IP 192.168.75.233.55398 > 104.16.218.109.https: Flags [P.], seq 14530:14636, ack 10746, win 2611, options [nop,nop,TS val 141248588 ecr 89236134], length 106
00:24:49.455229 IP 192.168.75.233.55398 > 104.16.218.109.https: Flags [P.], seq 14636:14742, ack 10746, win 2611, options [nop,nop,TS val 141248588 ecr 89236134], length 106
00:24:49.455367 IP 192.168.75.233.55398 > 104.16.218.109.https: Flags [P.], seq 14742:14847, ack 10746, win 2611, options [nop,nop,TS val 141248588 ecr 89236134], length 105
00:24:49.455566 IP 192.168.75.233.55398 > 104.16.218.109.https: Flags [P.], seq 14847:14952, ack 10746, win 2611, options [nop,nop,TS val 141248589 ecr 89236134], length 105
00:24:49.455604 IP 192.168.75.233.55398 > 104.16.218.109.https: Flags [P.], seq 14952:14987, ack 10746, win 2611, options [nop,nop,TS val 141248589 ecr 89236134], length 35
00:24:49.455698 IP 192.168.75.233.55398 > 104.16.218.109.https: Flags [P.], seq 14987:15022, ack 10746, win 2611, options [nop,nop,TS val 141248589 ecr 89236134], length 35
00:24:49.461931 IP 104.16.218.109.https > 192.168.75.233.55398: Flags [.], ack 14200, win 16, options [nop,nop,TS val 89236560 ecr 141248582], length 0
00:24:49.461974 IP 192.168.75.233.55398 > 104.16.218.109.https: Flags [P.], seq 15022:15092, ack 10746, win 2611, options [nop,nop,TS val 141248595 ecr 89236560], length 70
00:24:49.464077 IP 104.16.218.109.https > 192.168.75.233.55398: Flags [.], ack 15022, win 16, options [nop,nop,TS val 89236562 ecr 141248583], length 0
00:24:49.470769 IP 192.168.75.233.46058 > 104.16.218.109.https: Flags [S], seq 2201586992, win 64240, options [mss 1460,sackOK,TS val 141248604 ecr 0,nop,wscale 7], length 0
00:24:49.478466 IP 104.16.218.109.https > 192.168.75.233.55398: Flags [P.], seq 10746:10861, ack 15092, win 16, options [nop,nop,TS val 89236577 ecr 141248595], length 115
00:24:49.478500 IP 192.168.75.233.55398 > 104.16.218.109.https: Flags [.], ack 10861, win 2611, options [nop,nop,TS val 141248612 ecr 89236577], length 0
00:24:49.478527 IP 104.16.218.109.https > 192.168.75.233.55398: Flags [P.], seq 10861:11314, ack 15092, win 16, options [nop,nop,TS val 89236577 ecr 141248595], length 453
00:24:49.478533 IP 192.168.75.233.55398 > 104.16.218.109.https: Flags [.], ack 11314, win 2634, options [nop,nop,TS val 141248612 ecr 89236577], length 0
00:24:49.478536 IP 104.16.218.109.https > 192.168.75.233.55398: Flags [P.], seq 11314:11345, ack 15092, win 16, options [nop,nop,TS val 89236577 ecr 141248595], length 31
00:24:49.478540 IP 192.168.75.233.55398 > 104.16.218.109.https: Flags [.], ack 11345, win 2634, options [nop,nop,TS val 141248612 ecr 89236577], length 0
00:24:49.478781 IP 104.16.218.109.https > 192.168.75.233.46058: Flags [S.], seq 1701020079, ack 2201586993, win 65535, options [mss 1400,sackOK,TS val 1665702391 ecr 141248604,nop,wscale 13], length 0
00:24:49.478799 IP 192.168.75.233.46058 > 104.16.218.109.https: Flags [.], ack 1, win 502, options [nop,nop,TS val 141248612 ecr 1665702391], length 0
00:24:49.481871 IP 192.168.75.233.46058 > 104.16.218.109.https: Flags [P.], seq 1:612, ack 1, win 502, options [nop,nop,TS val 141248615 ecr 1665702391], length 611
00:24:49.482211 IP 192.168.75.233.46058 > 104.16.218.109.https: Flags [P.], seq 612:618, ack 1, win 502, options [nop,nop,TS val 141248615 ecr 1665702391], length 6
00:24:49.482230 IP 192.168.75.233.46058 > 104.16.218.109.https: Flags [P.], seq 618:788, ack 1, win 502, options [nop,nop,TS val 141248615 ecr 1665702391], length 170
00:24:49.489515 IP 104.16.218.109.https > 192.168.75.233.46058: Flags [.], ack 612, win 9, options [nop,nop,TS val 1665702402 ecr 141248615], length 0
00:24:49.489609 IP 104.16.218.109.https > 192.168.75.233.55398: Flags [P.], seq 11345:11605, ack 15092, win 16, options [nop,nop,TS val 89236588 ecr 141248612], length 260
00:24:49.489628 IP 192.168.75.233.55398 > 104.16.218.109.https: Flags [.], ack 11605, win 2657, options [nop,nop,TS val 141248623 ecr 89236588], length 0
00:24:49.489756 IP 104.16.218.109.https > 192.168.75.233.55398: Flags [.], seq 11605:13053, ack 15092, win 16, options [nop,nop,TS val 89236588 ecr 141248612], length 1448
00:24:49.489763 IP 192.168.75.233.55398 > 104.16.218.109.https: Flags [.], ack 13053, win 2679, options [nop,nop,TS val 141248623 ecr 89236588], length 0
00:24:49.489772 IP 104.16.218.109.https > 192.168.75.233.55398: Flags [.], seq 13053:14501, ack 15092, win 16, options [nop,nop,TS val 89236588 ecr 141248612], length 1448
00:24:49.489778 IP 192.168.75.233.55398 > 104.16.218.109.https: Flags [.], ack 14501, win 2702, options [nop,nop,TS val 141248623 ecr 89236588], length 0
00:24:49.489787 IP 104.16.218.109.https > 192.168.75.233.55398: Flags [.], seq 14501:15949, ack 15092, win 16, options [nop,nop,TS val 89236588 ecr 141248612], length 1448
00:24:49.489791 IP 192.168.75.233.55398 > 104.16.218.109.https: Flags [.], ack 15949, win 2725, options [nop,nop,TS val 141248623 ecr 89236588], length 0
00:24:49.489801 IP 104.16.218.109.https > 192.168.75.233.55398: Flags [.], seq 15949:17397, ack 15092, win 16, options [nop,nop,TS val 89236588 ecr 141248612], length 1448
00:24:49.489805 IP 192.168.75.233.55398 > 104.16.218.109.https: Flags [.], ack 17397, win 2747, options [nop,nop,TS val 141248623 ecr 89236588], length 0
00:24:49.489816 IP 104.16.218.109.https > 192.168.75.233.55398: Flags [.], seq 17397:20293, ack 15092, win 16, options [nop,nop,TS val 89236588 ecr 141248612], length 2896
00:24:49.489820 IP 192.168.75.233.55398 > 104.16.218.109.https: Flags [.], ack 20293, win 2792, options [nop,nop,TS val 141248623 ecr 89236588], length 0
00:24:49.489830 IP 104.16.218.109.https > 192.168.75.233.55398: Flags [.], seq 20293:21741, ack 15092, win 16, options [nop,nop,TS val 89236588 ecr 141248612], length 1448
00:24:49.489834 IP 192.168.75.233.55398 > 104.16.218.109.https: Flags [.], ack 21741, win 2815, options [nop,nop,TS val 141248623 ecr 89236588], length 0
00:24:49.489843 IP 104.16.218.109.https > 192.168.75.233.55398: Flags [.], seq 21741:23189, ack 15092, win 16, options [nop,nop,TS val 89236588 ecr 141248612], length 1448
00:24:49.489848 IP 192.168.75.233.55398 > 104.16.218.109.https: Flags [.], ack 23189, win 2838, options [nop,nop,TS val 141248623 ecr 89236588], length 0
00:24:49.489857 IP 104.16.218.109.https > 192.168.75.233.55398: Flags [.], seq 23189:24637, ack 15092, win 16, options [nop,nop,TS val 89236588 ecr 141248612], length 1448
00:24:49.489860 IP 192.168.75.233.55398 > 104.16.218.109.https: Flags [.], ack 24637, win 2860, options [nop,nop,TS val 141248623 ecr 89236588], length 0
00:24:49.489870 IP 104.16.218.109.https > 192.168.75.233.55398: Flags [.], seq 24637:26085, ack 15092, win 16, options [nop,nop,TS val 89236588 ecr 141248612], length 1448
00:24:49.489874 IP 192.168.75.233.55398 > 104.16.218.109.https: Flags [.], ack 26085, win 2883, options [nop,nop,TS val 141248623 ecr 89236588], length 0
00:24:49.489888 IP 104.16.218.109.https > 192.168.75.233.55398: Flags [P.], seq 26085:28011, ack 15092, win 16, options [nop,nop,TS val 89236588 ecr 141248612], length 1926
00:24:49.489892 IP 192.168.75.233.55398 > 104.16.218.109.https: Flags [.], ack 28011, win 2913, options [nop,nop,TS val 141248623 ecr 89236588], length 0
00:24:49.489893 IP 104.16.218.109.https > 192.168.75.233.46058: Flags [.], ack 618, win 9, options [nop,nop,TS val 1665702402 ecr 141248615], length 0
00:24:49.489908 IP 104.16.218.109.https > 192.168.75.233.55398: Flags [.], seq 28011:30907, ack 15092, win 16, options [nop,nop,TS val 89236588 ecr 141248612], length 2896
00:24:49.489912 IP 192.168.75.233.55398 > 104.16.218.109.https: Flags [.], ack 30907, win 2958, options [nop,nop,TS val 141248623 ecr 89236588], length 0
00:24:49.489923 IP 104.16.218.109.https > 192.168.75.233.55398: Flags [.], seq 30907:32355, ack 15092, win 16, options [nop,nop,TS val 89236588 ecr 141248612], length 1448
00:24:49.489927 IP 192.168.75.233.55398 > 104.16.218.109.https: Flags [.], ack 32355, win 2981, options [nop,nop,TS val 141248623 ecr 89236588], length 0
00:24:49.489935 IP 104.16.218.109.https > 192.168.75.233.55398: Flags [.], seq 32355:33803, ack 15092, win 16, options [nop,nop,TS val 89236588 ecr 141248612], length 1448
00:24:49.489939 IP 192.168.75.233.55398 > 104.16.218.109.https: Flags [.], ack 33803, win 3003, options [nop,nop,TS val 141248623 ecr 89236588], length 0
00:24:49.489947 IP 104.16.218.109.https > 192.168.75.233.55398: Flags [.], seq 33803:35251, ack 15092, win 16, options [nop,nop,TS val 89236588 ecr 141248612], length 1448
00:24:49.489951 IP 192.168.75.233.55398 > 104.16.218.109.https: Flags [.], ack 35251, win 3026, options [nop,nop,TS val 141248623 ecr 89236588], length 0
00:24:49.489959 IP 104.16.218.109.https > 192.168.75.233.55398: Flags [.], seq 35251:36699, ack 15092, win 16, options [nop,nop,TS val 89236588 ecr 141248612], length 1448
00:24:49.489963 IP 192.168.75.233.55398 > 104.16.218.109.https: Flags [.], ack 36699, win 3049, options [nop,nop,TS val 141248623 ecr 89236588], length 0
00:24:49.489972 IP 104.16.218.109.https > 192.168.75.233.55398: Flags [.], seq 36699:38147, ack 15092, win 16, options [nop,nop,TS val 89236588 ecr 141248612], length 1448
00:24:49.489975 IP 192.168.75.233.55398 > 104.16.218.109.https: Flags [.], ack 38147, win 3071, options [nop,nop,TS val 141248623 ecr 89236588], length 0
00:24:49.489984 IP 104.16.218.109.https > 192.168.75.233.55398: Flags [.], seq 38147:39595, ack 15092, win 16, options [nop,nop,TS val 89236588 ecr 141248612], length 1448
00:24:49.489988 IP 192.168.75.233.55398 > 104.16.218.109.https: Flags [.], ack 39595, win 3094, options [nop,nop,TS val 141248623 ecr 89236588], length 0
00:24:49.489997 IP 104.16.218.109.https > 192.168.75.233.55398: Flags [.], seq 39595:41043, ack 15092, win 16, options [nop,nop,TS val 89236588 ecr 141248612], length 1448
00:24:49.490001 IP 192.168.75.233.55398 > 104.16.218.109.https: Flags [.], ack 41043, win 3117, options [nop,nop,TS val 141248623 ecr 89236588], length 0
00:24:49.490010 IP 104.16.218.109.https > 192.168.75.233.55398: Flags [.], seq 41043:42491, ack 15092, win 16, options [nop,nop,TS val 89236588 ecr 141248612], length 1448
00:24:49.490015 IP 192.168.75.233.55398 > 104.16.218.109.https: Flags [.], ack 42491, win 3139, options [nop,nop,TS val 141248623 ecr 89236588], length 0
00:24:49.490025 IP 104.16.218.109.https > 192.168.75.233.55398: Flags [P.], seq 42491:44475, ack 15092, win 16, options [nop,nop,TS val 89236588 ecr 141248612], length 1984
00:24:49.490030 IP 192.168.75.233.55398 > 104.16.218.109.https: Flags [.], ack 44475, win 3170, options [nop,nop,TS val 141248623 ecr 89236588], length 0
00:24:49.490031 IP 104.16.218.109.https > 192.168.75.233.46058: Flags [.], ack 788, win 9, options [nop,nop,TS val 1665702402 ecr 141248615], length 0
00:24:49.490044 IP 104.16.218.109.https > 192.168.75.233.55398: Flags [.], seq 44475:45923, ack 15092, win 16, options [nop,nop,TS val 89236588 ecr 141248612], length 1448
00:24:49.490048 IP 192.168.75.233.55398 > 104.16.218.109.https: Flags [.], ack 45923, win 3193, options [nop,nop,TS val 141248623 ecr 89236588], length 0
00:24:49.490056 IP 104.16.218.109.https > 192.168.75.233.55398: Flags [.], seq 45923:47371, ack 15092, win 16, options [nop,nop,TS val 89236588 ecr 141248612], length 1448
00:24:49.490060 IP 192.168.75.233.55398 > 104.16.218.109.https: Flags [.], ack 47371, win 3215, options [nop,nop,TS val 141248623 ecr 89236588], length 0
00:24:49.490069 IP 104.16.218.109.https > 192.168.75.233.55398: Flags [.], seq 47371:48819, ack 15092, win 16, options [nop,nop,TS val 89236588 ecr 141248612], length 1448
00:24:49.490073 IP 192.168.75.233.55398 > 104.16.218.109.https: Flags [.], ack 48819, win 3238, options [nop,nop,TS val 141248623 ecr 89236588], length 0
00:24:49.490094 IP 104.16.218.109.https > 192.168.75.233.55398: Flags [.], seq 48819:50267, ack 15092, win 16, options [nop,nop,TS val 89236588 ecr 141248612], length 1448
00:24:49.490098 IP 192.168.75.233.55398 > 104.16.218.109.https: Flags [.], ack 50267, win 3261, options [nop,nop,TS val 141248623 ecr 89236588], length 0
00:24:49.490117 IP 104.16.218.109.https > 192.168.75.233.55398: Flags [.], seq 50267:51715, ack 15092, win 16, options [nop,nop,TS val 89236588 ecr 141248612], length 1448
00:24:49.490122 IP 192.168.75.233.55398 > 104.16.218.109.https: Flags [.], ack 51715, win 3283, options [nop,nop,TS val 141248623 ecr 89236588], length 0
00:24:49.490140 IP 104.16.218.109.https > 192.168.75.233.55398: Flags [.], seq 51715:53163, ack 15092, win 16, options [nop,nop,TS val 89236588 ecr 141248612], length 1448
00:24:49.490146 IP 192.168.75.233.55398 > 104.16.218.109.https: Flags [.], ack 53163, win 3306, options [nop,nop,TS val 141248623 ecr 89236588], length 0
00:24:49.490161 IP 104.16.218.109.https > 192.168.75.233.55398: Flags [.], seq 53163:54611, ack 15092, win 16, options [nop,nop,TS val 89236588 ecr 141248612], length 1448
00:24:49.490165 IP 192.168.75.233.55398 > 104.16.218.109.https: Flags [.], ack 54611, win 3329, options [nop,nop,TS val 141248623 ecr 89236588], length 0
00:24:49.490178 IP 104.16.218.109.https > 192.168.75.233.55398: Flags [.], seq 54611:56059, ack 15092, win 16, options [nop,nop,TS val 89236588 ecr 141248612], length 1448
00:24:49.490182 IP 192.168.75.233.55398 > 104.16.218.109.https: Flags [.], ack 56059, win 3351, options [nop,nop,TS val 141248623 ecr 89236588], length 0
00:24:49.490209 IP 104.16.218.109.https > 192.168.75.233.55398: Flags [.], seq 56059:57507, ack 15092, win 16, options [nop,nop,TS val 89236588 ecr 141248612], length 1448
00:24:49.490213 IP 192.168.75.233.55398 > 104.16.218.109.https: Flags [.], ack 57507, win 3374, options [nop,nop,TS val 141248623 ecr 89236588], length 0
00:24:49.490227 IP 104.16.218.109.https > 192.168.75.233.55398: Flags [.], seq 57507:58955, ack 15092, win 16, options [nop,nop,TS val 89236588 ecr 141248612], length 1448
00:24:49.490231 IP 192.168.75.233.55398 > 104.16.218.109.https: Flags [.], ack 58955, win 3396, options [nop,nop,TS val 141248623 ecr 89236588], length 0
00:24:49.490257 IP 104.16.218.109.https > 192.168.75.233.55398: Flags [P.], seq 58955:60881, ack 15092, win 16, options [nop,nop,TS val 89236588 ecr 141248612], length 1926
00:24:49.490261 IP 192.168.75.233.55398 > 104.16.218.109.https: Flags [.], ack 60881, win 3427, options [nop,nop,TS val 141248623 ecr 89236588], length 0
00:24:49.490280 IP 104.16.218.109.https > 192.168.75.233.55398: Flags [.], seq 60881:62329, ack 15092, win 16, options [nop,nop,TS val 89236588 ecr 141248612], length 1448
00:24:49.490285 IP 192.168.75.233.55398 > 104.16.218.109.https: Flags [.], ack 62329, win 3449, options [nop,nop,TS val 141248623 ecr 89236588], length 0
00:24:49.490301 IP 104.16.218.109.https > 192.168.75.233.55398: Flags [.], seq 62329:63777, ack 15092, win 16, options [nop,nop,TS val 89236588 ecr 141248612], length 1448
00:24:49.490305 IP 192.168.75.233.55398 > 104.16.218.109.https: Flags [.], ack 63777, win 3472, options [nop,nop,TS val 141248623 ecr 89236588], length 0
00:24:49.490327 IP 104.16.218.109.https > 192.168.75.233.55398: Flags [.], seq 63777:65225, ack 15092, win 16, options [nop,nop,TS val 89236588 ecr 141248612], length 1448
00:24:49.490331 IP 192.168.75.233.55398 > 104.16.218.109.https: Flags [.], ack 65225, win 3494, options [nop,nop,TS val 141248623 ecr 89236588], length 0
00:24:49.490345 IP 104.16.218.109.https > 192.168.75.233.55398: Flags [.], seq 65225:66673, ack 15092, win 16, options [nop,nop,TS val 89236588 ecr 141248612], length 1448
00:24:49.490349 IP 192.168.75.233.55398 > 104.16.218.109.https: Flags [.], ack 66673, win 3517, options [nop,nop,TS val 141248623 ecr 89236588], length 0
00:24:49.490369 IP 104.16.218.109.https > 192.168.75.233.55398: Flags [.], seq 66673:68121, ack 15092, win 16, options [nop,nop,TS val 89236588 ecr 141248612], length 1448
00:24:49.490373 IP 192.168.75.233.55398 > 104.16.218.109.https: Flags [.], ack 68121, win 3540, options [nop,nop,TS val 141248623 ecr 89236588], length 0
00:24:49.490390 IP 104.16.218.109.https > 192.168.75.233.55398: Flags [.], seq 68121:69569, ack 15092, win 16, options [nop,nop,TS val 89236588 ecr 141248612], length 1448
