00:38:23.298363 Loopback, skipCount 0,  invalid (256)
00:38:24.044199 IP 192.168.75.233.42066 > ip136.ip-94-23-149.eu.9100: Flags [P.], seq 910404339:910404875, ack 3036640430, win 3176, options [nop,nop,TS val 1247074737 ecr 1408445068], length 536
00:38:24.176319 IP 192.168.75.233.48785 > bns1.hananet.net.domain: 22581+ PTR? 136.149.23.94.in-addr.arpa. (44)
00:38:24.177593 IP bns1.hananet.net.domain > 192.168.75.233.48785: 22581 1/0/0 PTR ip136.ip-94-23-149.eu. (79)
00:38:24.177763 IP 192.168.75.233.45095 > bns1.hananet.net.domain: 15847+ PTR? 233.75.168.192.in-addr.arpa. (45)
00:38:24.178400 IP bns1.hananet.net.domain > 192.168.75.233.45095: 15847 NXDomain 0/0/0 (45)
00:38:24.311329 IP 192.168.75.233.59836 > we.love.servers.at.ioflood.net.https: Flags [P.], seq 2545688978:2545689431, ack 4042842188, win 22468, options [nop,nop,TS val 1442326091 ecr 3007150299], length 453
00:38:24.312022 IP ip136.ip-94-23-149.eu.9100 > 192.168.75.233.42066: Flags [.], ack 536, win 501, options [nop,nop,TS val 1408452176 ecr 1247074737], length 0
00:38:24.472913 IP we.love.servers.at.ioflood.net.https > 192.168.75.233.59836: Flags [.], seq 1:2897, ack 453, win 1364, options [nop,nop,TS val 3007152704 ecr 1442326091], length 2896
00:38:24.472954 IP 192.168.75.233.59836 > we.love.servers.at.ioflood.net.https: Flags [.], ack 2897, win 22458, options [nop,nop,TS val 1442326253 ecr 3007152704], length 0
00:38:24.472978 IP we.love.servers.at.ioflood.net.https > 192.168.75.233.59836: Flags [P.], seq 2897:8689, ack 453, win 1364, options [nop,nop,TS val 3007152704 ecr 1442326091], length 5792
00:38:24.472989 IP 192.168.75.233.59836 > we.love.servers.at.ioflood.net.https: Flags [.], ack 8689, win 22428, options [nop,nop,TS val 1442326253 ecr 3007152704], length 0
00:38:24.473383 IP we.love.servers.at.ioflood.net.https > 192.168.75.233.59836: Flags [.], seq 8689:10137, ack 453, win 1364, options [nop,nop,TS val 3007152705 ecr 1442326091], length 1448
00:38:24.473392 IP 192.168.75.233.59836 > we.love.servers.at.ioflood.net.https: Flags [.], ack 10137, win 22465, options [nop,nop,TS val 1442326253 ecr 3007152705], length 0
00:38:24.473405 IP we.love.servers.at.ioflood.net.https > 192.168.75.233.59836: Flags [.], seq 10137:13033, ack 453, win 1364, options [nop,nop,TS val 3007152705 ecr 1442326091], length 2896
00:38:24.473413 IP 192.168.75.233.59836 > we.love.servers.at.ioflood.net.https: Flags [.], ack 13033, win 22458, options [nop,nop,TS val 1442326253 ecr 3007152705], length 0
00:38:24.473426 IP we.love.servers.at.ioflood.net.https > 192.168.75.233.59836: Flags [.], seq 13033:14481, ack 453, win 1364, options [nop,nop,TS val 3007152705 ecr 1442326091], length 1448
00:38:24.473434 IP 192.168.75.233.59836 > we.love.servers.at.ioflood.net.https: Flags [.], ack 14481, win 22465, options [nop,nop,TS val 1442326253 ecr 3007152705], length 0
00:38:24.473446 IP we.love.servers.at.ioflood.net.https > 192.168.75.233.59836: Flags [P.], seq 14481:16407, ack 453, win 1364, options [nop,nop,TS val 3007152705 ecr 1442326091], length 1926
00:38:24.473453 IP 192.168.75.233.59836 > we.love.servers.at.ioflood.net.https: Flags [.], ack 16407, win 22461, options [nop,nop,TS val 1442326253 ecr 3007152705], length 0
00:38:24.474084 IP we.love.servers.at.ioflood.net.https > 192.168.75.233.59836: Flags [.], seq 16407:17855, ack 453, win 1364, options [nop,nop,TS val 3007152706 ecr 1442326091], length 1448
00:38:24.474095 IP 192.168.75.233.59836 > we.love.servers.at.ioflood.net.https: Flags [.], ack 17855, win 22465, options [nop,nop,TS val 1442326254 ecr 3007152706], length 0
00:38:24.474107 IP we.love.servers.at.ioflood.net.https > 192.168.75.233.59836: Flags [.], seq 17855:20751, ack 453, win 1364, options [nop,nop,TS val 3007152706 ecr 1442326091], length 2896
00:38:24.474115 IP 192.168.75.233.59836 > we.love.servers.at.ioflood.net.https: Flags [.], ack 20751, win 22458, options [nop,nop,TS val 1442326254 ecr 3007152706], length 0
00:38:24.474130 IP we.love.servers.at.ioflood.net.https > 192.168.75.233.59836: Flags [.], seq 20751:23647, ack 453, win 1364, options [nop,nop,TS val 3007152706 ecr 1442326091], length 2896
00:38:24.474138 IP 192.168.75.233.59836 > we.love.servers.at.ioflood.net.https: Flags [.], ack 23647, win 22458, options [nop,nop,TS val 1442326254 ecr 3007152706], length 0
00:38:24.474148 IP we.love.servers.at.ioflood.net.https > 192.168.75.233.59836: Flags [P.], seq 23647:25095, ack 453, win 1364, options [nop,nop,TS val 3007152706 ecr 1442326091], length 1448
00:38:24.474155 IP 192.168.75.233.59836 > we.love.servers.at.ioflood.net.https: Flags [.], ack 25095, win 22465, options [nop,nop,TS val 1442326254 ecr 3007152706], length 0
00:38:24.474932 IP we.love.servers.at.ioflood.net.https > 192.168.75.233.59836: Flags [.], seq 25095:26543, ack 453, win 1364, options [nop,nop,TS val 3007152706 ecr 1442326091], length 1448
00:38:24.474939 IP 192.168.75.233.59836 > we.love.servers.at.ioflood.net.https: Flags [.], ack 26543, win 22465, options [nop,nop,TS val 1442326255 ecr 3007152706], length 0
00:38:24.474951 IP we.love.servers.at.ioflood.net.https > 192.168.75.233.59836: Flags [.], seq 26543:27991, ack 453, win 1364, options [nop,nop,TS val 3007152706 ecr 1442326091], length 1448
00:38:24.474958 IP 192.168.75.233.59836 > we.love.servers.at.ioflood.net.https: Flags [.], ack 27991, win 22465, options [nop,nop,TS val 1442326255 ecr 3007152706], length 0
00:38:24.474971 IP we.love.servers.at.ioflood.net.https > 192.168.75.233.59836: Flags [.], seq 27991:30887, ack 453, win 1364, options [nop,nop,TS val 3007152706 ecr 1442326091], length 2896
00:38:24.474982 IP 192.168.75.233.59836 > we.love.servers.at.ioflood.net.https: Flags [.], ack 30887, win 22458, options [nop,nop,TS val 1442326255 ecr 3007152706], length 0
00:38:24.474994 IP we.love.servers.at.ioflood.net.https > 192.168.75.233.59836: Flags [P.], seq 30887:32813, ack 453, win 1364, options [nop,nop,TS val 3007152706 ecr 1442326091], length 1926
00:38:24.475002 IP 192.168.75.233.59836 > we.love.servers.at.ioflood.net.https: Flags [.], ack 32813, win 22461, options [nop,nop,TS val 1442326255 ecr 3007152706], length 0
00:38:24.482509 IP we.love.servers.at.ioflood.net.https > 192.168.75.233.59836: Flags [.], seq 32813:34261, ack 453, win 1364, options [nop,nop,TS val 3007152714 ecr 1442326091], length 1448
00:38:24.482528 IP 192.168.75.233.59836 > we.love.servers.at.ioflood.net.https: Flags [.], ack 34261, win 22465, options [nop,nop,TS val 1442326263 ecr 3007152714], length 0
00:38:24.482544 IP we.love.servers.at.ioflood.net.https > 192.168.75.233.59836: Flags [.], seq 34261:38605, ack 453, win 1364, options [nop,nop,TS val 3007152714 ecr 1442326091], length 4344
00:38:24.482556 IP we.love.servers.at.ioflood.net.https > 192.168.75.233.59836: Flags [.], seq 38605:40053, ack 453, win 1364, options [nop,nop,TS val 3007152714 ecr 1442326091], length 1448
00:38:24.482556 IP 192.168.75.233.59836 > we.love.servers.at.ioflood.net.https: Flags [.], ack 38605, win 22432, options [nop,nop,TS val 1442326263 ecr 3007152714], length 0
00:38:24.482567 IP we.love.servers.at.ioflood.net.https > 192.168.75.233.59836: Flags [P.], seq 40053:41501, ack 453, win 1364, options [nop,nop,TS val 3007152714 ecr 1442326091], length 1448
00:38:24.482574 IP 192.168.75.233.59836 > we.love.servers.at.ioflood.net.https: Flags [.], ack 41501, win 22465, options [nop,nop,TS val 1442326263 ecr 3007152714], length 0
00:38:24.482975 IP we.love.servers.at.ioflood.net.https > 192.168.75.233.59836: Flags [.], seq 41501:42949, ack 453, win 1364, options [nop,nop,TS val 3007152714 ecr 1442326091], length 1448
00:38:24.482987 IP we.love.servers.at.ioflood.net.https > 192.168.75.233.59836: Flags [.], seq 42949:44397, ack 453, win 1364, options [nop,nop,TS val 3007152714 ecr 1442326091], length 1448
00:38:24.482998 IP 192.168.75.233.59836 > we.love.servers.at.ioflood.net.https: Flags [.], ack 44397, win 22468, options [nop,nop,TS val 1442326263 ecr 3007152714], length 0
00:38:24.482999 IP we.love.servers.at.ioflood.net.https > 192.168.75.233.59836: Flags [.], seq 44397:45845, ack 453, win 1364, options [nop,nop,TS val 3007152714 ecr 1442326091], length 1448
00:38:24.483012 IP we.love.servers.at.ioflood.net.https > 192.168.75.233.59836: Flags [.], seq 45845:47293, ack 453, win 1364, options [nop,nop,TS val 3007152714 ecr 1442326091], length 1448
00:38:24.483022 IP 192.168.75.233.59836 > we.love.servers.at.ioflood.net.https: Flags [.], ack 47293, win 22468, options [nop,nop,TS val 1442326263 ecr 3007152714], length 0
00:38:24.483027 IP we.love.servers.at.ioflood.net.https > 192.168.75.233.59836: Flags [P.], seq 47293:49219, ack 453, win 1364, options [nop,nop,TS val 3007152714 ecr 1442326091], length 1926
00:38:24.483042 IP 192.168.75.233.59836 > we.love.servers.at.ioflood.net.https: Flags [.], ack 49219, win 22468, options [nop,nop,TS val 1442326263 ecr 3007152714], length 0
00:38:24.483697 IP we.love.servers.at.ioflood.net.https > 192.168.75.233.59836: Flags [.], seq 49219:50667, ack 453, win 1364, options [nop,nop,TS val 3007152715 ecr 1442326091], length 1448
00:38:24.483718 IP we.love.servers.at.ioflood.net.https > 192.168.75.233.59836: Flags [.], seq 50667:53563, ack 453, win 1364, options [nop,nop,TS val 3007152715 ecr 1442326091], length 2896
00:38:24.483731 IP we.love.servers.at.ioflood.net.https > 192.168.75.233.59836: Flags [.], seq 53563:55011, ack 453, win 1364, options [nop,nop,TS val 3007152715 ecr 1442326091], length 1448
00:38:24.483734 IP 192.168.75.233.59836 > we.love.servers.at.ioflood.net.https: Flags [.], ack 53563, win 22450, options [nop,nop,TS val 1442326264 ecr 3007152715], length 0
00:38:24.483744 IP we.love.servers.at.ioflood.net.https > 192.168.75.233.59836: Flags [.], seq 55011:56459, ack 453, win 1364, options [nop,nop,TS val 3007152715 ecr 1442326091], length 1448
00:38:24.483751 IP 192.168.75.233.59836 > we.love.servers.at.ioflood.net.https: Flags [.], ack 56459, win 22465, options [nop,nop,TS val 1442326264 ecr 3007152715], length 0
00:38:24.483764 IP we.love.servers.at.ioflood.net.https > 192.168.75.233.59836: Flags [P.], seq 56459:57907, ack 453, win 1364, options [nop,nop,TS val 3007152715 ecr 1442326091], length 1448
00:38:24.483780 IP 192.168.75.233.59836 > we.love.servers.at.ioflood.net.https: Flags [.], ack 57907, win 22468, options [nop,nop,TS val 1442326264 ecr 3007152715], length 0
00:38:24.484532 IP we.love.servers.at.ioflood.net.https > 192.168.75.233.59836: Flags [.], seq 57907:59355, ack 453, win 1364, options [nop,nop,TS val 3007152716 ecr 1442326091], length 1448
00:38:24.484544 IP we.love.servers.at.ioflood.net.https > 192.168.75.233.59836: Flags [.], seq 59355:60803, ack 453, win 1364, options [nop,nop,TS val 3007152716 ecr 1442326091], length 1448
00:38:24.484557 IP we.love.servers.at.ioflood.net.https > 192.168.75.233.59836: Flags [.], seq 60803:62251, ack 453, win 1364, options [nop,nop,TS val 3007152716 ecr 1442326091], length 1448
00:38:24.484557 IP 192.168.75.233.59836 > we.love.servers.at.ioflood.net.https: Flags [.], ack 60803, win 22468, options [nop,nop,TS val 1442326265 ecr 3007152716], length 0
00:38:24.484570 IP we.love.servers.at.ioflood.net.https > 192.168.75.233.59836: Flags [.], seq 62251:63699, ack 453, win 1364, options [nop,nop,TS val 3007152716 ecr 1442326091], length 1448
00:38:24.484585 IP we.love.servers.at.ioflood.net.https > 192.168.75.233.59836: Flags [.], seq 63699:65147, ack 453, win 1364, options [nop,nop,TS val 3007152716 ecr 1442326091], length 1448
00:38:24.484591 IP 192.168.75.233.59836 > we.love.servers.at.ioflood.net.https: Flags [.], ack 63699, win 22468, options [nop,nop,TS val 1442326265 ecr 3007152716], length 0
00:38:24.484596 IP we.love.servers.at.ioflood.net.https > 192.168.75.233.59836: Flags [P.], seq 65147:66595, ack 453, win 1364, options [nop,nop,TS val 3007152716 ecr 1442326091], length 1448
00:38:24.484603 IP 192.168.75.233.59836 > we.love.servers.at.ioflood.net.https: Flags [.], ack 66595, win 22465, options [nop,nop,TS val 1442326265 ecr 3007152716], length 0
00:38:24.485391 IP we.love.servers.at.ioflood.net.https > 192.168.75.233.59836: Flags [.], seq 66595:68043, ack 453, win 1364, options [nop,nop,TS val 3007152717 ecr 1442326091], length 1448
00:38:24.485406 IP we.love.servers.at.ioflood.net.https > 192.168.75.233.59836: Flags [.], seq 68043:69491, ack 453, win 1364, options [nop,nop,TS val 3007152717 ecr 1442326091], length 1448
00:38:24.485418 IP we.love.servers.at.ioflood.net.https > 192.168.75.233.59836: Flags [.], seq 69491:70939, ack 453, win 1364, options [nop,nop,TS val 3007152717 ecr 1442326091], length 1448
00:38:24.485422 IP 192.168.75.233.59836 > we.love.servers.at.ioflood.net.https: Flags [.], ack 69491, win 22468, options [nop,nop,TS val 1442326265 ecr 3007152717], length 0
00:38:24.485428 IP we.love.servers.at.ioflood.net.https > 192.168.75.233.59836: Flags [.], seq 70939:72387, ack 453, win 1364, options [nop,nop,TS val 3007152717 ecr 1442326091], length 1448
00:38:24.485441 IP we.love.servers.at.ioflood.net.https > 192.168.75.233.59836: Flags [.], seq 72387:73835, ack 453, win 1364, options [nop,nop,TS val 3007152717 ecr 1442326091], length 1448
00:38:24.485452 IP we.love.servers.at.ioflood.net.https > 192.168.75.233.59836: Flags [P.], seq 73835:75283, ack 453, win 1364, options [nop,nop,TS val 3007152717 ecr 1442326091], length 1448
00:38:24.485455 IP 192.168.75.233.59836 > we.love.servers.at.ioflood.net.https: Flags [.], ack 73835, win 22468, options [nop,nop,TS val 1442326265 ecr 3007152717], length 0
00:38:24.485462 IP 192.168.75.233.59836 > we.love.servers.at.ioflood.net.https: Flags [.], ack 75283, win 22468, options [nop,nop,TS val 1442326265 ecr 3007152717], length 0
00:38:24.486315 IP we.love.servers.at.ioflood.net.https > 192.168.75.233.59836: Flags [.], seq 75283:76731, ack 453, win 1364, options [nop,nop,TS val 3007152718 ecr 1442326091], length 1448
00:38:24.486327 IP we.love.servers.at.ioflood.net.https > 192.168.75.233.59836: Flags [.], seq 76731:78179, ack 453, win 1364, options [nop,nop,TS val 3007152718 ecr 1442326091], length 1448
00:38:24.486336 IP 192.168.75.233.59836 > we.love.servers.at.ioflood.net.https: Flags [.], ack 78179, win 22468, options [nop,nop,TS val 1442326266 ecr 3007152718], length 0
00:38:24.486339 IP we.love.servers.at.ioflood.net.https > 192.168.75.233.59836: Flags [.], seq 78179:79627, ack 453, win 1364, options [nop,nop,TS val 3007152718 ecr 1442326091], length 1448
00:38:24.486352 IP we.love.servers.at.ioflood.net.https > 192.168.75.233.59836: Flags [.], seq 79627:81075, ack 453, win 1364, options [nop,nop,TS val 3007152718 ecr 1442326091], length 1448
00:38:24.486364 IP we.love.servers.at.ioflood.net.https > 192.168.75.233.59836: Flags [.], seq 81075:82523, ack 453, win 1364, options [nop,nop,TS val 3007152718 ecr 1442326091], length 1448
00:38:24.486368 IP 192.168.75.233.59836 > we.love.servers.at.ioflood.net.https: Flags [.], ack 81075, win 22468, options [nop,nop,TS val 1442326266 ecr 3007152718], length 0
00:38:24.486376 IP we.love.servers.at.ioflood.net.https > 192.168.75.233.59836: Flags [P.], seq 82523:83971, ack 453, win 1364, options [nop,nop,TS val 3007152718 ecr 1442326091], length 1448
00:38:24.486398 IP 192.168.75.233.59836 > we.love.servers.at.ioflood.net.https: Flags [.], ack 83971, win 22458, options [nop,nop,TS val 1442326266 ecr 3007152718], length 0
00:38:24.487187 IP we.love.servers.at.ioflood.net.https > 192.168.75.233.59836: Flags [.], seq 83971:85419, ack 453, win 1364, options [nop,nop,TS val 3007152718 ecr 1442326091], length 1448
00:38:24.487203 IP we.love.servers.at.ioflood.net.https > 192.168.75.233.59836: Flags [.], seq 85419:86867, ack 453, win 1364, options [nop,nop,TS val 3007152718 ecr 1442326091], length 1448
00:38:24.487212 IP 192.168.75.233.59836 > we.love.servers.at.ioflood.net.https: Flags [.], ack 86867, win 22458, options [nop,nop,TS val 1442326267 ecr 3007152718], length 0
00:38:24.487225 IP we.love.servers.at.ioflood.net.https > 192.168.75.233.59836: Flags [.], seq 86867:89763, ack 453, win 1364, options [nop,nop,TS val 3007152718 ecr 1442326091], length 2896
00:38:24.487233 IP 192.168.75.233.59836 > we.love.servers.at.ioflood.net.https: Flags [.], ack 89763, win 22458, options [nop,nop,TS val 1442326267 ecr 3007152718], length 0
00:38:24.487249 IP we.love.servers.at.ioflood.net.https > 192.168.75.233.59836: Flags [P.], seq 89763:92659, ack 453, win 1364, options [nop,nop,TS val 3007152718 ecr 1442326091], length 2896
00:38:24.487258 IP 192.168.75.233.59836 > we.love.servers.at.ioflood.net.https: Flags [.], ack 92659, win 22458, options [nop,nop,TS val 1442326267 ecr 3007152718], length 0
00:38:24.488044 IP we.love.servers.at.ioflood.net.https > 192.168.75.233.59836: Flags [.], seq 92659:94107, ack 453, win 1364, options [nop,nop,TS val 3007152719 ecr 1442326091], length 1448
00:38:24.488058 IP we.love.servers.at.ioflood.net.https > 192.168.75.233.59836: Flags [.], seq 94107:95555, ack 453, win 1364, options [nop,nop,TS val 3007152719 ecr 1442326091], length 1448
00:38:24.488067 IP 192.168.75.233.59836 > we.love.servers.at.ioflood.net.https: Flags [.], ack 95555, win 22458, options [nop,nop,TS val 1442326268 ecr 3007152719], length 0
00:38:24.488079 IP we.love.servers.at.ioflood.net.https > 192.168.75.233.59836: Flags [P.], seq 95555:98437, ack 453, win 1364, options [nop,nop,TS val 3007152719 ecr 1442326091], length 2882
00:38:24.488091 IP 192.168.75.233.59836 > we.love.servers.at.ioflood.net.https: Flags [.], ack 98437, win 22458, options [nop,nop,TS val 1442326268 ecr 3007152719], length 0
00:38:24.503608 IP we.love.servers.at.ioflood.net.https > 192.168.75.233.59836: Flags [.], seq 98437:99885, ack 453, win 1364, options [nop,nop,TS val 3007152735 ecr 1442326091], length 1448
00:38:24.503642 IP we.love.servers.at.ioflood.net.https > 192.168.75.233.59836: Flags [.], seq 99885:104229, ack 453, win 1364, options [nop,nop,TS val 3007152735 ecr 1442326091], length 4344
00:38:24.503655 IP we.love.servers.at.ioflood.net.https > 192.168.75.233.59836: Flags [.], seq 104229:105677, ack 453, win 1364, options [nop,nop,TS val 3007152735 ecr 1442326091], length 1448
00:38:24.503667 IP we.love.servers.at.ioflood.net.https > 192.168.75.233.59836: Flags [P.], seq 105677:107125, ack 453, win 1364, options [nop,nop,TS val 3007152735 ecr 1442326091], length 1448
00:38:24.503667 IP 192.168.75.233.59836 > we.love.servers.at.ioflood.net.https: Flags [.], ack 104229, win 22443, options [nop,nop,TS val 1442326284 ecr 3007152735], length 0
00:38:24.503683 IP 192.168.75.233.59836 > we.love.servers.at.ioflood.net.https: Flags [.], ack 107125, win 22468, options [nop,nop,TS val 1442326284 ecr 3007152735], length 0
00:38:24.504027 IP we.love.servers.at.ioflood.net.https > 192.168.75.233.59836: Flags [.], seq 107125:108573, ack 453, win 1364, options [nop,nop,TS val 3007152736 ecr 1442326091], length 1448
00:38:24.504040 IP we.love.servers.at.ioflood.net.https > 192.168.75.233.59836: Flags [.], seq 108573:110021, ack 453, win 1364, options [nop,nop,TS val 3007152736 ecr 1442326091], length 1448
00:38:24.504052 IP 192.168.75.233.59836 > we.love.servers.at.ioflood.net.https: Flags [.], ack 110021, win 22468, options [nop,nop,TS val 1442326284 ecr 3007152736], length 0
00:38:24.504085 IP we.love.servers.at.ioflood.net.https > 192.168.75.233.59836: Flags [.], seq 110021:111469, ack 453, win 1364, options [nop,nop,TS val 3007152736 ecr 1442326091], length 1448
00:38:24.504097 IP we.love.servers.at.ioflood.net.https > 192.168.75.233.59836: Flags [.], seq 111469:112917, ack 453, win 1364, options [nop,nop,TS val 3007152736 ecr 1442326091], length 1448
00:38:24.504107 IP 192.168.75.233.59836 > we.love.servers.at.ioflood.net.https: Flags [.], ack 112917, win 22468, options [nop,nop,TS val 1442326284 ecr 3007152736], length 0
00:38:24.504112 IP we.love.servers.at.ioflood.net.https > 192.168.75.233.59836: Flags [P.], seq 112917:114843, ack 453, win 1364, options [nop,nop,TS val 3007152736 ecr 1442326091], length 1926
00:38:24.504129 IP 192.168.75.233.59836 > we.love.servers.at.ioflood.net.https: Flags [.], ack 114843, win 22468, options [nop,nop,TS val 1442326284 ecr 3007152736], length 0
00:38:24.504800 IP we.love.servers.at.ioflood.net.https > 192.168.75.233.59836: Flags [.], seq 114843:116291, ack 453, win 1364, options [nop,nop,TS val 3007152736 ecr 1442326091], length 1448
00:38:24.504816 IP we.love.servers.at.ioflood.net.https > 192.168.75.233.59836: Flags [.], seq 116291:117739, ack 453, win 1364, options [nop,nop,TS val 3007152736 ecr 1442326091], length 1448
00:38:24.504829 IP we.love.servers.at.ioflood.net.https > 192.168.75.233.59836: Flags [.], seq 117739:119187, ack 453, win 1364, options [nop,nop,TS val 3007152736 ecr 1442326091], length 1448
00:38:24.504830 IP 192.168.75.233.59836 > we.love.servers.at.ioflood.net.https: Flags [.], ack 117739, win 22458, options [nop,nop,TS val 1442326285 ecr 3007152736], length 0
00:38:24.504841 IP we.love.servers.at.ioflood.net.https > 192.168.75.233.59836: Flags [.], seq 119187:120635, ack 453, win 1364, options [nop,nop,TS val 3007152736 ecr 1442326091], length 1448
00:38:24.504850 IP 192.168.75.233.59836 > we.love.servers.at.ioflood.net.https: Flags [.], ack 120635, win 22465, options [nop,nop,TS val 1442326285 ecr 3007152736], length 0
00:38:24.504865 IP we.love.servers.at.ioflood.net.https > 192.168.75.233.59836: Flags [P.], seq 120635:123531, ack 453, win 1364, options [nop,nop,TS val 3007152736 ecr 1442326091], length 2896
00:38:24.504887 IP 192.168.75.233.59836 > we.love.servers.at.ioflood.net.https: Flags [.], ack 123531, win 22468, options [nop,nop,TS val 1442326285 ecr 3007152736], length 0
00:38:24.505689 IP we.love.servers.at.ioflood.net.https > 192.168.75.233.59836: Flags [.], seq 123531:124979, ack 453, win 1364, options [nop,nop,TS val 3007152737 ecr 1442326091], length 1448
00:38:24.505704 IP we.love.servers.at.ioflood.net.https > 192.168.75.233.59836: Flags [.], seq 124979:126427, ack 453, win 1364, options [nop,nop,TS val 3007152737 ecr 1442326091], length 1448
00:38:24.505717 IP we.love.servers.at.ioflood.net.https > 192.168.75.233.59836: Flags [.], seq 126427:127875, ack 453, win 1364, options [nop,nop,TS val 3007152737 ecr 1442326091], length 1448
00:38:24.505721 IP 192.168.75.233.59836 > we.love.servers.at.ioflood.net.https: Flags [.], ack 126427, win 22468, options [nop,nop,TS val 1442326286 ecr 3007152737], length 0
00:38:24.505727 IP we.love.servers.at.ioflood.net.https > 192.168.75.233.59836: Flags [.], seq 127875:129323, ack 453, win 1364, options [nop,nop,TS val 3007152737 ecr 1442326091], length 1448
00:38:24.505739 IP we.love.servers.at.ioflood.net.https > 192.168.75.233.59836: Flags [.], seq 129323:130771, ack 453, win 1364, options [nop,nop,TS val 3007152737 ecr 1442326091], length 1448
00:38:24.505743 IP 192.168.75.233.59836 > we.love.servers.at.ioflood.net.https: Flags [.], ack 129323, win 22468, options [nop,nop,TS val 1442326286 ecr 3007152737], length 0
00:38:24.505750 IP we.love.servers.at.ioflood.net.https > 192.168.75.233.59836: Flags [P.], seq 130771:132219, ack 453, win 1364, options [nop,nop,TS val 3007152737 ecr 1442326091], length 1448
00:38:24.505765 IP 192.168.75.233.59836 > we.love.servers.at.ioflood.net.https: Flags [.], ack 132219, win 22465, options [nop,nop,TS val 1442326286 ecr 3007152737], length 0
00:38:24.506655 IP we.love.servers.at.ioflood.net.https > 192.168.75.233.59836: Flags [.], seq 132219:133667, ack 453, win 1364, options [nop,nop,TS val 3007152738 ecr 1442326091], length 1448
00:38:24.506669 IP we.love.servers.at.ioflood.net.https > 192.168.75.233.59836: Flags [.], seq 133667:135115, ack 453, win 1364, options [nop,nop,TS val 3007152738 ecr 1442326091], length 1448
00:38:24.506681 IP we.love.servers.at.ioflood.net.https > 192.168.75.233.59836: Flags [.], seq 135115:136563, ack 453, win 1364, options [nop,nop,TS val 3007152738 ecr 1442326091], length 1448
00:38:24.506682 IP 192.168.75.233.59836 > we.love.servers.at.ioflood.net.https: Flags [.], ack 135115, win 22468, options [nop,nop,TS val 1442326287 ecr 3007152738], length 0
00:38:24.506692 IP we.love.servers.at.ioflood.net.https > 192.168.75.233.59836: Flags [.], seq 136563:138011, ack 453, win 1364, options [nop,nop,TS val 3007152738 ecr 1442326091], length 1448
00:38:24.506704 IP we.love.servers.at.ioflood.net.https > 192.168.75.233.59836: Flags [.], seq 138011:139459, ack 453, win 1364, options [nop,nop,TS val 3007152738 ecr 1442326091], length 1448
00:38:24.506708 IP 192.168.75.233.59836 > we.love.servers.at.ioflood.net.https: Flags [.], ack 138011, win 22468, options [nop,nop,TS val 1442326287 ecr 3007152738], length 0
00:38:24.506715 IP we.love.servers.at.ioflood.net.https > 192.168.75.233.59836: Flags [P.], seq 139459:140907, ack 453, win 1364, options [nop,nop,TS val 3007152738 ecr 1442326091], length 1448
00:38:24.506730 IP 192.168.75.233.59836 > we.love.servers.at.ioflood.net.https: Flags [.], ack 140907, win 22468, options [nop,nop,TS val 1442326287 ecr 3007152738], length 0
00:38:24.507533 IP we.love.servers.at.ioflood.net.https > 192.168.75.233.59836: Flags [.], seq 140907:142355, ack 453, win 1364, options [nop,nop,TS val 3007152739 ecr 1442326091], length 1448
00:38:24.507546 IP we.love.servers.at.ioflood.net.https > 192.168.75.233.59836: Flags [.], seq 142355:143803, ack 453, win 1364, options [nop,nop,TS val 3007152739 ecr 1442326091], length 1448
00:38:24.507558 IP we.love.servers.at.ioflood.net.https > 192.168.75.233.59836: Flags [.], seq 143803:145251, ack 453, win 1364, options [nop,nop,TS val 3007152739 ecr 1442326091], length 1448
00:38:24.507558 IP 192.168.75.233.59836 > we.love.servers.at.ioflood.net.https: Flags [.], ack 143803, win 22468, options [nop,nop,TS val 1442326288 ecr 3007152739], length 0
00:38:24.507571 IP we.love.servers.at.ioflood.net.https > 192.168.75.233.59836: Flags [.], seq 145251:146699, ack 453, win 1364, options [nop,nop,TS val 3007152739 ecr 1442326091], length 1448
00:38:24.507587 IP we.love.servers.at.ioflood.net.https > 192.168.75.233.59836: Flags [.], seq 146699:148147, ack 453, win 1364, options [nop,nop,TS val 3007152739 ecr 1442326091], length 1448
00:38:24.507596 IP 192.168.75.233.59836 > we.love.servers.at.ioflood.net.https: Flags [.], ack 148147, win 22458, options [nop,nop,TS val 1442326288 ecr 3007152739], length 0
00:38:24.507598 IP we.love.servers.at.ioflood.net.https > 192.168.75.233.59836: Flags [P.], seq 148147:149595, ack 453, win 1364, options [nop,nop,TS val 3007152739 ecr 1442326091], length 1448
00:38:24.507624 IP 192.168.75.233.59836 > we.love.servers.at.ioflood.net.https: Flags [.], ack 149595, win 22468, options [nop,nop,TS val 1442326288 ecr 3007152739], length 0
00:38:24.508444 IP we.love.servers.at.ioflood.net.https > 192.168.75.233.59836: Flags [.], seq 149595:151043, ack 453, win 1364, options [nop,nop,TS val 3007152740 ecr 1442326091], length 1448
00:38:24.508458 IP we.love.servers.at.ioflood.net.https > 192.168.75.233.59836: Flags [.], seq 151043:152491, ack 453, win 1364, options [nop,nop,TS val 3007152740 ecr 1442326091], length 1448
00:38:24.508471 IP we.love.servers.at.ioflood.net.https > 192.168.75.233.59836: Flags [.], seq 152491:153939, ack 453, win 1364, options [nop,nop,TS val 3007152740 ecr 1442326091], length 1448
00:38:24.508472 IP 192.168.75.233.59836 > we.love.servers.at.ioflood.net.https: Flags [.], ack 152491, win 22468, options [nop,nop,TS val 1442326289 ecr 3007152740], length 0
00:38:24.508481 IP we.love.servers.at.ioflood.net.https > 192.168.75.233.59836: Flags [.], seq 153939:155387, ack 453, win 1364, options [nop,nop,TS val 3007152740 ecr 1442326091], length 1448
00:38:24.508494 IP we.love.servers.at.ioflood.net.https > 192.168.75.233.59836: Flags [.], seq 155387:156835, ack 453, win 1364, options [nop,nop,TS val 3007152740 ecr 1442326091], length 1448
00:38:24.508498 IP 192.168.75.233.59836 > we.love.servers.at.ioflood.net.https: Flags [.], ack 155387, win 22468, options [nop,nop,TS val 1442326289 ecr 3007152740], length 0
00:38:24.508504 IP we.love.servers.at.ioflood.net.https > 192.168.75.233.59836: Flags [P.], seq 156835:158283, ack 453, win 1364, options [nop,nop,TS val 3007152740 ecr 1442326091], length 1448
00:38:24.508521 IP 192.168.75.233.59836 > we.love.servers.at.ioflood.net.https: Flags [.], ack 158283, win 22468, options [nop,nop,TS val 1442326289 ecr 3007152740], length 0
00:38:24.509301 IP we.love.servers.at.ioflood.net.https > 192.168.75.233.59836: Flags [.], seq 158283:159731, ack 453, win 1364, options [nop,nop,TS val 3007152741 ecr 1442326091], length 1448
00:38:24.509313 IP we.love.servers.at.ioflood.net.https > 192.168.75.233.59836: Flags [.], seq 159731:161179, ack 453, win 1364, options [nop,nop,TS val 3007152741 ecr 1442326091], length 1448
00:38:24.509322 IP 192.168.75.233.59836 > we.love.servers.at.ioflood.net.https: Flags [.], ack 161179, win 22468, options [nop,nop,TS val 1442326289 ecr 3007152741], length 0
00:38:24.509330 IP we.love.servers.at.ioflood.net.https > 192.168.75.233.59836: Flags [.], seq 161179:162627, ack 453, win 1364, options [nop,nop,TS val 3007152741 ecr 1442326091], length 1448
00:38:24.509343 IP we.love.servers.at.ioflood.net.https > 192.168.75.233.59836: Flags [P.], seq 162627:164061, ack 453, win 1364, options [nop,nop,TS val 3007152741 ecr 1442326091], length 1434
00:38:24.509355 IP 192.168.75.233.59836 > we.love.servers.at.ioflood.net.https: Flags [.], ack 164061, win 22468, options [nop,nop,TS val 1442326289 ecr 3007152741], length 0
00:38:24.522687 IP we.love.servers.at.ioflood.net.https > 192.168.75.233.59836: Flags [.], seq 164061:165509, ack 453, win 1364, options [nop,nop,TS val 3007152754 ecr 1442326091], length 1448
00:38:24.522704 IP we.love.servers.at.ioflood.net.https > 192.168.75.233.59836: Flags [.], seq 165509:166957, ack 453, win 1364, options [nop,nop,TS val 3007152754 ecr 1442326091], length 1448
00:38:24.522724 IP we.love.servers.at.ioflood.net.https > 192.168.75.233.59836: Flags [.], seq 166957:169853, ack 453, win 1364, options [nop,nop,TS val 3007152754 ecr 1442326091], length 2896
00:38:24.522726 IP 192.168.75.233.59836 > we.love.servers.at.ioflood.net.https: Flags [.], ack 166957, win 22458, options [nop,nop,TS val 1442326303 ecr 3007152754], length 0
00:38:24.522734 IP we.love.servers.at.ioflood.net.https > 192.168.75.233.59836: Flags [.], seq 169853:171301, ack 453, win 1364, options [nop,nop,TS val 3007152754 ecr 1442326091], length 1448
00:38:24.522739 IP 192.168.75.233.59836 > we.love.servers.at.ioflood.net.https: Flags [.], ack 169853, win 22468, options [nop,nop,TS val 1442326303 ecr 3007152754], length 0
00:38:24.522747 IP we.love.servers.at.ioflood.net.https > 192.168.75.233.59836: Flags [P.], seq 171301:172749, ack 453, win 1364, options [nop,nop,TS val 3007152754 ecr 1442326091], length 1448
00:38:24.522770 IP 192.168.75.233.59836 > we.love.servers.at.ioflood.net.https: Flags [.], ack 172749, win 22468, options [nop,nop,TS val 1442326303 ecr 3007152754], length 0
00:38:24.523134 IP we.love.servers.at.ioflood.net.https > 192.168.75.233.59836: Flags [.], seq 172749:174197, ack 453, win 1364, options [nop,nop,TS val 3007152754 ecr 1442326091], length 1448
00:38:24.523158 IP we.love.servers.at.ioflood.net.https > 192.168.75.233.59836: Flags [.], seq 174197:175645, ack 453, win 1364, options [nop,nop,TS val 3007152754 ecr 1442326091], length 1448
00:38:24.523171 IP we.love.servers.at.ioflood.net.https > 192.168.75.233.59836: Flags [.], seq 175645:177093, ack 453, win 1364, options [nop,nop,TS val 3007152754 ecr 1442326091], length 1448
00:38:24.523183 IP we.love.servers.at.ioflood.net.https > 192.168.75.233.59836: Flags [.], seq 177093:178541, ack 453, win 1364, options [nop,nop,TS val 3007152754 ecr 1442326091], length 1448
00:38:24.523184 IP 192.168.75.233.59836 > we.love.servers.at.ioflood.net.https: Flags [.], ack 177093, win 22468, options [nop,nop,TS val 1442326303 ecr 3007152754], length 0
00:38:24.523198 IP we.love.servers.at.ioflood.net.https > 192.168.75.233.59836: Flags [P.], seq 178541:180467, ack 453, win 1364, options [nop,nop,TS val 3007152754 ecr 1442326091], length 1926
00:38:24.523217 IP 192.168.75.233.59836 > we.love.servers.at.ioflood.net.https: Flags [.], ack 180467, win 22468, options [nop,nop,TS val 1442326303 ecr 3007152754], length 0
00:38:24.523930 IP we.love.servers.at.ioflood.net.https > 192.168.75.233.59836: Flags [.], seq 180467:181915, ack 453, win 1364, options [nop,nop,TS val 3007152755 ecr 1442326091], length 1448
00:38:24.523945 IP we.love.servers.at.ioflood.net.https > 192.168.75.233.59836: Flags [.], seq 181915:183363, ack 453, win 1364, options [nop,nop,TS val 3007152755 ecr 1442326091], length 1448
00:38:24.523958 IP we.love.servers.at.ioflood.net.https > 192.168.75.233.59836: Flags [.], seq 183363:184811, ack 453, win 1364, options [nop,nop,TS val 3007152755 ecr 1442326091], length 1448
00:38:24.523959 IP 192.168.75.233.59836 > we.love.servers.at.ioflood.net.https: Flags [.], ack 183363, win 22458, options [nop,nop,TS val 1442326304 ecr 3007152755], length 0
00:38:24.523968 IP we.love.servers.at.ioflood.net.https > 192.168.75.233.59836: Flags [.], seq 184811:186259, ack 453, win 1364, options [nop,nop,TS val 3007152755 ecr 1442326091], length 1448
00:38:24.523976 IP 192.168.75.233.59836 > we.love.servers.at.ioflood.net.https: Flags [.], ack 186259, win 22465, options [nop,nop,TS val 1442326304 ecr 3007152755], length 0
00:38:24.523990 IP we.love.servers.at.ioflood.net.https > 192.168.75.233.59836: Flags [P.], seq 186259:189155, ack 453, win 1364, options [nop,nop,TS val 3007152755 ecr 1442326091], length 2896
00:38:24.524002 IP 192.168.75.233.59836 > we.love.servers.at.ioflood.net.https: Flags [.], ack 189155, win 22468, options [nop,nop,TS val 1442326304 ecr 3007152755], length 0
00:38:24.524875 IP we.love.servers.at.ioflood.net.https > 192.168.75.233.59836: Flags [.], seq 189155:190603, ack 453, win 1364, options [nop,nop,TS val 3007152756 ecr 1442326091], length 1448
00:38:24.524887 IP we.love.servers.at.ioflood.net.https > 192.168.75.233.59836: Flags [.], seq 190603:192051, ack 453, win 1364, options [nop,nop,TS val 3007152756 ecr 1442326091], length 1448
00:38:24.524899 IP 192.168.75.233.59836 > we.love.servers.at.ioflood.net.https: Flags [.], ack 192051, win 22468, options [nop,nop,TS val 1442326305 ecr 3007152756], length 0
00:38:24.524900 IP we.love.servers.at.ioflood.net.https > 192.168.75.233.59836: Flags [.], seq 192051:193499, ack 453, win 1364, options [nop,nop,TS val 3007152756 ecr 1442326091], length 1448
00:38:24.524913 IP we.love.servers.at.ioflood.net.https > 192.168.75.233.59836: Flags [.], seq 193499:194947, ack 453, win 1364, options [nop,nop,TS val 3007152756 ecr 1442326091], length 1448
00:38:24.524924 IP 192.168.75.233.59836 > we.love.servers.at.ioflood.net.https: Flags [.], ack 194947, win 22468, options [nop,nop,TS val 1442326305 ecr 3007152756], length 0
00:38:24.524925 IP we.love.servers.at.ioflood.net.https > 192.168.75.233.59836: Flags [.], seq 194947:196395, ack 453, win 1364, options [nop,nop,TS val 3007152756 ecr 1442326091], length 1448
00:38:24.524938 IP we.love.servers.at.ioflood.net.https > 192.168.75.233.59836: Flags [P.], seq 196395:197843, ack 453, win 1364, options [nop,nop,TS val 3007152756 ecr 1442326091], length 1448
00:38:24.524945 IP 192.168.75.233.59836 > we.love.servers.at.ioflood.net.https: Flags [.], ack 197843, win 22465, options [nop,nop,TS val 1442326305 ecr 3007152756], length 0
00:38:24.525657 IP we.love.servers.at.ioflood.net.https > 192.168.75.233.59836: Flags [.], seq 197843:199291, ack 453, win 1364, options [nop,nop,TS val 3007152757 ecr 1442326091], length 1448
00:38:24.525674 IP we.love.servers.at.ioflood.net.https > 192.168.75.233.59836: Flags [.], seq 199291:200739, ack 453, win 1364, options [nop,nop,TS val 3007152757 ecr 1442326091], length 1448
00:38:24.525688 IP we.love.servers.at.ioflood.net.https > 192.168.75.233.59836: Flags [.], seq 200739:202187, ack 453, win 1364, options [nop,nop,TS val 3007152757 ecr 1442326091], length 1448
00:38:24.525689 IP 192.168.75.233.59836 > we.love.servers.at.ioflood.net.https: Flags [.], ack 200739, win 22468, options [nop,nop,TS val 1442326306 ecr 3007152757], length 0
00:38:24.525701 IP we.love.servers.at.ioflood.net.https > 192.168.75.233.59836: Flags [.], seq 202187:203635, ack 453, win 1364, options [nop,nop,TS val 3007152757 ecr 1442326091], length 1448
00:38:24.525716 IP we.love.servers.at.ioflood.net.https > 192.168.75.233.59836: Flags [P.], seq 203635:206531, ack 453, win 1364, options [nop,nop,TS val 3007152757 ecr 1442326091], length 2896
00:38:24.525720 IP 192.168.75.233.59836 > we.love.servers.at.ioflood.net.https: Flags [.], ack 203635, win 22468, options [nop,nop,TS val 1442326306 ecr 3007152757], length 0
00:38:24.525727 IP 192.168.75.233.59836 > we.love.servers.at.ioflood.net.https: Flags [.], ack 206531, win 22468, options [nop,nop,TS val 1442326306 ecr 3007152757], length 0
00:38:24.526570 IP we.love.servers.at.ioflood.net.https > 192.168.75.233.59836: Flags [.], seq 206531:207979, ack 453, win 1364, options [nop,nop,TS val 3007152758 ecr 1442326091], length 1448
00:38:24.526583 IP we.love.servers.at.ioflood.net.https > 192.168.75.233.59836: Flags [.], seq 207979:209427, ack 453, win 1364, options [nop,nop,TS val 3007152758 ecr 1442326091], length 1448
00:38:24.526595 IP we.love.servers.at.ioflood.net.https > 192.168.75.233.59836: Flags [.], seq 209427:210875, ack 453, win 1364, options [nop,nop,TS val 3007152758 ecr 1442326091], length 1448
00:38:24.526598 IP 192.168.75.233.59836 > we.love.servers.at.ioflood.net.https: Flags [.], ack 209427, win 22468, options [nop,nop,TS val 1442326307 ecr 3007152758], length 0
00:38:24.526608 IP we.love.servers.at.ioflood.net.https > 192.168.75.233.59836: Flags [.], seq 210875:212323, ack 453, win 1364, options [nop,nop,TS val 3007152758 ecr 1442326091], length 1448
00:38:24.526621 IP we.love.servers.at.ioflood.net.https > 192.168.75.233.59836: Flags [.], seq 212323:213771, ack 453, win 1364, options [nop,nop,TS val 3007152758 ecr 1442326091], length 1448
00:38:24.526625 IP 192.168.75.233.59836 > we.love.servers.at.ioflood.net.https: Flags [.], ack 212323, win 22468, options [nop,nop,TS val 1442326307 ecr 3007152758], length 0
00:38:24.526632 IP we.love.servers.at.ioflood.net.https > 192.168.75.233.59836: Flags [P.], seq 213771:215219, ack 453, win 1364, options [nop,nop,TS val 3007152758 ecr 1442326091], length 1448
00:38:24.526654 IP 192.168.75.233.59836 > we.love.servers.at.ioflood.net.https: Flags [.], ack 215219, win 22458, options [nop,nop,TS val 1442326307 ecr 3007152758], length 0
00:38:24.527422 IP we.love.servers.at.ioflood.net.https > 192.168.75.233.59836: Flags [.], seq 215219:216667, ack 453, win 1364, options [nop,nop,TS val 3007152758 ecr 1442326091], length 1448
00:38:24.527436 IP we.love.servers.at.ioflood.net.https > 192.168.75.233.59836: Flags [.], seq 216667:218115, ack 453, win 1364, options [nop,nop,TS val 3007152758 ecr 1442326091], length 1448
00:38:24.527445 IP 192.168.75.233.59836 > we.love.servers.at.ioflood.net.https: Flags [.], ack 218115, win 22458, options [nop,nop,TS val 1442326307 ecr 3007152758], length 0
00:38:24.527458 IP we.love.servers.at.ioflood.net.https > 192.168.75.233.59836: Flags [.], seq 218115:221011, ack 453, win 1364, options [nop,nop,TS val 3007152758 ecr 1442326091], length 2896
00:38:24.527471 IP 192.168.75.233.59836 > we.love.servers.at.ioflood.net.https: Flags [.], ack 221011, win 22458, options [nop,nop,TS val 1442326307 ecr 3007152758], length 0
00:38:24.527493 IP we.love.servers.at.ioflood.net.https > 192.168.75.233.59836: Flags [P.], seq 221011:223907, ack 453, win 1364, options [nop,nop,TS val 3007152758 ecr 1442326091], length 2896
