01:24:03.284530 IP 192.168.75.233.40751 > bns1.hananet.net.domain: 29622+ A? rr1---sn-n3cgv5qc5oq-bh26e.googlevideo.com. (60)
01:24:03.284551 IP 192.168.75.233.40751 > bns1.hananet.net.domain: 49853+ AAAA? rr1---sn-n3cgv5qc5oq-bh26e.googlevideo.com. (60)
01:24:03.286183 IP bns1.hananet.net.domain > 192.168.75.233.40751: 29622 2/0/0 CNAME rr1.sn-n3cgv5qc5oq-bh26e.googlevideo.com., A 1.225.35.172 (130)
01:24:03.286217 IP bns1.hananet.net.domain > 192.168.75.233.40751: 49853 2/0/0 CNAME rr1.sn-n3cgv5qc5oq-bh26e.googlevideo.com., AAAA 2001:290:20:2051::c (142)
01:24:03.295390 IP 192.168.75.233.46360 > bns1.hananet.net.domain: 25617+ A? rr1---sn-n3cgv5qc5oq-bh26e.googlevideo.com. (60)
01:24:03.295408 IP 192.168.75.233.46360 > bns1.hananet.net.domain: 59413+ AAAA? rr1---sn-n3cgv5qc5oq-bh26e.googlevideo.com. (60)
01:24:03.296992 IP bns1.hananet.net.domain > 192.168.75.233.46360: 25617 2/0/0 CNAME rr1.sn-n3cgv5qc5oq-bh26e.googlevideo.com., A 1.225.35.172 (130)
01:24:03.297034 IP bns1.hananet.net.domain > 192.168.75.233.46360: 59413 2/0/0 CNAME rr1.sn-n3cgv5qc5oq-bh26e.googlevideo.com., AAAA 2001:290:20:2051::c (142)
01:24:03.300082 IP 192.168.75.233.55970 > 1.225.35.172.https: UDP, length 1357
01:24:03.300210 IP 192.168.75.233.55970 > 1.225.35.172.https: UDP, length 1357
01:24:03.300259 IP 192.168.75.233.55970 > 1.225.35.172.https: UDP, length 327
01:24:03.313240 IP 1.225.35.172.https > 192.168.75.233.55970: UDP, length 140
01:24:03.313727 IP 192.168.75.233.55970 > 1.225.35.172.https: UDP, length 33
01:24:03.315527 IP 1.225.35.172.https > 192.168.75.233.55970: UDP, length 1352
01:24:03.315581 IP 1.225.35.172.https > 192.168.75.233.55970: UDP, length 1357
01:24:03.315597 IP 1.225.35.172.https > 192.168.75.233.55970: UDP, length 1357
01:24:03.315615 IP 1.225.35.172.https > 192.168.75.233.55970: UDP, length 1357
01:24:03.315616 IP 1.225.35.172.https > 192.168.75.233.55970: UDP, length 1357
01:24:03.315636 IP 1.225.35.172.https > 192.168.75.233.55970: UDP, length 1357
01:24:03.315637 IP 1.225.35.172.https > 192.168.75.233.55970: UDP, length 1357
01:24:03.315662 IP 1.225.35.172.https > 192.168.75.233.55970: UDP, length 1357
01:24:03.315664 IP 1.225.35.172.https > 192.168.75.233.55970: UDP, length 1357
01:24:03.315683 IP 1.225.35.172.https > 192.168.75.233.55970: UDP, length 1357
01:24:03.315684 IP 1.225.35.172.https > 192.168.75.233.55970: UDP, length 1357
01:24:03.315703 IP 1.225.35.172.https > 192.168.75.233.55970: UDP, length 1357
01:24:03.315704 IP 1.225.35.172.https > 192.168.75.233.55970: UDP, length 1357
01:24:03.315722 IP 1.225.35.172.https > 192.168.75.233.55970: UDP, length 1357
01:24:03.315737 IP 1.225.35.172.https > 192.168.75.233.55970: UDP, length 1357
01:24:03.315738 IP 1.225.35.172.https > 192.168.75.233.55970: UDP, length 1357
01:24:03.316019 IP 192.168.75.233.55970 > 1.225.35.172.https: UDP, length 33
01:24:03.318071 IP 1.225.35.172.https > 192.168.75.233.55970: UDP, length 1357
01:24:03.318092 IP 1.225.35.172.https > 192.168.75.233.55970: UDP, length 1357
01:24:03.318093 IP 1.225.35.172.https > 192.168.75.233.55970: UDP, length 1357
01:24:03.318112 IP 1.225.35.172.https > 192.168.75.233.55970: UDP, length 1357
01:24:03.318113 IP 1.225.35.172.https > 192.168.75.233.55970: UDP, length 1357
01:24:03.318131 IP 1.225.35.172.https > 192.168.75.233.55970: UDP, length 1357
01:24:03.318147 IP 1.225.35.172.https > 192.168.75.233.55970: UDP, length 1357
01:24:03.318147 IP 1.225.35.172.https > 192.168.75.233.55970: UDP, length 1357
01:24:03.318164 IP 1.225.35.172.https > 192.168.75.233.55970: UDP, length 1357
01:24:03.318183 IP 1.225.35.172.https > 192.168.75.233.55970: UDP, length 1357
01:24:03.318184 IP 1.225.35.172.https > 192.168.75.233.55970: UDP, length 1357
01:24:03.318201 IP 1.225.35.172.https > 192.168.75.233.55970: UDP, length 1357
01:24:03.318217 IP 1.225.35.172.https > 192.168.75.233.55970: UDP, length 1357
01:24:03.318218 IP 1.225.35.172.https > 192.168.75.233.55970: UDP, length 1357
01:24:03.318234 IP 1.225.35.172.https > 192.168.75.233.55970: UDP, length 895
01:24:03.318915 IP 192.168.75.233.55970 > 1.225.35.172.https: UDP, length 33
01:24:03.322075 IP 1.225.35.172.https > 192.168.75.233.55970: UDP, length 28
01:24:03.901860 IP ip136.ip-94-23-149.eu.9100 > 192.168.75.233.42066: Flags [P.], seq 3036887876:3036888412, ack 910545197, win 501, options [nop,nop,TS val 1411191774 ecr 1249807667], length 536
01:24:03.901906 IP 192.168.75.233.42066 > ip136.ip-94-23-149.eu.9100: Flags [.], ack 536, win 3966, options [nop,nop,TS val 1249814595 ecr 1411191774], length 0
01:24:04.080399 IP 192.168.75.233.32810 > bns1.hananet.net.domain: 51904+ PTR? 82.163.220.210.in-addr.arpa. (45)
01:24:04.083111 IP 192.168.75.233.41194 > nrt12s29-in-f14.1e100.net.https: UDP, length 1357
01:24:04.083210 IP 192.168.75.233.41194 > nrt12s29-in-f14.1e100.net.https: UDP, length 1357
01:24:04.083294 IP 192.168.75.233.41194 > nrt12s29-in-f14.1e100.net.https: UDP, length 1357
01:24:04.084508 IP 192.168.75.233.41194 > nrt12s29-in-f14.1e100.net.https: UDP, length 324
01:24:04.089327 IP bns1.hananet.net.domain > 192.168.75.233.32810: 51904 1/0/0 PTR bns1.hananet.net. (75)
01:24:04.089600 IP 192.168.75.233.60970 > bns1.hananet.net.domain: 53224+ PTR? 233.75.168.192.in-addr.arpa. (45)
01:24:04.099848 IP bns1.hananet.net.domain > 192.168.75.233.60970: 53224 NXDomain 0/1/0 (80)
01:24:04.100197 IP 192.168.75.233.59782 > bns1.hananet.net.domain: 62871+ PTR? 172.35.225.1.in-addr.arpa. (43)
01:24:04.112100 IP bns1.hananet.net.domain > 192.168.75.233.59782: 62871 NXDomain 0/1/0 (122)
01:24:04.112823 IP 192.168.75.233.44752 > bns1.hananet.net.domain: 42700+ PTR? 136.149.23.94.in-addr.arpa. (44)
01:24:04.134967 IP nrt12s29-in-f14.1e100.net.https > 192.168.75.233.41194: UDP, length 36
01:24:04.155635 IP 192.168.75.233.41194 > nrt12s29-in-f14.1e100.net.https: UDP, length 34
01:24:04.188165 IP nrt12s29-in-f14.1e100.net.https > 192.168.75.233.41194: UDP, length 1352
01:24:04.188166 IP nrt12s29-in-f14.1e100.net.https > 192.168.75.233.41194: UDP, length 549
01:24:04.188341 IP nrt12s29-in-f14.1e100.net.https > 192.168.75.233.41194: UDP, length 232
01:24:04.189499 IP 192.168.75.233.41194 > nrt12s29-in-f14.1e100.net.https: UDP, length 41
01:24:04.239055 IP nrt12s29-in-f14.1e100.net.https > 192.168.75.233.41194: UDP, length 29
01:24:04.372135 IP bns1.hananet.net.domain > 192.168.75.233.44752: 42700 1/0/0 PTR ip136.ip-94-23-149.eu. (79)
01:24:05.103780 IP 192.168.75.233.39976 > bns1.hananet.net.domain: 15691+ PTR? 238.175.217.172.in-addr.arpa. (46)
01:24:05.113909 IP bns1.hananet.net.domain > 192.168.75.233.39976: 15691 1/0/0 PTR nrt12s29-in-f14.1e100.net. (85)
01:24:05.306049 IP 192.168.75.233.46155 > bns1.hananet.net.domain: 59586+ A? rr1---sn-n3cgv5qc5oq-bh26e.googlevideo.com. (60)
01:24:05.306060 IP 192.168.75.233.46155 > bns1.hananet.net.domain: 3838+ AAAA? rr1---sn-n3cgv5qc5oq-bh26e.googlevideo.com. (60)
01:24:05.307177 IP bns1.hananet.net.domain > 192.168.75.233.46155: 59586 2/0/0 CNAME rr1.sn-n3cgv5qc5oq-bh26e.googlevideo.com., A 1.225.35.172 (130)
01:24:05.307208 IP bns1.hananet.net.domain > 192.168.75.233.46155: 3838 2/0/0 CNAME rr1.sn-n3cgv5qc5oq-bh26e.googlevideo.com., AAAA 2001:290:20:2051::c (142)
01:24:05.314593 IP 192.168.75.233.54520 > bns1.hananet.net.domain: 17118+ A? rr1---sn-n3cgv5qc5oq-bh26e.googlevideo.com. (60)
01:24:05.314602 IP 192.168.75.233.54520 > bns1.hananet.net.domain: 21200+ AAAA? rr1---sn-n3cgv5qc5oq-bh26e.googlevideo.com. (60)
01:24:05.315958 IP bns1.hananet.net.domain > 192.168.75.233.54520: 17118 2/0/0 CNAME rr1.sn-n3cgv5qc5oq-bh26e.googlevideo.com., A 1.225.35.172 (130)
01:24:05.315996 IP bns1.hananet.net.domain > 192.168.75.233.54520: 21200 2/0/0 CNAME rr1.sn-n3cgv5qc5oq-bh26e.googlevideo.com., AAAA 2001:290:20:2051::c (142)
01:24:05.319109 IP 192.168.75.233.55970 > 1.225.35.172.https: UDP, length 1357
01:24:05.319198 IP 192.168.75.233.55970 > 1.225.35.172.https: UDP, length 1357
01:24:05.319257 IP 192.168.75.233.55970 > 1.225.35.172.https: UDP, length 327
01:24:05.330610 IP 1.225.35.172.https > 192.168.75.233.55970: UDP, length 35
01:24:05.333600 IP 1.225.35.172.https > 192.168.75.233.55970: UDP, length 133
01:24:05.334093 IP 192.168.75.233.55970 > 1.225.35.172.https: UDP, length 40
01:24:05.335436 IP 1.225.35.172.https > 192.168.75.233.55970: UDP, length 153
01:24:05.335451 IP 1.225.35.172.https > 192.168.75.233.55970: UDP, length 27
01:24:05.335759 IP 192.168.75.233.55970 > 1.225.35.172.https: UDP, length 33
01:24:05.342562 IP 1.225.35.172.https > 192.168.75.233.55970: UDP, length 28
01:24:07.286130 IP 192.168.75.233.46388 > 146.75.49.140.https: Flags [P.], seq 427716493:427716532, ack 116889017, win 4311, options [nop,nop,TS val 1152912981 ecr 1908801832], length 39
01:24:07.296054 IP 146.75.49.140.https > 192.168.75.233.46388: Flags [.], ack 39, win 353, options [nop,nop,TS val 1908860597 ecr 1152912981], length 0
01:24:07.296087 IP 146.75.49.140.https > 192.168.75.233.46388: Flags [P.], seq 1:40, ack 39, win 353, options [nop,nop,TS val 1908860597 ecr 1152912981], length 39
01:24:07.339498 IP 192.168.75.233.46388 > 146.75.49.140.https: Flags [.], ack 40, win 4311, options [nop,nop,TS val 1152913035 ecr 1908860597], length 0
01:24:07.549928 IP 192.168.75.233.41194 > nrt12s29-in-f14.1e100.net.https: UDP, length 1357
01:24:07.550028 IP 192.168.75.233.41194 > nrt12s29-in-f14.1e100.net.https: UDP, length 946
01:24:07.604971 IP nrt12s29-in-f14.1e100.net.https > 192.168.75.233.41194: UDP, length 36
01:24:07.625637 IP 192.168.75.233.41194 > nrt12s29-in-f14.1e100.net.https: UDP, length 34
01:24:07.637683 IP nrt12s29-in-f14.1e100.net.https > 192.168.75.233.41194: UDP, length 86
01:24:07.637838 IP nrt12s29-in-f14.1e100.net.https > 192.168.75.233.41194: UDP, length 26
01:24:07.638261 IP 192.168.75.233.41194 > nrt12s29-in-f14.1e100.net.https: UDP, length 41
01:24:07.687085 IP nrt12s29-in-f14.1e100.net.https > 192.168.75.233.41194: UDP, length 29
01:24:08.175711 IP 192.168.75.233.41006 > bns1.hananet.net.domain: 41412+ PTR? 140.49.75.146.in-addr.arpa. (44)
01:24:08.177112 IP bns1.hananet.net.domain > 192.168.75.233.41006: 41412 NXDomain 0/0/0 (44)
01:24:09.705950 Loopback, skipCount 0,  invalid (256)
01:24:10.286775 IP 192.168.75.233.60494 > nrt13s54-in-f22.1e100.net.https: Flags [P.], seq 3261113049:3261113088, ack 197612988, win 501, options [nop,nop,TS val 4179871980 ecr 1244111232], length 39
01:24:10.286887 IP 192.168.75.233.59074 > nrt12s58-in-f1.1e100.net.https: Flags [P.], seq 2752971272:2752971311, ack 526754568, win 501, options [nop,nop,TS val 3996342790 ecr 3923743685], length 39
01:24:10.332675 IP nrt12s58-in-f1.1e100.net.https > 192.168.75.233.59074: Flags [.], ack 39, win 265, options [nop,nop,TS val 3923802230 ecr 3996342790], length 0
01:24:10.332717 IP nrt12s58-in-f1.1e100.net.https > 192.168.75.233.59074: Flags [P.], seq 1:40, ack 39, win 265, options [nop,nop,TS val 3923802230 ecr 3996342790], length 39
01:24:10.332741 IP 192.168.75.233.59074 > nrt12s58-in-f1.1e100.net.https: Flags [.], ack 40, win 501, options [nop,nop,TS val 3996342836 ecr 3923802230], length 0
01:24:10.358311 IP nrt13s54-in-f22.1e100.net.https > 192.168.75.233.60494: Flags [.], ack 39, win 265, options [nop,nop,TS val 1244169654 ecr 4179871980], length 0
01:24:10.358351 IP nrt13s54-in-f22.1e100.net.https > 192.168.75.233.60494: Flags [P.], seq 1:40, ack 39, win 265, options [nop,nop,TS val 1244169654 ecr 4179871980], length 39
01:24:10.399502 IP 192.168.75.233.60494 > nrt13s54-in-f22.1e100.net.https: Flags [.], ack 40, win 501, options [nop,nop,TS val 4179872093 ecr 1244169654], length 0
01:24:10.924052 IP 192.168.75.233.42484 > bns1.hananet.net.domain: 31695+ A? rr1---sn-n3cgv5qc5oq-bh26e.googlevideo.com. (60)
01:24:10.924087 IP 192.168.75.233.42484 > bns1.hananet.net.domain: 62451+ AAAA? rr1---sn-n3cgv5qc5oq-bh26e.googlevideo.com. (60)
01:24:10.925339 IP bns1.hananet.net.domain > 192.168.75.233.42484: 31695 2/0/0 CNAME rr1.sn-n3cgv5qc5oq-bh26e.googlevideo.com., A 1.225.35.172 (130)
01:24:10.925370 IP bns1.hananet.net.domain > 192.168.75.233.42484: 62451 2/0/0 CNAME rr1.sn-n3cgv5qc5oq-bh26e.googlevideo.com., AAAA 2001:290:20:2051::c (142)
01:24:10.931087 IP 192.168.75.233.55887 > bns1.hananet.net.domain: 65484+ A? rr1---sn-n3cgv5qc5oq-bh26e.googlevideo.com. (60)
01:24:10.931097 IP 192.168.75.233.55887 > bns1.hananet.net.domain: 1737+ AAAA? rr1---sn-n3cgv5qc5oq-bh26e.googlevideo.com. (60)
01:24:10.932109 IP bns1.hananet.net.domain > 192.168.75.233.55887: 65484 2/0/0 CNAME rr1.sn-n3cgv5qc5oq-bh26e.googlevideo.com., A 1.225.35.172 (130)
01:24:10.932131 IP bns1.hananet.net.domain > 192.168.75.233.55887: 1737 2/0/0 CNAME rr1.sn-n3cgv5qc5oq-bh26e.googlevideo.com., AAAA 2001:290:20:2051::c (142)
01:24:10.936123 IP 192.168.75.233.55970 > 1.225.35.172.https: UDP, length 1357
01:24:10.936192 IP 192.168.75.233.55970 > 1.225.35.172.https: UDP, length 1357
01:24:10.936233 IP 192.168.75.233.55970 > 1.225.35.172.https: UDP, length 327
01:24:10.949198 IP 1.225.35.172.https > 192.168.75.233.55970: UDP, length 140
01:24:10.949638 IP 192.168.75.233.55970 > 1.225.35.172.https: UDP, length 33
01:24:10.951411 IP 1.225.35.172.https > 192.168.75.233.55970: UDP, length 1352
01:24:10.951449 IP 1.225.35.172.https > 192.168.75.233.55970: UDP, length 1357
01:24:10.951460 IP 1.225.35.172.https > 192.168.75.233.55970: UDP, length 1357
01:24:10.951485 IP 1.225.35.172.https > 192.168.75.233.55970: UDP, length 1357
01:24:10.951485 IP 1.225.35.172.https > 192.168.75.233.55970: UDP, length 1357
01:24:10.951503 IP 1.225.35.172.https > 192.168.75.233.55970: UDP, length 1357
01:24:10.951504 IP 1.225.35.172.https > 192.168.75.233.55970: UDP, length 1357
01:24:10.951584 IP 1.225.35.172.https > 192.168.75.233.55970: UDP, length 1357
01:24:10.951594 IP 1.225.35.172.https > 192.168.75.233.55970: UDP, length 1357
01:24:10.951606 IP 1.225.35.172.https > 192.168.75.233.55970: UDP, length 1357
01:24:10.951617 IP 1.225.35.172.https > 192.168.75.233.55970: UDP, length 1357
01:24:10.951631 IP 1.225.35.172.https > 192.168.75.233.55970: UDP, length 1357
01:24:10.951641 IP 1.225.35.172.https > 192.168.75.233.55970: UDP, length 1357
01:24:10.951651 IP 1.225.35.172.https > 192.168.75.233.55970: UDP, length 1357
01:24:10.951662 IP 1.225.35.172.https > 192.168.75.233.55970: UDP, length 1357
01:24:10.951674 IP 1.225.35.172.https > 192.168.75.233.55970: UDP, length 1357
01:24:10.951876 IP 192.168.75.233.55970 > 1.225.35.172.https: UDP, length 33
01:24:10.953346 IP 1.225.35.172.https > 192.168.75.233.55970: UDP, length 1357
01:24:10.953365 IP 1.225.35.172.https > 192.168.75.233.55970: UDP, length 1357
01:24:10.953366 IP 1.225.35.172.https > 192.168.75.233.55970: UDP, length 1357
01:24:10.953378 IP 1.225.35.172.https > 192.168.75.233.55970: UDP, length 1357
01:24:10.953388 IP 1.225.35.172.https > 192.168.75.233.55970: UDP, length 1357
01:24:10.953399 IP 1.225.35.172.https > 192.168.75.233.55970: UDP, length 1357
01:24:10.953413 IP 1.225.35.172.https > 192.168.75.233.55970: UDP, length 1357
01:24:10.953422 IP 1.225.35.172.https > 192.168.75.233.55970: UDP, length 1357
01:24:10.953433 IP 1.225.35.172.https > 192.168.75.233.55970: UDP, length 1357
01:24:10.953445 IP 1.225.35.172.https > 192.168.75.233.55970: UDP, length 1357
01:24:10.953456 IP 1.225.35.172.https > 192.168.75.233.55970: UDP, length 1357
01:24:10.953468 IP 1.225.35.172.https > 192.168.75.233.55970: UDP, length 1357
01:24:10.953479 IP 1.225.35.172.https > 192.168.75.233.55970: UDP, length 1357
01:24:10.953494 IP 1.225.35.172.https > 192.168.75.233.55970: UDP, length 1357
01:24:10.953504 IP 1.225.35.172.https > 192.168.75.233.55970: UDP, length 1357
01:24:10.953514 IP 1.225.35.172.https > 192.168.75.233.55970: UDP, length 1357
01:24:10.953524 IP 1.225.35.172.https > 192.168.75.233.55970: UDP, length 1357
01:24:10.953542 IP 1.225.35.172.https > 192.168.75.233.55970: UDP, length 1357
01:24:10.953553 IP 1.225.35.172.https > 192.168.75.233.55970: UDP, length 1357
01:24:10.953563 IP 1.225.35.172.https > 192.168.75.233.55970: UDP, length 1357
01:24:10.953573 IP 1.225.35.172.https > 192.168.75.233.55970: UDP, length 1357
01:24:10.953583 IP 1.225.35.172.https > 192.168.75.233.55970: UDP, length 1357
01:24:10.953596 IP 1.225.35.172.https > 192.168.75.233.55970: UDP, length 1357
01:24:10.953605 IP 1.225.35.172.https > 192.168.75.233.55970: UDP, length 1357
01:24:10.954344 IP 192.168.75.233.55970 > 1.225.35.172.https: UDP, length 33
01:24:10.955412 IP 1.225.35.172.https > 192.168.75.233.55970: UDP, length 1357
01:24:10.955435 IP 1.225.35.172.https > 192.168.75.233.55970: UDP, length 1357
01:24:10.955436 IP 1.225.35.172.https > 192.168.75.233.55970: UDP, length 1357
01:24:10.955449 IP 1.225.35.172.https > 192.168.75.233.55970: UDP, length 1357
01:24:10.955476 IP 1.225.35.172.https > 192.168.75.233.55970: UDP, length 1357
01:24:10.955477 IP 1.225.35.172.https > 192.168.75.233.55970: UDP, length 1357
01:24:10.955478 IP 1.225.35.172.https > 192.168.75.233.55970: UDP, length 1357
01:24:10.955503 IP 1.225.35.172.https > 192.168.75.233.55970: UDP, length 1357
01:24:10.955503 IP 1.225.35.172.https > 192.168.75.233.55970: UDP, length 1357
01:24:10.955516 IP 1.225.35.172.https > 192.168.75.233.55970: UDP, length 1357
01:24:10.955527 IP 1.225.35.172.https > 192.168.75.233.55970: UDP, length 1357
01:24:10.955536 IP 1.225.35.172.https > 192.168.75.233.55970: UDP, length 1357
01:24:10.955545 IP 1.225.35.172.https > 192.168.75.233.55970: UDP, length 1357
01:24:10.955556 IP 1.225.35.172.https > 192.168.75.233.55970: UDP, length 1357
01:24:10.955567 IP 1.225.35.172.https > 192.168.75.233.55970: UDP, length 1357
01:24:10.955581 IP 1.225.35.172.https > 192.168.75.233.55970: UDP, length 1357
01:24:10.955590 IP 1.225.35.172.https > 192.168.75.233.55970: UDP, length 1357
01:24:10.955602 IP 1.225.35.172.https > 192.168.75.233.55970: UDP, length 1357
01:24:10.955613 IP 1.225.35.172.https > 192.168.75.233.55970: UDP, length 1357
01:24:10.955624 IP 1.225.35.172.https > 192.168.75.233.55970: UDP, length 1357
01:24:10.955644 IP 1.225.35.172.https > 192.168.75.233.55970: UDP, length 1357
01:24:10.955644 IP 1.225.35.172.https > 192.168.75.233.55970: UDP, length 1357
01:24:10.955658 IP 1.225.35.172.https > 192.168.75.233.55970: UDP, length 1357
01:24:10.955670 IP 1.225.35.172.https > 192.168.75.233.55970: UDP, length 1357
01:24:10.956642 IP 192.168.75.233.55970 > 1.225.35.172.https: UDP, length 33
01:24:10.957655 IP 1.225.35.172.https > 192.168.75.233.55970: UDP, length 1357
01:24:10.957675 IP 1.225.35.172.https > 192.168.75.233.55970: UDP, length 1357
01:24:10.957676 IP 1.225.35.172.https > 192.168.75.233.55970: UDP, length 1357
01:24:10.957688 IP 1.225.35.172.https > 192.168.75.233.55970: UDP, length 1357
01:24:10.957698 IP 1.225.35.172.https > 192.168.75.233.55970: UDP, length 1357
01:24:10.957710 IP 1.225.35.172.https > 192.168.75.233.55970: UDP, length 1357
01:24:10.957721 IP 1.225.35.172.https > 192.168.75.233.55970: UDP, length 1357
01:24:10.957732 IP 1.225.35.172.https > 192.168.75.233.55970: UDP, length 1357
01:24:10.957745 IP 1.225.35.172.https > 192.168.75.233.55970: UDP, length 1357
01:24:10.957755 IP 1.225.35.172.https > 192.168.75.233.55970: UDP, length 1357
01:24:10.957766 IP 1.225.35.172.https > 192.168.75.233.55970: UDP, length 1357
01:24:10.957778 IP 1.225.35.172.https > 192.168.75.233.55970: UDP, length 1357
01:24:10.957789 IP 1.225.35.172.https > 192.168.75.233.55970: UDP, length 1357
01:24:10.957801 IP 1.225.35.172.https > 192.168.75.233.55970: UDP, length 1357
01:24:10.957812 IP 1.225.35.172.https > 192.168.75.233.55970: UDP, length 1357
01:24:10.957823 IP 1.225.35.172.https > 192.168.75.233.55970: UDP, length 1357
01:24:10.957835 IP 1.225.35.172.https > 192.168.75.233.55970: UDP, length 1357
01:24:10.957846 IP 1.225.35.172.https > 192.168.75.233.55970: UDP, length 1357
01:24:10.957857 IP 1.225.35.172.https > 192.168.75.233.55970: UDP, length 1357
01:24:10.957880 IP 1.225.35.172.https > 192.168.75.233.55970: UDP, length 1357
01:24:10.957881 IP 1.225.35.172.https > 192.168.75.233.55970: UDP, length 1357
01:24:10.957892 IP 1.225.35.172.https > 192.168.75.233.55970: UDP, length 1357
01:24:10.957903 IP 1.225.35.172.https > 192.168.75.233.55970: UDP, length 1357
01:24:10.957914 IP 1.225.35.172.https > 192.168.75.233.55970: UDP, length 1357
01:24:10.957928 IP 1.225.35.172.https > 192.168.75.233.55970: UDP, length 1357
01:24:10.957937 IP 1.225.35.172.https > 192.168.75.233.55970: UDP, length 1357
01:24:10.957949 IP 1.225.35.172.https > 192.168.75.233.55970: UDP, length 1357
01:24:10.957969 IP 1.225.35.172.https > 192.168.75.233.55970: UDP, length 1357
01:24:10.958542 IP 192.168.75.233.55970 > 1.225.35.172.https: UDP, length 33
01:24:10.959887 IP 1.225.35.172.https > 192.168.75.233.55970: UDP, length 1357
01:24:10.959907 IP 1.225.35.172.https > 192.168.75.233.55970: UDP, length 1357
01:24:10.959908 IP 1.225.35.172.https > 192.168.75.233.55970: UDP, length 1357
01:24:10.959921 IP 1.225.35.172.https > 192.168.75.233.55970: UDP, length 1357
01:24:10.959931 IP 1.225.35.172.https > 192.168.75.233.55970: UDP, length 1357
01:24:10.959941 IP 1.225.35.172.https > 192.168.75.233.55970: UDP, length 1357
01:24:10.959952 IP 1.225.35.172.https > 192.168.75.233.55970: UDP, length 1357
01:24:10.959963 IP 1.225.35.172.https > 192.168.75.233.55970: UDP, length 1357
01:24:10.959975 IP 1.225.35.172.https > 192.168.75.233.55970: UDP, length 1357
01:24:10.959989 IP 1.225.35.172.https > 192.168.75.233.55970: UDP, length 1357
01:24:10.959999 IP 1.225.35.172.https > 192.168.75.233.55970: UDP, length 1357
01:24:10.960009 IP 1.225.35.172.https > 192.168.75.233.55970: UDP, length 1357
01:24:10.960020 IP 1.225.35.172.https > 192.168.75.233.55970: UDP, length 1357
01:24:10.960033 IP 1.225.35.172.https > 192.168.75.233.55970: UDP, length 1357
01:24:10.960044 IP 1.225.35.172.https > 192.168.75.233.55970: UDP, length 1357
01:24:10.960055 IP 1.225.35.172.https > 192.168.75.233.55970: UDP, length 1357
01:24:10.960066 IP 1.225.35.172.https > 192.168.75.233.55970: UDP, length 1357
01:24:10.960077 IP 1.225.35.172.https > 192.168.75.233.55970: UDP, length 1357
01:24:10.960088 IP 1.225.35.172.https > 192.168.75.233.55970: UDP, length 1357
01:24:10.960100 IP 1.225.35.172.https > 192.168.75.233.55970: UDP, length 1357
01:24:10.960111 IP 1.225.35.172.https > 192.168.75.233.55970: UDP, length 1357
01:24:10.960122 IP 1.225.35.172.https > 192.168.75.233.55970: UDP, length 1357
01:24:10.960134 IP 1.225.35.172.https > 192.168.75.233.55970: UDP, length 1357
01:24:10.960145 IP 1.225.35.172.https > 192.168.75.233.55970: UDP, length 1357
01:24:10.960157 IP 1.225.35.172.https > 192.168.75.233.55970: UDP, length 1357
01:24:10.960168 IP 1.225.35.172.https > 192.168.75.233.55970: UDP, length 1357
01:24:10.960179 IP 1.225.35.172.https > 192.168.75.233.55970: UDP, length 1357
01:24:10.960205 IP 1.225.35.172.https > 192.168.75.233.55970: UDP, length 1357
01:24:10.960222 IP 1.225.35.172.https > 192.168.75.233.55970: UDP, length 1357
01:24:10.960244 IP 1.225.35.172.https > 192.168.75.233.55970: UDP, length 1357
01:24:10.960261 IP 1.225.35.172.https > 192.168.75.233.55970: UDP, length 1357
01:24:10.960284 IP 1.225.35.172.https > 192.168.75.233.55970: UDP, length 1357
01:24:10.960668 IP 192.168.75.233.55970 > 1.225.35.172.https: UDP, length 33
01:24:10.960830 IP 1.225.35.172.https > 192.168.75.233.55970: UDP, length 1357
01:24:10.960847 IP 1.225.35.172.https > 192.168.75.233.55970: UDP, length 1357
01:24:10.960863 IP 1.225.35.172.https > 192.168.75.233.55970: UDP, length 1357
01:24:10.960864 IP 1.225.35.172.https > 192.168.75.233.55970: UDP, length 1357
01:24:10.960875 IP 1.225.35.172.https > 192.168.75.233.55970: UDP, length 1357
01:24:10.960886 IP 1.225.35.172.https > 192.168.75.233.55970: UDP, length 1357
01:24:10.960897 IP 1.225.35.172.https > 192.168.75.233.55970: UDP, length 1357
01:24:10.960908 IP 1.225.35.172.https > 192.168.75.233.55970: UDP, length 1357
01:24:10.960920 IP 1.225.35.172.https > 192.168.75.233.55970: UDP, length 1357
01:24:10.960931 IP 1.225.35.172.https > 192.168.75.233.55970: UDP, length 1357
01:24:10.960942 IP 1.225.35.172.https > 192.168.75.233.55970: UDP, length 1357
01:24:10.960954 IP 1.225.35.172.https > 192.168.75.233.55970: UDP, length 1357
01:24:10.960965 IP 1.225.35.172.https > 192.168.75.233.55970: UDP, length 1357
01:24:10.960979 IP 1.225.35.172.https > 192.168.75.233.55970: UDP, length 1357
01:24:10.960990 IP 1.225.35.172.https > 192.168.75.233.55970: UDP, length 1357
01:24:10.960999 IP 1.225.35.172.https > 192.168.75.233.55970: UDP, length 1357
01:24:10.961214 IP 192.168.75.233.55970 > 1.225.35.172.https: UDP, length 33
01:24:10.964527 IP 1.225.35.172.https > 192.168.75.233.55970: UDP, length 1357
01:24:10.964545 IP 1.225.35.172.https > 192.168.75.233.55970: UDP, length 1357
01:24:10.964546 IP 1.225.35.172.https > 192.168.75.233.55970: UDP, length 1357
01:24:10.964559 IP 1.225.35.172.https > 192.168.75.233.55970: UDP, length 1357
01:24:10.964570 IP 1.225.35.172.https > 192.168.75.233.55970: UDP, length 1357
01:24:10.964582 IP 1.225.35.172.https > 192.168.75.233.55970: UDP, length 1357
01:24:10.964593 IP 1.225.35.172.https > 192.168.75.233.55970: UDP, length 1357
01:24:10.964604 IP 1.225.35.172.https > 192.168.75.233.55970: UDP, length 1357
01:24:10.964616 IP 1.225.35.172.https > 192.168.75.233.55970: UDP, length 1357
01:24:10.964627 IP 1.225.35.172.https > 192.168.75.233.55970: UDP, length 1357
01:24:10.964638 IP 1.225.35.172.https > 192.168.75.233.55970: UDP, length 1357
01:24:10.964650 IP 1.225.35.172.https > 192.168.75.233.55970: UDP, length 1357
01:24:10.964661 IP 1.225.35.172.https > 192.168.75.233.55970: UDP, length 1357
01:24:10.964673 IP 1.225.35.172.https > 192.168.75.233.55970: UDP, length 1357
01:24:10.964684 IP 1.225.35.172.https > 192.168.75.233.55970: UDP, length 1357
01:24:10.964700 IP 1.225.35.172.https > 192.168.75.233.55970: UDP, length 1357
01:24:10.964710 IP 1.225.35.172.https > 192.168.75.233.55970: UDP, length 1357
01:24:10.964720 IP 1.225.35.172.https > 192.168.75.233.55970: UDP, length 1357
01:24:10.964730 IP 1.225.35.172.https > 192.168.75.233.55970: UDP, length 1357
01:24:10.964741 IP 1.225.35.172.https > 192.168.75.233.55970: UDP, length 1357
01:24:10.964752 IP 1.225.35.172.https > 192.168.75.233.55970: UDP, length 1357
01:24:10.964764 IP 1.225.35.172.https > 192.168.75.233.55970: UDP, length 1357
01:24:10.964775 IP 1.225.35.172.https > 192.168.75.233.55970: UDP, length 1357
01:24:10.964787 IP 1.225.35.172.https > 192.168.75.233.55970: UDP, length 1357
01:24:10.964798 IP 1.225.35.172.https > 192.168.75.233.55970: UDP, length 1357
01:24:10.964809 IP 1.225.35.172.https > 192.168.75.233.55970: UDP, length 1357
01:24:10.964821 IP 1.225.35.172.https > 192.168.75.233.55970: UDP, length 1357
01:24:10.964840 IP 1.225.35.172.https > 192.168.75.233.55970: UDP, length 1357
01:24:10.964860 IP 1.225.35.172.https > 192.168.75.233.55970: UDP, length 1357
01:24:10.964883 IP 1.225.35.172.https > 192.168.75.233.55970: UDP, length 1357
01:24:10.964907 IP 1.225.35.172.https > 192.168.75.233.55970: UDP, length 1357
01:24:10.964927 IP 1.225.35.172.https > 192.168.75.233.55970: UDP, length 1357
01:24:10.964942 IP 1.225.35.172.https > 192.168.75.233.55970: UDP, length 1357
01:24:10.964965 IP 1.225.35.172.https > 192.168.75.233.55970: UDP, length 1357
01:24:10.964984 IP 1.225.35.172.https > 192.168.75.233.55970: UDP, length 1357
01:24:10.965004 IP 1.225.35.172.https > 192.168.75.233.55970: UDP, length 1357
01:24:10.965026 IP 1.225.35.172.https > 192.168.75.233.55970: UDP, length 1357
01:24:10.965046 IP 1.225.35.172.https > 192.168.75.233.55970: UDP, length 1357
01:24:10.965048 IP 192.168.75.233.41082 > bns1.hananet.net.domain: 16487+ PTR? 22.207.250.142.in-addr.arpa. (45)
01:24:10.965070 IP 1.225.35.172.https > 192.168.75.233.55970: UDP, length 1357
01:24:10.965088 IP 1.225.35.172.https > 192.168.75.233.55970: UDP, length 1357
01:24:10.965108 IP 1.225.35.172.https > 192.168.75.233.55970: UDP, length 1357
01:24:10.965128 IP 1.225.35.172.https > 192.168.75.233.55970: UDP, length 1357
01:24:10.965147 IP 1.225.35.172.https > 192.168.75.233.55970: UDP, length 1357
01:24:10.965170 IP 1.225.35.172.https > 192.168.75.233.55970: UDP, length 1357
01:24:10.965190 IP 1.225.35.172.https > 192.168.75.233.55970: UDP, length 1357
01:24:10.965212 IP 1.225.35.172.https > 192.168.75.233.55970: UDP, length 1357
01:24:10.965233 IP 1.225.35.172.https > 192.168.75.233.55970: UDP, length 1357
01:24:10.965258 IP 1.225.35.172.https > 192.168.75.233.55970: UDP, length 1357
01:24:10.965259 IP 1.225.35.172.https > 192.168.75.233.55970: UDP, length 264
01:24:10.965899 IP 192.168.75.233.55970 > 1.225.35.172.https: UDP, length 33
01:24:10.966053 IP bns1.hananet.net.domain > 192.168.75.233.41082: 16487 1/0/0 PTR nrt13s54-in-f22.1e100.net. (84)
01:24:10.966187 IP 192.168.75.233.59196 > bns1.hananet.net.domain: 44574+ PTR? 1.198.250.142.in-addr.arpa. (44)
01:24:10.973945 IP bns1.hananet.net.domain > 192.168.75.233.59196: 44574 1/0/0 PTR nrt12s58-in-f1.1e100.net. (82)
01:24:11.030043 IP ip136.ip-94-23-149.eu.9100 > 192.168.75.233.42066: Flags [P.], seq 536:1072, ack 1, win 501, options [nop,nop,TS val 1411198902 ecr 1249814595], length 536
01:24:11.030073 IP 192.168.75.233.42066 > ip136.ip-94-23-149.eu.9100: Flags [.], ack 1072, win 3974, options [nop,nop,TS val 1249821723 ecr 1411198902], length 0
01:24:11.287187 IP 192.168.75.233.45006 > bom05s09-in-f10.1e100.net.https: Flags [P.], seq 1740231487:1740231526, ack 597032875, win 501, options [nop,nop,TS val 320168333 ecr 481148678], length 39
01:24:11.329054 IP bom05s09-in-f10.1e100.net.https > 192.168.75.233.45006: Flags [P.], seq 1:40, ack 39, win 256, options [nop,nop,TS val 481207519 ecr 320168333], length 39
01:24:11.371501 IP 192.168.75.233.45006 > bom05s09-in-f10.1e100.net.https: Flags [.], ack 40, win 501, options [nop,nop,TS val 320168418 ecr 481207519], length 0
01:24:11.983821 IP 192.168.75.233.41620 > bns1.hananet.net.domain: 30390+ PTR? 234.26.217.172.in-addr.arpa. (45)
01:24:11.985215 IP bns1.hananet.net.domain > 192.168.75.233.41620: 30390 2/0/0 PTR bom05s09-in-f10.1e100.net., PTR nrt12s51-in-f10.1e100.net. (123)
01:24:12.100182 IP 192.168.75.233.44957 > 104.16.219.109.https: UDP, length 1357
01:24:12.100234 IP 192.168.75.233.44957 > 104.16.219.109.https: UDP, length 236
01:24:12.114864 IP 104.16.219.109.https > 192.168.75.233.44957: UDP, length 1200
01:24:12.116093 IP 104.16.219.109.https > 192.168.75.233.44957: UDP, length 55
01:24:12.116094 IP 104.16.219.109.https > 192.168.75.233.44957: UDP, length 27
01:24:12.116094 IP 104.16.219.109.https > 192.168.75.233.44957: UDP, length 27
01:24:12.116095 IP 104.16.219.109.https > 192.168.75.233.44957: UDP, length 52
01:24:12.117893 IP 192.168.75.233.44957 > 104.16.219.109.https: UDP, length 139
01:24:12.124826 IP 104.16.219.109.https > 192.168.75.233.44957: UDP, length 27
01:24:12.145489 IP 192.168.75.233.44957 > 104.16.219.109.https: UDP, length 44
01:24:12.184514 IP 104.16.219.109.https > 192.168.75.233.44957: UDP, length 460
01:24:12.205183 IP 192.168.75.233.44957 > 104.16.219.109.https: UDP, length 44
01:24:12.431497 IP 192.168.75.233.60910 > 104.16.89.50.https: Flags [.], ack 159809528, win 501, options [nop,nop,TS val 3029610035 ecr 2380147302], length 0
01:24:12.440707 IP 104.16.89.50.https > 192.168.75.233.60910: Flags [.], ack 1, win 9, options [nop,nop,TS val 2380157541 ecr 3029548883], length 0
01:24:12.943510 IP 192.168.75.233.49514 > nrt12s46-in-f3.1e100.net.http: Flags [.], ack 2033262453, win 501, options [nop,nop,TS val 1279435633 ecr 3369716767], length 0
01:24:12.983790 IP nrt12s46-in-f3.1e100.net.http > 192.168.75.233.49514: Flags [.], ack 1, win 286, options [nop,nop,TS val 3369727007 ecr 1279374431], length 0
01:24:13.011689 IP 192.168.75.233.58432 > bns1.hananet.net.domain: 18558+ PTR? 109.219.16.104.in-addr.arpa. (45)
01:24:13.028038 IP bns1.hananet.net.domain > 192.168.75.233.58432: 18558 NXDomain 0/1/0 (140)
01:24:13.028257 IP 192.168.75.233.49572 > bns1.hananet.net.domain: 30120+ PTR? 50.89.16.104.in-addr.arpa. (43)
01:24:13.029121 IP bns1.hananet.net.domain > 192.168.75.233.49572: 30120 NXDomain 0/0/0 (43)
01:24:13.029201 IP 192.168.75.233.46330 > bns1.hananet.net.domain: 32613+ PTR? 163.42.251.142.in-addr.arpa. (45)
01:24:13.037785 IP bns1.hananet.net.domain > 192.168.75.233.46330: 32613 1/0/0 PTR nrt12s46-in-f3.1e100.net. (83)
01:24:13.177504 IP 192.168.75.233.41935 > bns1.hananet.net.domain: 21435+ A? rr1---sn-n3cgv5qc5oq-bh26e.googlevideo.com. (60)
01:24:13.177516 IP 192.168.75.233.41935 > bns1.hananet.net.domain: 34980+ AAAA? rr1---sn-n3cgv5qc5oq-bh26e.googlevideo.com. (60)
01:24:13.179230 IP bns1.hananet.net.domain > 192.168.75.233.41935: 21435 2/0/0 CNAME rr1.sn-n3cgv5qc5oq-bh26e.googlevideo.com., A 1.225.35.172 (130)
01:24:13.179273 IP bns1.hananet.net.domain > 192.168.75.233.41935: 34980 2/0/0 CNAME rr1.sn-n3cgv5qc5oq-bh26e.googlevideo.com., AAAA 2001:290:20:2051::c (142)
01:24:13.184899 IP 192.168.75.233.42345 > bns1.hananet.net.domain: 50939+ A? rr1---sn-n3cgv5qc5oq-bh26e.googlevideo.com. (60)
01:24:13.184909 IP 192.168.75.233.42345 > bns1.hananet.net.domain: 49415+ AAAA? rr1---sn-n3cgv5qc5oq-bh26e.googlevideo.com. (60)
01:24:13.186137 IP bns1.hananet.net.domain > 192.168.75.233.42345: 50939 2/0/0 CNAME rr1.sn-n3cgv5qc5oq-bh26e.googlevideo.com., A 1.225.35.172 (130)
01:24:13.186177 IP bns1.hananet.net.domain > 192.168.75.233.42345: 49415 2/0/0 CNAME rr1.sn-n3cgv5qc5oq-bh26e.googlevideo.com., AAAA 2001:290:20:2051::c (142)
01:24:13.193307 IP 192.168.75.233.55970 > 1.225.35.172.https: UDP, length 1357
01:24:13.193397 IP 192.168.75.233.55970 > 1.225.35.172.https: UDP, length 1357
01:24:13.193447 IP 192.168.75.233.55970 > 1.225.35.172.https: UDP, length 327
01:24:13.199488 IP 192.168.75.233.49524 > nrt12s46-in-f3.1e100.net.http: Flags [.], ack 3427231801, win 501, options [nop,nop,TS val 1279435889 ecr 3677565793], length 0
01:24:13.204454 IP 1.225.35.172.https > 192.168.75.233.55970: UDP, length 35
01:24:13.207146 IP 1.225.35.172.https > 192.168.75.233.55970: UDP, length 133
01:24:13.207623 IP 192.168.75.233.55970 > 1.225.35.172.https: UDP, length 40
01:24:13.209052 IP 1.225.35.172.https > 192.168.75.233.55970: UDP, length 153
01:24:13.209067 IP 1.225.35.172.https > 192.168.75.233.55970: UDP, length 27
01:24:13.209355 IP 192.168.75.233.55970 > 1.225.35.172.https: UDP, length 33
01:24:13.215345 IP 1.225.35.172.https > 192.168.75.233.55970: UDP, length 28
01:24:13.240686 IP nrt12s46-in-f3.1e100.net.http > 192.168.75.233.49524: Flags [.], ack 1, win 300, options [nop,nop,TS val 3677576033 ecr 1279374486], length 0
01:24:14.986083 IP 192.168.75.233.42028 > bns1.hananet.net.domain: 57121+ A? obsproject.com. (32)
01:24:14.986098 IP 192.168.75.233.42028 > bns1.hananet.net.domain: 2877+ AAAA? obsproject.com. (32)
01:24:14.998043 IP bns1.hananet.net.domain > 192.168.75.233.42028: 57121 1/0/0 A 142.4.216.103 (48)
01:24:15.001332 IP bns1.hananet.net.domain > 192.168.75.233.42028: 2877 1/0/0 AAAA 2607:5300:60:1567:a585:cd28:2747:ec5a (60)
01:24:15.001572 IP 192.168.75.233.54444 > kore.r1ch.net.https: Flags [S], seq 1089313578, win 64240, options [mss 1460,sackOK,TS val 627081460 ecr 0,nop,wscale 7], length 0
01:24:15.059729 IP 192.168.75.233.39687 > bns1.hananet.net.domain: 58163+ PTR? 103.216.4.142.in-addr.arpa. (44)
01:24:15.089845 IP ip136.ip-94-23-149.eu.9100 > 192.168.75.233.42066: Flags [P.], seq 1072:1608, ack 1, win 501, options [nop,nop,TS val 1411202962 ecr 1249821723], length 536
01:24:15.089876 IP 192.168.75.233.42066 > ip136.ip-94-23-149.eu.9100: Flags [.], ack 1608, win 3983, options [nop,nop,TS val 1249825783 ecr 1411202962], length 0
01:24:15.130910 IP 192.168.75.233.36170 > bns1.hananet.net.domain: 30181+ A? ingest.twitch.tv. (34)
01:24:15.130920 IP 192.168.75.233.36170 > bns1.hananet.net.domain: 47075+ AAAA? ingest.twitch.tv. (34)
01:24:15.139643 IP bns1.hananet.net.domain > 192.168.75.233.36170: 30181 2/0/0 A 192.108.239.253, A 23.160.0.253 (66)
01:24:15.142010 IP bns1.hananet.net.domain > 192.168.75.233.36170: 47075 0/1/0 (121)
01:24:15.142234 IP 192.168.75.233.56718 > 192.108.239.253.https: Flags [S], seq 1601973159, win 64240, options [mss 1460,sackOK,TS val 2137047484 ecr 0,nop,wscale 7], length 0
01:24:15.149838 IP 192.108.239.253.https > 192.168.75.233.56718: Flags [S.], seq 1705822773, ack 1601973160, win 65160, options [mss 1460,sackOK,TS val 1076392381 ecr 2137047484,nop,wscale 9], length 0
01:24:15.149871 IP 192.168.75.233.56718 > 192.108.239.253.https: Flags [.], ack 1, win 502, options [nop,nop,TS val 2137047492 ecr 1076392381], length 0
01:24:15.192019 IP kore.r1ch.net.https > 192.168.75.233.54444: Flags [S.], seq 3299241760, ack 1089313579, win 28960, options [mss 1460,sackOK,TS val 3777922483 ecr 627081460,nop,wscale 10], length 0
01:24:15.192055 IP 192.168.75.233.54444 > kore.r1ch.net.https: Flags [.], ack 1, win 502, options [nop,nop,TS val 627081650 ecr 3777922483], length 0
01:24:15.235186 IP 192.168.75.233.56718 > 192.108.239.253.https: Flags [P.], seq 1:406, ack 1, win 502, options [nop,nop,TS val 2137047577 ecr 1076392381], length 405
01:24:15.241235 IP 192.168.75.233.54444 > kore.r1ch.net.https: Flags [P.], seq 1:404, ack 1, win 502, options [nop,nop,TS val 627081699 ecr 3777922483], length 403
01:24:15.244026 IP 192.108.239.253.https > 192.168.75.233.56718: Flags [.], ack 406, win 127, options [nop,nop,TS val 1076392476 ecr 2137047577], length 0
01:24:15.249324 IP 192.108.239.253.https > 192.168.75.233.56718: Flags [.], seq 1:1449, ack 406, win 127, options [nop,nop,TS val 1076392481 ecr 2137047577], length 1448
01:24:15.249351 IP 192.168.75.233.56718 > 192.108.239.253.https: Flags [.], ack 1449, win 501, options [nop,nop,TS val 2137047591 ecr 1076392481], length 0
01:24:15.249372 IP 192.108.239.253.https > 192.168.75.233.56718: Flags [P.], seq 1449:4345, ack 406, win 127, options [nop,nop,TS val 1076392481 ecr 2137047577], length 2896
01:24:15.249373 IP 192.108.239.253.https > 192.168.75.233.56718: Flags [P.], seq 4345:7115, ack 406, win 127, options [nop,nop,TS val 1076392481 ecr 2137047577], length 2770
01:24:15.249382 IP 192.168.75.233.56718 > 192.108.239.253.https: Flags [.], ack 4345, win 489, options [nop,nop,TS val 2137047591 ecr 1076392481], length 0
01:24:15.249391 IP 192.168.75.233.56718 > 192.108.239.253.https: Flags [.], ack 7115, win 474, options [nop,nop,TS val 2137047591 ecr 1076392481], length 0
01:24:15.249614 IP 192.168.75.233.56718 > 192.108.239.253.https: Flags [P.], seq 406:412, ack 7115, win 474, options [nop,nop,TS val 2137047592 ecr 1076392481], length 6
01:24:15.250152 IP 192.168.75.233.56718 > 192.108.239.253.https: Flags [P.], seq 412:470, ack 7115, win 501, options [nop,nop,TS val 2137047592 ecr 1076392481], length 58
01:24:15.252277 IP 192.168.75.233.56718 > 192.108.239.253.https: Flags [P.], seq 470:596, ack 7115, win 501, options [nop,nop,TS val 2137047594 ecr 1076392481], length 126
01:24:15.253208 IP bns1.hananet.net.domain > 192.168.75.233.39687: 58163 1/0/0 PTR kore.r1ch.net. (71)
01:24:15.258100 IP 192.108.239.253.https > 192.168.75.233.56718: Flags [.], ack 470, win 127, options [nop,nop,TS val 1076392490 ecr 2137047592], length 0
01:24:15.301619 IP 192.108.239.253.https > 192.168.75.233.56718: Flags [.], ack 596, win 127, options [nop,nop,TS val 1076392533 ecr 2137047594], length 0
01:24:15.432619 IP kore.r1ch.net.https > 192.168.75.233.54444: Flags [.], ack 404, win 30, options [nop,nop,TS val 3777922724 ecr 627081699], length 0
01:24:15.434065 IP kore.r1ch.net.https > 192.168.75.233.54444: Flags [.], seq 1:1449, ack 404, win 30, options [nop,nop,TS val 3777922725 ecr 627081699], length 1448
01:24:15.434088 IP 192.168.75.233.54444 > kore.r1ch.net.https: Flags [.], ack 1449, win 501, options [nop,nop,TS val 627081892 ecr 3777922725], length 0
01:24:15.434114 IP kore.r1ch.net.https > 192.168.75.233.54444: Flags [P.], seq 1449:3778, ack 404, win 30, options [nop,nop,TS val 3777922725 ecr 627081699], length 2329
