08:22:49.639429 IP ip-192-168-75-233.ap-northeast-1.compute.internal.46802 > ec2-13-231-171-17.ap-northeast-1.compute.amazonaws.com.openvpn: UDP, length 76
08:22:49.685470 IP ec2-13-231-171-17.ap-northeast-1.compute.amazonaws.com.openvpn > ip-192-168-75-233.ap-northeast-1.compute.internal.46802: UDP, length 76
08:22:50.056131 IP ip-192-168-75-233.ap-northeast-1.compute.internal.46802 > ec2-13-231-171-17.ap-northeast-1.compute.amazonaws.com.openvpn: UDP, length 96
08:22:50.098301 IP ec2-13-231-171-17.ap-northeast-1.compute.amazonaws.com.openvpn > ip-192-168-75-233.ap-northeast-1.compute.internal.46802: UDP, length 164
08:22:50.098668 IP ip-192-168-75-233.ap-northeast-1.compute.internal.46802 > ec2-13-231-171-17.ap-northeast-1.compute.amazonaws.com.openvpn: UDP, length 97
08:22:50.138338 IP ec2-13-231-171-17.ap-northeast-1.compute.amazonaws.com.openvpn > ip-192-168-75-233.ap-northeast-1.compute.internal.46802: UDP, length 160
08:22:51.593619 IP ec2-13-231-171-17.ap-northeast-1.compute.amazonaws.com.openvpn > ip-192-168-75-233.ap-northeast-1.compute.internal.46802: UDP, length 612
08:22:51.593762 IP ip-192-168-75-233.ap-northeast-1.compute.internal.46802 > ec2-13-231-171-17.ap-northeast-1.compute.amazonaws.com.openvpn: UDP, length 76
08:22:52.239679 IP ip-192-168-75-233.ap-northeast-1.compute.internal.46802 > ec2-13-231-171-17.ap-northeast-1.compute.amazonaws.com.openvpn: UDP, length 80
08:22:52.239711 IP ip-192-168-75-233.ap-northeast-1.compute.internal.46802 > ec2-13-231-171-17.ap-northeast-1.compute.amazonaws.com.openvpn: UDP, length 80
08:22:52.281676 IP ec2-13-231-171-17.ap-northeast-1.compute.amazonaws.com.openvpn > ip-192-168-75-233.ap-northeast-1.compute.internal.46802: UDP, length 96
08:22:52.282182 IP ec2-13-231-171-17.ap-northeast-1.compute.amazonaws.com.openvpn > ip-192-168-75-233.ap-northeast-1.compute.internal.46802: UDP, length 164
08:22:52.282681 IP ip-192-168-75-233.ap-northeast-1.compute.internal.46802 > ec2-13-231-171-17.ap-northeast-1.compute.amazonaws.com.openvpn: UDP, length 84
08:22:52.324670 IP ec2-13-231-171-17.ap-northeast-1.compute.amazonaws.com.openvpn > ip-192-168-75-233.ap-northeast-1.compute.internal.46802: UDP, length 84
08:22:52.324833 IP ip-192-168-75-233.ap-northeast-1.compute.internal.46802 > ec2-13-231-171-17.ap-northeast-1.compute.amazonaws.com.openvpn: UDP, length 76
08:22:52.326668 IP ip-192-168-75-233.ap-northeast-1.compute.internal.46802 > ec2-13-231-171-17.ap-northeast-1.compute.amazonaws.com.openvpn: UDP, length 593
08:22:52.368473 IP ec2-13-231-171-17.ap-northeast-1.compute.amazonaws.com.openvpn > ip-192-168-75-233.ap-northeast-1.compute.internal.46802: UDP, length 1350
08:22:52.368536 IP ec2-13-231-171-17.ap-northeast-1.compute.amazonaws.com.openvpn > ip-192-168-75-233.ap-northeast-1.compute.internal.46802: UDP, length 1350
08:22:52.368549 IP ec2-13-231-171-17.ap-northeast-1.compute.amazonaws.com.openvpn > ip-192-168-75-233.ap-northeast-1.compute.internal.46802: UDP, length 1020
08:22:52.368678 IP ip-192-168-75-233.ap-northeast-1.compute.internal.46802 > ec2-13-231-171-17.ap-northeast-1.compute.amazonaws.com.openvpn: UDP, length 76
08:22:52.368726 IP ip-192-168-75-233.ap-northeast-1.compute.internal.46802 > ec2-13-231-171-17.ap-northeast-1.compute.amazonaws.com.openvpn: UDP, length 76
08:22:52.368751 IP ip-192-168-75-233.ap-northeast-1.compute.internal.46802 > ec2-13-231-171-17.ap-northeast-1.compute.amazonaws.com.openvpn: UDP, length 76
08:22:52.380286 IP ip-192-168-75-233.ap-northeast-1.compute.internal.46802 > ec2-13-231-171-17.ap-northeast-1.compute.amazonaws.com.openvpn: UDP, length 140
08:22:52.380488 IP ip-192-168-75-233.ap-northeast-1.compute.internal.46802 > ec2-13-231-171-17.ap-northeast-1.compute.amazonaws.com.openvpn: UDP, length 246
08:22:52.420541 IP ec2-13-231-171-17.ap-northeast-1.compute.amazonaws.com.openvpn > ip-192-168-75-233.ap-northeast-1.compute.internal.46802: UDP, length 155
08:22:52.420588 IP ec2-13-231-171-17.ap-northeast-1.compute.amazonaws.com.openvpn > ip-192-168-75-233.ap-northeast-1.compute.internal.46802: UDP, length 155
08:22:52.420609 IP ec2-13-231-171-17.ap-northeast-1.compute.amazonaws.com.openvpn > ip-192-168-75-233.ap-northeast-1.compute.internal.46802: UDP, length 140
08:22:52.421434 IP ip-192-168-75-233.ap-northeast-1.compute.internal.46802 > ec2-13-231-171-17.ap-northeast-1.compute.amazonaws.com.openvpn: UDP, length 76
08:22:52.421472 IP ip-192-168-75-233.ap-northeast-1.compute.internal.46802 > ec2-13-231-171-17.ap-northeast-1.compute.amazonaws.com.openvpn: UDP, length 107
08:22:52.506057 IP ec2-13-231-171-17.ap-northeast-1.compute.amazonaws.com.openvpn > ip-192-168-75-233.ap-northeast-1.compute.internal.46802: UDP, length 76
08:22:53.123697 IP ip-192-168-75-233.ap-northeast-1.compute.internal.46802 > ec2-13-231-171-17.ap-northeast-1.compute.amazonaws.com.openvpn: UDP, length 612
08:22:53.407874 IP ec2-13-231-171-17.ap-northeast-1.compute.amazonaws.com.openvpn > ip-192-168-75-233.ap-northeast-1.compute.internal.46802: UDP, length 76
08:22:53.571251 IP ip-192-168-75-233.ap-northeast-1.compute.internal.46802 > ec2-13-231-171-17.ap-northeast-1.compute.amazonaws.com.openvpn: UDP, length 86
08:22:53.571292 IP ip-192-168-75-233.ap-northeast-1.compute.internal.46802 > ec2-13-231-171-17.ap-northeast-1.compute.amazonaws.com.openvpn: UDP, length 86
08:22:53.571318 IP ip-192-168-75-233.ap-northeast-1.compute.internal.46802 > ec2-13-231-171-17.ap-northeast-1.compute.amazonaws.com.openvpn: UDP, length 83
08:22:53.571337 IP ip-192-168-75-233.ap-northeast-1.compute.internal.46802 > ec2-13-231-171-17.ap-northeast-1.compute.amazonaws.com.openvpn: UDP, length 83
08:22:53.571417 IP ip-192-168-75-233.ap-northeast-1.compute.internal.46802 > ec2-13-231-171-17.ap-northeast-1.compute.amazonaws.com.openvpn: UDP, length 89
08:22:53.571436 IP ip-192-168-75-233.ap-northeast-1.compute.internal.46802 > ec2-13-231-171-17.ap-northeast-1.compute.amazonaws.com.openvpn: UDP, length 89
08:22:53.613807 IP ec2-13-231-171-17.ap-northeast-1.compute.amazonaws.com.openvpn > ip-192-168-75-233.ap-northeast-1.compute.internal.46802: UDP, length 217
08:22:53.615176 IP ec2-13-231-171-17.ap-northeast-1.compute.amazonaws.com.openvpn > ip-192-168-75-233.ap-northeast-1.compute.internal.46802: UDP, length 363
08:22:53.615746 IP ip-192-168-75-233.ap-northeast-1.compute.internal.46802 > ec2-13-231-171-17.ap-northeast-1.compute.amazonaws.com.openvpn: UDP, length 85
08:22:53.615764 IP ip-192-168-75-233.ap-northeast-1.compute.internal.46802 > ec2-13-231-171-17.ap-northeast-1.compute.amazonaws.com.openvpn: UDP, length 85
08:22:53.615824 IP ec2-13-231-171-17.ap-northeast-1.compute.amazonaws.com.openvpn > ip-192-168-75-233.ap-northeast-1.compute.internal.46802: UDP, length 121
08:22:53.615926 IP ec2-13-231-171-17.ap-northeast-1.compute.amazonaws.com.openvpn > ip-192-168-75-233.ap-northeast-1.compute.internal.46802: UDP, length 145
08:22:53.616295 IP ip-192-168-75-233.ap-northeast-1.compute.internal.46802 > ec2-13-231-171-17.ap-northeast-1.compute.amazonaws.com.openvpn: UDP, length 87
08:22:53.616310 IP ip-192-168-75-233.ap-northeast-1.compute.internal.46802 > ec2-13-231-171-17.ap-northeast-1.compute.amazonaws.com.openvpn: UDP, length 87
08:22:53.616656 IP ec2-13-231-171-17.ap-northeast-1.compute.amazonaws.com.openvpn > ip-192-168-75-233.ap-northeast-1.compute.internal.46802: UDP, length 184
08:22:53.619108 IP ec2-13-231-171-17.ap-northeast-1.compute.amazonaws.com.openvpn > ip-192-168-75-233.ap-northeast-1.compute.internal.46802: UDP, length 308
08:22:53.619699 IP ip-192-168-75-233.ap-northeast-1.compute.internal.46802 > ec2-13-231-171-17.ap-northeast-1.compute.amazonaws.com.openvpn: UDP, length 80
08:22:53.619716 IP ip-192-168-75-233.ap-northeast-1.compute.internal.46802 > ec2-13-231-171-17.ap-northeast-1.compute.amazonaws.com.openvpn: UDP, length 80
08:22:53.654932 IP ec2-13-231-171-17.ap-northeast-1.compute.amazonaws.com.openvpn > ip-192-168-75-233.ap-northeast-1.compute.internal.46802: UDP, length 375
08:22:53.654991 IP ec2-13-231-171-17.ap-northeast-1.compute.amazonaws.com.openvpn > ip-192-168-75-233.ap-northeast-1.compute.internal.46802: UDP, length 231
08:22:53.655198 IP ec2-13-231-171-17.ap-northeast-1.compute.amazonaws.com.openvpn > ip-192-168-75-233.ap-northeast-1.compute.internal.46802: UDP, length 150
08:22:53.655426 IP ec2-13-231-171-17.ap-northeast-1.compute.amazonaws.com.openvpn > ip-192-168-75-233.ap-northeast-1.compute.internal.46802: UDP, length 138
08:22:53.655876 IP ip-192-168-75-233.ap-northeast-1.compute.internal.46802 > ec2-13-231-171-17.ap-northeast-1.compute.amazonaws.com.openvpn: UDP, length 86
08:22:53.655895 IP ip-192-168-75-233.ap-northeast-1.compute.internal.46802 > ec2-13-231-171-17.ap-northeast-1.compute.amazonaws.com.openvpn: UDP, length 86
08:22:53.655907 IP ip-192-168-75-233.ap-northeast-1.compute.internal.46802 > ec2-13-231-171-17.ap-northeast-1.compute.amazonaws.com.openvpn: UDP, length 85
08:22:53.655923 IP ip-192-168-75-233.ap-northeast-1.compute.internal.46802 > ec2-13-231-171-17.ap-northeast-1.compute.amazonaws.com.openvpn: UDP, length 85
08:22:53.658004 IP ec2-13-231-171-17.ap-northeast-1.compute.amazonaws.com.openvpn > ip-192-168-75-233.ap-northeast-1.compute.internal.46802: UDP, length 136
08:22:53.659015 IP ec2-13-231-171-17.ap-northeast-1.compute.amazonaws.com.openvpn > ip-192-168-75-233.ap-northeast-1.compute.internal.46802: UDP, length 112
08:22:53.694305 IP ec2-13-231-171-17.ap-northeast-1.compute.amazonaws.com.openvpn > ip-192-168-75-233.ap-northeast-1.compute.internal.46802: UDP, length 141
08:22:53.694332 IP ec2-13-231-171-17.ap-northeast-1.compute.amazonaws.com.openvpn > ip-192-168-75-233.ap-northeast-1.compute.internal.46802: UDP, length 117
08:22:53.698280 IP ec2-13-231-171-17.ap-northeast-1.compute.amazonaws.com.openvpn > ip-192-168-75-233.ap-northeast-1.compute.internal.46802: UDP, length 138
08:22:53.698309 IP ec2-13-231-171-17.ap-northeast-1.compute.amazonaws.com.openvpn > ip-192-168-75-233.ap-northeast-1.compute.internal.46802: UDP, length 180
08:22:53.991720 IP ip-192-168-75-233.ap-northeast-1.compute.internal.46802 > ec2-13-231-171-17.ap-northeast-1.compute.amazonaws.com.openvpn: UDP, length 84
08:22:54.247375 IP ip-192-168-75-233.ap-northeast-1.compute.internal.46802 > ec2-13-231-171-17.ap-northeast-1.compute.amazonaws.com.openvpn: UDP, length 84
08:22:54.263410 IP ip-192-168-75-233.ap-northeast-1.compute.internal.46802 > ec2-13-231-171-17.ap-northeast-1.compute.amazonaws.com.openvpn: UDP, length 397
08:22:54.308291 IP ec2-13-231-171-17.ap-northeast-1.compute.amazonaws.com.openvpn > ip-192-168-75-233.ap-northeast-1.compute.internal.46802: UDP, length 76
08:22:54.455774 IP ip-192-168-75-66.ap-northeast-1.compute.internal.mdns > mdns.mcast.net.mdns: 0 A (QM)? e566f778-1b61-7791-f517-6881acc41d6b.local. (60)
08:22:54.456163 IP6 fe80::bff0:8a76:6922:be9a.mdns > ff02::fb.mdns: 0 A (QM)? e566f778-1b61-7791-f517-6881acc41d6b.local. (60)
08:22:54.456318 IP ip-192-168-75-66.ap-northeast-1.compute.internal.mdns > mdns.mcast.net.mdns: 0*- [0q] 1/0/0 (Cache flush) A 192.168.75.66 (70)
08:22:54.633908 IP ec2-13-231-171-17.ap-northeast-1.compute.amazonaws.com.openvpn > ip-192-168-75-233.ap-northeast-1.compute.internal.46802: UDP, length 1350
08:22:54.633944 IP ec2-13-231-171-17.ap-northeast-1.compute.amazonaws.com.openvpn > ip-192-168-75-233.ap-northeast-1.compute.internal.46802: UDP, length 1350
08:22:54.633965 IP ec2-13-231-171-17.ap-northeast-1.compute.amazonaws.com.openvpn > ip-192-168-75-233.ap-northeast-1.compute.internal.46802: UDP, length 1350
08:22:54.634021 IP ec2-13-231-171-17.ap-northeast-1.compute.amazonaws.com.openvpn > ip-192-168-75-233.ap-northeast-1.compute.internal.46802: UDP, length 901
08:22:54.634042 IP ec2-13-231-171-17.ap-northeast-1.compute.amazonaws.com.openvpn > ip-192-168-75-233.ap-northeast-1.compute.internal.46802: UDP, length 1350
08:22:54.634065 IP ec2-13-231-171-17.ap-northeast-1.compute.amazonaws.com.openvpn > ip-192-168-75-233.ap-northeast-1.compute.internal.46802: UDP, length 1350
08:22:54.634070 IP ec2-13-231-171-17.ap-northeast-1.compute.amazonaws.com.openvpn > ip-192-168-75-233.ap-northeast-1.compute.internal.46802: UDP, length 131
08:22:54.634156 IP ip-192-168-75-233.ap-northeast-1.compute.internal.46802 > ec2-13-231-171-17.ap-northeast-1.compute.amazonaws.com.openvpn: UDP, length 76
08:22:54.634173 IP ip-192-168-75-233.ap-northeast-1.compute.internal.46802 > ec2-13-231-171-17.ap-northeast-1.compute.amazonaws.com.openvpn: UDP, length 76
08:22:54.634185 IP ip-192-168-75-233.ap-northeast-1.compute.internal.46802 > ec2-13-231-171-17.ap-northeast-1.compute.amazonaws.com.openvpn: UDP, length 76
08:22:54.634303 IP ec2-13-231-171-17.ap-northeast-1.compute.amazonaws.com.openvpn > ip-192-168-75-233.ap-northeast-1.compute.internal.46802: UDP, length 733
08:22:54.634360 IP ec2-13-231-171-17.ap-northeast-1.compute.amazonaws.com.openvpn > ip-192-168-75-233.ap-northeast-1.compute.internal.46802: UDP, length 1350
08:22:54.634380 IP ec2-13-231-171-17.ap-northeast-1.compute.amazonaws.com.openvpn > ip-192-168-75-233.ap-northeast-1.compute.internal.46802: UDP, length 1350
08:22:54.634387 IP ip-192-168-75-233.ap-northeast-1.compute.internal.46802 > ec2-13-231-171-17.ap-northeast-1.compute.amazonaws.com.openvpn: UDP, length 76
08:22:54.634453 IP ip-192-168-75-233.ap-northeast-1.compute.internal.46802 > ec2-13-231-171-17.ap-northeast-1.compute.amazonaws.com.openvpn: UDP, length 76
08:22:54.676473 IP ec2-13-231-171-17.ap-northeast-1.compute.amazonaws.com.openvpn > ip-192-168-75-233.ap-northeast-1.compute.internal.46802: UDP, length 1350
08:22:54.676519 IP ec2-13-231-171-17.ap-northeast-1.compute.amazonaws.com.openvpn > ip-192-168-75-233.ap-northeast-1.compute.internal.46802: UDP, length 1350
08:22:54.676527 IP ec2-13-231-171-17.ap-northeast-1.compute.amazonaws.com.openvpn > ip-192-168-75-233.ap-northeast-1.compute.internal.46802: UDP, length 1350
08:22:54.676547 IP ec2-13-231-171-17.ap-northeast-1.compute.amazonaws.com.openvpn > ip-192-168-75-233.ap-northeast-1.compute.internal.46802: UDP, length 1350
08:22:54.676670 IP ip-192-168-75-233.ap-northeast-1.compute.internal.46802 > ec2-13-231-171-17.ap-northeast-1.compute.amazonaws.com.openvpn: UDP, length 76
08:22:54.676694 IP ip-192-168-75-233.ap-northeast-1.compute.internal.46802 > ec2-13-231-171-17.ap-northeast-1.compute.amazonaws.com.openvpn: UDP, length 76
08:22:54.678444 IP ec2-13-231-171-17.ap-northeast-1.compute.amazonaws.com.openvpn > ip-192-168-75-233.ap-northeast-1.compute.internal.46802: UDP, length 1350
08:22:54.678507 IP ec2-13-231-171-17.ap-northeast-1.compute.amazonaws.com.openvpn > ip-192-168-75-233.ap-northeast-1.compute.internal.46802: UDP, length 1350
08:22:54.678565 IP ec2-13-231-171-17.ap-northeast-1.compute.amazonaws.com.openvpn > ip-192-168-75-233.ap-northeast-1.compute.internal.46802: UDP, length 1350
08:22:54.678594 IP ec2-13-231-171-17.ap-northeast-1.compute.amazonaws.com.openvpn > ip-192-168-75-233.ap-northeast-1.compute.internal.46802: UDP, length 1350
08:22:54.678613 IP ec2-13-231-171-17.ap-northeast-1.compute.amazonaws.com.openvpn > ip-192-168-75-233.ap-northeast-1.compute.internal.46802: UDP, length 1350
08:22:54.678630 IP ec2-13-231-171-17.ap-northeast-1.compute.amazonaws.com.openvpn > ip-192-168-75-233.ap-northeast-1.compute.internal.46802: UDP, length 1350
08:22:54.678696 IP ec2-13-231-171-17.ap-northeast-1.compute.amazonaws.com.openvpn > ip-192-168-75-233.ap-northeast-1.compute.internal.46802: UDP, length 1350
08:22:54.678712 IP ec2-13-231-171-17.ap-northeast-1.compute.amazonaws.com.openvpn > ip-192-168-75-233.ap-northeast-1.compute.internal.46802: UDP, length 1350
08:22:54.678728 IP ec2-13-231-171-17.ap-northeast-1.compute.amazonaws.com.openvpn > ip-192-168-75-233.ap-northeast-1.compute.internal.46802: UDP, length 1350
08:22:54.678755 IP ec2-13-231-171-17.ap-northeast-1.compute.amazonaws.com.openvpn > ip-192-168-75-233.ap-northeast-1.compute.internal.46802: UDP, length 1350
08:22:54.678773 IP ec2-13-231-171-17.ap-northeast-1.compute.amazonaws.com.openvpn > ip-192-168-75-233.ap-northeast-1.compute.internal.46802: UDP, length 1350
08:22:54.678804 IP ec2-13-231-171-17.ap-northeast-1.compute.amazonaws.com.openvpn > ip-192-168-75-233.ap-northeast-1.compute.internal.46802: UDP, length 1350
08:22:54.678820 IP ec2-13-231-171-17.ap-northeast-1.compute.amazonaws.com.openvpn > ip-192-168-75-233.ap-northeast-1.compute.internal.46802: UDP, length 1350
08:22:54.678860 IP ec2-13-231-171-17.ap-northeast-1.compute.amazonaws.com.openvpn > ip-192-168-75-233.ap-northeast-1.compute.internal.46802: UDP, length 1350
08:22:54.678882 IP ec2-13-231-171-17.ap-northeast-1.compute.amazonaws.com.openvpn > ip-192-168-75-233.ap-northeast-1.compute.internal.46802: UDP, length 1350
08:22:54.678897 IP ec2-13-231-171-17.ap-northeast-1.compute.amazonaws.com.openvpn > ip-192-168-75-233.ap-northeast-1.compute.internal.46802: UDP, length 1350
08:22:54.679046 IP ip-192-168-75-233.ap-northeast-1.compute.internal.46802 > ec2-13-231-171-17.ap-northeast-1.compute.amazonaws.com.openvpn: UDP, length 76
08:22:54.679268 IP ip-192-168-75-233.ap-northeast-1.compute.internal.46802 > ec2-13-231-171-17.ap-northeast-1.compute.amazonaws.com.openvpn: UDP, length 76
08:22:54.679297 IP ip-192-168-75-233.ap-northeast-1.compute.internal.46802 > ec2-13-231-171-17.ap-northeast-1.compute.amazonaws.com.openvpn: UDP, length 76
08:22:54.679372 IP ip-192-168-75-233.ap-northeast-1.compute.internal.46802 > ec2-13-231-171-17.ap-northeast-1.compute.amazonaws.com.openvpn: UDP, length 76
08:22:54.679401 IP ip-192-168-75-233.ap-northeast-1.compute.internal.46802 > ec2-13-231-171-17.ap-northeast-1.compute.amazonaws.com.openvpn: UDP, length 76
08:22:54.679424 IP ip-192-168-75-233.ap-northeast-1.compute.internal.46802 > ec2-13-231-171-17.ap-northeast-1.compute.amazonaws.com.openvpn: UDP, length 76
08:22:54.679449 IP ip-192-168-75-233.ap-northeast-1.compute.internal.46802 > ec2-13-231-171-17.ap-northeast-1.compute.amazonaws.com.openvpn: UDP, length 76
08:22:54.718270 IP ip-192-168-75-233.ap-northeast-1.compute.internal.46802 > ec2-13-231-171-17.ap-northeast-1.compute.amazonaws.com.openvpn: UDP, length 93
08:22:54.718289 IP ip-192-168-75-233.ap-northeast-1.compute.internal.46802 > ec2-13-231-171-17.ap-northeast-1.compute.amazonaws.com.openvpn: UDP, length 93
08:22:54.718303 IP ip-192-168-75-233.ap-northeast-1.compute.internal.46802 > ec2-13-231-171-17.ap-northeast-1.compute.amazonaws.com.openvpn: UDP, length 99
08:22:54.718311 IP ip-192-168-75-233.ap-northeast-1.compute.internal.46802 > ec2-13-231-171-17.ap-northeast-1.compute.amazonaws.com.openvpn: UDP, length 99
08:22:54.718444 IP ec2-13-231-171-17.ap-northeast-1.compute.amazonaws.com.openvpn > ip-192-168-75-233.ap-northeast-1.compute.internal.46802: UDP, length 1350
08:22:54.718501 IP ec2-13-231-171-17.ap-northeast-1.compute.amazonaws.com.openvpn > ip-192-168-75-233.ap-northeast-1.compute.internal.46802: UDP, length 1350
08:22:54.718518 IP ip-192-168-75-233.ap-northeast-1.compute.internal.46802 > ec2-13-231-171-17.ap-northeast-1.compute.amazonaws.com.openvpn: UDP, length 76
08:22:54.718534 IP ec2-13-231-171-17.ap-northeast-1.compute.amazonaws.com.openvpn > ip-192-168-75-233.ap-northeast-1.compute.internal.46802: UDP, length 1350
08:22:54.718567 IP ec2-13-231-171-17.ap-northeast-1.compute.amazonaws.com.openvpn > ip-192-168-75-233.ap-northeast-1.compute.internal.46802: UDP, length 1350
08:22:54.718604 IP ip-192-168-75-233.ap-northeast-1.compute.internal.46802 > ec2-13-231-171-17.ap-northeast-1.compute.amazonaws.com.openvpn: UDP, length 76
08:22:54.718611 IP ec2-13-231-171-17.ap-northeast-1.compute.amazonaws.com.openvpn > ip-192-168-75-233.ap-northeast-1.compute.internal.46802: UDP, length 1350
08:22:54.718661 IP ip-192-168-75-233.ap-northeast-1.compute.internal.46802 > ec2-13-231-171-17.ap-northeast-1.compute.amazonaws.com.openvpn: UDP, length 76
08:22:54.718667 IP ec2-13-231-171-17.ap-northeast-1.compute.amazonaws.com.openvpn > ip-192-168-75-233.ap-northeast-1.compute.internal.46802: UDP, length 1350
08:22:54.718689 IP ec2-13-231-171-17.ap-northeast-1.compute.amazonaws.com.openvpn > ip-192-168-75-233.ap-northeast-1.compute.internal.46802: UDP, length 1350
08:22:54.718728 IP ip-192-168-75-233.ap-northeast-1.compute.internal.46802 > ec2-13-231-171-17.ap-northeast-1.compute.amazonaws.com.openvpn: UDP, length 76
08:22:54.720365 IP ec2-13-231-171-17.ap-northeast-1.compute.amazonaws.com.openvpn > ip-192-168-75-233.ap-northeast-1.compute.internal.46802: UDP, length 1350
08:22:54.720400 IP ec2-13-231-171-17.ap-northeast-1.compute.amazonaws.com.openvpn > ip-192-168-75-233.ap-northeast-1.compute.internal.46802: UDP, length 1350
08:22:54.720424 IP ec2-13-231-171-17.ap-northeast-1.compute.amazonaws.com.openvpn > ip-192-168-75-233.ap-northeast-1.compute.internal.46802: UDP, length 1350
08:22:54.720434 IP ip-192-168-75-233.ap-northeast-1.compute.internal.46802 > ec2-13-231-171-17.ap-northeast-1.compute.amazonaws.com.openvpn: UDP, length 76
08:22:54.720496 IP ec2-13-231-171-17.ap-northeast-1.compute.amazonaws.com.openvpn > ip-192-168-75-233.ap-northeast-1.compute.internal.46802: UDP, length 1350
08:22:54.720527 IP ec2-13-231-171-17.ap-northeast-1.compute.amazonaws.com.openvpn > ip-192-168-75-233.ap-northeast-1.compute.internal.46802: UDP, length 1350
08:22:54.720533 IP ec2-13-231-171-17.ap-northeast-1.compute.amazonaws.com.openvpn > ip-192-168-75-233.ap-northeast-1.compute.internal.46802: UDP, length 349
08:22:54.720563 IP ip-192-168-75-233.ap-northeast-1.compute.internal.46802 > ec2-13-231-171-17.ap-northeast-1.compute.amazonaws.com.openvpn: UDP, length 76
08:22:54.720600 IP ip-192-168-75-233.ap-northeast-1.compute.internal.46802 > ec2-13-231-171-17.ap-northeast-1.compute.amazonaws.com.openvpn: UDP, length 76
08:22:54.756617 IP ec2-13-231-171-17.ap-northeast-1.compute.amazonaws.com.openvpn > ip-192-168-75-233.ap-northeast-1.compute.internal.46802: UDP, length 157
08:22:54.756666 IP ec2-13-231-171-17.ap-northeast-1.compute.amazonaws.com.openvpn > ip-192-168-75-233.ap-northeast-1.compute.internal.46802: UDP, length 175
08:22:54.756693 IP ec2-13-231-171-17.ap-northeast-1.compute.amazonaws.com.openvpn > ip-192-168-75-233.ap-northeast-1.compute.internal.46802: UDP, length 163
08:22:54.756733 IP ec2-13-231-171-17.ap-northeast-1.compute.amazonaws.com.openvpn > ip-192-168-75-233.ap-northeast-1.compute.internal.46802: UDP, length 211
08:22:54.757094 IP ip-192-168-75-233.ap-northeast-1.compute.internal.46802 > ec2-13-231-171-17.ap-northeast-1.compute.amazonaws.com.openvpn: UDP, length 84
08:22:54.757266 IP ip-192-168-75-233.ap-northeast-1.compute.internal.46802 > ec2-13-231-171-17.ap-northeast-1.compute.amazonaws.com.openvpn: UDP, length 84
08:22:54.759211 ARP, Request who-has ip-192-168-75-1.ap-northeast-1.compute.internal tell ip-192-168-75-233.ap-northeast-1.compute.internal, length 28
08:22:54.759850 ARP, Reply ip-192-168-75-1.ap-northeast-1.compute.internal is-at d0:96:fb:e7:bb:a2 (oui Unknown), length 46
08:22:54.798179 IP ec2-13-231-171-17.ap-northeast-1.compute.amazonaws.com.openvpn > ip-192-168-75-233.ap-northeast-1.compute.internal.46802: UDP, length 84
08:22:54.798284 IP ec2-13-231-171-17.ap-northeast-1.compute.amazonaws.com.openvpn > ip-192-168-75-233.ap-northeast-1.compute.internal.46802: UDP, length 84
08:22:54.798313 IP ip-192-168-75-233.ap-northeast-1.compute.internal.46802 > ec2-13-231-171-17.ap-northeast-1.compute.amazonaws.com.openvpn: UDP, length 76
08:22:54.798357 IP ip-192-168-75-233.ap-northeast-1.compute.internal.46802 > ec2-13-231-171-17.ap-northeast-1.compute.amazonaws.com.openvpn: UDP, length 76
08:22:54.800921 IP ip-192-168-75-233.ap-northeast-1.compute.internal.46802 > ec2-13-231-171-17.ap-northeast-1.compute.amazonaws.com.openvpn: UDP, length 593
08:22:54.803326 IP ip-192-168-75-233.ap-northeast-1.compute.internal.46802 > ec2-13-231-171-17.ap-northeast-1.compute.amazonaws.com.openvpn: UDP, length 593
08:22:54.842087 IP ec2-13-231-171-17.ap-northeast-1.compute.amazonaws.com.openvpn > ip-192-168-75-233.ap-northeast-1.compute.internal.46802: UDP, length 76
08:22:54.843824 IP ec2-13-231-171-17.ap-northeast-1.compute.amazonaws.com.openvpn > ip-192-168-75-233.ap-northeast-1.compute.internal.46802: UDP, length 1350
08:22:54.843882 IP ec2-13-231-171-17.ap-northeast-1.compute.amazonaws.com.openvpn > ip-192-168-75-233.ap-northeast-1.compute.internal.46802: UDP, length 1350
08:22:54.843922 IP ec2-13-231-171-17.ap-northeast-1.compute.amazonaws.com.openvpn > ip-192-168-75-233.ap-northeast-1.compute.internal.46802: UDP, length 1350
08:22:54.843969 IP ec2-13-231-171-17.ap-northeast-1.compute.amazonaws.com.openvpn > ip-192-168-75-233.ap-northeast-1.compute.internal.46802: UDP, length 1350
08:22:54.843975 IP ec2-13-231-171-17.ap-northeast-1.compute.amazonaws.com.openvpn > ip-192-168-75-233.ap-northeast-1.compute.internal.46802: UDP, length 813
08:22:54.843984 IP ip-192-168-75-233.ap-northeast-1.compute.internal.46802 > ec2-13-231-171-17.ap-northeast-1.compute.amazonaws.com.openvpn: UDP, length 76
08:22:54.843991 IP ec2-13-231-171-17.ap-northeast-1.compute.amazonaws.com.openvpn > ip-192-168-75-233.ap-northeast-1.compute.internal.46802: UDP, length 76
08:22:54.844016 IP ip-192-168-75-233.ap-northeast-1.compute.internal.46802 > ec2-13-231-171-17.ap-northeast-1.compute.amazonaws.com.openvpn: UDP, length 76
08:22:54.844046 IP ip-192-168-75-233.ap-northeast-1.compute.internal.46802 > ec2-13-231-171-17.ap-northeast-1.compute.amazonaws.com.openvpn: UDP, length 76
08:22:54.844078 IP ip-192-168-75-233.ap-northeast-1.compute.internal.46802 > ec2-13-231-171-17.ap-northeast-1.compute.amazonaws.com.openvpn: UDP, length 76
08:22:54.844085 IP ip-192-168-75-233.ap-northeast-1.compute.internal.46802 > ec2-13-231-171-17.ap-northeast-1.compute.amazonaws.com.openvpn: UDP, length 76
08:22:54.845553 IP ec2-13-231-171-17.ap-northeast-1.compute.amazonaws.com.openvpn > ip-192-168-75-233.ap-northeast-1.compute.internal.46802: UDP, length 1350
08:22:54.845588 IP ec2-13-231-171-17.ap-northeast-1.compute.amazonaws.com.openvpn > ip-192-168-75-233.ap-northeast-1.compute.internal.46802: UDP, length 1350
08:22:54.845618 IP ec2-13-231-171-17.ap-northeast-1.compute.amazonaws.com.openvpn > ip-192-168-75-233.ap-northeast-1.compute.internal.46802: UDP, length 1350
08:22:54.845623 IP ec2-13-231-171-17.ap-northeast-1.compute.amazonaws.com.openvpn > ip-192-168-75-233.ap-northeast-1.compute.internal.46802: UDP, length 587
08:22:54.845796 IP ip-192-168-75-233.ap-northeast-1.compute.internal.46802 > ec2-13-231-171-17.ap-northeast-1.compute.amazonaws.com.openvpn: UDP, length 76
08:22:54.845824 IP ip-192-168-75-233.ap-northeast-1.compute.internal.46802 > ec2-13-231-171-17.ap-northeast-1.compute.amazonaws.com.openvpn: UDP, length 76
08:22:54.845843 IP ip-192-168-75-233.ap-northeast-1.compute.internal.46802 > ec2-13-231-171-17.ap-northeast-1.compute.amazonaws.com.openvpn: UDP, length 76
08:22:54.845860 IP ip-192-168-75-233.ap-northeast-1.compute.internal.46802 > ec2-13-231-171-17.ap-northeast-1.compute.amazonaws.com.openvpn: UDP, length 76
08:22:54.849532 IP ip-192-168-75-233.ap-northeast-1.compute.internal.46802 > ec2-13-231-171-17.ap-northeast-1.compute.amazonaws.com.openvpn: UDP, length 140
08:22:54.850352 IP ip-192-168-75-233.ap-northeast-1.compute.internal.46802 > ec2-13-231-171-17.ap-northeast-1.compute.amazonaws.com.openvpn: UDP, length 246
08:22:54.851987 IP ip-192-168-75-233.ap-northeast-1.compute.internal.46802 > ec2-13-231-171-17.ap-northeast-1.compute.amazonaws.com.openvpn: UDP, length 140
08:22:54.852470 IP ip-192-168-75-233.ap-northeast-1.compute.internal.46802 > ec2-13-231-171-17.ap-northeast-1.compute.amazonaws.com.openvpn: UDP, length 246
08:22:54.874435 IP ip-192-168-75-233.ap-northeast-1.compute.internal.46802 > ec2-13-231-171-17.ap-northeast-1.compute.amazonaws.com.openvpn: UDP, length 375
08:22:54.874591 IP ip-192-168-75-233.ap-northeast-1.compute.internal.46802 > ec2-13-231-171-17.ap-northeast-1.compute.amazonaws.com.openvpn: UDP, length 162
08:22:54.874752 IP ip-192-168-75-233.ap-northeast-1.compute.internal.46802 > ec2-13-231-171-17.ap-northeast-1.compute.amazonaws.com.openvpn: UDP, length 170
08:22:54.874948 IP ip-192-168-75-233.ap-northeast-1.compute.internal.46802 > ec2-13-231-171-17.ap-northeast-1.compute.amazonaws.com.openvpn: UDP, length 163
08:22:54.875161 IP ip-192-168-75-233.ap-northeast-1.compute.internal.46802 > ec2-13-231-171-17.ap-northeast-1.compute.amazonaws.com.openvpn: UDP, length 163
08:22:54.875328 IP ip-192-168-75-233.ap-northeast-1.compute.internal.46802 > ec2-13-231-171-17.ap-northeast-1.compute.amazonaws.com.openvpn: UDP, length 163
08:22:54.875544 IP ip-192-168-75-233.ap-northeast-1.compute.internal.46802 > ec2-13-231-171-17.ap-northeast-1.compute.amazonaws.com.openvpn: UDP, length 166
08:22:54.875792 IP ip-192-168-75-233.ap-northeast-1.compute.internal.46802 > ec2-13-231-171-17.ap-northeast-1.compute.amazonaws.com.openvpn: UDP, length 165
08:22:54.891126 IP ec2-13-231-171-17.ap-northeast-1.compute.amazonaws.com.openvpn > ip-192-168-75-233.ap-northeast-1.compute.internal.46802: UDP, length 76
08:22:54.891153 IP ec2-13-231-171-17.ap-northeast-1.compute.amazonaws.com.openvpn > ip-192-168-75-233.ap-northeast-1.compute.internal.46802: UDP, length 76
08:22:54.891164 IP ec2-13-231-171-17.ap-northeast-1.compute.amazonaws.com.openvpn > ip-192-168-75-233.ap-northeast-1.compute.internal.46802: UDP, length 141
08:22:54.891286 IP ip-192-168-75-233.ap-northeast-1.compute.internal.46802 > ec2-13-231-171-17.ap-northeast-1.compute.amazonaws.com.openvpn: UDP, length 1350
08:22:54.891295 IP ip-192-168-75-233.ap-northeast-1.compute.internal.46802 > ec2-13-231-171-17.ap-northeast-1.compute.amazonaws.com.openvpn: UDP, length 1350
08:22:54.891301 IP ip-192-168-75-233.ap-northeast-1.compute.internal.46802 > ec2-13-231-171-17.ap-northeast-1.compute.amazonaws.com.openvpn: UDP, length 620
08:22:54.891333 IP ip-192-168-75-233.ap-northeast-1.compute.internal.46802 > ec2-13-231-171-17.ap-northeast-1.compute.amazonaws.com.openvpn: UDP, length 107
08:22:54.891857 IP ec2-13-231-171-17.ap-northeast-1.compute.amazonaws.com.openvpn > ip-192-168-75-233.ap-northeast-1.compute.internal.46802: UDP, length 76
08:22:54.891878 IP ec2-13-231-171-17.ap-northeast-1.compute.amazonaws.com.openvpn > ip-192-168-75-233.ap-northeast-1.compute.internal.46802: UDP, length 76
08:22:54.891976 IP ec2-13-231-171-17.ap-northeast-1.compute.amazonaws.com.openvpn > ip-192-168-75-233.ap-northeast-1.compute.internal.46802: UDP, length 141
08:22:54.892056 IP ip-192-168-75-233.ap-northeast-1.compute.internal.46802 > ec2-13-231-171-17.ap-northeast-1.compute.amazonaws.com.openvpn: UDP, length 107
08:22:54.914040 IP ec2-13-231-171-17.ap-northeast-1.compute.amazonaws.com.openvpn > ip-192-168-75-233.ap-northeast-1.compute.internal.46802: UDP, length 76
08:22:54.914171 IP ip-192-168-75-233.ap-northeast-1.compute.internal.46802 > ec2-13-231-171-17.ap-northeast-1.compute.amazonaws.com.openvpn: UDP, length 1350
08:22:54.914185 IP ip-192-168-75-233.ap-northeast-1.compute.internal.46802 > ec2-13-231-171-17.ap-northeast-1.compute.amazonaws.com.openvpn: UDP, length 1350
08:22:54.914600 IP ec2-13-231-171-17.ap-northeast-1.compute.amazonaws.com.openvpn > ip-192-168-75-233.ap-northeast-1.compute.internal.46802: UDP, length 477
08:22:54.914749 IP ec2-13-231-171-17.ap-northeast-1.compute.amazonaws.com.openvpn > ip-192-168-75-233.ap-northeast-1.compute.internal.46802: UDP, length 1350
08:22:54.914795 IP ip-192-168-75-233.ap-northeast-1.compute.internal.46802 > ec2-13-231-171-17.ap-northeast-1.compute.amazonaws.com.openvpn: UDP, length 76
08:22:54.914821 IP ec2-13-231-171-17.ap-northeast-1.compute.amazonaws.com.openvpn > ip-192-168-75-233.ap-northeast-1.compute.internal.46802: UDP, length 1350
08:22:54.914849 IP ec2-13-231-171-17.ap-northeast-1.compute.amazonaws.com.openvpn > ip-192-168-75-233.ap-northeast-1.compute.internal.46802: UDP, length 1350
08:22:54.914890 IP ec2-13-231-171-17.ap-northeast-1.compute.amazonaws.com.openvpn > ip-192-168-75-233.ap-northeast-1.compute.internal.46802: UDP, length 1350
08:22:54.915142 IP ip-192-168-75-233.ap-northeast-1.compute.internal.46802 > ec2-13-231-171-17.ap-northeast-1.compute.amazonaws.com.openvpn: UDP, length 76
08:22:54.916245 IP ec2-13-231-171-17.ap-northeast-1.compute.amazonaws.com.openvpn > ip-192-168-75-233.ap-northeast-1.compute.internal.46802: UDP, length 1350
08:22:54.916264 IP ec2-13-231-171-17.ap-northeast-1.compute.amazonaws.com.openvpn > ip-192-168-75-233.ap-northeast-1.compute.internal.46802: UDP, length 629
08:22:54.916336 IP ip-192-168-75-233.ap-northeast-1.compute.internal.46802 > ec2-13-231-171-17.ap-northeast-1.compute.amazonaws.com.openvpn: UDP, length 76
08:22:54.917014 IP ec2-13-231-171-17.ap-northeast-1.compute.amazonaws.com.openvpn > ip-192-168-75-233.ap-northeast-1.compute.internal.46802: UDP, length 76
08:22:54.917054 IP ec2-13-231-171-17.ap-northeast-1.compute.amazonaws.com.openvpn > ip-192-168-75-233.ap-northeast-1.compute.internal.46802: UDP, length 76
08:22:54.917061 IP ip-192-168-75-233.ap-northeast-1.compute.internal.46802 > ec2-13-231-171-17.ap-northeast-1.compute.amazonaws.com.openvpn: UDP, length 1350
08:22:54.917068 IP ip-192-168-75-233.ap-northeast-1.compute.internal.46802 > ec2-13-231-171-17.ap-northeast-1.compute.amazonaws.com.openvpn: UDP, length 271
08:22:54.917093 IP ec2-13-231-171-17.ap-northeast-1.compute.amazonaws.com.openvpn > ip-192-168-75-233.ap-northeast-1.compute.internal.46802: UDP, length 76
08:22:54.917129 IP ec2-13-231-171-17.ap-northeast-1.compute.amazonaws.com.openvpn > ip-192-168-75-233.ap-northeast-1.compute.internal.46802: UDP, length 76
08:22:54.917224 IP ec2-13-231-171-17.ap-northeast-1.compute.amazonaws.com.openvpn > ip-192-168-75-233.ap-northeast-1.compute.internal.46802: UDP, length 1350
08:22:54.917265 IP ec2-13-231-171-17.ap-northeast-1.compute.amazonaws.com.openvpn > ip-192-168-75-233.ap-northeast-1.compute.internal.46802: UDP, length 1350
08:22:54.917291 IP ip-192-168-75-233.ap-northeast-1.compute.internal.46802 > ec2-13-231-171-17.ap-northeast-1.compute.amazonaws.com.openvpn: UDP, length 76
08:22:54.918558 IP ec2-13-231-171-17.ap-northeast-1.compute.amazonaws.com.openvpn > ip-192-168-75-233.ap-northeast-1.compute.internal.46802: UDP, length 1350
08:22:54.918617 IP ec2-13-231-171-17.ap-northeast-1.compute.amazonaws.com.openvpn > ip-192-168-75-233.ap-northeast-1.compute.internal.46802: UDP, length 1350
08:22:54.918648 IP ip-192-168-75-233.ap-northeast-1.compute.internal.46802 > ec2-13-231-171-17.ap-northeast-1.compute.amazonaws.com.openvpn: UDP, length 76
08:22:54.919974 IP ec2-13-231-171-17.ap-northeast-1.compute.amazonaws.com.openvpn > ip-192-168-75-233.ap-northeast-1.compute.internal.46802: UDP, length 1350
08:22:54.920008 IP ec2-13-231-171-17.ap-northeast-1.compute.amazonaws.com.openvpn > ip-192-168-75-233.ap-northeast-1.compute.internal.46802: UDP, length 1350
08:22:54.920102 IP ip-192-168-75-233.ap-northeast-1.compute.internal.46802 > ec2-13-231-171-17.ap-northeast-1.compute.amazonaws.com.openvpn: UDP, length 76
08:22:54.921286 IP ec2-13-231-171-17.ap-northeast-1.compute.amazonaws.com.openvpn > ip-192-168-75-233.ap-northeast-1.compute.internal.46802: UDP, length 76
08:22:54.921348 IP ec2-13-231-171-17.ap-northeast-1.compute.amazonaws.com.openvpn > ip-192-168-75-233.ap-northeast-1.compute.internal.46802: UDP, length 76
08:22:54.921380 IP ec2-13-231-171-17.ap-northeast-1.compute.amazonaws.com.openvpn > ip-192-168-75-233.ap-northeast-1.compute.internal.46802: UDP, length 76
08:22:54.921457 IP ec2-13-231-171-17.ap-northeast-1.compute.amazonaws.com.openvpn > ip-192-168-75-233.ap-northeast-1.compute.internal.46802: UDP, length 1350
08:22:54.921477 IP ec2-13-231-171-17.ap-northeast-1.compute.amazonaws.com.openvpn > ip-192-168-75-233.ap-northeast-1.compute.internal.46802: UDP, length 1350
08:22:54.921512 IP ip-192-168-75-233.ap-northeast-1.compute.internal.46802 > ec2-13-231-171-17.ap-northeast-1.compute.amazonaws.com.openvpn: UDP, length 76
08:22:54.922743 IP ec2-13-231-171-17.ap-northeast-1.compute.amazonaws.com.openvpn > ip-192-168-75-233.ap-northeast-1.compute.internal.46802: UDP, length 1350
08:22:54.922780 IP ec2-13-231-171-17.ap-northeast-1.compute.amazonaws.com.openvpn > ip-192-168-75-233.ap-northeast-1.compute.internal.46802: UDP, length 1350
08:22:54.922822 IP ip-192-168-75-233.ap-northeast-1.compute.internal.46802 > ec2-13-231-171-17.ap-northeast-1.compute.amazonaws.com.openvpn: UDP, length 76
08:22:54.924194 IP ec2-13-231-171-17.ap-northeast-1.compute.amazonaws.com.openvpn > ip-192-168-75-233.ap-northeast-1.compute.internal.46802: UDP, length 1350
08:22:54.924208 IP ec2-13-231-171-17.ap-northeast-1.compute.amazonaws.com.openvpn > ip-192-168-75-233.ap-northeast-1.compute.internal.46802: UDP, length 1350
08:22:54.924270 IP ip-192-168-75-233.ap-northeast-1.compute.internal.46802 > ec2-13-231-171-17.ap-northeast-1.compute.amazonaws.com.openvpn: UDP, length 76
08:22:54.925592 IP ec2-13-231-171-17.ap-northeast-1.compute.amazonaws.com.openvpn > ip-192-168-75-233.ap-northeast-1.compute.internal.46802: UDP, length 1350
08:22:54.925610 IP ec2-13-231-171-17.ap-northeast-1.compute.amazonaws.com.openvpn > ip-192-168-75-233.ap-northeast-1.compute.internal.46802: UDP, length 1350
08:22:54.925697 IP ip-192-168-75-233.ap-northeast-1.compute.internal.46802 > ec2-13-231-171-17.ap-northeast-1.compute.amazonaws.com.openvpn: UDP, length 76
08:22:54.926998 IP ec2-13-231-171-17.ap-northeast-1.compute.amazonaws.com.openvpn > ip-192-168-75-233.ap-northeast-1.compute.internal.46802: UDP, length 1350
08:22:54.927020 IP ec2-13-231-171-17.ap-northeast-1.compute.amazonaws.com.openvpn > ip-192-168-75-233.ap-northeast-1.compute.internal.46802: UDP, length 1350
08:22:54.927097 IP ip-192-168-75-233.ap-northeast-1.compute.internal.46802 > ec2-13-231-171-17.ap-northeast-1.compute.amazonaws.com.openvpn: UDP, length 76
08:22:54.928535 IP ec2-13-231-171-17.ap-northeast-1.compute.amazonaws.com.openvpn > ip-192-168-75-233.ap-northeast-1.compute.internal.46802: UDP, length 1350
08:22:54.928599 IP ec2-13-231-171-17.ap-northeast-1.compute.amazonaws.com.openvpn > ip-192-168-75-233.ap-northeast-1.compute.internal.46802: UDP, length 1350
08:22:54.928644 IP ip-192-168-75-233.ap-northeast-1.compute.internal.46802 > ec2-13-231-171-17.ap-northeast-1.compute.amazonaws.com.openvpn: UDP, length 76
08:22:54.929825 IP ec2-13-231-171-17.ap-northeast-1.compute.amazonaws.com.openvpn > ip-192-168-75-233.ap-northeast-1.compute.internal.46802: UDP, length 1350
08:22:54.929864 IP ec2-13-231-171-17.ap-northeast-1.compute.amazonaws.com.openvpn > ip-192-168-75-233.ap-northeast-1.compute.internal.46802: UDP, length 1350
08:22:54.929896 IP ip-192-168-75-233.ap-northeast-1.compute.internal.46802 > ec2-13-231-171-17.ap-northeast-1.compute.amazonaws.com.openvpn: UDP, length 76
08:22:54.931206 IP ec2-13-231-171-17.ap-northeast-1.compute.amazonaws.com.openvpn > ip-192-168-75-233.ap-northeast-1.compute.internal.46802: UDP, length 1350
08:22:54.931226 IP ec2-13-231-171-17.ap-northeast-1.compute.amazonaws.com.openvpn > ip-192-168-75-233.ap-northeast-1.compute.internal.46802: UDP, length 1350
08:22:54.931277 IP ip-192-168-75-233.ap-northeast-1.compute.internal.46802 > ec2-13-231-171-17.ap-northeast-1.compute.amazonaws.com.openvpn: UDP, length 76
08:22:54.935989 IP ec2-13-231-171-17.ap-northeast-1.compute.amazonaws.com.openvpn > ip-192-168-75-233.ap-northeast-1.compute.internal.46802: UDP, length 76
08:22:54.938101 IP ec2-13-231-171-17.ap-northeast-1.compute.amazonaws.com.openvpn > ip-192-168-75-233.ap-northeast-1.compute.internal.46802: UDP, length 76
08:22:54.938233 IP ec2-13-231-171-17.ap-northeast-1.compute.amazonaws.com.openvpn > ip-192-168-75-233.ap-northeast-1.compute.internal.46802: UDP, length 1350
08:22:54.938249 IP ec2-13-231-171-17.ap-northeast-1.compute.amazonaws.com.openvpn > ip-192-168-75-233.ap-northeast-1.compute.internal.46802: UDP, length 1350
