09:01:14.411210 ARP, Request who-has ip-192-168-75-1.ap-northeast-1.compute.internal tell ip-192-168-75-233.ap-northeast-1.compute.internal, length 28
09:01:14.412434 ARP, Reply ip-192-168-75-1.ap-northeast-1.compute.internal is-at d0:96:fb:e7:bb:a2 (oui Unknown), length 46
09:01:14.984160 IP ip-192-168-75-233.ap-northeast-1.compute.internal.46802 > ec2-13-231-171-17.ap-northeast-1.compute.amazonaws.com.openvpn: UDP, length 95
09:01:15.028217 IP ec2-13-231-171-17.ap-northeast-1.compute.amazonaws.com.openvpn > ip-192-168-75-233.ap-northeast-1.compute.internal.46802: UDP, length 156
09:01:15.028531 IP ip-192-168-75-233.ap-northeast-1.compute.internal.46802 > ec2-13-231-171-17.ap-northeast-1.compute.amazonaws.com.openvpn: UDP, length 97
09:01:15.068080 IP ec2-13-231-171-17.ap-northeast-1.compute.amazonaws.com.openvpn > ip-192-168-75-233.ap-northeast-1.compute.internal.46802: UDP, length 160
09:01:15.463339 IP ip-192-168-75-233.ap-northeast-1.compute.internal.46802 > ec2-13-231-171-17.ap-northeast-1.compute.amazonaws.com.openvpn: UDP, length 76
09:01:15.505794 IP ec2-13-231-171-17.ap-northeast-1.compute.amazonaws.com.openvpn > ip-192-168-75-233.ap-northeast-1.compute.internal.46802: UDP, length 76
09:01:16.007713 IP ip-192-168-75-233.ap-northeast-1.compute.internal.46802 > ec2-13-231-171-17.ap-northeast-1.compute.amazonaws.com.openvpn: UDP, length 96
09:01:16.053570 IP ec2-13-231-171-17.ap-northeast-1.compute.amazonaws.com.openvpn > ip-192-168-75-233.ap-northeast-1.compute.internal.46802: UDP, length 164
09:01:16.711492 IP ip-192-168-75-233.ap-northeast-1.compute.internal.46802 > ec2-13-231-171-17.ap-northeast-1.compute.amazonaws.com.openvpn: UDP, length 76
09:01:16.743445 IP ip-192-168-75-233.ap-northeast-1.compute.internal.46802 > ec2-13-231-171-17.ap-northeast-1.compute.amazonaws.com.openvpn: UDP, length 76
09:01:16.752856 IP ec2-13-231-171-17.ap-northeast-1.compute.amazonaws.com.openvpn > ip-192-168-75-233.ap-northeast-1.compute.internal.46802: UDP, length 76
09:01:16.782757 IP ec2-13-231-171-17.ap-northeast-1.compute.amazonaws.com.openvpn > ip-192-168-75-233.ap-northeast-1.compute.internal.46802: UDP, length 76
09:01:17.127334 IP ip-192-168-75-233.ap-northeast-1.compute.internal.46802 > ec2-13-231-171-17.ap-northeast-1.compute.amazonaws.com.openvpn: UDP, length 76
09:01:17.170038 IP ec2-13-231-171-17.ap-northeast-1.compute.amazonaws.com.openvpn > ip-192-168-75-233.ap-northeast-1.compute.internal.46802: UDP, length 76
09:01:17.223343 IP ip-192-168-75-233.ap-northeast-1.compute.internal.46802 > ec2-13-231-171-17.ap-northeast-1.compute.amazonaws.com.openvpn: UDP, length 76
09:01:17.264844 IP ec2-13-231-171-17.ap-northeast-1.compute.amazonaws.com.openvpn > ip-192-168-75-233.ap-northeast-1.compute.internal.46802: UDP, length 76
09:01:19.527453 IP ip-192-168-75-233.ap-northeast-1.compute.internal.46802 > ec2-13-231-171-17.ap-northeast-1.compute.amazonaws.com.openvpn: UDP, length 76
09:01:19.572548 IP ec2-13-231-171-17.ap-northeast-1.compute.amazonaws.com.openvpn > ip-192-168-75-233.ap-northeast-1.compute.internal.46802: UDP, length 76
09:01:20.145716 Loopback, skipCount 0,  invalid (256)
09:01:23.625161 IP ip-192-168-75-233.ap-northeast-1.compute.internal.46802 > ec2-13-231-171-17.ap-northeast-1.compute.amazonaws.com.openvpn: UDP, length 115
09:01:23.668764 IP ec2-13-231-171-17.ap-northeast-1.compute.amazonaws.com.openvpn > ip-192-168-75-233.ap-northeast-1.compute.internal.46802: UDP, length 115
09:01:23.668895 IP ip-192-168-75-233.ap-northeast-1.compute.internal.46802 > ec2-13-231-171-17.ap-northeast-1.compute.amazonaws.com.openvpn: UDP, length 76
09:01:25.671491 IP ip-192-168-75-233.ap-northeast-1.compute.internal.46802 > ec2-13-231-171-17.ap-northeast-1.compute.amazonaws.com.openvpn: UDP, length 76
09:01:25.714217 IP ec2-13-231-171-17.ap-northeast-1.compute.amazonaws.com.openvpn > ip-192-168-75-233.ap-northeast-1.compute.internal.46802: UDP, length 76
09:01:26.951355 IP ip-192-168-75-233.ap-northeast-1.compute.internal.46802 > ec2-13-231-171-17.ap-northeast-1.compute.amazonaws.com.openvpn: UDP, length 76
09:01:26.951389 IP ip-192-168-75-233.ap-northeast-1.compute.internal.46802 > ec2-13-231-171-17.ap-northeast-1.compute.amazonaws.com.openvpn: UDP, length 76
09:01:26.995045 IP ec2-13-231-171-17.ap-northeast-1.compute.amazonaws.com.openvpn > ip-192-168-75-233.ap-northeast-1.compute.internal.46802: UDP, length 76
09:01:26.995081 IP ec2-13-231-171-17.ap-northeast-1.compute.amazonaws.com.openvpn > ip-192-168-75-233.ap-northeast-1.compute.internal.46802: UDP, length 76
09:01:27.207498 IP ip-192-168-75-233.ap-northeast-1.compute.internal.46802 > ec2-13-231-171-17.ap-northeast-1.compute.amazonaws.com.openvpn: UDP, length 76
09:01:27.248326 IP ec2-13-231-171-17.ap-northeast-1.compute.amazonaws.com.openvpn > ip-192-168-75-233.ap-northeast-1.compute.internal.46802: UDP, length 76
09:01:27.463493 IP ip-192-168-75-233.ap-northeast-1.compute.internal.46802 > ec2-13-231-171-17.ap-northeast-1.compute.amazonaws.com.openvpn: UDP, length 76
09:01:27.505121 IP ec2-13-231-171-17.ap-northeast-1.compute.amazonaws.com.openvpn > ip-192-168-75-233.ap-northeast-1.compute.internal.46802: UDP, length 76
09:01:28.487433 IP ip-192-168-75-233.ap-northeast-1.compute.internal.46802 > ec2-13-231-171-17.ap-northeast-1.compute.amazonaws.com.openvpn: UDP, length 84
09:01:28.743278 IP ip-192-168-75-233.ap-northeast-1.compute.internal.46802 > ec2-13-231-171-17.ap-northeast-1.compute.amazonaws.com.openvpn: UDP, length 84
09:01:29.767304 IP ip-192-168-75-233.ap-northeast-1.compute.internal.46802 > ec2-13-231-171-17.ap-northeast-1.compute.amazonaws.com.openvpn: UDP, length 76
09:01:29.808896 IP ec2-13-231-171-17.ap-northeast-1.compute.amazonaws.com.openvpn > ip-192-168-75-233.ap-northeast-1.compute.internal.46802: UDP, length 76
09:01:30.167887 Loopback, skipCount 0,  invalid (256)
09:01:35.911454 IP ip-192-168-75-233.ap-northeast-1.compute.internal.46802 > ec2-13-231-171-17.ap-northeast-1.compute.amazonaws.com.openvpn: UDP, length 76
09:01:35.956262 IP ec2-13-231-171-17.ap-northeast-1.compute.amazonaws.com.openvpn > ip-192-168-75-233.ap-northeast-1.compute.internal.46802: UDP, length 76
09:01:37.195286 IP ip-192-168-75-233.ap-northeast-1.compute.internal.46802 > ec2-13-231-171-17.ap-northeast-1.compute.amazonaws.com.openvpn: UDP, length 76
09:01:37.195306 IP ip-192-168-75-233.ap-northeast-1.compute.internal.46802 > ec2-13-231-171-17.ap-northeast-1.compute.amazonaws.com.openvpn: UDP, length 76
09:01:37.237001 IP ec2-13-231-171-17.ap-northeast-1.compute.amazonaws.com.openvpn > ip-192-168-75-233.ap-northeast-1.compute.internal.46802: UDP, length 76
09:01:37.237133 IP ec2-13-231-171-17.ap-northeast-1.compute.amazonaws.com.openvpn > ip-192-168-75-233.ap-northeast-1.compute.internal.46802: UDP, length 76
09:01:37.451285 IP ip-192-168-75-233.ap-northeast-1.compute.internal.46802 > ec2-13-231-171-17.ap-northeast-1.compute.amazonaws.com.openvpn: UDP, length 76
09:01:37.490151 IP ec2-13-231-171-17.ap-northeast-1.compute.amazonaws.com.openvpn > ip-192-168-75-233.ap-northeast-1.compute.internal.46802: UDP, length 76
09:01:37.630150 IP ip-192-168-75-233.ap-northeast-1.compute.internal.46802 > ec2-13-231-171-17.ap-northeast-1.compute.amazonaws.com.openvpn: UDP, length 115
09:01:37.674759 IP ec2-13-231-171-17.ap-northeast-1.compute.amazonaws.com.openvpn > ip-192-168-75-233.ap-northeast-1.compute.internal.46802: UDP, length 115
09:01:37.674838 IP ip-192-168-75-233.ap-northeast-1.compute.internal.46802 > ec2-13-231-171-17.ap-northeast-1.compute.amazonaws.com.openvpn: UDP, length 76
09:01:37.703249 IP ip-192-168-75-233.ap-northeast-1.compute.internal.46802 > ec2-13-231-171-17.ap-northeast-1.compute.amazonaws.com.openvpn: UDP, length 76
09:01:37.742848 IP ec2-13-231-171-17.ap-northeast-1.compute.amazonaws.com.openvpn > ip-192-168-75-233.ap-northeast-1.compute.internal.46802: UDP, length 76
09:01:38.630624 IP ip-192-168-75-233.ap-northeast-1.compute.internal.46802 > ec2-13-231-171-17.ap-northeast-1.compute.amazonaws.com.openvpn: UDP, length 115
09:01:38.674258 IP ec2-13-231-171-17.ap-northeast-1.compute.amazonaws.com.openvpn > ip-192-168-75-233.ap-northeast-1.compute.internal.46802: UDP, length 115
09:01:38.674337 IP ip-192-168-75-233.ap-northeast-1.compute.internal.46802 > ec2-13-231-171-17.ap-northeast-1.compute.amazonaws.com.openvpn: UDP, length 76
09:01:38.776945 IP ip-192-168-75-233.ap-northeast-1.compute.internal.46802 > ec2-13-231-171-17.ap-northeast-1.compute.amazonaws.com.openvpn: UDP, length 94
09:01:38.776971 IP ip-192-168-75-233.ap-northeast-1.compute.internal.46802 > ec2-13-231-171-17.ap-northeast-1.compute.amazonaws.com.openvpn: UDP, length 94
09:01:38.815327 IP ec2-13-231-171-17.ap-northeast-1.compute.amazonaws.com.openvpn > ip-192-168-75-233.ap-northeast-1.compute.internal.46802: UDP, length 110
09:01:38.815392 IP ec2-13-231-171-17.ap-northeast-1.compute.amazonaws.com.openvpn > ip-192-168-75-233.ap-northeast-1.compute.internal.46802: UDP, length 174
09:01:38.815750 IP ip-192-168-75-233.ap-northeast-1.compute.internal.46802 > ec2-13-231-171-17.ap-northeast-1.compute.amazonaws.com.openvpn: UDP, length 84
09:01:39.066219 IP ip-192-168-75-233.ap-northeast-1.compute.internal.46802 > ec2-13-231-171-17.ap-northeast-1.compute.amazonaws.com.openvpn: UDP, length 94
09:01:39.105239 IP ec2-13-231-171-17.ap-northeast-1.compute.amazonaws.com.openvpn > ip-192-168-75-233.ap-northeast-1.compute.internal.46802: UDP, length 110
09:01:39.106006 IP ip-192-168-75-233.ap-northeast-1.compute.internal.46802 > ec2-13-231-171-17.ap-northeast-1.compute.amazonaws.com.openvpn: UDP, length 84
09:01:39.847474 IP ip-192-168-75-233.ap-northeast-1.compute.internal.46802 > ec2-13-231-171-17.ap-northeast-1.compute.amazonaws.com.openvpn: UDP, length 84
09:01:40.007424 IP ip-192-168-75-233.ap-northeast-1.compute.internal.46802 > ec2-13-231-171-17.ap-northeast-1.compute.amazonaws.com.openvpn: UDP, length 76
09:01:40.047049 IP ec2-13-231-171-17.ap-northeast-1.compute.amazonaws.com.openvpn > ip-192-168-75-233.ap-northeast-1.compute.internal.46802: UDP, length 76
09:01:40.135335 IP ip-192-168-75-233.ap-northeast-1.compute.internal.46802 > ec2-13-231-171-17.ap-northeast-1.compute.amazonaws.com.openvpn: UDP, length 84
09:01:40.190078 Loopback, skipCount 0,  invalid (256)
09:01:41.863304 IP ip-192-168-75-233.ap-northeast-1.compute.internal.46802 > ec2-13-231-171-17.ap-northeast-1.compute.amazonaws.com.openvpn: UDP, length 84
09:01:42.151308 IP ip-192-168-75-233.ap-northeast-1.compute.internal.46802 > ec2-13-231-171-17.ap-northeast-1.compute.amazonaws.com.openvpn: UDP, length 84
09:01:42.732260 IP ip-192-168-75-233.ap-northeast-1.compute.internal.46802 > ec2-13-231-171-17.ap-northeast-1.compute.amazonaws.com.openvpn: UDP, length 100
09:01:42.732294 IP ip-192-168-75-233.ap-northeast-1.compute.internal.46802 > ec2-13-231-171-17.ap-northeast-1.compute.amazonaws.com.openvpn: UDP, length 76
09:01:42.777058 IP ec2-13-231-171-17.ap-northeast-1.compute.amazonaws.com.openvpn > ip-192-168-75-233.ap-northeast-1.compute.internal.46802: UDP, length 100
09:01:42.777090 IP ec2-13-231-171-17.ap-northeast-1.compute.amazonaws.com.openvpn > ip-192-168-75-233.ap-northeast-1.compute.internal.46802: UDP, length 76
09:01:42.777244 IP ip-192-168-75-233.ap-northeast-1.compute.internal.46802 > ec2-13-231-171-17.ap-northeast-1.compute.amazonaws.com.openvpn: UDP, length 64
09:01:42.777271 IP ip-192-168-75-233.ap-northeast-1.compute.internal.46802 > ec2-13-231-171-17.ap-northeast-1.compute.amazonaws.com.openvpn: UDP, length 64
09:01:43.847215 ARP, Request who-has ip-192-168-75-1.ap-northeast-1.compute.internal tell ip-192-168-75-233.ap-northeast-1.compute.internal, length 28
09:01:43.847955 ARP, Reply ip-192-168-75-1.ap-northeast-1.compute.internal is-at d0:96:fb:e7:bb:a2 (oui Unknown), length 46
09:01:45.633470 IP ip-192-168-75-233.ap-northeast-1.compute.internal.46802 > ec2-13-231-171-17.ap-northeast-1.compute.amazonaws.com.openvpn: UDP, length 115
09:01:45.633537 IP ip-192-168-75-233.ap-northeast-1.compute.internal.46802 > ec2-13-231-171-17.ap-northeast-1.compute.amazonaws.com.openvpn: UDP, length 115
09:01:45.633558 IP ip-192-168-75-233.ap-northeast-1.compute.internal.46802 > ec2-13-231-171-17.ap-northeast-1.compute.amazonaws.com.openvpn: UDP, length 115
09:01:45.633577 IP ip-192-168-75-233.ap-northeast-1.compute.internal.46802 > ec2-13-231-171-17.ap-northeast-1.compute.amazonaws.com.openvpn: UDP, length 115
09:01:45.676892 IP ec2-13-231-171-17.ap-northeast-1.compute.amazonaws.com.openvpn > ip-192-168-75-233.ap-northeast-1.compute.internal.46802: UDP, length 115
09:01:45.676893 IP ec2-13-231-171-17.ap-northeast-1.compute.amazonaws.com.openvpn > ip-192-168-75-233.ap-northeast-1.compute.internal.46802: UDP, length 115
09:01:45.677059 IP ip-192-168-75-233.ap-northeast-1.compute.internal.46802 > ec2-13-231-171-17.ap-northeast-1.compute.amazonaws.com.openvpn: UDP, length 76
09:01:45.677086 IP ip-192-168-75-233.ap-northeast-1.compute.internal.46802 > ec2-13-231-171-17.ap-northeast-1.compute.amazonaws.com.openvpn: UDP, length 76
09:01:45.677096 IP ec2-13-231-171-17.ap-northeast-1.compute.amazonaws.com.openvpn > ip-192-168-75-233.ap-northeast-1.compute.internal.46802: UDP, length 115
09:01:45.677160 IP ip-192-168-75-233.ap-northeast-1.compute.internal.46802 > ec2-13-231-171-17.ap-northeast-1.compute.amazonaws.com.openvpn: UDP, length 76
09:01:45.677215 IP ec2-13-231-171-17.ap-northeast-1.compute.amazonaws.com.openvpn > ip-192-168-75-233.ap-northeast-1.compute.internal.46802: UDP, length 115
09:01:45.677287 IP ip-192-168-75-233.ap-northeast-1.compute.internal.46802 > ec2-13-231-171-17.ap-northeast-1.compute.amazonaws.com.openvpn: UDP, length 76
09:01:45.895311 IP ip-192-168-75-233.ap-northeast-1.compute.internal.46802 > ec2-13-231-171-17.ap-northeast-1.compute.amazonaws.com.openvpn: UDP, length 84
09:01:46.151365 IP ip-192-168-75-233.ap-northeast-1.compute.internal.46802 > ec2-13-231-171-17.ap-northeast-1.compute.amazonaws.com.openvpn: UDP, length 76
09:01:46.192592 IP ec2-13-231-171-17.ap-northeast-1.compute.amazonaws.com.openvpn > ip-192-168-75-233.ap-northeast-1.compute.internal.46802: UDP, length 76
09:01:46.407451 IP ip-192-168-75-233.ap-northeast-1.compute.internal.46802 > ec2-13-231-171-17.ap-northeast-1.compute.amazonaws.com.openvpn: UDP, length 84
09:01:46.633895 IP ip-192-168-75-233.ap-northeast-1.compute.internal.46802 > ec2-13-231-171-17.ap-northeast-1.compute.amazonaws.com.openvpn: UDP, length 115
09:01:46.656274 IP ip-192-168-75-66.ap-northeast-1.compute.internal.mdns > mdns.mcast.net.mdns: 0 PTR (QM)? _googlecast._tcp.local. (40)
09:01:46.656419 IP6 fe80::bff0:8a76:6922:be9a.mdns > ff02::fb.mdns: 0 PTR (QM)? _googlecast._tcp.local. (40)
09:01:46.657174 IP ip-192-168-75-66.ap-northeast-1.compute.internal.mdns > mdns.mcast.net.mdns: 0*- [0q] 1/0/3 PTR BID-AT200-e566f7781b617791f5176881acc41d6b._googlecast._tcp.local. (369)
09:01:46.659864 IP6 fe80::bff0:8a76:6922:be9a.mdns > ff02::fb.mdns: 0*- [0q] 1/0/3 PTR BID-AT200-e566f7781b617791f5176881acc41d6b._googlecast._tcp.local. (381)
09:01:46.678726 IP ec2-13-231-171-17.ap-northeast-1.compute.amazonaws.com.openvpn > ip-192-168-75-233.ap-northeast-1.compute.internal.46802: UDP, length 115
09:01:46.678849 IP ip-192-168-75-233.ap-northeast-1.compute.internal.46802 > ec2-13-231-171-17.ap-northeast-1.compute.amazonaws.com.openvpn: UDP, length 76
09:01:46.727679 IP ip-192-168-75-233.ap-northeast-1.compute.internal.46802 > ec2-13-231-171-17.ap-northeast-1.compute.amazonaws.com.openvpn: UDP, length 94
09:01:46.766537 IP ec2-13-231-171-17.ap-northeast-1.compute.amazonaws.com.openvpn > ip-192-168-75-233.ap-northeast-1.compute.internal.46802: UDP, length 122
09:01:46.766879 IP ip-192-168-75-233.ap-northeast-1.compute.internal.46802 > ec2-13-231-171-17.ap-northeast-1.compute.amazonaws.com.openvpn: UDP, length 96
09:01:46.806754 IP ec2-13-231-171-17.ap-northeast-1.compute.amazonaws.com.openvpn > ip-192-168-75-233.ap-northeast-1.compute.internal.46802: UDP, length 158
09:01:46.807122 IP ip-192-168-75-233.ap-northeast-1.compute.internal.46802 > ec2-13-231-171-17.ap-northeast-1.compute.amazonaws.com.openvpn: UDP, length 142
09:01:46.846505 IP ec2-13-231-171-17.ap-northeast-1.compute.amazonaws.com.openvpn > ip-192-168-75-233.ap-northeast-1.compute.internal.46802: UDP, length 206
09:01:46.846785 IP ip-192-168-75-233.ap-northeast-1.compute.internal.46802 > ec2-13-231-171-17.ap-northeast-1.compute.amazonaws.com.openvpn: UDP, length 142
09:01:46.886423 IP ec2-13-231-171-17.ap-northeast-1.compute.amazonaws.com.openvpn > ip-192-168-75-233.ap-northeast-1.compute.internal.46802: UDP, length 201
09:01:47.435350 IP ip-192-168-75-233.ap-northeast-1.compute.internal.46802 > ec2-13-231-171-17.ap-northeast-1.compute.amazonaws.com.openvpn: UDP, length 76
09:01:47.435389 IP ip-192-168-75-233.ap-northeast-1.compute.internal.46802 > ec2-13-231-171-17.ap-northeast-1.compute.amazonaws.com.openvpn: UDP, length 76
09:01:47.477297 IP ec2-13-231-171-17.ap-northeast-1.compute.amazonaws.com.openvpn > ip-192-168-75-233.ap-northeast-1.compute.internal.46802: UDP, length 76
09:01:47.477299 IP ec2-13-231-171-17.ap-northeast-1.compute.amazonaws.com.openvpn > ip-192-168-75-233.ap-northeast-1.compute.internal.46802: UDP, length 76
09:01:47.687426 IP ip-192-168-75-233.ap-northeast-1.compute.internal.46802 > ec2-13-231-171-17.ap-northeast-1.compute.amazonaws.com.openvpn: UDP, length 76
09:01:47.726536 IP ec2-13-231-171-17.ap-northeast-1.compute.amazonaws.com.openvpn > ip-192-168-75-233.ap-northeast-1.compute.internal.46802: UDP, length 76
09:01:47.943466 IP ip-192-168-75-233.ap-northeast-1.compute.internal.46802 > ec2-13-231-171-17.ap-northeast-1.compute.amazonaws.com.openvpn: UDP, length 76
09:01:47.985403 IP ec2-13-231-171-17.ap-northeast-1.compute.amazonaws.com.openvpn > ip-192-168-75-233.ap-northeast-1.compute.internal.46802: UDP, length 76
09:01:50.212268 Loopback, skipCount 0,  invalid (256)
09:01:50.635491 IP ip-192-168-75-233.ap-northeast-1.compute.internal.46802 > ec2-13-231-171-17.ap-northeast-1.compute.amazonaws.com.openvpn: UDP, length 115
09:01:50.680463 IP ec2-13-231-171-17.ap-northeast-1.compute.amazonaws.com.openvpn > ip-192-168-75-233.ap-northeast-1.compute.internal.46802: UDP, length 115
09:01:50.680765 IP ip-192-168-75-233.ap-northeast-1.compute.internal.46802 > ec2-13-231-171-17.ap-northeast-1.compute.amazonaws.com.openvpn: UDP, length 76
09:01:51.635902 IP ip-192-168-75-233.ap-northeast-1.compute.internal.46802 > ec2-13-231-171-17.ap-northeast-1.compute.amazonaws.com.openvpn: UDP, length 115
09:01:51.635943 IP ip-192-168-75-233.ap-northeast-1.compute.internal.46802 > ec2-13-231-171-17.ap-northeast-1.compute.amazonaws.com.openvpn: UDP, length 115
09:01:51.680608 IP ec2-13-231-171-17.ap-northeast-1.compute.amazonaws.com.openvpn > ip-192-168-75-233.ap-northeast-1.compute.internal.46802: UDP, length 115
09:01:51.680800 IP ip-192-168-75-233.ap-northeast-1.compute.internal.46802 > ec2-13-231-171-17.ap-northeast-1.compute.amazonaws.com.openvpn: UDP, length 76
09:01:51.681738 IP ec2-13-231-171-17.ap-northeast-1.compute.amazonaws.com.openvpn > ip-192-168-75-233.ap-northeast-1.compute.internal.46802: UDP, length 115
09:01:51.681875 IP ip-192-168-75-233.ap-northeast-1.compute.internal.46802 > ec2-13-231-171-17.ap-northeast-1.compute.amazonaws.com.openvpn: UDP, length 76
09:01:54.087280 IP ip-192-168-75-233.ap-northeast-1.compute.internal.46802 > ec2-13-231-171-17.ap-northeast-1.compute.amazonaws.com.openvpn: UDP, length 84
09:01:54.599278 IP ip-192-168-75-233.ap-northeast-1.compute.internal.46802 > ec2-13-231-171-17.ap-northeast-1.compute.amazonaws.com.openvpn: UDP, length 84
09:01:55.637660 IP ip-192-168-75-233.ap-northeast-1.compute.internal.46802 > ec2-13-231-171-17.ap-northeast-1.compute.amazonaws.com.openvpn: UDP, length 115
09:01:55.680561 IP ec2-13-231-171-17.ap-northeast-1.compute.amazonaws.com.openvpn > ip-192-168-75-233.ap-northeast-1.compute.internal.46802: UDP, length 76
09:01:55.680593 IP ec2-13-231-171-17.ap-northeast-1.compute.amazonaws.com.openvpn > ip-192-168-75-233.ap-northeast-1.compute.internal.46802: UDP, length 115
09:01:55.680645 IP ip-192-168-75-233.ap-northeast-1.compute.internal.46802 > ec2-13-231-171-17.ap-northeast-1.compute.amazonaws.com.openvpn: UDP, length 76
09:01:56.391429 IP ip-192-168-75-233.ap-northeast-1.compute.internal.46802 > ec2-13-231-171-17.ap-northeast-1.compute.amazonaws.com.openvpn: UDP, length 76
09:01:56.433017 IP ec2-13-231-171-17.ap-northeast-1.compute.amazonaws.com.openvpn > ip-192-168-75-233.ap-northeast-1.compute.internal.46802: UDP, length 76
09:01:57.638832 IP ip-192-168-75-233.ap-northeast-1.compute.internal.46802 > ec2-13-231-171-17.ap-northeast-1.compute.amazonaws.com.openvpn: UDP, length 115
09:01:57.671448 IP ip-192-168-75-233.ap-northeast-1.compute.internal.46802 > ec2-13-231-171-17.ap-northeast-1.compute.amazonaws.com.openvpn: UDP, length 76
09:01:57.671472 IP ip-192-168-75-233.ap-northeast-1.compute.internal.46802 > ec2-13-231-171-17.ap-northeast-1.compute.amazonaws.com.openvpn: UDP, length 76
09:01:57.683162 IP ec2-13-231-171-17.ap-northeast-1.compute.amazonaws.com.openvpn > ip-192-168-75-233.ap-northeast-1.compute.internal.46802: UDP, length 76
09:01:57.683194 IP ec2-13-231-171-17.ap-northeast-1.compute.amazonaws.com.openvpn > ip-192-168-75-233.ap-northeast-1.compute.internal.46802: UDP, length 115
09:01:57.683332 IP ip-192-168-75-233.ap-northeast-1.compute.internal.46802 > ec2-13-231-171-17.ap-northeast-1.compute.amazonaws.com.openvpn: UDP, length 76
09:01:57.709154 IP ec2-13-231-171-17.ap-northeast-1.compute.amazonaws.com.openvpn > ip-192-168-75-233.ap-northeast-1.compute.internal.46802: UDP, length 76
09:01:57.710926 IP ec2-13-231-171-17.ap-northeast-1.compute.amazonaws.com.openvpn > ip-192-168-75-233.ap-northeast-1.compute.internal.46802: UDP, length 76
09:01:57.927421 IP ip-192-168-75-233.ap-northeast-1.compute.internal.46802 > ec2-13-231-171-17.ap-northeast-1.compute.amazonaws.com.openvpn: UDP, length 76
09:01:57.968761 IP ec2-13-231-171-17.ap-northeast-1.compute.amazonaws.com.openvpn > ip-192-168-75-233.ap-northeast-1.compute.internal.46802: UDP, length 76
09:01:58.183321 IP ip-192-168-75-233.ap-northeast-1.compute.internal.46802 > ec2-13-231-171-17.ap-northeast-1.compute.amazonaws.com.openvpn: UDP, length 76
09:01:58.223496 IP ec2-13-231-171-17.ap-northeast-1.compute.amazonaws.com.openvpn > ip-192-168-75-233.ap-northeast-1.compute.internal.46802: UDP, length 76
09:01:59.639386 IP ip-192-168-75-233.ap-northeast-1.compute.internal.46802 > ec2-13-231-171-17.ap-northeast-1.compute.amazonaws.com.openvpn: UDP, length 115
09:01:59.639426 IP ip-192-168-75-233.ap-northeast-1.compute.internal.46802 > ec2-13-231-171-17.ap-northeast-1.compute.amazonaws.com.openvpn: UDP, length 115
09:01:59.682376 IP ec2-13-231-171-17.ap-northeast-1.compute.amazonaws.com.openvpn > ip-192-168-75-233.ap-northeast-1.compute.internal.46802: UDP, length 76
09:01:59.682377 IP ec2-13-231-171-17.ap-northeast-1.compute.amazonaws.com.openvpn > ip-192-168-75-233.ap-northeast-1.compute.internal.46802: UDP, length 76
09:01:59.682415 IP ec2-13-231-171-17.ap-northeast-1.compute.amazonaws.com.openvpn > ip-192-168-75-233.ap-northeast-1.compute.internal.46802: UDP, length 115
09:01:59.682416 IP ec2-13-231-171-17.ap-northeast-1.compute.amazonaws.com.openvpn > ip-192-168-75-233.ap-northeast-1.compute.internal.46802: UDP, length 115
09:01:59.682649 IP ip-192-168-75-233.ap-northeast-1.compute.internal.46802 > ec2-13-231-171-17.ap-northeast-1.compute.amazonaws.com.openvpn: UDP, length 76
09:01:59.682658 IP ip-192-168-75-233.ap-northeast-1.compute.internal.46802 > ec2-13-231-171-17.ap-northeast-1.compute.amazonaws.com.openvpn: UDP, length 76
09:02:00.023708 IP ip-192-168-75-233.ap-northeast-1.compute.internal.46802 > ec2-13-231-171-17.ap-northeast-1.compute.amazonaws.com.openvpn: UDP, length 80
09:02:00.023722 IP ip-192-168-75-233.ap-northeast-1.compute.internal.46802 > ec2-13-231-171-17.ap-northeast-1.compute.amazonaws.com.openvpn: UDP, length 80
09:02:00.064468 IP ec2-13-231-171-17.ap-northeast-1.compute.amazonaws.com.openvpn > ip-192-168-75-233.ap-northeast-1.compute.internal.46802: UDP, length 96
09:02:00.066484 IP ec2-13-231-171-17.ap-northeast-1.compute.amazonaws.com.openvpn > ip-192-168-75-233.ap-northeast-1.compute.internal.46802: UDP, length 145
09:02:00.067116 IP ip-192-168-75-233.ap-northeast-1.compute.internal.46802 > ec2-13-231-171-17.ap-northeast-1.compute.amazonaws.com.openvpn: UDP, length 84
09:02:00.107709 IP ec2-13-231-171-17.ap-northeast-1.compute.amazonaws.com.openvpn > ip-192-168-75-233.ap-northeast-1.compute.internal.46802: UDP, length 84
09:02:00.107841 IP ip-192-168-75-233.ap-northeast-1.compute.internal.46802 > ec2-13-231-171-17.ap-northeast-1.compute.amazonaws.com.openvpn: UDP, length 76
09:02:00.189217 IP ip-192-168-75-233.ap-northeast-1.compute.internal.46802 > ec2-13-231-171-17.ap-northeast-1.compute.amazonaws.com.openvpn: UDP, length 475
09:02:00.230024 IP ec2-13-231-171-17.ap-northeast-1.compute.amazonaws.com.openvpn > ip-192-168-75-233.ap-northeast-1.compute.internal.46802: UDP, length 1350
09:02:00.230054 IP ec2-13-231-171-17.ap-northeast-1.compute.amazonaws.com.openvpn > ip-192-168-75-233.ap-northeast-1.compute.internal.46802: UDP, length 1350
09:02:00.230056 IP ec2-13-231-171-17.ap-northeast-1.compute.amazonaws.com.openvpn > ip-192-168-75-233.ap-northeast-1.compute.internal.46802: UDP, length 1063
09:02:00.230191 IP ip-192-168-75-233.ap-northeast-1.compute.internal.46802 > ec2-13-231-171-17.ap-northeast-1.compute.amazonaws.com.openvpn: UDP, length 76
09:02:00.230210 IP ip-192-168-75-233.ap-northeast-1.compute.internal.46802 > ec2-13-231-171-17.ap-northeast-1.compute.amazonaws.com.openvpn: UDP, length 76
09:02:00.230226 IP ip-192-168-75-233.ap-northeast-1.compute.internal.46802 > ec2-13-231-171-17.ap-northeast-1.compute.amazonaws.com.openvpn: UDP, length 76
09:02:00.230313 IP ip-192-168-75-233.ap-northeast-1.compute.internal.46802 > ec2-13-231-171-17.ap-northeast-1.compute.amazonaws.com.openvpn: UDP, length 82
09:02:00.230616 IP ip-192-168-75-233.ap-northeast-1.compute.internal.46802 > ec2-13-231-171-17.ap-northeast-1.compute.amazonaws.com.openvpn: UDP, length 134
09:02:00.233133 IP ip-192-168-75-233.ap-northeast-1.compute.internal.46802 > ec2-13-231-171-17.ap-northeast-1.compute.amazonaws.com.openvpn: UDP, length 162
09:02:00.233159 IP ip-192-168-75-233.ap-northeast-1.compute.internal.46802 > ec2-13-231-171-17.ap-northeast-1.compute.amazonaws.com.openvpn: UDP, length 234
09:02:00.233395 Loopback, skipCount 0,  invalid (256)
09:02:00.270643 IP ec2-13-231-171-17.ap-northeast-1.compute.amazonaws.com.openvpn > ip-192-168-75-233.ap-northeast-1.compute.internal.46802: UDP, length 76
09:02:00.270670 IP ec2-13-231-171-17.ap-northeast-1.compute.amazonaws.com.openvpn > ip-192-168-75-233.ap-northeast-1.compute.internal.46802: UDP, length 155
09:02:00.270705 IP ec2-13-231-171-17.ap-northeast-1.compute.amazonaws.com.openvpn > ip-192-168-75-233.ap-northeast-1.compute.internal.46802: UDP, length 155
09:02:00.270794 IP ip-192-168-75-233.ap-northeast-1.compute.internal.46802 > ec2-13-231-171-17.ap-northeast-1.compute.amazonaws.com.openvpn: UDP, length 76
09:02:00.273312 IP ec2-13-231-171-17.ap-northeast-1.compute.amazonaws.com.openvpn > ip-192-168-75-233.ap-northeast-1.compute.internal.46802: UDP, length 76
09:02:00.273314 IP ec2-13-231-171-17.ap-northeast-1.compute.amazonaws.com.openvpn > ip-192-168-75-233.ap-northeast-1.compute.internal.46802: UDP, length 140
09:02:00.273491 IP ip-192-168-75-233.ap-northeast-1.compute.internal.46802 > ec2-13-231-171-17.ap-northeast-1.compute.amazonaws.com.openvpn: UDP, length 107
09:02:00.359952 IP ec2-13-231-171-17.ap-northeast-1.compute.amazonaws.com.openvpn > ip-192-168-75-233.ap-northeast-1.compute.internal.46802: UDP, length 76
09:02:00.443631 IP ec2-13-231-171-17.ap-northeast-1.compute.amazonaws.com.openvpn > ip-192-168-75-233.ap-northeast-1.compute.internal.46802: UDP, length 377
09:02:00.487295 IP ip-192-168-75-233.ap-northeast-1.compute.internal.46802 > ec2-13-231-171-17.ap-northeast-1.compute.amazonaws.com.openvpn: UDP, length 76
09:02:00.639780 IP ip-192-168-75-233.ap-northeast-1.compute.internal.46802 > ec2-13-231-171-17.ap-northeast-1.compute.amazonaws.com.openvpn: UDP, length 115
09:02:00.683312 IP ec2-13-231-171-17.ap-northeast-1.compute.amazonaws.com.openvpn > ip-192-168-75-233.ap-northeast-1.compute.internal.46802: UDP, length 76
09:02:00.683343 IP ec2-13-231-171-17.ap-northeast-1.compute.amazonaws.com.openvpn > ip-192-168-75-233.ap-northeast-1.compute.internal.46802: UDP, length 115
09:02:00.683456 IP ip-192-168-75-233.ap-northeast-1.compute.internal.46802 > ec2-13-231-171-17.ap-northeast-1.compute.amazonaws.com.openvpn: UDP, length 76
09:02:01.640274 IP ip-192-168-75-233.ap-northeast-1.compute.internal.46802 > ec2-13-231-171-17.ap-northeast-1.compute.amazonaws.com.openvpn: UDP, length 115
09:02:01.640302 IP ip-192-168-75-233.ap-northeast-1.compute.internal.46802 > ec2-13-231-171-17.ap-northeast-1.compute.amazonaws.com.openvpn: UDP, length 115
09:02:01.682920 IP ec2-13-231-171-17.ap-northeast-1.compute.amazonaws.com.openvpn > ip-192-168-75-233.ap-northeast-1.compute.internal.46802: UDP, length 76
09:02:01.682921 IP ec2-13-231-171-17.ap-northeast-1.compute.amazonaws.com.openvpn > ip-192-168-75-233.ap-northeast-1.compute.internal.46802: UDP, length 115
09:02:01.683100 IP ip-192-168-75-233.ap-northeast-1.compute.internal.46802 > ec2-13-231-171-17.ap-northeast-1.compute.amazonaws.com.openvpn: UDP, length 76
09:02:01.685990 IP ec2-13-231-171-17.ap-northeast-1.compute.amazonaws.com.openvpn > ip-192-168-75-233.ap-northeast-1.compute.internal.46802: UDP, length 115
09:02:01.686101 IP ip-192-168-75-233.ap-northeast-1.compute.internal.46802 > ec2-13-231-171-17.ap-northeast-1.compute.amazonaws.com.openvpn: UDP, length 76
09:02:02.640728 IP ip-192-168-75-233.ap-northeast-1.compute.internal.46802 > ec2-13-231-171-17.ap-northeast-1.compute.amazonaws.com.openvpn: UDP, length 122
09:02:02.848273 IP ec2-13-231-171-17.ap-northeast-1.compute.amazonaws.com.openvpn > ip-192-168-75-233.ap-northeast-1.compute.internal.46802: UDP, length 122
09:02:02.848436 IP ip-192-168-75-233.ap-northeast-1.compute.internal.46802 > ec2-13-231-171-17.ap-northeast-1.compute.amazonaws.com.openvpn: UDP, length 76
09:02:02.875586 IP6 fe80::7285:c2ff:fed2:8f44.mdns > ff02::fb.mdns: 0 [2q] PTR (QM)? _ipp._tcp.local. PTR (QM)? _ipps._tcp.local. (45)
09:02:02.875696 IP ip-192-168-75-233.ap-northeast-1.compute.internal.mdns > mdns.mcast.net.mdns: 0 [2q] PTR (QM)? _ipp._tcp.local. PTR (QM)? _ipps._tcp.local. (45)
09:02:03.111696 IP ip-192-168-75-233.ap-northeast-1.compute.internal.46802 > ec2-13-231-171-17.ap-northeast-1.compute.amazonaws.com.openvpn: UDP, length 142
09:02:03.149784 IP ec2-13-231-171-17.ap-northeast-1.compute.amazonaws.com.openvpn > ip-192-168-75-233.ap-northeast-1.compute.internal.46802: UDP, length 201
09:02:03.640927 IP ip-192-168-75-233.ap-northeast-1.compute.internal.46802 > ec2-13-231-171-17.ap-northeast-1.compute.amazonaws.com.openvpn: UDP, length 115
09:02:03.640966 IP ip-192-168-75-233.ap-northeast-1.compute.internal.46802 > ec2-13-231-171-17.ap-northeast-1.compute.amazonaws.com.openvpn: UDP, length 115
09:02:03.640978 IP ip-192-168-75-233.ap-northeast-1.compute.internal.46802 > ec2-13-231-171-17.ap-northeast-1.compute.amazonaws.com.openvpn: UDP, length 115
09:02:03.641021 IP ip-192-168-75-233.ap-northeast-1.compute.internal.46802 > ec2-13-231-171-17.ap-northeast-1.compute.amazonaws.com.openvpn: UDP, length 115
09:02:03.684955 IP ec2-13-231-171-17.ap-northeast-1.compute.amazonaws.com.openvpn > ip-192-168-75-233.ap-northeast-1.compute.internal.46802: UDP, length 76
09:02:03.684992 IP ec2-13-231-171-17.ap-northeast-1.compute.amazonaws.com.openvpn > ip-192-168-75-233.ap-northeast-1.compute.internal.46802: UDP, length 115
09:02:03.685131 IP ec2-13-231-171-17.ap-northeast-1.compute.amazonaws.com.openvpn > ip-192-168-75-233.ap-northeast-1.compute.internal.46802: UDP, length 76
09:02:03.685211 IP ec2-13-231-171-17.ap-northeast-1.compute.amazonaws.com.openvpn > ip-192-168-75-233.ap-northeast-1.compute.internal.46802: UDP, length 115
09:02:03.685300 IP ec2-13-231-171-17.ap-northeast-1.compute.amazonaws.com.openvpn > ip-192-168-75-233.ap-northeast-1.compute.internal.46802: UDP, length 115
09:02:03.685351 IP ip-192-168-75-233.ap-northeast-1.compute.internal.46802 > ec2-13-231-171-17.ap-northeast-1.compute.amazonaws.com.openvpn: UDP, length 76
09:02:03.685646 IP ec2-13-231-171-17.ap-northeast-1.compute.amazonaws.com.openvpn > ip-192-168-75-233.ap-northeast-1.compute.internal.46802: UDP, length 76
09:02:03.685675 IP ec2-13-231-171-17.ap-northeast-1.compute.amazonaws.com.openvpn > ip-192-168-75-233.ap-northeast-1.compute.internal.46802: UDP, length 115
09:02:03.685707 IP ip-192-168-75-233.ap-northeast-1.compute.internal.46802 > ec2-13-231-171-17.ap-northeast-1.compute.amazonaws.com.openvpn: UDP, length 76
09:02:03.727289 IP ip-192-168-75-233.ap-northeast-1.compute.internal.46802 > ec2-13-231-171-17.ap-northeast-1.compute.amazonaws.com.openvpn: UDP, length 76
09:02:03.727314 IP ip-192-168-75-233.ap-northeast-1.compute.internal.46802 > ec2-13-231-171-17.ap-northeast-1.compute.amazonaws.com.openvpn: UDP, length 76
09:02:04.641626 IP ip-192-168-75-233.ap-northeast-1.compute.internal.46802 > ec2-13-231-171-17.ap-northeast-1.compute.amazonaws.com.openvpn: UDP, length 115
09:02:04.641660 IP ip-192-168-75-233.ap-northeast-1.compute.internal.46802 > ec2-13-231-171-17.ap-northeast-1.compute.amazonaws.com.openvpn: UDP, length 115
09:02:04.641681 IP ip-192-168-75-233.ap-northeast-1.compute.internal.46802 > ec2-13-231-171-17.ap-northeast-1.compute.amazonaws.com.openvpn: UDP, length 115
09:02:04.641696 IP ip-192-168-75-233.ap-northeast-1.compute.internal.46802 > ec2-13-231-171-17.ap-northeast-1.compute.amazonaws.com.openvpn: UDP, length 115
09:02:04.641745 IP ip-192-168-75-233.ap-northeast-1.compute.internal.46802 > ec2-13-231-171-17.ap-northeast-1.compute.amazonaws.com.openvpn: UDP, length 115
09:02:04.683399 IP ec2-13-231-171-17.ap-northeast-1.compute.amazonaws.com.openvpn > ip-192-168-75-233.ap-northeast-1.compute.internal.46802: UDP, length 76
09:02:04.683455 IP ec2-13-231-171-17.ap-northeast-1.compute.amazonaws.com.openvpn > ip-192-168-75-233.ap-northeast-1.compute.internal.46802: UDP, length 115
09:02:04.683575 IP ip-192-168-75-233.ap-northeast-1.compute.internal.46802 > ec2-13-231-171-17.ap-northeast-1.compute.amazonaws.com.openvpn: UDP, length 76
09:02:04.684577 IP ec2-13-231-171-17.ap-northeast-1.compute.amazonaws.com.openvpn > ip-192-168-75-233.ap-northeast-1.compute.internal.46802: UDP, length 76
09:02:04.684704 IP ec2-13-231-171-17.ap-northeast-1.compute.amazonaws.com.openvpn > ip-192-168-75-233.ap-northeast-1.compute.internal.46802: UDP, length 76
09:02:04.684751 IP ec2-13-231-171-17.ap-northeast-1.compute.amazonaws.com.openvpn > ip-192-168-75-233.ap-northeast-1.compute.internal.46802: UDP, length 115
09:02:04.684823 IP ip-192-168-75-233.ap-northeast-1.compute.internal.46802 > ec2-13-231-171-17.ap-northeast-1.compute.amazonaws.com.openvpn: UDP, length 76
09:02:04.685451 IP ec2-13-231-171-17.ap-northeast-1.compute.amazonaws.com.openvpn > ip-192-168-75-233.ap-northeast-1.compute.internal.46802: UDP, length 76
09:02:04.685489 IP ec2-13-231-171-17.ap-northeast-1.compute.amazonaws.com.openvpn > ip-192-168-75-233.ap-northeast-1.compute.internal.46802: UDP, length 115
09:02:04.685561 IP ec2-13-231-171-17.ap-northeast-1.compute.amazonaws.com.openvpn > ip-192-168-75-233.ap-northeast-1.compute.internal.46802: UDP, length 115
09:02:04.685602 IP ec2-13-231-171-17.ap-northeast-1.compute.amazonaws.com.openvpn > ip-192-168-75-233.ap-northeast-1.compute.internal.46802: UDP, length 76
09:02:04.685718 IP ec2-13-231-171-17.ap-northeast-1.compute.amazonaws.com.openvpn > ip-192-168-75-233.ap-northeast-1.compute.internal.46802: UDP, length 115
09:02:04.727304 IP ip-192-168-75-233.ap-northeast-1.compute.internal.46802 > ec2-13-231-171-17.ap-northeast-1.compute.amazonaws.com.openvpn: UDP, length 76
09:02:04.727323 IP ip-192-168-75-233.ap-northeast-1.compute.internal.46802 > ec2-13-231-171-17.ap-northeast-1.compute.amazonaws.com.openvpn: UDP, length 76
09:02:04.727336 IP ip-192-168-75-233.ap-northeast-1.compute.internal.46802 > ec2-13-231-171-17.ap-northeast-1.compute.amazonaws.com.openvpn: UDP, length 76
09:02:05.642306 IP ip-192-168-75-233.ap-northeast-1.compute.internal.46802 > ec2-13-231-171-17.ap-northeast-1.compute.amazonaws.com.openvpn: UDP, length 115
09:02:05.642338 IP ip-192-168-75-233.ap-northeast-1.compute.internal.46802 > ec2-13-231-171-17.ap-northeast-1.compute.amazonaws.com.openvpn: UDP, length 115
09:02:05.642351 IP ip-192-168-75-233.ap-northeast-1.compute.internal.46802 > ec2-13-231-171-17.ap-northeast-1.compute.amazonaws.com.openvpn: UDP, length 115
09:02:05.685357 IP ec2-13-231-171-17.ap-northeast-1.compute.amazonaws.com.openvpn > ip-192-168-75-233.ap-northeast-1.compute.internal.46802: UDP, length 76
09:02:05.685384 IP ec2-13-231-171-17.ap-northeast-1.compute.amazonaws.com.openvpn > ip-192-168-75-233.ap-northeast-1.compute.internal.46802: UDP, length 115
09:02:05.686472 IP ec2-13-231-171-17.ap-northeast-1.compute.amazonaws.com.openvpn > ip-192-168-75-233.ap-northeast-1.compute.internal.46802: UDP, length 76
09:02:05.686489 IP ec2-13-231-171-17.ap-northeast-1.compute.amazonaws.com.openvpn > ip-192-168-75-233.ap-northeast-1.compute.internal.46802: UDP, length 115
09:02:05.689483 IP ec2-13-231-171-17.ap-northeast-1.compute.amazonaws.com.openvpn > ip-192-168-75-233.ap-northeast-1.compute.internal.46802: UDP, length 76
09:02:05.689493 IP ec2-13-231-171-17.ap-northeast-1.compute.amazonaws.com.openvpn > ip-192-168-75-233.ap-northeast-1.compute.internal.46802: UDP, length 115
09:02:05.727304 IP ip-192-168-75-233.ap-northeast-1.compute.internal.46802 > ec2-13-231-171-17.ap-northeast-1.compute.amazonaws.com.openvpn: UDP, length 76
09:02:05.727324 IP ip-192-168-75-233.ap-northeast-1.compute.internal.46802 > ec2-13-231-171-17.ap-northeast-1.compute.amazonaws.com.openvpn: UDP, length 76
09:02:05.731292 IP ip-192-168-75-233.ap-northeast-1.compute.internal.46802 > ec2-13-231-171-17.ap-northeast-1.compute.amazonaws.com.openvpn: UDP, length 76
09:02:06.001616 IP ip-192-168-75-1.ap-northeast-1.compute.internal > all-systems.mcast.net: igmp query v2
09:02:06.183731 IP ip-192-168-75-233.ap-northeast-1.compute.internal.46802 > ec2-13-231-171-17.ap-northeast-1.compute.amazonaws.com.openvpn: UDP, length 92
09:02:06.224992 IP ec2-13-231-171-17.ap-northeast-1.compute.amazonaws.com.openvpn > ip-192-168-75-233.ap-northeast-1.compute.internal.46802: UDP, length 127
09:02:06.631443 IP ip-192-168-75-233.ap-northeast-1.compute.internal.46802 > ec2-13-231-171-17.ap-northeast-1.compute.amazonaws.com.openvpn: UDP, length 76
09:02:06.672633 IP ec2-13-231-171-17.ap-northeast-1.compute.amazonaws.com.openvpn > ip-192-168-75-233.ap-northeast-1.compute.internal.46802: UDP, length 76
09:02:07.911335 IP ip-192-168-75-233.ap-northeast-1.compute.internal.46802 > ec2-13-231-171-17.ap-northeast-1.compute.amazonaws.com.openvpn: UDP, length 76
09:02:07.911370 IP ip-192-168-75-233.ap-northeast-1.compute.internal.46802 > ec2-13-231-171-17.ap-northeast-1.compute.amazonaws.com.openvpn: UDP, length 76
09:02:07.953625 IP ec2-13-231-171-17.ap-northeast-1.compute.amazonaws.com.openvpn > ip-192-168-75-233.ap-northeast-1.compute.internal.46802: UDP, length 76
09:02:07.953653 IP ec2-13-231-171-17.ap-northeast-1.compute.amazonaws.com.openvpn > ip-192-168-75-233.ap-northeast-1.compute.internal.46802: UDP, length 76
09:02:08.167345 IP ip-192-168-75-233.ap-northeast-1.compute.internal.46802 > ec2-13-231-171-17.ap-northeast-1.compute.amazonaws.com.openvpn: UDP, length 76
09:02:08.206801 IP ec2-13-231-171-17.ap-northeast-1.compute.amazonaws.com.openvpn > ip-192-168-75-233.ap-northeast-1.compute.internal.46802: UDP, length 76
