09:16:34.579563 IP ip-192-168-75-233.ap-northeast-1.compute.internal.46802 > ec2-13-231-171-17.ap-northeast-1.compute.amazonaws.com.openvpn: UDP, length 115
09:16:34.622819 IP ec2-13-231-171-17.ap-northeast-1.compute.amazonaws.com.openvpn > ip-192-168-75-233.ap-northeast-1.compute.internal.46802: UDP, length 115
09:16:34.622962 IP ip-192-168-75-233.ap-northeast-1.compute.internal.46802 > ec2-13-231-171-17.ap-northeast-1.compute.amazonaws.com.openvpn: UDP, length 76
09:16:35.336252 IP ip-192-168-75-233.ap-northeast-1.compute.internal.46802 > ec2-13-231-171-17.ap-northeast-1.compute.amazonaws.com.openvpn: UDP, length 96
09:16:35.381641 IP ec2-13-231-171-17.ap-northeast-1.compute.amazonaws.com.openvpn > ip-192-168-75-233.ap-northeast-1.compute.internal.46802: UDP, length 164
09:16:35.381956 IP ip-192-168-75-233.ap-northeast-1.compute.internal.46802 > ec2-13-231-171-17.ap-northeast-1.compute.amazonaws.com.openvpn: UDP, length 97
09:16:35.420800 IP ec2-13-231-171-17.ap-northeast-1.compute.amazonaws.com.openvpn > ip-192-168-75-233.ap-northeast-1.compute.internal.46802: UDP, length 160
09:16:36.654821 IP ec2-13-231-171-17.ap-northeast-1.compute.amazonaws.com.openvpn > ip-192-168-75-233.ap-northeast-1.compute.internal.46802: UDP, length 149
09:16:36.655284 IP ip-192-168-75-233.ap-northeast-1.compute.internal.46802 > ec2-13-231-171-17.ap-northeast-1.compute.amazonaws.com.openvpn: UDP, length 76
09:16:36.695584 IP ec2-13-231-171-17.ap-northeast-1.compute.amazonaws.com.openvpn > ip-192-168-75-233.ap-northeast-1.compute.internal.46802: UDP, length 76
09:16:36.695708 IP ip-192-168-75-233.ap-northeast-1.compute.internal.46802 > ec2-13-231-171-17.ap-northeast-1.compute.amazonaws.com.openvpn: UDP, length 76
09:16:37.312812 IP ip-192-168-75-233.ap-northeast-1.compute.internal.46802 > ec2-13-231-171-17.ap-northeast-1.compute.amazonaws.com.openvpn: UDP, length 118
09:16:37.404249 IP ec2-13-231-171-17.ap-northeast-1.compute.amazonaws.com.openvpn > ip-192-168-75-233.ap-northeast-1.compute.internal.46802: UDP, length 64
09:16:41.025900 IP ip-192-168-75-1.ap-northeast-1.compute.internal > all-systems.mcast.net: igmp query v2
09:16:41.479430 IP ip-192-168-75-233.ap-northeast-1.compute.internal.46802 > ec2-13-231-171-17.ap-northeast-1.compute.amazonaws.com.openvpn: UDP, length 92
09:16:41.519184 IP ec2-13-231-171-17.ap-northeast-1.compute.amazonaws.com.openvpn > ip-192-168-75-233.ap-northeast-1.compute.internal.46802: UDP, length 127
09:16:41.519504 IP ip-192-168-75-233.ap-northeast-1.compute.internal.46802 > ec2-13-231-171-17.ap-northeast-1.compute.amazonaws.com.openvpn: UDP, length 95
09:16:41.558873 IP ec2-13-231-171-17.ap-northeast-1.compute.amazonaws.com.openvpn > ip-192-168-75-233.ap-northeast-1.compute.internal.46802: UDP, length 156
09:16:41.895328 IP ip-192-168-75-233.ap-northeast-1.compute.internal.46802 > ec2-13-231-171-17.ap-northeast-1.compute.amazonaws.com.openvpn: UDP, length 76
09:16:41.895360 IP ip-192-168-75-233.ap-northeast-1.compute.internal.46802 > ec2-13-231-171-17.ap-northeast-1.compute.amazonaws.com.openvpn: UDP, length 76
09:16:41.895372 IP ip-192-168-75-233.ap-northeast-1.compute.internal.46802 > ec2-13-231-171-17.ap-northeast-1.compute.amazonaws.com.openvpn: UDP, length 76
09:16:41.895384 IP ip-192-168-75-233.ap-northeast-1.compute.internal.46802 > ec2-13-231-171-17.ap-northeast-1.compute.amazonaws.com.openvpn: UDP, length 76
09:16:41.899253 IP ip-192-168-75-233.ap-northeast-1.compute.internal.46802 > ec2-13-231-171-17.ap-northeast-1.compute.amazonaws.com.openvpn: UDP, length 76
09:16:41.899273 IP ip-192-168-75-233.ap-northeast-1.compute.internal.46802 > ec2-13-231-171-17.ap-northeast-1.compute.amazonaws.com.openvpn: UDP, length 76
09:16:41.937179 IP ec2-13-231-171-17.ap-northeast-1.compute.amazonaws.com.openvpn > ip-192-168-75-233.ap-northeast-1.compute.internal.46802: UDP, length 76
09:16:41.938287 IP ec2-13-231-171-17.ap-northeast-1.compute.amazonaws.com.openvpn > ip-192-168-75-233.ap-northeast-1.compute.internal.46802: UDP, length 76
09:16:41.938318 IP ec2-13-231-171-17.ap-northeast-1.compute.amazonaws.com.openvpn > ip-192-168-75-233.ap-northeast-1.compute.internal.46802: UDP, length 76
09:16:41.939048 IP ec2-13-231-171-17.ap-northeast-1.compute.amazonaws.com.openvpn > ip-192-168-75-233.ap-northeast-1.compute.internal.46802: UDP, length 76
09:16:41.939223 IP ec2-13-231-171-17.ap-northeast-1.compute.amazonaws.com.openvpn > ip-192-168-75-233.ap-northeast-1.compute.internal.46802: UDP, length 76
09:16:41.939248 IP ec2-13-231-171-17.ap-northeast-1.compute.amazonaws.com.openvpn > ip-192-168-75-233.ap-northeast-1.compute.internal.46802: UDP, length 76
09:16:42.050847 Loopback, skipCount 0,  invalid (256)
09:16:43.943325 IP ip-192-168-75-233.ap-northeast-1.compute.internal.46802 > ec2-13-231-171-17.ap-northeast-1.compute.amazonaws.com.openvpn: UDP, length 76
09:16:43.943369 IP ip-192-168-75-233.ap-northeast-1.compute.internal.46802 > ec2-13-231-171-17.ap-northeast-1.compute.amazonaws.com.openvpn: UDP, length 76
09:16:43.943390 IP ip-192-168-75-233.ap-northeast-1.compute.internal.46802 > ec2-13-231-171-17.ap-northeast-1.compute.amazonaws.com.openvpn: UDP, length 76
09:16:43.943410 IP ip-192-168-75-233.ap-northeast-1.compute.internal.46802 > ec2-13-231-171-17.ap-northeast-1.compute.amazonaws.com.openvpn: UDP, length 76
09:16:43.943429 IP ip-192-168-75-233.ap-northeast-1.compute.internal.46802 > ec2-13-231-171-17.ap-northeast-1.compute.amazonaws.com.openvpn: UDP, length 76
09:16:43.943448 IP ip-192-168-75-233.ap-northeast-1.compute.internal.46802 > ec2-13-231-171-17.ap-northeast-1.compute.amazonaws.com.openvpn: UDP, length 76
09:16:43.943465 IP ip-192-168-75-233.ap-northeast-1.compute.internal.46802 > ec2-13-231-171-17.ap-northeast-1.compute.amazonaws.com.openvpn: UDP, length 76
09:16:43.943482 IP ip-192-168-75-233.ap-northeast-1.compute.internal.46802 > ec2-13-231-171-17.ap-northeast-1.compute.amazonaws.com.openvpn: UDP, length 76
09:16:43.943499 IP ip-192-168-75-233.ap-northeast-1.compute.internal.46802 > ec2-13-231-171-17.ap-northeast-1.compute.amazonaws.com.openvpn: UDP, length 76
09:16:43.943518 IP ip-192-168-75-233.ap-northeast-1.compute.internal.46802 > ec2-13-231-171-17.ap-northeast-1.compute.amazonaws.com.openvpn: UDP, length 76
09:16:43.943535 IP ip-192-168-75-233.ap-northeast-1.compute.internal.46802 > ec2-13-231-171-17.ap-northeast-1.compute.amazonaws.com.openvpn: UDP, length 76
09:16:43.943552 IP ip-192-168-75-233.ap-northeast-1.compute.internal.46802 > ec2-13-231-171-17.ap-northeast-1.compute.amazonaws.com.openvpn: UDP, length 76
09:16:43.986637 IP ec2-13-231-171-17.ap-northeast-1.compute.amazonaws.com.openvpn > ip-192-168-75-233.ap-northeast-1.compute.internal.46802: UDP, length 76
09:16:43.986671 IP ec2-13-231-171-17.ap-northeast-1.compute.amazonaws.com.openvpn > ip-192-168-75-233.ap-northeast-1.compute.internal.46802: UDP, length 76
09:16:43.986671 IP ec2-13-231-171-17.ap-northeast-1.compute.amazonaws.com.openvpn > ip-192-168-75-233.ap-northeast-1.compute.internal.46802: UDP, length 76
09:16:43.986699 IP ec2-13-231-171-17.ap-northeast-1.compute.amazonaws.com.openvpn > ip-192-168-75-233.ap-northeast-1.compute.internal.46802: UDP, length 76
09:16:43.986724 IP ec2-13-231-171-17.ap-northeast-1.compute.amazonaws.com.openvpn > ip-192-168-75-233.ap-northeast-1.compute.internal.46802: UDP, length 76
09:16:43.987464 IP ec2-13-231-171-17.ap-northeast-1.compute.amazonaws.com.openvpn > ip-192-168-75-233.ap-northeast-1.compute.internal.46802: UDP, length 76
09:16:43.987465 IP ec2-13-231-171-17.ap-northeast-1.compute.amazonaws.com.openvpn > ip-192-168-75-233.ap-northeast-1.compute.internal.46802: UDP, length 76
09:16:43.987484 IP ec2-13-231-171-17.ap-northeast-1.compute.amazonaws.com.openvpn > ip-192-168-75-233.ap-northeast-1.compute.internal.46802: UDP, length 76
09:16:43.987498 IP ec2-13-231-171-17.ap-northeast-1.compute.amazonaws.com.openvpn > ip-192-168-75-233.ap-northeast-1.compute.internal.46802: UDP, length 76
09:16:43.988215 IP ec2-13-231-171-17.ap-northeast-1.compute.amazonaws.com.openvpn > ip-192-168-75-233.ap-northeast-1.compute.internal.46802: UDP, length 76
09:16:43.989058 IP ec2-13-231-171-17.ap-northeast-1.compute.amazonaws.com.openvpn > ip-192-168-75-233.ap-northeast-1.compute.internal.46802: UDP, length 76
09:16:43.989074 IP ec2-13-231-171-17.ap-northeast-1.compute.amazonaws.com.openvpn > ip-192-168-75-233.ap-northeast-1.compute.internal.46802: UDP, length 76
09:16:44.199288 IP ip-192-168-75-233.ap-northeast-1.compute.internal.46802 > ec2-13-231-171-17.ap-northeast-1.compute.amazonaws.com.openvpn: UDP, length 76
09:16:44.238698 IP ec2-13-231-171-17.ap-northeast-1.compute.amazonaws.com.openvpn > ip-192-168-75-233.ap-northeast-1.compute.internal.46802: UDP, length 76
09:16:45.991303 IP ip-192-168-75-233.ap-northeast-1.compute.internal.46802 > ec2-13-231-171-17.ap-northeast-1.compute.amazonaws.com.openvpn: UDP, length 76
09:16:46.034672 IP ec2-13-231-171-17.ap-northeast-1.compute.amazonaws.com.openvpn > ip-192-168-75-233.ap-northeast-1.compute.internal.46802: UDP, length 76
09:16:49.580277 IP ip-192-168-75-233.ap-northeast-1.compute.internal.46802 > ec2-13-231-171-17.ap-northeast-1.compute.amazonaws.com.openvpn: UDP, length 115
09:16:49.627010 IP ec2-13-231-171-17.ap-northeast-1.compute.amazonaws.com.openvpn > ip-192-168-75-233.ap-northeast-1.compute.internal.46802: UDP, length 115
09:16:49.627180 IP ip-192-168-75-233.ap-northeast-1.compute.internal.46802 > ec2-13-231-171-17.ap-northeast-1.compute.amazonaws.com.openvpn: UDP, length 76
09:16:51.615249 IP ip-192-168-75-233.ap-northeast-1.compute.internal.46802 > ec2-13-231-171-17.ap-northeast-1.compute.amazonaws.com.openvpn: UDP, length 1409
09:16:51.615279 IP ip-192-168-75-233.ap-northeast-1.compute.internal.46802 > ec2-13-231-171-17.ap-northeast-1.compute.amazonaws.com.openvpn: UDP, length 1409
09:16:51.617526 IP ip-192-168-75-233.ap-northeast-1.compute.internal.46802 > ec2-13-231-171-17.ap-northeast-1.compute.amazonaws.com.openvpn: UDP, length 1015
09:16:51.687889 IP ec2-13-231-171-17.ap-northeast-1.compute.amazonaws.com.openvpn > ip-192-168-75-233.ap-northeast-1.compute.internal.46802: UDP, length 1409
09:16:51.698835 IP ec2-13-231-171-17.ap-northeast-1.compute.amazonaws.com.openvpn > ip-192-168-75-233.ap-northeast-1.compute.internal.46802: UDP, length 1409
09:16:51.699580 IP ec2-13-231-171-17.ap-northeast-1.compute.amazonaws.com.openvpn > ip-192-168-75-233.ap-northeast-1.compute.internal.46802: UDP, length 667
09:16:51.699597 IP ec2-13-231-171-17.ap-northeast-1.compute.amazonaws.com.openvpn > ip-192-168-75-233.ap-northeast-1.compute.internal.46802: UDP, length 79
09:16:51.701434 IP ip-192-168-75-233.ap-northeast-1.compute.internal.46802 > ec2-13-231-171-17.ap-northeast-1.compute.amazonaws.com.openvpn: UDP, length 165
09:16:51.741834 IP ec2-13-231-171-17.ap-northeast-1.compute.amazonaws.com.openvpn > ip-192-168-75-233.ap-northeast-1.compute.internal.46802: UDP, length 175
09:16:51.741861 IP ec2-13-231-171-17.ap-northeast-1.compute.amazonaws.com.openvpn > ip-192-168-75-233.ap-northeast-1.compute.internal.46802: UDP, length 77
09:16:51.742339 IP ip-192-168-75-233.ap-northeast-1.compute.internal.46802 > ec2-13-231-171-17.ap-northeast-1.compute.amazonaws.com.openvpn: UDP, length 83
09:16:51.743131 IP ec2-13-231-171-17.ap-northeast-1.compute.amazonaws.com.openvpn > ip-192-168-75-233.ap-northeast-1.compute.internal.46802: UDP, length 277
09:16:51.743710 IP ip-192-168-75-233.ap-northeast-1.compute.internal.46802 > ec2-13-231-171-17.ap-northeast-1.compute.amazonaws.com.openvpn: UDP, length 88
09:16:51.743979 IP ec2-13-231-171-17.ap-northeast-1.compute.amazonaws.com.openvpn > ip-192-168-75-233.ap-northeast-1.compute.internal.46802: UDP, length 76
09:16:51.744174 IP ip-192-168-75-233.ap-northeast-1.compute.internal.46802 > ec2-13-231-171-17.ap-northeast-1.compute.amazonaws.com.openvpn: UDP, length 83
09:16:51.810120 IP ec2-13-231-171-17.ap-northeast-1.compute.amazonaws.com.openvpn > ip-192-168-75-233.ap-northeast-1.compute.internal.46802: UDP, length 79
09:16:52.070770 Loopback, skipCount 0,  invalid (256)
09:16:54.439288 IP ip-192-168-75-233.ap-northeast-1.compute.internal.46802 > ec2-13-231-171-17.ap-northeast-1.compute.amazonaws.com.openvpn: UDP, length 76
09:16:54.482764 IP ec2-13-231-171-17.ap-northeast-1.compute.amazonaws.com.openvpn > ip-192-168-75-233.ap-northeast-1.compute.internal.46802: UDP, length 76
09:16:54.545661 IP ip-192-168-75-233.ap-northeast-1.compute.internal.46802 > ec2-13-231-171-17.ap-northeast-1.compute.amazonaws.com.openvpn: UDP, length 85
09:16:54.545688 IP ip-192-168-75-233.ap-northeast-1.compute.internal.46802 > ec2-13-231-171-17.ap-northeast-1.compute.amazonaws.com.openvpn: UDP, length 85
09:16:54.583885 IP ec2-13-231-171-17.ap-northeast-1.compute.amazonaws.com.openvpn > ip-192-168-75-233.ap-northeast-1.compute.internal.46802: UDP, length 375
09:16:54.583922 IP ec2-13-231-171-17.ap-northeast-1.compute.amazonaws.com.openvpn > ip-192-168-75-233.ap-northeast-1.compute.internal.46802: UDP, length 231
09:16:56.743224 ARP, Request who-has ip-192-168-75-1.ap-northeast-1.compute.internal tell ip-192-168-75-233.ap-northeast-1.compute.internal, length 28
09:16:56.743663 ARP, Reply ip-192-168-75-1.ap-northeast-1.compute.internal is-at d0:96:fb:e7:bb:a2 (oui Unknown), length 46
09:16:56.914207 IP ip-192-168-75-233.ap-northeast-1.compute.internal.46802 > ec2-13-231-171-17.ap-northeast-1.compute.amazonaws.com.openvpn: UDP, length 115
09:16:56.914512 IP ip-192-168-75-233.ap-northeast-1.compute.internal.46802 > ec2-13-231-171-17.ap-northeast-1.compute.amazonaws.com.openvpn: UDP, length 100
09:16:56.914533 IP ip-192-168-75-233.ap-northeast-1.compute.internal.46802 > ec2-13-231-171-17.ap-northeast-1.compute.amazonaws.com.openvpn: UDP, length 76
09:16:56.957067 IP ec2-13-231-171-17.ap-northeast-1.compute.amazonaws.com.openvpn > ip-192-168-75-233.ap-northeast-1.compute.internal.46802: UDP, length 76
09:16:56.958498 IP ec2-13-231-171-17.ap-northeast-1.compute.amazonaws.com.openvpn > ip-192-168-75-233.ap-northeast-1.compute.internal.46802: UDP, length 76
09:16:56.958554 IP ip-192-168-75-233.ap-northeast-1.compute.internal.46802 > ec2-13-231-171-17.ap-northeast-1.compute.amazonaws.com.openvpn: UDP, length 76
09:16:56.958711 IP ec2-13-231-171-17.ap-northeast-1.compute.amazonaws.com.openvpn > ip-192-168-75-233.ap-northeast-1.compute.internal.46802: UDP, length 76
09:16:57.886661 IP ip-192-168-75-233.ap-northeast-1.compute.internal.46802 > ec2-13-231-171-17.ap-northeast-1.compute.amazonaws.com.openvpn: UDP, length 104
09:16:57.914525 IP ip-192-168-75-233.ap-northeast-1.compute.internal.46802 > ec2-13-231-171-17.ap-northeast-1.compute.amazonaws.com.openvpn: UDP, length 100
09:16:57.914540 IP ip-192-168-75-233.ap-northeast-1.compute.internal.46802 > ec2-13-231-171-17.ap-northeast-1.compute.amazonaws.com.openvpn: UDP, length 76
09:16:57.929650 IP ec2-13-231-171-17.ap-northeast-1.compute.amazonaws.com.openvpn > ip-192-168-75-233.ap-northeast-1.compute.internal.46802: UDP, length 168
09:16:57.954868 IP ec2-13-231-171-17.ap-northeast-1.compute.amazonaws.com.openvpn > ip-192-168-75-233.ap-northeast-1.compute.internal.46802: UDP, length 76
09:16:57.954981 IP ip-192-168-75-233.ap-northeast-1.compute.internal.46802 > ec2-13-231-171-17.ap-northeast-1.compute.amazonaws.com.openvpn: UDP, length 76
09:17:00.914978 IP ip-192-168-75-233.ap-northeast-1.compute.internal.46802 > ec2-13-231-171-17.ap-northeast-1.compute.amazonaws.com.openvpn: UDP, length 115
09:17:00.915178 IP ip-192-168-75-233.ap-northeast-1.compute.internal.46802 > ec2-13-231-171-17.ap-northeast-1.compute.amazonaws.com.openvpn: UDP, length 100
09:17:00.915206 IP ip-192-168-75-233.ap-northeast-1.compute.internal.46802 > ec2-13-231-171-17.ap-northeast-1.compute.amazonaws.com.openvpn: UDP, length 76
09:17:00.960112 IP ec2-13-231-171-17.ap-northeast-1.compute.amazonaws.com.openvpn > ip-192-168-75-233.ap-northeast-1.compute.internal.46802: UDP, length 76
09:17:00.960150 IP ec2-13-231-171-17.ap-northeast-1.compute.amazonaws.com.openvpn > ip-192-168-75-233.ap-northeast-1.compute.internal.46802: UDP, length 76
09:17:00.960151 IP ec2-13-231-171-17.ap-northeast-1.compute.amazonaws.com.openvpn > ip-192-168-75-233.ap-northeast-1.compute.internal.46802: UDP, length 76
09:17:00.960349 IP ip-192-168-75-233.ap-northeast-1.compute.internal.46802 > ec2-13-231-171-17.ap-northeast-1.compute.amazonaws.com.openvpn: UDP, length 76
09:17:01.669831 IP ec2-13-231-171-17.ap-northeast-1.compute.amazonaws.com.openvpn > ip-192-168-75-233.ap-northeast-1.compute.internal.46802: UDP, length 158
09:17:01.669938 IP ip-192-168-75-233.ap-northeast-1.compute.internal.46802 > ec2-13-231-171-17.ap-northeast-1.compute.amazonaws.com.openvpn: UDP, length 64
09:17:02.091046 Loopback, skipCount 0,  invalid (256)
09:17:02.615482 IP ip-192-168-75-233.ap-northeast-1.compute.internal.46802 > ec2-13-231-171-17.ap-northeast-1.compute.amazonaws.com.openvpn: UDP, length 115
09:17:02.615503 IP ip-192-168-75-233.ap-northeast-1.compute.internal.46802 > ec2-13-231-171-17.ap-northeast-1.compute.amazonaws.com.openvpn: UDP, length 122
09:17:02.659874 IP ec2-13-231-171-17.ap-northeast-1.compute.amazonaws.com.openvpn > ip-192-168-75-233.ap-northeast-1.compute.internal.46802: UDP, length 76
09:17:02.659964 IP ec2-13-231-171-17.ap-northeast-1.compute.amazonaws.com.openvpn > ip-192-168-75-233.ap-northeast-1.compute.internal.46802: UDP, length 115
09:17:02.703297 IP ip-192-168-75-233.ap-northeast-1.compute.internal.46802 > ec2-13-231-171-17.ap-northeast-1.compute.amazonaws.com.openvpn: UDP, length 76
09:17:02.824095 IP ec2-13-231-171-17.ap-northeast-1.compute.amazonaws.com.openvpn > ip-192-168-75-233.ap-northeast-1.compute.internal.46802: UDP, length 122
09:17:02.824203 IP ip-192-168-75-233.ap-northeast-1.compute.internal.46802 > ec2-13-231-171-17.ap-northeast-1.compute.amazonaws.com.openvpn: UDP, length 76
09:17:03.615803 IP ip-192-168-75-233.ap-northeast-1.compute.internal.46802 > ec2-13-231-171-17.ap-northeast-1.compute.amazonaws.com.openvpn: UDP, length 115
09:17:03.659592 IP ec2-13-231-171-17.ap-northeast-1.compute.amazonaws.com.openvpn > ip-192-168-75-233.ap-northeast-1.compute.internal.46802: UDP, length 76
09:17:03.659625 IP ec2-13-231-171-17.ap-northeast-1.compute.amazonaws.com.openvpn > ip-192-168-75-233.ap-northeast-1.compute.internal.46802: UDP, length 115
09:17:03.659801 IP ip-192-168-75-233.ap-northeast-1.compute.internal.46802 > ec2-13-231-171-17.ap-northeast-1.compute.amazonaws.com.openvpn: UDP, length 76
09:17:04.400232 IP ip-192-168-75-233.ap-northeast-1.compute.internal.46802 > ec2-13-231-171-17.ap-northeast-1.compute.amazonaws.com.openvpn: UDP, length 118
09:17:04.494227 IP ec2-13-231-171-17.ap-northeast-1.compute.amazonaws.com.openvpn > ip-192-168-75-233.ap-northeast-1.compute.internal.46802: UDP, length 64
09:17:04.915408 IP ip-192-168-75-233.ap-northeast-1.compute.internal.46802 > ec2-13-231-171-17.ap-northeast-1.compute.amazonaws.com.openvpn: UDP, length 115
09:17:04.915429 IP ip-192-168-75-233.ap-northeast-1.compute.internal.46802 > ec2-13-231-171-17.ap-northeast-1.compute.amazonaws.com.openvpn: UDP, length 115
09:17:04.915696 IP ip-192-168-75-233.ap-northeast-1.compute.internal.46802 > ec2-13-231-171-17.ap-northeast-1.compute.amazonaws.com.openvpn: UDP, length 100
09:17:04.915717 IP ip-192-168-75-233.ap-northeast-1.compute.internal.46802 > ec2-13-231-171-17.ap-northeast-1.compute.amazonaws.com.openvpn: UDP, length 76
09:17:04.916229 IP ip-192-168-75-233.ap-northeast-1.compute.internal.46802 > ec2-13-231-171-17.ap-northeast-1.compute.amazonaws.com.openvpn: UDP, length 100
09:17:04.916247 IP ip-192-168-75-233.ap-northeast-1.compute.internal.46802 > ec2-13-231-171-17.ap-northeast-1.compute.amazonaws.com.openvpn: UDP, length 76
09:17:04.959194 IP ec2-13-231-171-17.ap-northeast-1.compute.amazonaws.com.openvpn > ip-192-168-75-233.ap-northeast-1.compute.internal.46802: UDP, length 76
09:17:04.959249 IP ec2-13-231-171-17.ap-northeast-1.compute.amazonaws.com.openvpn > ip-192-168-75-233.ap-northeast-1.compute.internal.46802: UDP, length 76
09:17:04.959749 IP ec2-13-231-171-17.ap-northeast-1.compute.amazonaws.com.openvpn > ip-192-168-75-233.ap-northeast-1.compute.internal.46802: UDP, length 76
09:17:04.959875 IP ec2-13-231-171-17.ap-northeast-1.compute.amazonaws.com.openvpn > ip-192-168-75-233.ap-northeast-1.compute.internal.46802: UDP, length 76
09:17:04.959948 IP ip-192-168-75-233.ap-northeast-1.compute.internal.46802 > ec2-13-231-171-17.ap-northeast-1.compute.amazonaws.com.openvpn: UDP, length 76
09:17:04.960027 IP ip-192-168-75-233.ap-northeast-1.compute.internal.46802 > ec2-13-231-171-17.ap-northeast-1.compute.amazonaws.com.openvpn: UDP, length 76
09:17:06.471279 IP ip-192-168-75-233.ap-northeast-1.compute.internal.46802 > ec2-13-231-171-17.ap-northeast-1.compute.amazonaws.com.openvpn: UDP, length 76
09:17:06.471297 IP ip-192-168-75-233.ap-northeast-1.compute.internal.46802 > ec2-13-231-171-17.ap-northeast-1.compute.amazonaws.com.openvpn: UDP, length 76
09:17:06.512738 IP ec2-13-231-171-17.ap-northeast-1.compute.amazonaws.com.openvpn > ip-192-168-75-233.ap-northeast-1.compute.internal.46802: UDP, length 76
09:17:06.515438 IP ec2-13-231-171-17.ap-northeast-1.compute.amazonaws.com.openvpn > ip-192-168-75-233.ap-northeast-1.compute.internal.46802: UDP, length 76
09:17:08.519324 IP ip-192-168-75-233.ap-northeast-1.compute.internal.46802 > ec2-13-231-171-17.ap-northeast-1.compute.amazonaws.com.openvpn: UDP, length 76
09:17:08.519362 IP ip-192-168-75-233.ap-northeast-1.compute.internal.46802 > ec2-13-231-171-17.ap-northeast-1.compute.amazonaws.com.openvpn: UDP, length 76
09:17:08.519379 IP ip-192-168-75-233.ap-northeast-1.compute.internal.46802 > ec2-13-231-171-17.ap-northeast-1.compute.amazonaws.com.openvpn: UDP, length 76
09:17:08.519393 IP ip-192-168-75-233.ap-northeast-1.compute.internal.46802 > ec2-13-231-171-17.ap-northeast-1.compute.amazonaws.com.openvpn: UDP, length 76
09:17:08.519407 IP ip-192-168-75-233.ap-northeast-1.compute.internal.46802 > ec2-13-231-171-17.ap-northeast-1.compute.amazonaws.com.openvpn: UDP, length 76
09:17:08.519421 IP ip-192-168-75-233.ap-northeast-1.compute.internal.46802 > ec2-13-231-171-17.ap-northeast-1.compute.amazonaws.com.openvpn: UDP, length 76
09:17:08.519435 IP ip-192-168-75-233.ap-northeast-1.compute.internal.46802 > ec2-13-231-171-17.ap-northeast-1.compute.amazonaws.com.openvpn: UDP, length 76
09:17:08.519449 IP ip-192-168-75-233.ap-northeast-1.compute.internal.46802 > ec2-13-231-171-17.ap-northeast-1.compute.amazonaws.com.openvpn: UDP, length 76
09:17:08.519463 IP ip-192-168-75-233.ap-northeast-1.compute.internal.46802 > ec2-13-231-171-17.ap-northeast-1.compute.amazonaws.com.openvpn: UDP, length 76
09:17:08.563369 IP ec2-13-231-171-17.ap-northeast-1.compute.amazonaws.com.openvpn > ip-192-168-75-233.ap-northeast-1.compute.internal.46802: UDP, length 76
09:17:08.563370 IP ec2-13-231-171-17.ap-northeast-1.compute.amazonaws.com.openvpn > ip-192-168-75-233.ap-northeast-1.compute.internal.46802: UDP, length 76
09:17:08.563413 IP ec2-13-231-171-17.ap-northeast-1.compute.amazonaws.com.openvpn > ip-192-168-75-233.ap-northeast-1.compute.internal.46802: UDP, length 76
09:17:08.563480 IP ec2-13-231-171-17.ap-northeast-1.compute.amazonaws.com.openvpn > ip-192-168-75-233.ap-northeast-1.compute.internal.46802: UDP, length 76
09:17:08.563481 IP ec2-13-231-171-17.ap-northeast-1.compute.amazonaws.com.openvpn > ip-192-168-75-233.ap-northeast-1.compute.internal.46802: UDP, length 76
09:17:08.564167 IP ec2-13-231-171-17.ap-northeast-1.compute.amazonaws.com.openvpn > ip-192-168-75-233.ap-northeast-1.compute.internal.46802: UDP, length 76
09:17:08.564196 IP ec2-13-231-171-17.ap-northeast-1.compute.amazonaws.com.openvpn > ip-192-168-75-233.ap-northeast-1.compute.internal.46802: UDP, length 76
09:17:08.564218 IP ec2-13-231-171-17.ap-northeast-1.compute.amazonaws.com.openvpn > ip-192-168-75-233.ap-northeast-1.compute.internal.46802: UDP, length 76
09:17:08.564243 IP ec2-13-231-171-17.ap-northeast-1.compute.amazonaws.com.openvpn > ip-192-168-75-233.ap-northeast-1.compute.internal.46802: UDP, length 76
09:17:09.473976 IP ec2-13-231-171-17.ap-northeast-1.compute.amazonaws.com.openvpn > ip-192-168-75-233.ap-northeast-1.compute.internal.46802: UDP, length 154
09:17:09.474076 IP ip-192-168-75-233.ap-northeast-1.compute.internal.46802 > ec2-13-231-171-17.ap-northeast-1.compute.amazonaws.com.openvpn: UDP, length 64
09:17:10.567282 IP ip-192-168-75-233.ap-northeast-1.compute.internal.46802 > ec2-13-231-171-17.ap-northeast-1.compute.amazonaws.com.openvpn: UDP, length 76
09:17:10.567299 IP ip-192-168-75-233.ap-northeast-1.compute.internal.46802 > ec2-13-231-171-17.ap-northeast-1.compute.amazonaws.com.openvpn: UDP, length 76
09:17:10.567305 IP ip-192-168-75-233.ap-northeast-1.compute.internal.46802 > ec2-13-231-171-17.ap-northeast-1.compute.amazonaws.com.openvpn: UDP, length 76
09:17:10.609820 IP ec2-13-231-171-17.ap-northeast-1.compute.amazonaws.com.openvpn > ip-192-168-75-233.ap-northeast-1.compute.internal.46802: UDP, length 76
09:17:10.611662 IP ec2-13-231-171-17.ap-northeast-1.compute.amazonaws.com.openvpn > ip-192-168-75-233.ap-northeast-1.compute.internal.46802: UDP, length 76
09:17:10.611738 IP ec2-13-231-171-17.ap-northeast-1.compute.amazonaws.com.openvpn > ip-192-168-75-233.ap-northeast-1.compute.internal.46802: UDP, length 76
09:17:12.111197 Loopback, skipCount 0,  invalid (256)
09:17:22.131372 Loopback, skipCount 0,  invalid (256)
09:17:22.567352 IP ip-192-168-75-233.ap-northeast-1.compute.internal.46802 > ec2-13-231-171-17.ap-northeast-1.compute.amazonaws.com.openvpn: UDP, length 40
09:17:22.605980 IP ec2-13-231-171-17.ap-northeast-1.compute.amazonaws.com.openvpn > ip-192-168-75-233.ap-northeast-1.compute.internal.46802: UDP, length 40
09:17:22.616563 IP ip-192-168-75-233.ap-northeast-1.compute.internal.46802 > ec2-13-231-171-17.ap-northeast-1.compute.amazonaws.com.openvpn: UDP, length 115
09:17:22.656764 IP ec2-13-231-171-17.ap-northeast-1.compute.amazonaws.com.openvpn > ip-192-168-75-233.ap-northeast-1.compute.internal.46802: UDP, length 115
09:17:22.656873 IP ip-192-168-75-233.ap-northeast-1.compute.internal.46802 > ec2-13-231-171-17.ap-northeast-1.compute.amazonaws.com.openvpn: UDP, length 76
09:17:24.556779 IP ip-192-168-75-233.ap-northeast-1.compute.internal.46802 > ec2-13-231-171-17.ap-northeast-1.compute.amazonaws.com.openvpn: UDP, length 85
09:17:24.556813 IP ip-192-168-75-233.ap-northeast-1.compute.internal.46802 > ec2-13-231-171-17.ap-northeast-1.compute.amazonaws.com.openvpn: UDP, length 85
09:17:24.596433 IP ec2-13-231-171-17.ap-northeast-1.compute.amazonaws.com.openvpn > ip-192-168-75-233.ap-northeast-1.compute.internal.46802: UDP, length 375
09:17:24.598132 IP ec2-13-231-171-17.ap-northeast-1.compute.amazonaws.com.openvpn > ip-192-168-75-233.ap-northeast-1.compute.internal.46802: UDP, length 231
09:17:26.334292 IP ip-192-168-75-233.ap-northeast-1.compute.internal.46802 > ec2-13-231-171-17.ap-northeast-1.compute.amazonaws.com.openvpn: UDP, length 94
09:17:26.377738 IP ec2-13-231-171-17.ap-northeast-1.compute.amazonaws.com.openvpn > ip-192-168-75-233.ap-northeast-1.compute.internal.46802: UDP, length 110
09:17:26.377900 IP ip-192-168-75-233.ap-northeast-1.compute.internal.46802 > ec2-13-231-171-17.ap-northeast-1.compute.amazonaws.com.openvpn: UDP, length 94
09:17:26.417317 IP ec2-13-231-171-17.ap-northeast-1.compute.amazonaws.com.openvpn > ip-192-168-75-233.ap-northeast-1.compute.internal.46802: UDP, length 174
09:17:26.417838 IP ip-192-168-75-233.ap-northeast-1.compute.internal.46802 > ec2-13-231-171-17.ap-northeast-1.compute.amazonaws.com.openvpn: UDP, length 84
09:17:26.668106 IP ip-192-168-75-233.ap-northeast-1.compute.internal.46802 > ec2-13-231-171-17.ap-northeast-1.compute.amazonaws.com.openvpn: UDP, length 94
09:17:26.710463 IP ec2-13-231-171-17.ap-northeast-1.compute.amazonaws.com.openvpn > ip-192-168-75-233.ap-northeast-1.compute.internal.46802: UDP, length 110
09:17:26.711026 IP ip-192-168-75-233.ap-northeast-1.compute.internal.46802 > ec2-13-231-171-17.ap-northeast-1.compute.amazonaws.com.openvpn: UDP, length 84
09:17:26.951288 IP ip-192-168-75-233.ap-northeast-1.compute.internal.46802 > ec2-13-231-171-17.ap-northeast-1.compute.amazonaws.com.openvpn: UDP, length 76
09:17:26.951313 IP ip-192-168-75-233.ap-northeast-1.compute.internal.46802 > ec2-13-231-171-17.ap-northeast-1.compute.amazonaws.com.openvpn: UDP, length 76
09:17:26.951321 IP ip-192-168-75-233.ap-northeast-1.compute.internal.46802 > ec2-13-231-171-17.ap-northeast-1.compute.amazonaws.com.openvpn: UDP, length 76
09:17:26.951336 IP ip-192-168-75-233.ap-northeast-1.compute.internal.46802 > ec2-13-231-171-17.ap-northeast-1.compute.amazonaws.com.openvpn: UDP, length 76
09:17:26.951344 IP ip-192-168-75-233.ap-northeast-1.compute.internal.46802 > ec2-13-231-171-17.ap-northeast-1.compute.amazonaws.com.openvpn: UDP, length 76
09:17:26.951355 IP ip-192-168-75-233.ap-northeast-1.compute.internal.46802 > ec2-13-231-171-17.ap-northeast-1.compute.amazonaws.com.openvpn: UDP, length 76
09:17:26.994004 IP ec2-13-231-171-17.ap-northeast-1.compute.amazonaws.com.openvpn > ip-192-168-75-233.ap-northeast-1.compute.internal.46802: UDP, length 76
09:17:26.995131 IP ec2-13-231-171-17.ap-northeast-1.compute.amazonaws.com.openvpn > ip-192-168-75-233.ap-northeast-1.compute.internal.46802: UDP, length 76
09:17:26.995151 IP ec2-13-231-171-17.ap-northeast-1.compute.amazonaws.com.openvpn > ip-192-168-75-233.ap-northeast-1.compute.internal.46802: UDP, length 76
09:17:26.995997 IP ec2-13-231-171-17.ap-northeast-1.compute.amazonaws.com.openvpn > ip-192-168-75-233.ap-northeast-1.compute.internal.46802: UDP, length 76
09:17:26.995998 IP ec2-13-231-171-17.ap-northeast-1.compute.amazonaws.com.openvpn > ip-192-168-75-233.ap-northeast-1.compute.internal.46802: UDP, length 76
09:17:26.996029 IP ec2-13-231-171-17.ap-northeast-1.compute.amazonaws.com.openvpn > ip-192-168-75-233.ap-northeast-1.compute.internal.46802: UDP, length 76
09:17:27.122583 IP ec2-13-231-171-17.ap-northeast-1.compute.amazonaws.com.openvpn > ip-192-168-75-233.ap-northeast-1.compute.internal.46802: UDP, length 157
09:17:27.122685 IP ip-192-168-75-233.ap-northeast-1.compute.internal.46802 > ec2-13-231-171-17.ap-northeast-1.compute.amazonaws.com.openvpn: UDP, length 64
09:17:27.431287 IP ip-192-168-75-233.ap-northeast-1.compute.internal.46802 > ec2-13-231-171-17.ap-northeast-1.compute.amazonaws.com.openvpn: UDP, length 84
09:17:27.719337 IP ip-192-168-75-233.ap-northeast-1.compute.internal.46802 > ec2-13-231-171-17.ap-northeast-1.compute.amazonaws.com.openvpn: UDP, length 84
09:17:27.915723 IP ip-192-168-75-233.ap-northeast-1.compute.internal.46802 > ec2-13-231-171-17.ap-northeast-1.compute.amazonaws.com.openvpn: UDP, length 115
09:17:27.915893 IP ip-192-168-75-233.ap-northeast-1.compute.internal.46802 > ec2-13-231-171-17.ap-northeast-1.compute.amazonaws.com.openvpn: UDP, length 100
09:17:27.915901 IP ip-192-168-75-233.ap-northeast-1.compute.internal.46802 > ec2-13-231-171-17.ap-northeast-1.compute.amazonaws.com.openvpn: UDP, length 76
09:17:27.955684 IP ec2-13-231-171-17.ap-northeast-1.compute.amazonaws.com.openvpn > ip-192-168-75-233.ap-northeast-1.compute.internal.46802: UDP, length 76
09:17:27.956766 IP ec2-13-231-171-17.ap-northeast-1.compute.amazonaws.com.openvpn > ip-192-168-75-233.ap-northeast-1.compute.internal.46802: UDP, length 76
09:17:27.956813 IP ip-192-168-75-233.ap-northeast-1.compute.internal.46802 > ec2-13-231-171-17.ap-northeast-1.compute.amazonaws.com.openvpn: UDP, length 76
09:17:28.999275 IP ip-192-168-75-233.ap-northeast-1.compute.internal.46802 > ec2-13-231-171-17.ap-northeast-1.compute.amazonaws.com.openvpn: UDP, length 76
09:17:28.999293 IP ip-192-168-75-233.ap-northeast-1.compute.internal.46802 > ec2-13-231-171-17.ap-northeast-1.compute.amazonaws.com.openvpn: UDP, length 76
09:17:28.999300 IP ip-192-168-75-233.ap-northeast-1.compute.internal.46802 > ec2-13-231-171-17.ap-northeast-1.compute.amazonaws.com.openvpn: UDP, length 76
09:17:28.999306 IP ip-192-168-75-233.ap-northeast-1.compute.internal.46802 > ec2-13-231-171-17.ap-northeast-1.compute.amazonaws.com.openvpn: UDP, length 76
09:17:28.999312 IP ip-192-168-75-233.ap-northeast-1.compute.internal.46802 > ec2-13-231-171-17.ap-northeast-1.compute.amazonaws.com.openvpn: UDP, length 76
09:17:28.999318 IP ip-192-168-75-233.ap-northeast-1.compute.internal.46802 > ec2-13-231-171-17.ap-northeast-1.compute.amazonaws.com.openvpn: UDP, length 76
09:17:28.999323 IP ip-192-168-75-233.ap-northeast-1.compute.internal.46802 > ec2-13-231-171-17.ap-northeast-1.compute.amazonaws.com.openvpn: UDP, length 76
09:17:28.999328 IP ip-192-168-75-233.ap-northeast-1.compute.internal.46802 > ec2-13-231-171-17.ap-northeast-1.compute.amazonaws.com.openvpn: UDP, length 76
09:17:28.999333 IP ip-192-168-75-233.ap-northeast-1.compute.internal.46802 > ec2-13-231-171-17.ap-northeast-1.compute.amazonaws.com.openvpn: UDP, length 76
09:17:28.999339 IP ip-192-168-75-233.ap-northeast-1.compute.internal.46802 > ec2-13-231-171-17.ap-northeast-1.compute.amazonaws.com.openvpn: UDP, length 76
09:17:28.999344 IP ip-192-168-75-233.ap-northeast-1.compute.internal.46802 > ec2-13-231-171-17.ap-northeast-1.compute.amazonaws.com.openvpn: UDP, length 76
09:17:28.999349 IP ip-192-168-75-233.ap-northeast-1.compute.internal.46802 > ec2-13-231-171-17.ap-northeast-1.compute.amazonaws.com.openvpn: UDP, length 76
09:17:29.041987 IP ec2-13-231-171-17.ap-northeast-1.compute.amazonaws.com.openvpn > ip-192-168-75-233.ap-northeast-1.compute.internal.46802: UDP, length 76
09:17:29.042948 IP ec2-13-231-171-17.ap-northeast-1.compute.amazonaws.com.openvpn > ip-192-168-75-233.ap-northeast-1.compute.internal.46802: UDP, length 76
09:17:29.042978 IP ec2-13-231-171-17.ap-northeast-1.compute.amazonaws.com.openvpn > ip-192-168-75-233.ap-northeast-1.compute.internal.46802: UDP, length 76
09:17:29.043151 IP ec2-13-231-171-17.ap-northeast-1.compute.amazonaws.com.openvpn > ip-192-168-75-233.ap-northeast-1.compute.internal.46802: UDP, length 76
09:17:29.043830 IP ec2-13-231-171-17.ap-northeast-1.compute.amazonaws.com.openvpn > ip-192-168-75-233.ap-northeast-1.compute.internal.46802: UDP, length 76
09:17:29.043910 IP ec2-13-231-171-17.ap-northeast-1.compute.amazonaws.com.openvpn > ip-192-168-75-233.ap-northeast-1.compute.internal.46802: UDP, length 76
09:17:29.043935 IP ec2-13-231-171-17.ap-northeast-1.compute.amazonaws.com.openvpn > ip-192-168-75-233.ap-northeast-1.compute.internal.46802: UDP, length 76
09:17:29.043956 IP ec2-13-231-171-17.ap-northeast-1.compute.amazonaws.com.openvpn > ip-192-168-75-233.ap-northeast-1.compute.internal.46802: UDP, length 76
09:17:29.043972 IP ec2-13-231-171-17.ap-northeast-1.compute.amazonaws.com.openvpn > ip-192-168-75-233.ap-northeast-1.compute.internal.46802: UDP, length 76
09:17:29.045011 IP ec2-13-231-171-17.ap-northeast-1.compute.amazonaws.com.openvpn > ip-192-168-75-233.ap-northeast-1.compute.internal.46802: UDP, length 76
09:17:29.045025 IP ec2-13-231-171-17.ap-northeast-1.compute.amazonaws.com.openvpn > ip-192-168-75-233.ap-northeast-1.compute.internal.46802: UDP, length 76
09:17:29.045042 IP ec2-13-231-171-17.ap-northeast-1.compute.amazonaws.com.openvpn > ip-192-168-75-233.ap-northeast-1.compute.internal.46802: UDP, length 76
09:17:29.447287 IP ip-192-168-75-233.ap-northeast-1.compute.internal.46802 > ec2-13-231-171-17.ap-northeast-1.compute.amazonaws.com.openvpn: UDP, length 84
09:17:29.735286 IP ip-192-168-75-233.ap-northeast-1.compute.internal.46802 > ec2-13-231-171-17.ap-northeast-1.compute.amazonaws.com.openvpn: UDP, length 84
09:17:31.047275 IP ip-192-168-75-233.ap-northeast-1.compute.internal.46802 > ec2-13-231-171-17.ap-northeast-1.compute.amazonaws.com.openvpn: UDP, length 76
09:17:31.091158 IP ec2-13-231-171-17.ap-northeast-1.compute.amazonaws.com.openvpn > ip-192-168-75-233.ap-northeast-1.compute.internal.46802: UDP, length 76
09:17:31.480859 IP ip-192-168-75-233.ap-northeast-1.compute.internal.46802 > ec2-13-231-171-17.ap-northeast-1.compute.amazonaws.com.openvpn: UDP, length 118
09:17:31.574370 IP ec2-13-231-171-17.ap-northeast-1.compute.amazonaws.com.openvpn > ip-192-168-75-233.ap-northeast-1.compute.internal.46802: UDP, length 64
09:17:31.597416 IP ip-192-168-75-233.ap-northeast-1.compute.internal.46802 > ec2-13-231-171-17.ap-northeast-1.compute.amazonaws.com.openvpn: UDP, length 1409
09:17:31.597434 IP ip-192-168-75-233.ap-northeast-1.compute.internal.46802 > ec2-13-231-171-17.ap-northeast-1.compute.amazonaws.com.openvpn: UDP, length 1409
09:17:31.600309 IP ip-192-168-75-233.ap-northeast-1.compute.internal.46802 > ec2-13-231-171-17.ap-northeast-1.compute.amazonaws.com.openvpn: UDP, length 1024
09:17:31.665634 IP ec2-13-231-171-17.ap-northeast-1.compute.amazonaws.com.openvpn > ip-192-168-75-233.ap-northeast-1.compute.internal.46802: UDP, length 1409
09:17:31.678339 IP ec2-13-231-171-17.ap-northeast-1.compute.amazonaws.com.openvpn > ip-192-168-75-233.ap-northeast-1.compute.internal.46802: UDP, length 1409
09:17:31.679133 IP ec2-13-231-171-17.ap-northeast-1.compute.amazonaws.com.openvpn > ip-192-168-75-233.ap-northeast-1.compute.internal.46802: UDP, length 667
09:17:31.679148 IP ec2-13-231-171-17.ap-northeast-1.compute.amazonaws.com.openvpn > ip-192-168-75-233.ap-northeast-1.compute.internal.46802: UDP, length 79
09:17:31.679299 IP ip-192-168-75-233.ap-northeast-1.compute.internal.46802 > ec2-13-231-171-17.ap-northeast-1.compute.amazonaws.com.openvpn: UDP, length 166
09:17:31.700192 IP ip-192-168-75-233.ap-northeast-1.compute.internal.46802 > ec2-13-231-171-17.ap-northeast-1.compute.amazonaws.com.openvpn: UDP, length 84
09:17:31.721082 IP ec2-13-231-171-17.ap-northeast-1.compute.amazonaws.com.openvpn > ip-192-168-75-233.ap-northeast-1.compute.internal.46802: UDP, length 175
09:17:31.721765 IP ec2-13-231-171-17.ap-northeast-1.compute.amazonaws.com.openvpn > ip-192-168-75-233.ap-northeast-1.compute.internal.46802: UDP, length 77
09:17:31.722039 IP ip-192-168-75-233.ap-northeast-1.compute.internal.46802 > ec2-13-231-171-17.ap-northeast-1.compute.amazonaws.com.openvpn: UDP, length 83
09:17:31.722679 IP ec2-13-231-171-17.ap-northeast-1.compute.amazonaws.com.openvpn > ip-192-168-75-233.ap-northeast-1.compute.internal.46802: UDP, length 277
09:17:31.723173 IP ip-192-168-75-233.ap-northeast-1.compute.internal.46802 > ec2-13-231-171-17.ap-northeast-1.compute.amazonaws.com.openvpn: UDP, length 88
09:17:31.723248 IP ec2-13-231-171-17.ap-northeast-1.compute.amazonaws.com.openvpn > ip-192-168-75-233.ap-northeast-1.compute.internal.46802: UDP, length 76
09:17:31.723389 IP ip-192-168-75-233.ap-northeast-1.compute.internal.46802 > ec2-13-231-171-17.ap-northeast-1.compute.amazonaws.com.openvpn: UDP, length 83
09:17:31.790369 IP ec2-13-231-171-17.ap-northeast-1.compute.amazonaws.com.openvpn > ip-192-168-75-233.ap-northeast-1.compute.internal.46802: UDP, length 79
09:17:32.151866 Loopback, skipCount 0,  invalid (256)
09:17:33.607330 IP ip-192-168-75-233.ap-northeast-1.compute.internal.46802 > ec2-13-231-171-17.ap-northeast-1.compute.amazonaws.com.openvpn: UDP, length 84
09:17:33.863289 IP ip-192-168-75-233.ap-northeast-1.compute.internal.46802 > ec2-13-231-171-17.ap-northeast-1.compute.amazonaws.com.openvpn: UDP, length 84
09:17:40.052470 IP ip-192-168-75-233.ap-northeast-1.compute.internal.46802 > ec2-13-231-171-17.ap-northeast-1.compute.amazonaws.com.openvpn: UDP, length 80
09:17:40.052486 IP ip-192-168-75-233.ap-northeast-1.compute.internal.46802 > ec2-13-231-171-17.ap-northeast-1.compute.amazonaws.com.openvpn: UDP, length 80
09:17:40.095657 IP ec2-13-231-171-17.ap-northeast-1.compute.amazonaws.com.openvpn > ip-192-168-75-233.ap-northeast-1.compute.internal.46802: UDP, length 96
09:17:40.095745 IP ec2-13-231-171-17.ap-northeast-1.compute.amazonaws.com.openvpn > ip-192-168-75-233.ap-northeast-1.compute.internal.46802: UDP, length 164
