08:21:27.036004 IP ec2-13-231-171-17.ap-northeast-1.compute.amazonaws.com.openvpn > ip-192-168-75-233.ap-northeast-1.compute.internal.46802: UDP, length 612
08:21:27.036353 IP ip-192-168-75-233.ap-northeast-1.compute.internal.46802 > ec2-13-231-171-17.ap-northeast-1.compute.amazonaws.com.openvpn: UDP, length 76
08:21:27.719729 IP ip-192-168-75-233.ap-northeast-1.compute.internal.46802 > ec2-13-231-171-17.ap-northeast-1.compute.amazonaws.com.openvpn: UDP, length 115
08:21:27.719757 IP ip-192-168-75-233.ap-northeast-1.compute.internal.46802 > ec2-13-231-171-17.ap-northeast-1.compute.amazonaws.com.openvpn: UDP, length 122
08:21:27.719776 IP ip-192-168-75-233.ap-northeast-1.compute.internal.46802 > ec2-13-231-171-17.ap-northeast-1.compute.amazonaws.com.openvpn: UDP, length 115
08:21:27.764273 IP ec2-13-231-171-17.ap-northeast-1.compute.amazonaws.com.openvpn > ip-192-168-75-233.ap-northeast-1.compute.internal.46802: UDP, length 115
08:21:27.764504 IP ip-192-168-75-233.ap-northeast-1.compute.internal.46802 > ec2-13-231-171-17.ap-northeast-1.compute.amazonaws.com.openvpn: UDP, length 76
08:21:27.765080 IP ec2-13-231-171-17.ap-northeast-1.compute.amazonaws.com.openvpn > ip-192-168-75-233.ap-northeast-1.compute.internal.46802: UDP, length 115
08:21:27.765154 IP ip-192-168-75-233.ap-northeast-1.compute.internal.46802 > ec2-13-231-171-17.ap-northeast-1.compute.amazonaws.com.openvpn: UDP, length 76
08:21:27.816109 IP ip-192-168-75-233.ap-northeast-1.compute.internal.46802 > ec2-13-231-171-17.ap-northeast-1.compute.amazonaws.com.openvpn: UDP, length 97
08:21:27.856543 IP ec2-13-231-171-17.ap-northeast-1.compute.amazonaws.com.openvpn > ip-192-168-75-233.ap-northeast-1.compute.internal.46802: UDP, length 160
08:21:27.856856 IP ip-192-168-75-233.ap-northeast-1.compute.internal.46802 > ec2-13-231-171-17.ap-northeast-1.compute.amazonaws.com.openvpn: UDP, length 96
08:21:27.896406 IP ec2-13-231-171-17.ap-northeast-1.compute.amazonaws.com.openvpn > ip-192-168-75-233.ap-northeast-1.compute.internal.46802: UDP, length 164
08:21:27.929184 IP ec2-13-231-171-17.ap-northeast-1.compute.amazonaws.com.openvpn > ip-192-168-75-233.ap-northeast-1.compute.internal.46802: UDP, length 122
08:21:27.929450 IP ip-192-168-75-233.ap-northeast-1.compute.internal.46802 > ec2-13-231-171-17.ap-northeast-1.compute.amazonaws.com.openvpn: UDP, length 76
08:21:27.975236 ARP, Request who-has ip-192-168-75-1.ap-northeast-1.compute.internal tell ip-192-168-75-233.ap-northeast-1.compute.internal, length 28
08:21:27.976243 ARP, Reply ip-192-168-75-1.ap-northeast-1.compute.internal is-at d0:96:fb:e7:bb:a2 (oui Unknown), length 46
08:21:28.720085 IP ip-192-168-75-233.ap-northeast-1.compute.internal.46802 > ec2-13-231-171-17.ap-northeast-1.compute.amazonaws.com.openvpn: UDP, length 115
08:21:28.743303 IP ip-192-168-75-233.ap-northeast-1.compute.internal.46802 > ec2-13-231-171-17.ap-northeast-1.compute.amazonaws.com.openvpn: UDP, length 76
08:21:28.765257 IP ec2-13-231-171-17.ap-northeast-1.compute.amazonaws.com.openvpn > ip-192-168-75-233.ap-northeast-1.compute.internal.46802: UDP, length 115
08:21:28.765429 IP ip-192-168-75-233.ap-northeast-1.compute.internal.46802 > ec2-13-231-171-17.ap-northeast-1.compute.amazonaws.com.openvpn: UDP, length 76
08:21:28.784647 IP ec2-13-231-171-17.ap-northeast-1.compute.amazonaws.com.openvpn > ip-192-168-75-233.ap-northeast-1.compute.internal.46802: UDP, length 76
08:21:28.839581 IP ip-192-168-75-233.ap-northeast-1.compute.internal.46802 > ec2-13-231-171-17.ap-northeast-1.compute.amazonaws.com.openvpn: UDP, length 95
08:21:28.879292 IP ec2-13-231-171-17.ap-northeast-1.compute.amazonaws.com.openvpn > ip-192-168-75-233.ap-northeast-1.compute.internal.46802: UDP, length 156
08:21:28.999356 IP ip-192-168-75-233.ap-northeast-1.compute.internal.46802 > ec2-13-231-171-17.ap-northeast-1.compute.amazonaws.com.openvpn: UDP, length 76
08:21:29.041010 IP ec2-13-231-171-17.ap-northeast-1.compute.amazonaws.com.openvpn > ip-192-168-75-233.ap-northeast-1.compute.internal.46802: UDP, length 76
08:21:29.255399 IP ip-192-168-75-233.ap-northeast-1.compute.internal.46802 > ec2-13-231-171-17.ap-northeast-1.compute.amazonaws.com.openvpn: UDP, length 76
08:21:29.297292 IP ec2-13-231-171-17.ap-northeast-1.compute.amazonaws.com.openvpn > ip-192-168-75-233.ap-northeast-1.compute.internal.46802: UDP, length 76
08:21:29.511477 IP ip-192-168-75-233.ap-northeast-1.compute.internal.46802 > ec2-13-231-171-17.ap-northeast-1.compute.amazonaws.com.openvpn: UDP, length 76
08:21:29.511504 IP ip-192-168-75-233.ap-northeast-1.compute.internal.46802 > ec2-13-231-171-17.ap-northeast-1.compute.amazonaws.com.openvpn: UDP, length 76
08:21:29.552113 IP ec2-13-231-171-17.ap-northeast-1.compute.amazonaws.com.openvpn > ip-192-168-75-233.ap-northeast-1.compute.internal.46802: UDP, length 76
08:21:29.552309 IP ec2-13-231-171-17.ap-northeast-1.compute.amazonaws.com.openvpn > ip-192-168-75-233.ap-northeast-1.compute.internal.46802: UDP, length 76
08:21:29.720621 IP ip-192-168-75-233.ap-northeast-1.compute.internal.46802 > ec2-13-231-171-17.ap-northeast-1.compute.amazonaws.com.openvpn: UDP, length 115
08:21:29.760942 IP ec2-13-231-171-17.ap-northeast-1.compute.amazonaws.com.openvpn > ip-192-168-75-233.ap-northeast-1.compute.internal.46802: UDP, length 115
08:21:29.761248 IP ip-192-168-75-233.ap-northeast-1.compute.internal.46802 > ec2-13-231-171-17.ap-northeast-1.compute.amazonaws.com.openvpn: UDP, length 76
08:21:29.767405 IP ip-192-168-75-233.ap-northeast-1.compute.internal.46802 > ec2-13-231-171-17.ap-northeast-1.compute.amazonaws.com.openvpn: UDP, length 76
08:21:29.806875 IP ec2-13-231-171-17.ap-northeast-1.compute.amazonaws.com.openvpn > ip-192-168-75-233.ap-northeast-1.compute.internal.46802: UDP, length 76
08:21:30.924074 IP ip-192-168-75-233.ap-northeast-1.compute.internal.46802 > ec2-13-231-171-17.ap-northeast-1.compute.amazonaws.com.openvpn: UDP, length 612
08:21:31.176528 IP ip-192-168-75-233.ap-northeast-1.compute.internal.46802 > ec2-13-231-171-17.ap-northeast-1.compute.amazonaws.com.openvpn: UDP, length 612
08:21:31.202572 IP ec2-13-231-171-17.ap-northeast-1.compute.amazonaws.com.openvpn > ip-192-168-75-233.ap-northeast-1.compute.internal.46802: UDP, length 76
08:21:31.484119 IP ec2-13-231-171-17.ap-northeast-1.compute.amazonaws.com.openvpn > ip-192-168-75-233.ap-northeast-1.compute.internal.46802: UDP, length 76
08:21:31.721085 IP ip-192-168-75-233.ap-northeast-1.compute.internal.46802 > ec2-13-231-171-17.ap-northeast-1.compute.amazonaws.com.openvpn: UDP, length 115
08:21:31.721115 IP ip-192-168-75-233.ap-northeast-1.compute.internal.46802 > ec2-13-231-171-17.ap-northeast-1.compute.amazonaws.com.openvpn: UDP, length 115
08:21:31.764439 IP ec2-13-231-171-17.ap-northeast-1.compute.amazonaws.com.openvpn > ip-192-168-75-233.ap-northeast-1.compute.internal.46802: UDP, length 115
08:21:31.764666 IP ip-192-168-75-233.ap-northeast-1.compute.internal.46802 > ec2-13-231-171-17.ap-northeast-1.compute.amazonaws.com.openvpn: UDP, length 76
08:21:31.765129 IP ec2-13-231-171-17.ap-northeast-1.compute.amazonaws.com.openvpn > ip-192-168-75-233.ap-northeast-1.compute.internal.46802: UDP, length 115
08:21:31.765183 IP ip-192-168-75-233.ap-northeast-1.compute.internal.46802 > ec2-13-231-171-17.ap-northeast-1.compute.amazonaws.com.openvpn: UDP, length 76
08:21:31.952943 IP ip-192-168-75-233.ap-northeast-1.compute.internal.46802 > ec2-13-231-171-17.ap-northeast-1.compute.amazonaws.com.openvpn: UDP, length 76
08:21:31.992881 IP ec2-13-231-171-17.ap-northeast-1.compute.amazonaws.com.openvpn > ip-192-168-75-233.ap-northeast-1.compute.internal.46802: UDP, length 76
08:21:31.993185 IP ip-192-168-75-233.ap-northeast-1.compute.internal.46802 > ec2-13-231-171-17.ap-northeast-1.compute.amazonaws.com.openvpn: UDP, length 76
08:21:32.721490 IP ip-192-168-75-233.ap-northeast-1.compute.internal.46802 > ec2-13-231-171-17.ap-northeast-1.compute.amazonaws.com.openvpn: UDP, length 115
08:21:32.721522 IP ip-192-168-75-233.ap-northeast-1.compute.internal.46802 > ec2-13-231-171-17.ap-northeast-1.compute.amazonaws.com.openvpn: UDP, length 115
08:21:32.765151 IP ec2-13-231-171-17.ap-northeast-1.compute.amazonaws.com.openvpn > ip-192-168-75-233.ap-northeast-1.compute.internal.46802: UDP, length 115
08:21:32.765312 IP ip-192-168-75-233.ap-northeast-1.compute.internal.46802 > ec2-13-231-171-17.ap-northeast-1.compute.amazonaws.com.openvpn: UDP, length 76
08:21:32.766535 IP ec2-13-231-171-17.ap-northeast-1.compute.amazonaws.com.openvpn > ip-192-168-75-233.ap-northeast-1.compute.internal.46802: UDP, length 115
08:21:32.766671 IP ip-192-168-75-233.ap-northeast-1.compute.internal.46802 > ec2-13-231-171-17.ap-northeast-1.compute.amazonaws.com.openvpn: UDP, length 76
08:21:33.095490 IP ip-192-168-75-233.ap-northeast-1.compute.internal.46802 > ec2-13-231-171-17.ap-northeast-1.compute.amazonaws.com.openvpn: UDP, length 76
08:21:33.095526 IP ip-192-168-75-233.ap-northeast-1.compute.internal.46802 > ec2-13-231-171-17.ap-northeast-1.compute.amazonaws.com.openvpn: UDP, length 76
08:21:33.138648 IP ec2-13-231-171-17.ap-northeast-1.compute.amazonaws.com.openvpn > ip-192-168-75-233.ap-northeast-1.compute.internal.46802: UDP, length 76
08:21:33.140674 IP ec2-13-231-171-17.ap-northeast-1.compute.amazonaws.com.openvpn > ip-192-168-75-233.ap-northeast-1.compute.internal.46802: UDP, length 76
08:21:33.721737 IP ip-192-168-75-233.ap-northeast-1.compute.internal.46802 > ec2-13-231-171-17.ap-northeast-1.compute.amazonaws.com.openvpn: UDP, length 115
08:21:33.721751 IP ip-192-168-75-233.ap-northeast-1.compute.internal.46802 > ec2-13-231-171-17.ap-northeast-1.compute.amazonaws.com.openvpn: UDP, length 115
08:21:33.765148 IP ec2-13-231-171-17.ap-northeast-1.compute.amazonaws.com.openvpn > ip-192-168-75-233.ap-northeast-1.compute.internal.46802: UDP, length 115
08:21:33.765265 IP ip-192-168-75-233.ap-northeast-1.compute.internal.46802 > ec2-13-231-171-17.ap-northeast-1.compute.amazonaws.com.openvpn: UDP, length 76
08:21:33.766974 IP ec2-13-231-171-17.ap-northeast-1.compute.amazonaws.com.openvpn > ip-192-168-75-233.ap-northeast-1.compute.internal.46802: UDP, length 115
08:21:33.767045 IP ip-192-168-75-233.ap-northeast-1.compute.internal.46802 > ec2-13-231-171-17.ap-northeast-1.compute.amazonaws.com.openvpn: UDP, length 76
08:21:34.722082 IP ip-192-168-75-233.ap-northeast-1.compute.internal.46802 > ec2-13-231-171-17.ap-northeast-1.compute.amazonaws.com.openvpn: UDP, length 115
08:21:34.766420 IP ec2-13-231-171-17.ap-northeast-1.compute.amazonaws.com.openvpn > ip-192-168-75-233.ap-northeast-1.compute.internal.46802: UDP, length 115
08:21:34.766576 IP ip-192-168-75-233.ap-northeast-1.compute.internal.46802 > ec2-13-231-171-17.ap-northeast-1.compute.amazonaws.com.openvpn: UDP, length 76
08:21:35.094830 Loopback, skipCount 0,  invalid (256)
08:21:35.655299 IP ip-192-168-75-233.ap-northeast-1.compute.internal.46802 > ec2-13-231-171-17.ap-northeast-1.compute.amazonaws.com.openvpn: UDP, length 76
08:21:35.698709 IP ec2-13-231-171-17.ap-northeast-1.compute.amazonaws.com.openvpn > ip-192-168-75-233.ap-northeast-1.compute.internal.46802: UDP, length 76
08:21:35.711044 IP ip-192-168-75-233.ap-northeast-1.compute.internal.46802 > ec2-13-231-171-17.ap-northeast-1.compute.amazonaws.com.openvpn: UDP, length 81
08:21:35.711058 IP ip-192-168-75-233.ap-northeast-1.compute.internal.46802 > ec2-13-231-171-17.ap-northeast-1.compute.amazonaws.com.openvpn: UDP, length 81
08:21:35.711114 IP ip-192-168-75-233.ap-northeast-1.compute.internal.46802 > ec2-13-231-171-17.ap-northeast-1.compute.amazonaws.com.openvpn: UDP, length 79
08:21:35.711866 IP ip-192-168-75-233.ap-northeast-1.compute.internal.46802 > ec2-13-231-171-17.ap-northeast-1.compute.amazonaws.com.openvpn: UDP, length 84
08:21:35.722361 IP ip-192-168-75-233.ap-northeast-1.compute.internal.46802 > ec2-13-231-171-17.ap-northeast-1.compute.amazonaws.com.openvpn: UDP, length 115
08:21:35.722380 IP ip-192-168-75-233.ap-northeast-1.compute.internal.46802 > ec2-13-231-171-17.ap-northeast-1.compute.amazonaws.com.openvpn: UDP, length 115
08:21:35.736830 IP ip-192-168-75-233.ap-northeast-1.compute.internal.46802 > ec2-13-231-171-17.ap-northeast-1.compute.amazonaws.com.openvpn: UDP, length 79
08:21:35.736863 IP ip-192-168-75-233.ap-northeast-1.compute.internal.46802 > ec2-13-231-171-17.ap-northeast-1.compute.amazonaws.com.openvpn: UDP, length 79
08:21:35.748881 IP ec2-13-231-171-17.ap-northeast-1.compute.amazonaws.com.openvpn > ip-192-168-75-233.ap-northeast-1.compute.internal.46802: UDP, length 113
08:21:35.748918 IP ec2-13-231-171-17.ap-northeast-1.compute.amazonaws.com.openvpn > ip-192-168-75-233.ap-northeast-1.compute.internal.46802: UDP, length 137
08:21:35.751477 IP ec2-13-231-171-17.ap-northeast-1.compute.amazonaws.com.openvpn > ip-192-168-75-233.ap-northeast-1.compute.internal.46802: UDP, length 84
08:21:35.751605 IP ip-192-168-75-233.ap-northeast-1.compute.internal.46802 > ec2-13-231-171-17.ap-northeast-1.compute.amazonaws.com.openvpn: UDP, length 76
08:21:35.754186 IP ip-192-168-75-233.ap-northeast-1.compute.internal.46802 > ec2-13-231-171-17.ap-northeast-1.compute.amazonaws.com.openvpn: UDP, length 1409
08:21:35.755128 IP ec2-13-231-171-17.ap-northeast-1.compute.amazonaws.com.openvpn > ip-192-168-75-233.ap-northeast-1.compute.internal.46802: UDP, length 111
08:21:35.758306 IP ip-192-168-75-233.ap-northeast-1.compute.internal.46802 > ec2-13-231-171-17.ap-northeast-1.compute.amazonaws.com.openvpn: UDP, length 687
08:21:35.758538 IP ip-192-168-75-233.ap-northeast-1.compute.internal.46802 > ec2-13-231-171-17.ap-northeast-1.compute.amazonaws.com.openvpn: UDP, length 82
08:21:35.758560 IP ip-192-168-75-233.ap-northeast-1.compute.internal.46802 > ec2-13-231-171-17.ap-northeast-1.compute.amazonaws.com.openvpn: UDP, length 246
08:21:35.761568 IP ip-192-168-75-233.ap-northeast-1.compute.internal.46802 > ec2-13-231-171-17.ap-northeast-1.compute.amazonaws.com.openvpn: UDP, length 888
08:21:35.761967 IP ec2-13-231-171-17.ap-northeast-1.compute.amazonaws.com.openvpn > ip-192-168-75-233.ap-northeast-1.compute.internal.46802: UDP, length 115
08:21:35.762052 IP ip-192-168-75-233.ap-northeast-1.compute.internal.46802 > ec2-13-231-171-17.ap-northeast-1.compute.amazonaws.com.openvpn: UDP, length 76
08:21:35.762569 IP ec2-13-231-171-17.ap-northeast-1.compute.amazonaws.com.openvpn > ip-192-168-75-233.ap-northeast-1.compute.internal.46802: UDP, length 76
08:21:35.762620 IP ec2-13-231-171-17.ap-northeast-1.compute.amazonaws.com.openvpn > ip-192-168-75-233.ap-northeast-1.compute.internal.46802: UDP, length 115
08:21:35.762681 IP ip-192-168-75-233.ap-northeast-1.compute.internal.46802 > ec2-13-231-171-17.ap-northeast-1.compute.amazonaws.com.openvpn: UDP, length 76
08:21:35.774935 IP ec2-13-231-171-17.ap-northeast-1.compute.amazonaws.com.openvpn > ip-192-168-75-233.ap-northeast-1.compute.internal.46802: UDP, length 111
08:21:35.774971 IP ec2-13-231-171-17.ap-northeast-1.compute.amazonaws.com.openvpn > ip-192-168-75-233.ap-northeast-1.compute.internal.46802: UDP, length 135
08:21:35.797956 IP ec2-13-231-171-17.ap-northeast-1.compute.amazonaws.com.openvpn > ip-192-168-75-233.ap-northeast-1.compute.internal.46802: UDP, length 1252
08:21:35.798925 IP ec2-13-231-171-17.ap-northeast-1.compute.amazonaws.com.openvpn > ip-192-168-75-233.ap-northeast-1.compute.internal.46802: UDP, length 1252
08:21:35.798938 IP ec2-13-231-171-17.ap-northeast-1.compute.amazonaws.com.openvpn > ip-192-168-75-233.ap-northeast-1.compute.internal.46802: UDP, length 76
08:21:35.798952 IP ec2-13-231-171-17.ap-northeast-1.compute.amazonaws.com.openvpn > ip-192-168-75-233.ap-northeast-1.compute.internal.46802: UDP, length 76
08:21:35.800300 IP ip-192-168-75-233.ap-northeast-1.compute.internal.46802 > ec2-13-231-171-17.ap-northeast-1.compute.amazonaws.com.openvpn: UDP, length 146
08:21:35.800475 IP ec2-13-231-171-17.ap-northeast-1.compute.amazonaws.com.openvpn > ip-192-168-75-233.ap-northeast-1.compute.internal.46802: UDP, length 76
08:21:35.800902 IP ec2-13-231-171-17.ap-northeast-1.compute.amazonaws.com.openvpn > ip-192-168-75-233.ap-northeast-1.compute.internal.46802: UDP, length 758
08:21:35.800917 IP ec2-13-231-171-17.ap-northeast-1.compute.amazonaws.com.openvpn > ip-192-168-75-233.ap-northeast-1.compute.internal.46802: UDP, length 147
08:21:35.800952 IP ip-192-168-75-233.ap-northeast-1.compute.internal.46802 > ec2-13-231-171-17.ap-northeast-1.compute.amazonaws.com.openvpn: UDP, length 76
08:21:35.800960 IP ip-192-168-75-233.ap-northeast-1.compute.internal.46802 > ec2-13-231-171-17.ap-northeast-1.compute.amazonaws.com.openvpn: UDP, length 76
08:21:35.801298 IP ip-192-168-75-233.ap-northeast-1.compute.internal.46802 > ec2-13-231-171-17.ap-northeast-1.compute.amazonaws.com.openvpn: UDP, length 160
08:21:35.801469 IP ip-192-168-75-233.ap-northeast-1.compute.internal.46802 > ec2-13-231-171-17.ap-northeast-1.compute.amazonaws.com.openvpn: UDP, length 115
08:21:35.801747 IP ip-192-168-75-233.ap-northeast-1.compute.internal.46802 > ec2-13-231-171-17.ap-northeast-1.compute.amazonaws.com.openvpn: UDP, length 100
08:21:35.801758 IP ip-192-168-75-233.ap-northeast-1.compute.internal.46802 > ec2-13-231-171-17.ap-northeast-1.compute.amazonaws.com.openvpn: UDP, length 76
08:21:35.802240 IP ec2-13-231-171-17.ap-northeast-1.compute.amazonaws.com.openvpn > ip-192-168-75-233.ap-northeast-1.compute.internal.46802: UDP, length 108
08:21:35.802272 IP ec2-13-231-171-17.ap-northeast-1.compute.amazonaws.com.openvpn > ip-192-168-75-233.ap-northeast-1.compute.internal.46802: UDP, length 79
08:21:35.802286 IP ec2-13-231-171-17.ap-northeast-1.compute.amazonaws.com.openvpn > ip-192-168-75-233.ap-northeast-1.compute.internal.46802: UDP, length 79
08:21:35.802322 IP ec2-13-231-171-17.ap-northeast-1.compute.amazonaws.com.openvpn > ip-192-168-75-233.ap-northeast-1.compute.internal.46802: UDP, length 104
08:21:35.802940 IP ip-192-168-75-233.ap-northeast-1.compute.internal.46802 > ec2-13-231-171-17.ap-northeast-1.compute.amazonaws.com.openvpn: UDP, length 97
08:21:35.840852 IP ec2-13-231-171-17.ap-northeast-1.compute.amazonaws.com.openvpn > ip-192-168-75-233.ap-northeast-1.compute.internal.46802: UDP, length 77
08:21:35.841161 IP ec2-13-231-171-17.ap-northeast-1.compute.amazonaws.com.openvpn > ip-192-168-75-233.ap-northeast-1.compute.internal.46802: UDP, length 76
08:21:35.841882 IP ec2-13-231-171-17.ap-northeast-1.compute.amazonaws.com.openvpn > ip-192-168-75-233.ap-northeast-1.compute.internal.46802: UDP, length 76
08:21:35.841938 IP ip-192-168-75-233.ap-northeast-1.compute.internal.46802 > ec2-13-231-171-17.ap-northeast-1.compute.amazonaws.com.openvpn: UDP, length 76
08:21:35.842638 IP ec2-13-231-171-17.ap-northeast-1.compute.amazonaws.com.openvpn > ip-192-168-75-233.ap-northeast-1.compute.internal.46802: UDP, length 78
08:21:35.862058 IP ip-192-168-75-233.ap-northeast-1.compute.internal.46802 > ec2-13-231-171-17.ap-northeast-1.compute.amazonaws.com.openvpn: UDP, length 96
08:21:35.892014 IP ec2-13-231-171-17.ap-northeast-1.compute.amazonaws.com.openvpn > ip-192-168-75-233.ap-northeast-1.compute.internal.46802: UDP, length 1252
08:21:35.892048 IP ec2-13-231-171-17.ap-northeast-1.compute.amazonaws.com.openvpn > ip-192-168-75-233.ap-northeast-1.compute.internal.46802: UDP, length 1252
08:21:35.892080 IP ec2-13-231-171-17.ap-northeast-1.compute.amazonaws.com.openvpn > ip-192-168-75-233.ap-northeast-1.compute.internal.46802: UDP, length 1252
08:21:35.892112 IP ec2-13-231-171-17.ap-northeast-1.compute.amazonaws.com.openvpn > ip-192-168-75-233.ap-northeast-1.compute.internal.46802: UDP, length 1252
08:21:35.892165 IP ec2-13-231-171-17.ap-northeast-1.compute.amazonaws.com.openvpn > ip-192-168-75-233.ap-northeast-1.compute.internal.46802: UDP, length 1252
08:21:35.892209 IP ec2-13-231-171-17.ap-northeast-1.compute.amazonaws.com.openvpn > ip-192-168-75-233.ap-northeast-1.compute.internal.46802: UDP, length 1252
08:21:35.892215 IP ec2-13-231-171-17.ap-northeast-1.compute.amazonaws.com.openvpn > ip-192-168-75-233.ap-northeast-1.compute.internal.46802: UDP, length 488
08:21:35.892268 IP ec2-13-231-171-17.ap-northeast-1.compute.amazonaws.com.openvpn > ip-192-168-75-233.ap-northeast-1.compute.internal.46802: UDP, length 1252
08:21:35.892299 IP ec2-13-231-171-17.ap-northeast-1.compute.amazonaws.com.openvpn > ip-192-168-75-233.ap-northeast-1.compute.internal.46802: UDP, length 1252
08:21:35.892304 IP ec2-13-231-171-17.ap-northeast-1.compute.amazonaws.com.openvpn > ip-192-168-75-233.ap-northeast-1.compute.internal.46802: UDP, length 242
08:21:35.892335 IP ec2-13-231-171-17.ap-northeast-1.compute.amazonaws.com.openvpn > ip-192-168-75-233.ap-northeast-1.compute.internal.46802: UDP, length 776
08:21:35.892378 IP ec2-13-231-171-17.ap-northeast-1.compute.amazonaws.com.openvpn > ip-192-168-75-233.ap-northeast-1.compute.internal.46802: UDP, length 1077
08:21:35.892631 IP ip-192-168-75-233.ap-northeast-1.compute.internal.46802 > ec2-13-231-171-17.ap-northeast-1.compute.amazonaws.com.openvpn: UDP, length 95
08:21:35.933328 IP ec2-13-231-171-17.ap-northeast-1.compute.amazonaws.com.openvpn > ip-192-168-75-233.ap-northeast-1.compute.internal.46802: UDP, length 1252
08:21:35.933361 IP ec2-13-231-171-17.ap-northeast-1.compute.amazonaws.com.openvpn > ip-192-168-75-233.ap-northeast-1.compute.internal.46802: UDP, length 1252
08:21:35.933414 IP ec2-13-231-171-17.ap-northeast-1.compute.amazonaws.com.openvpn > ip-192-168-75-233.ap-northeast-1.compute.internal.46802: UDP, length 1252
08:21:35.933428 IP ec2-13-231-171-17.ap-northeast-1.compute.amazonaws.com.openvpn > ip-192-168-75-233.ap-northeast-1.compute.internal.46802: UDP, length 1252
08:21:35.933491 IP ec2-13-231-171-17.ap-northeast-1.compute.amazonaws.com.openvpn > ip-192-168-75-233.ap-northeast-1.compute.internal.46802: UDP, length 1252
08:21:35.933521 IP ec2-13-231-171-17.ap-northeast-1.compute.amazonaws.com.openvpn > ip-192-168-75-233.ap-northeast-1.compute.internal.46802: UDP, length 1252
08:21:35.933562 IP ec2-13-231-171-17.ap-northeast-1.compute.amazonaws.com.openvpn > ip-192-168-75-233.ap-northeast-1.compute.internal.46802: UDP, length 1252
08:21:35.933602 IP ec2-13-231-171-17.ap-northeast-1.compute.amazonaws.com.openvpn > ip-192-168-75-233.ap-northeast-1.compute.internal.46802: UDP, length 1252
08:21:35.933629 IP ec2-13-231-171-17.ap-northeast-1.compute.amazonaws.com.openvpn > ip-192-168-75-233.ap-northeast-1.compute.internal.46802: UDP, length 1252
08:21:35.933658 IP ec2-13-231-171-17.ap-northeast-1.compute.amazonaws.com.openvpn > ip-192-168-75-233.ap-northeast-1.compute.internal.46802: UDP, length 1252
08:21:35.933711 IP ec2-13-231-171-17.ap-northeast-1.compute.amazonaws.com.openvpn > ip-192-168-75-233.ap-northeast-1.compute.internal.46802: UDP, length 1252
08:21:35.933741 IP ec2-13-231-171-17.ap-northeast-1.compute.amazonaws.com.openvpn > ip-192-168-75-233.ap-northeast-1.compute.internal.46802: UDP, length 1252
08:21:35.933757 IP ip-192-168-75-233.ap-northeast-1.compute.internal.46802 > ec2-13-231-171-17.ap-northeast-1.compute.amazonaws.com.openvpn: UDP, length 95
08:21:35.933782 IP ec2-13-231-171-17.ap-northeast-1.compute.amazonaws.com.openvpn > ip-192-168-75-233.ap-northeast-1.compute.internal.46802: UDP, length 1252
08:21:35.933802 IP ec2-13-231-171-17.ap-northeast-1.compute.amazonaws.com.openvpn > ip-192-168-75-233.ap-northeast-1.compute.internal.46802: UDP, length 1197
08:21:35.934034 IP ip-192-168-75-233.ap-northeast-1.compute.internal.46802 > ec2-13-231-171-17.ap-northeast-1.compute.amazonaws.com.openvpn: UDP, length 95
08:21:35.986512 IP ip-192-168-75-233.ap-northeast-1.compute.internal.46802 > ec2-13-231-171-17.ap-northeast-1.compute.amazonaws.com.openvpn: UDP, length 100
08:21:35.986525 IP ip-192-168-75-233.ap-northeast-1.compute.internal.46802 > ec2-13-231-171-17.ap-northeast-1.compute.amazonaws.com.openvpn: UDP, length 100
08:21:36.025805 IP ec2-13-231-171-17.ap-northeast-1.compute.amazonaws.com.openvpn > ip-192-168-75-233.ap-northeast-1.compute.internal.46802: UDP, length 116
08:21:36.026217 IP ec2-13-231-171-17.ap-northeast-1.compute.amazonaws.com.openvpn > ip-192-168-75-233.ap-northeast-1.compute.internal.46802: UDP, length 128
08:21:36.193087 IP ip-192-168-75-233.ap-northeast-1.compute.internal.46802 > ec2-13-231-171-17.ap-northeast-1.compute.amazonaws.com.openvpn: UDP, length 845
08:21:36.193257 IP ip-192-168-75-233.ap-northeast-1.compute.internal.46802 > ec2-13-231-171-17.ap-northeast-1.compute.amazonaws.com.openvpn: UDP, length 94
08:21:36.237611 IP ec2-13-231-171-17.ap-northeast-1.compute.amazonaws.com.openvpn > ip-192-168-75-233.ap-northeast-1.compute.internal.46802: UDP, length 83
08:21:36.258227 IP ip-192-168-75-233.ap-northeast-1.compute.internal.46802 > ec2-13-231-171-17.ap-northeast-1.compute.amazonaws.com.openvpn: UDP, length 96
08:21:36.274899 IP ec2-13-231-171-17.ap-northeast-1.compute.amazonaws.com.openvpn > ip-192-168-75-233.ap-northeast-1.compute.internal.46802: UDP, length 78
08:21:36.295467 IP ip-192-168-75-233.ap-northeast-1.compute.internal.46802 > ec2-13-231-171-17.ap-northeast-1.compute.amazonaws.com.openvpn: UDP, length 96
08:21:36.609237 IP ip-192-168-75-233.ap-northeast-1.compute.internal.46802 > ec2-13-231-171-17.ap-northeast-1.compute.amazonaws.com.openvpn: UDP, length 983
08:21:36.657944 IP ec2-13-231-171-17.ap-northeast-1.compute.amazonaws.com.openvpn > ip-192-168-75-233.ap-northeast-1.compute.internal.46802: UDP, length 79
08:21:36.721469 IP ec2-13-231-171-17.ap-northeast-1.compute.amazonaws.com.openvpn > ip-192-168-75-233.ap-northeast-1.compute.internal.46802: UDP, length 520
08:21:36.722559 IP ip-192-168-75-233.ap-northeast-1.compute.internal.46802 > ec2-13-231-171-17.ap-northeast-1.compute.amazonaws.com.openvpn: UDP, length 115
08:21:36.742648 IP ip-192-168-75-233.ap-northeast-1.compute.internal.46802 > ec2-13-231-171-17.ap-northeast-1.compute.amazonaws.com.openvpn: UDP, length 96
08:21:36.761687 IP ec2-13-231-171-17.ap-northeast-1.compute.amazonaws.com.openvpn > ip-192-168-75-233.ap-northeast-1.compute.internal.46802: UDP, length 115
08:21:36.761873 IP ip-192-168-75-233.ap-northeast-1.compute.internal.46802 > ec2-13-231-171-17.ap-northeast-1.compute.amazonaws.com.openvpn: UDP, length 76
08:21:36.819069 IP ip-192-168-75-233.ap-northeast-1.compute.internal.46802 > ec2-13-231-171-17.ap-northeast-1.compute.amazonaws.com.openvpn: UDP, length 855
08:21:36.861840 IP ec2-13-231-171-17.ap-northeast-1.compute.amazonaws.com.openvpn > ip-192-168-75-233.ap-northeast-1.compute.internal.46802: UDP, length 79
08:21:36.876241 IP ec2-13-231-171-17.ap-northeast-1.compute.amazonaws.com.openvpn > ip-192-168-75-233.ap-northeast-1.compute.internal.46802: UDP, length 755
08:21:36.897200 IP ip-192-168-75-233.ap-northeast-1.compute.internal.46802 > ec2-13-231-171-17.ap-northeast-1.compute.amazonaws.com.openvpn: UDP, length 96
08:21:36.960758 IP ip-192-168-75-233.ap-northeast-1.compute.internal.46802 > ec2-13-231-171-17.ap-northeast-1.compute.amazonaws.com.openvpn: UDP, length 1046
08:21:37.003880 IP ec2-13-231-171-17.ap-northeast-1.compute.amazonaws.com.openvpn > ip-192-168-75-233.ap-northeast-1.compute.internal.46802: UDP, length 79
08:21:37.035409 IP ec2-13-231-171-17.ap-northeast-1.compute.amazonaws.com.openvpn > ip-192-168-75-233.ap-northeast-1.compute.internal.46802: UDP, length 870
08:21:37.056671 IP ip-192-168-75-233.ap-northeast-1.compute.internal.46802 > ec2-13-231-171-17.ap-northeast-1.compute.amazonaws.com.openvpn: UDP, length 96
08:21:37.633761 IP ip-192-168-75-233.ap-northeast-1.compute.internal.46802 > ec2-13-231-171-17.ap-northeast-1.compute.amazonaws.com.openvpn: UDP, length 612
08:21:37.722935 IP ip-192-168-75-233.ap-northeast-1.compute.internal.46802 > ec2-13-231-171-17.ap-northeast-1.compute.amazonaws.com.openvpn: UDP, length 122
08:21:37.722982 IP ip-192-168-75-233.ap-northeast-1.compute.internal.46802 > ec2-13-231-171-17.ap-northeast-1.compute.amazonaws.com.openvpn: UDP, length 122
08:21:37.866633 IP ec2-13-231-171-17.ap-northeast-1.compute.amazonaws.com.openvpn > ip-192-168-75-233.ap-northeast-1.compute.internal.46802: UDP, length 76
08:21:37.866668 IP ec2-13-231-171-17.ap-northeast-1.compute.amazonaws.com.openvpn > ip-192-168-75-233.ap-northeast-1.compute.internal.46802: UDP, length 122
08:21:37.866812 IP ip-192-168-75-233.ap-northeast-1.compute.internal.46802 > ec2-13-231-171-17.ap-northeast-1.compute.amazonaws.com.openvpn: UDP, length 76
08:21:37.872525 IP ec2-13-231-171-17.ap-northeast-1.compute.amazonaws.com.openvpn > ip-192-168-75-233.ap-northeast-1.compute.internal.46802: UDP, length 76
08:21:37.872548 IP ec2-13-231-171-17.ap-northeast-1.compute.amazonaws.com.openvpn > ip-192-168-75-233.ap-northeast-1.compute.internal.46802: UDP, length 122
08:21:37.872640 IP ip-192-168-75-233.ap-northeast-1.compute.internal.46802 > ec2-13-231-171-17.ap-northeast-1.compute.amazonaws.com.openvpn: UDP, length 76
08:21:37.918694 IP ec2-13-231-171-17.ap-northeast-1.compute.amazonaws.com.openvpn > ip-192-168-75-233.ap-northeast-1.compute.internal.46802: UDP, length 76
08:21:38.723242 IP ip-192-168-75-233.ap-northeast-1.compute.internal.46802 > ec2-13-231-171-17.ap-northeast-1.compute.amazonaws.com.openvpn: UDP, length 122
08:21:38.723285 IP ip-192-168-75-233.ap-northeast-1.compute.internal.46802 > ec2-13-231-171-17.ap-northeast-1.compute.amazonaws.com.openvpn: UDP, length 115
08:21:38.723306 IP ip-192-168-75-233.ap-northeast-1.compute.internal.46802 > ec2-13-231-171-17.ap-northeast-1.compute.amazonaws.com.openvpn: UDP, length 122
08:21:38.723329 IP ip-192-168-75-233.ap-northeast-1.compute.internal.46802 > ec2-13-231-171-17.ap-northeast-1.compute.amazonaws.com.openvpn: UDP, length 122
08:21:38.753904 IP ec2-13-231-171-17.ap-northeast-1.compute.amazonaws.com.openvpn > ip-192-168-75-233.ap-northeast-1.compute.internal.46802: UDP, length 612
08:21:38.754081 IP ip-192-168-75-233.ap-northeast-1.compute.internal.46802 > ec2-13-231-171-17.ap-northeast-1.compute.amazonaws.com.openvpn: UDP, length 76
08:21:38.766399 IP ec2-13-231-171-17.ap-northeast-1.compute.amazonaws.com.openvpn > ip-192-168-75-233.ap-northeast-1.compute.internal.46802: UDP, length 115
08:21:38.766531 IP ip-192-168-75-233.ap-northeast-1.compute.internal.46802 > ec2-13-231-171-17.ap-northeast-1.compute.amazonaws.com.openvpn: UDP, length 76
08:21:38.864789 IP ec2-13-231-171-17.ap-northeast-1.compute.amazonaws.com.openvpn > ip-192-168-75-233.ap-northeast-1.compute.internal.46802: UDP, length 76
08:21:38.864832 IP ec2-13-231-171-17.ap-northeast-1.compute.amazonaws.com.openvpn > ip-192-168-75-233.ap-northeast-1.compute.internal.46802: UDP, length 122
08:21:38.864985 IP ip-192-168-75-233.ap-northeast-1.compute.internal.46802 > ec2-13-231-171-17.ap-northeast-1.compute.amazonaws.com.openvpn: UDP, length 76
08:21:38.869383 IP ec2-13-231-171-17.ap-northeast-1.compute.amazonaws.com.openvpn > ip-192-168-75-233.ap-northeast-1.compute.internal.46802: UDP, length 76
08:21:38.869410 IP ec2-13-231-171-17.ap-northeast-1.compute.amazonaws.com.openvpn > ip-192-168-75-233.ap-northeast-1.compute.internal.46802: UDP, length 122
08:21:38.869522 IP ip-192-168-75-233.ap-northeast-1.compute.internal.46802 > ec2-13-231-171-17.ap-northeast-1.compute.amazonaws.com.openvpn: UDP, length 76
08:21:38.875416 IP ec2-13-231-171-17.ap-northeast-1.compute.amazonaws.com.openvpn > ip-192-168-75-233.ap-northeast-1.compute.internal.46802: UDP, length 76
08:21:38.875436 IP ec2-13-231-171-17.ap-northeast-1.compute.amazonaws.com.openvpn > ip-192-168-75-233.ap-northeast-1.compute.internal.46802: UDP, length 122
08:21:38.875514 IP ip-192-168-75-233.ap-northeast-1.compute.internal.46802 > ec2-13-231-171-17.ap-northeast-1.compute.amazonaws.com.openvpn: UDP, length 76
08:21:38.953628 IP ip-192-168-75-233.ap-northeast-1.compute.internal.46802 > ec2-13-231-171-17.ap-northeast-1.compute.amazonaws.com.openvpn: UDP, length 76
08:21:38.983322 IP ip-192-168-75-233.ap-northeast-1.compute.internal.46802 > ec2-13-231-171-17.ap-northeast-1.compute.amazonaws.com.openvpn: UDP, length 76
08:21:38.994877 IP ec2-13-231-171-17.ap-northeast-1.compute.amazonaws.com.openvpn > ip-192-168-75-233.ap-northeast-1.compute.internal.46802: UDP, length 76
08:21:38.995055 IP ip-192-168-75-233.ap-northeast-1.compute.internal.46802 > ec2-13-231-171-17.ap-northeast-1.compute.amazonaws.com.openvpn: UDP, length 76
08:21:39.024658 IP ec2-13-231-171-17.ap-northeast-1.compute.amazonaws.com.openvpn > ip-192-168-75-233.ap-northeast-1.compute.internal.46802: UDP, length 76
08:21:39.164875 IP ec2-13-231-171-17.ap-northeast-1.compute.amazonaws.com.openvpn > ip-192-168-75-233.ap-northeast-1.compute.internal.46802: UDP, length 100
08:21:39.164915 IP ec2-13-231-171-17.ap-northeast-1.compute.amazonaws.com.openvpn > ip-192-168-75-233.ap-northeast-1.compute.internal.46802: UDP, length 76
08:21:39.165103 IP ip-192-168-75-233.ap-northeast-1.compute.internal.46802 > ec2-13-231-171-17.ap-northeast-1.compute.amazonaws.com.openvpn: UDP, length 76
08:21:39.165248 IP ip-192-168-75-233.ap-northeast-1.compute.internal.46802 > ec2-13-231-171-17.ap-northeast-1.compute.amazonaws.com.openvpn: UDP, length 115
08:21:39.165476 IP ip-192-168-75-233.ap-northeast-1.compute.internal.46802 > ec2-13-231-171-17.ap-northeast-1.compute.amazonaws.com.openvpn: UDP, length 100
08:21:39.165500 IP ip-192-168-75-233.ap-northeast-1.compute.internal.46802 > ec2-13-231-171-17.ap-northeast-1.compute.amazonaws.com.openvpn: UDP, length 76
08:21:39.205919 IP ec2-13-231-171-17.ap-northeast-1.compute.amazonaws.com.openvpn > ip-192-168-75-233.ap-northeast-1.compute.internal.46802: UDP, length 64
08:21:39.205944 IP ec2-13-231-171-17.ap-northeast-1.compute.amazonaws.com.openvpn > ip-192-168-75-233.ap-northeast-1.compute.internal.46802: UDP, length 64
08:21:39.363697 IP ec2-13-231-171-17.ap-northeast-1.compute.amazonaws.com.openvpn > ip-192-168-75-233.ap-northeast-1.compute.internal.46802: UDP, length 100
08:21:39.363731 IP ec2-13-231-171-17.ap-northeast-1.compute.amazonaws.com.openvpn > ip-192-168-75-233.ap-northeast-1.compute.internal.46802: UDP, length 76
08:21:39.363885 IP ip-192-168-75-233.ap-northeast-1.compute.internal.46802 > ec2-13-231-171-17.ap-northeast-1.compute.amazonaws.com.openvpn: UDP, length 76
08:21:39.364006 IP ip-192-168-75-233.ap-northeast-1.compute.internal.46802 > ec2-13-231-171-17.ap-northeast-1.compute.amazonaws.com.openvpn: UDP, length 115
08:21:39.364248 IP ip-192-168-75-233.ap-northeast-1.compute.internal.46802 > ec2-13-231-171-17.ap-northeast-1.compute.amazonaws.com.openvpn: UDP, length 100
08:21:39.364275 IP ip-192-168-75-233.ap-northeast-1.compute.internal.46802 > ec2-13-231-171-17.ap-northeast-1.compute.amazonaws.com.openvpn: UDP, length 76
08:21:39.404708 IP ec2-13-231-171-17.ap-northeast-1.compute.amazonaws.com.openvpn > ip-192-168-75-233.ap-northeast-1.compute.internal.46802: UDP, length 64
08:21:39.404732 IP ec2-13-231-171-17.ap-northeast-1.compute.amazonaws.com.openvpn > ip-192-168-75-233.ap-northeast-1.compute.internal.46802: UDP, length 64
08:21:39.404752 IP ec2-13-231-171-17.ap-northeast-1.compute.amazonaws.com.openvpn > ip-192-168-75-233.ap-northeast-1.compute.internal.46802: UDP, length 64
08:21:39.499335 IP ip-192-168-75-233.ap-northeast-1.compute.internal.46802 > ec2-13-231-171-17.ap-northeast-1.compute.amazonaws.com.openvpn: UDP, length 76
08:21:39.540946 IP ec2-13-231-171-17.ap-northeast-1.compute.amazonaws.com.openvpn > ip-192-168-75-233.ap-northeast-1.compute.internal.46802: UDP, length 76
08:21:39.751311 IP ip-192-168-75-233.ap-northeast-1.compute.internal.46802 > ec2-13-231-171-17.ap-northeast-1.compute.amazonaws.com.openvpn: UDP, length 76
08:21:39.755265 IP ip-192-168-75-233.ap-northeast-1.compute.internal.46802 > ec2-13-231-171-17.ap-northeast-1.compute.amazonaws.com.openvpn: UDP, length 76
08:21:39.792434 IP ec2-13-231-171-17.ap-northeast-1.compute.amazonaws.com.openvpn > ip-192-168-75-233.ap-northeast-1.compute.internal.46802: UDP, length 76
08:21:39.794570 IP ec2-13-231-171-17.ap-northeast-1.compute.amazonaws.com.openvpn > ip-192-168-75-233.ap-northeast-1.compute.internal.46802: UDP, length 76
08:21:40.011317 IP ip-192-168-75-233.ap-northeast-1.compute.internal.46802 > ec2-13-231-171-17.ap-northeast-1.compute.amazonaws.com.openvpn: UDP, length 76
08:21:40.050975 IP ec2-13-231-171-17.ap-northeast-1.compute.amazonaws.com.openvpn > ip-192-168-75-233.ap-northeast-1.compute.internal.46802: UDP, length 76
08:21:40.263323 IP ip-192-168-75-233.ap-northeast-1.compute.internal.46802 > ec2-13-231-171-17.ap-northeast-1.compute.amazonaws.com.openvpn: UDP, length 84
08:21:40.523342 IP ip-192-168-75-233.ap-northeast-1.compute.internal.46802 > ec2-13-231-171-17.ap-northeast-1.compute.amazonaws.com.openvpn: UDP, length 84
08:21:40.723846 IP ip-192-168-75-233.ap-northeast-1.compute.internal.46802 > ec2-13-231-171-17.ap-northeast-1.compute.amazonaws.com.openvpn: UDP, length 115
08:21:40.723872 IP ip-192-168-75-233.ap-northeast-1.compute.internal.46802 > ec2-13-231-171-17.ap-northeast-1.compute.amazonaws.com.openvpn: UDP, length 115
08:21:40.763449 IP ec2-13-231-171-17.ap-northeast-1.compute.amazonaws.com.openvpn > ip-192-168-75-233.ap-northeast-1.compute.internal.46802: UDP, length 115
08:21:40.763567 IP ip-192-168-75-233.ap-northeast-1.compute.internal.46802 > ec2-13-231-171-17.ap-northeast-1.compute.amazonaws.com.openvpn: UDP, length 76
08:21:40.765182 IP ec2-13-231-171-17.ap-northeast-1.compute.amazonaws.com.openvpn > ip-192-168-75-233.ap-northeast-1.compute.internal.46802: UDP, length 115
08:21:40.765279 IP ip-192-168-75-233.ap-northeast-1.compute.internal.46802 > ec2-13-231-171-17.ap-northeast-1.compute.amazonaws.com.openvpn: UDP, length 76
08:21:41.195760 IP ip-192-168-75-233.ap-northeast-1.compute.internal.46802 > ec2-13-231-171-17.ap-northeast-1.compute.amazonaws.com.openvpn: UDP, length 98
08:21:41.195776 IP ip-192-168-75-233.ap-northeast-1.compute.internal.46802 > ec2-13-231-171-17.ap-northeast-1.compute.amazonaws.com.openvpn: UDP, length 98
08:21:41.197124 IP ip-192-168-75-233.ap-northeast-1.compute.internal.46802 > ec2-13-231-171-17.ap-northeast-1.compute.amazonaws.com.openvpn: UDP, length 113
08:21:41.197142 IP ip-192-168-75-233.ap-northeast-1.compute.internal.46802 > ec2-13-231-171-17.ap-northeast-1.compute.amazonaws.com.openvpn: UDP, length 113
08:21:41.197744 IP ip-192-168-75-233.ap-northeast-1.compute.internal.46802 > ec2-13-231-171-17.ap-northeast-1.compute.amazonaws.com.openvpn: UDP, length 689
08:21:41.197776 IP ip-192-168-75-233.ap-northeast-1.compute.internal.46802 > ec2-13-231-171-17.ap-northeast-1.compute.amazonaws.com.openvpn: UDP, length 854
08:21:41.239480 IP ec2-13-231-171-17.ap-northeast-1.compute.amazonaws.com.openvpn > ip-192-168-75-233.ap-northeast-1.compute.internal.46802: UDP, length 197
08:21:41.239533 IP ec2-13-231-171-17.ap-northeast-1.compute.amazonaws.com.openvpn > ip-192-168-75-233.ap-northeast-1.compute.internal.46802: UDP, length 179
08:21:41.239550 IP ec2-13-231-171-17.ap-northeast-1.compute.amazonaws.com.openvpn > ip-192-168-75-233.ap-northeast-1.compute.internal.46802: UDP, length 129
08:21:41.239577 IP ec2-13-231-171-17.ap-northeast-1.compute.amazonaws.com.openvpn > ip-192-168-75-233.ap-northeast-1.compute.internal.46802: UDP, length 114
08:21:41.241028 IP ip-192-168-75-233.ap-northeast-1.compute.internal.46802 > ec2-13-231-171-17.ap-northeast-1.compute.amazonaws.com.openvpn: UDP, length 853
08:21:41.241783 IP ec2-13-231-171-17.ap-northeast-1.compute.amazonaws.com.openvpn > ip-192-168-75-233.ap-northeast-1.compute.internal.46802: UDP, length 76
08:21:41.242085 IP ip-192-168-75-233.ap-northeast-1.compute.internal.46802 > ec2-13-231-171-17.ap-northeast-1.compute.amazonaws.com.openvpn: UDP, length 1409
08:21:41.285021 IP ec2-13-231-171-17.ap-northeast-1.compute.amazonaws.com.openvpn > ip-192-168-75-233.ap-northeast-1.compute.internal.46802: UDP, length 1409
08:21:41.285066 IP ec2-13-231-171-17.ap-northeast-1.compute.amazonaws.com.openvpn > ip-192-168-75-233.ap-northeast-1.compute.internal.46802: UDP, length 1409
