08:43:07.653383 Loopback, skipCount 0,  invalid (256)
08:43:09.738549 IP ip-192-168-75-233.ap-northeast-1.compute.internal.46802 > ec2-13-231-171-17.ap-northeast-1.compute.amazonaws.com.openvpn: UDP, length 115
08:43:09.738673 IP ip-192-168-75-233.ap-northeast-1.compute.internal.46802 > ec2-13-231-171-17.ap-northeast-1.compute.amazonaws.com.openvpn: UDP, length 115
08:43:09.738712 IP ip-192-168-75-233.ap-northeast-1.compute.internal.46802 > ec2-13-231-171-17.ap-northeast-1.compute.amazonaws.com.openvpn: UDP, length 115
08:43:09.738956 IP ip-192-168-75-233.ap-northeast-1.compute.internal.46802 > ec2-13-231-171-17.ap-northeast-1.compute.amazonaws.com.openvpn: UDP, length 100
08:43:09.738980 IP ip-192-168-75-233.ap-northeast-1.compute.internal.46802 > ec2-13-231-171-17.ap-northeast-1.compute.amazonaws.com.openvpn: UDP, length 76
08:43:09.739761 IP ip-192-168-75-233.ap-northeast-1.compute.internal.46802 > ec2-13-231-171-17.ap-northeast-1.compute.amazonaws.com.openvpn: UDP, length 100
08:43:09.739782 IP ip-192-168-75-233.ap-northeast-1.compute.internal.46802 > ec2-13-231-171-17.ap-northeast-1.compute.amazonaws.com.openvpn: UDP, length 76
08:43:09.740005 IP ip-192-168-75-233.ap-northeast-1.compute.internal.46802 > ec2-13-231-171-17.ap-northeast-1.compute.amazonaws.com.openvpn: UDP, length 100
08:43:09.740024 IP ip-192-168-75-233.ap-northeast-1.compute.internal.46802 > ec2-13-231-171-17.ap-northeast-1.compute.amazonaws.com.openvpn: UDP, length 76
08:43:09.785352 IP ec2-13-231-171-17.ap-northeast-1.compute.amazonaws.com.openvpn > ip-192-168-75-233.ap-northeast-1.compute.internal.46802: UDP, length 76
08:43:09.785353 IP ec2-13-231-171-17.ap-northeast-1.compute.amazonaws.com.openvpn > ip-192-168-75-233.ap-northeast-1.compute.internal.46802: UDP, length 76
08:43:09.785354 IP ec2-13-231-171-17.ap-northeast-1.compute.amazonaws.com.openvpn > ip-192-168-75-233.ap-northeast-1.compute.internal.46802: UDP, length 76
08:43:09.785483 IP ec2-13-231-171-17.ap-northeast-1.compute.amazonaws.com.openvpn > ip-192-168-75-233.ap-northeast-1.compute.internal.46802: UDP, length 76
08:43:09.785666 IP ip-192-168-75-233.ap-northeast-1.compute.internal.46802 > ec2-13-231-171-17.ap-northeast-1.compute.amazonaws.com.openvpn: UDP, length 76
08:43:09.785693 IP ip-192-168-75-233.ap-northeast-1.compute.internal.46802 > ec2-13-231-171-17.ap-northeast-1.compute.amazonaws.com.openvpn: UDP, length 76
08:43:09.787061 IP ec2-13-231-171-17.ap-northeast-1.compute.amazonaws.com.openvpn > ip-192-168-75-233.ap-northeast-1.compute.internal.46802: UDP, length 76
08:43:09.787063 IP ec2-13-231-171-17.ap-northeast-1.compute.amazonaws.com.openvpn > ip-192-168-75-233.ap-northeast-1.compute.internal.46802: UDP, length 76
08:43:09.787332 IP ip-192-168-75-233.ap-northeast-1.compute.internal.46802 > ec2-13-231-171-17.ap-northeast-1.compute.amazonaws.com.openvpn: UDP, length 76
08:43:10.664461 IP ip-192-168-75-233.ap-northeast-1.compute.internal.46802 > ec2-13-231-171-17.ap-northeast-1.compute.amazonaws.com.openvpn: UDP, length 96
08:43:10.709777 IP ec2-13-231-171-17.ap-northeast-1.compute.amazonaws.com.openvpn > ip-192-168-75-233.ap-northeast-1.compute.internal.46802: UDP, length 164
08:43:10.710276 IP ip-192-168-75-233.ap-northeast-1.compute.internal.46802 > ec2-13-231-171-17.ap-northeast-1.compute.amazonaws.com.openvpn: UDP, length 97
08:43:10.750278 IP ec2-13-231-171-17.ap-northeast-1.compute.amazonaws.com.openvpn > ip-192-168-75-233.ap-northeast-1.compute.internal.46802: UDP, length 160
08:43:13.063749 IP ip-192-168-75-233.ap-northeast-1.compute.internal.46802 > ec2-13-231-171-17.ap-northeast-1.compute.amazonaws.com.openvpn: UDP, length 76
08:43:13.107801 IP ec2-13-231-171-17.ap-northeast-1.compute.amazonaws.com.openvpn > ip-192-168-75-233.ap-northeast-1.compute.internal.46802: UDP, length 76
08:43:14.343652 IP ip-192-168-75-233.ap-northeast-1.compute.internal.46802 > ec2-13-231-171-17.ap-northeast-1.compute.amazonaws.com.openvpn: UDP, length 76
08:43:14.389441 IP ec2-13-231-171-17.ap-northeast-1.compute.amazonaws.com.openvpn > ip-192-168-75-233.ap-northeast-1.compute.internal.46802: UDP, length 76
08:43:14.855555 ARP, Request who-has ip-192-168-75-1.ap-northeast-1.compute.internal tell ip-192-168-75-233.ap-northeast-1.compute.internal, length 28
08:43:14.856328 ARP, Reply ip-192-168-75-1.ap-northeast-1.compute.internal is-at d0:96:fb:e7:bb:a2 (oui Unknown), length 46
08:43:15.740574 IP ip-192-168-75-233.ap-northeast-1.compute.internal.46802 > ec2-13-231-171-17.ap-northeast-1.compute.amazonaws.com.openvpn: UDP, length 115
08:43:15.740707 IP ip-192-168-75-233.ap-northeast-1.compute.internal.46802 > ec2-13-231-171-17.ap-northeast-1.compute.amazonaws.com.openvpn: UDP, length 100
08:43:15.740732 IP ip-192-168-75-233.ap-northeast-1.compute.internal.46802 > ec2-13-231-171-17.ap-northeast-1.compute.amazonaws.com.openvpn: UDP, length 76
08:43:15.781145 IP ec2-13-231-171-17.ap-northeast-1.compute.amazonaws.com.openvpn > ip-192-168-75-233.ap-northeast-1.compute.internal.46802: UDP, length 76
08:43:15.781821 IP ec2-13-231-171-17.ap-northeast-1.compute.amazonaws.com.openvpn > ip-192-168-75-233.ap-northeast-1.compute.internal.46802: UDP, length 76
08:43:15.781908 IP ip-192-168-75-233.ap-northeast-1.compute.internal.46802 > ec2-13-231-171-17.ap-northeast-1.compute.amazonaws.com.openvpn: UDP, length 76
08:43:15.783528 IP ip-192-168-75-233.ap-northeast-1.compute.internal.46802 > ec2-13-231-171-17.ap-northeast-1.compute.amazonaws.com.openvpn: UDP, length 95
08:43:15.825208 IP ec2-13-231-171-17.ap-northeast-1.compute.amazonaws.com.openvpn > ip-192-168-75-233.ap-northeast-1.compute.internal.46802: UDP, length 156
08:43:16.256489 IP ip-192-168-75-66.ap-northeast-1.compute.internal.mdns > mdns.mcast.net.mdns: 0 A (QM)? e566f778-1b61-7791-f517-6881acc41d6b.local. (60)
08:43:16.256554 IP6 fe80::bff0:8a76:6922:be9a.mdns > ff02::fb.mdns: 0 A (QM)? e566f778-1b61-7791-f517-6881acc41d6b.local. (60)
08:43:16.256652 IP ip-192-168-75-66.ap-northeast-1.compute.internal.mdns > mdns.mcast.net.mdns: 0*- [0q] 1/0/0 (Cache flush) A 192.168.75.66 (70)
08:43:16.807768 IP ip-192-168-75-233.ap-northeast-1.compute.internal.46802 > ec2-13-231-171-17.ap-northeast-1.compute.amazonaws.com.openvpn: UDP, length 94
08:43:16.852719 IP ec2-13-231-171-17.ap-northeast-1.compute.amazonaws.com.openvpn > ip-192-168-75-233.ap-northeast-1.compute.internal.46802: UDP, length 122
08:43:16.852948 IP ip-192-168-75-233.ap-northeast-1.compute.internal.46802 > ec2-13-231-171-17.ap-northeast-1.compute.amazonaws.com.openvpn: UDP, length 96
08:43:16.892736 IP ec2-13-231-171-17.ap-northeast-1.compute.amazonaws.com.openvpn > ip-192-168-75-233.ap-northeast-1.compute.internal.46802: UDP, length 158
08:43:16.893084 IP ip-192-168-75-233.ap-northeast-1.compute.internal.46802 > ec2-13-231-171-17.ap-northeast-1.compute.amazonaws.com.openvpn: UDP, length 142
08:43:16.933006 IP ec2-13-231-171-17.ap-northeast-1.compute.amazonaws.com.openvpn > ip-192-168-75-233.ap-northeast-1.compute.internal.46802: UDP, length 206
08:43:16.933437 IP ip-192-168-75-233.ap-northeast-1.compute.internal.46802 > ec2-13-231-171-17.ap-northeast-1.compute.amazonaws.com.openvpn: UDP, length 142
08:43:16.975141 IP ec2-13-231-171-17.ap-northeast-1.compute.amazonaws.com.openvpn > ip-192-168-75-233.ap-northeast-1.compute.internal.46802: UDP, length 201
08:43:16.988666 IP ip-192-168-75-66.ap-northeast-1.compute.internal.mdns > mdns.mcast.net.mdns: 0 AAAA (QM)? e566f778-1b61-7791-f517-6881acc41d6b.local. (60)
08:43:16.988811 IP6 fe80::bff0:8a76:6922:be9a.mdns > ff02::fb.mdns: 0 AAAA (QM)? e566f778-1b61-7791-f517-6881acc41d6b.local. (60)
08:43:16.989477 IP6 fe80::bff0:8a76:6922:be9a.mdns > ff02::fb.mdns: 0*- [0q] 1/0/0 (Cache flush) AAAA fe80::bff0:8a76:6922:be9a (82)
08:43:17.676562 Loopback, skipCount 0,  invalid (256)
08:43:18.046111 IP ip-192-168-75-66.ap-northeast-1.compute.internal.mdns > mdns.mcast.net.mdns: 0 SRV (QM)? bid-at200-e566f7781b617791f5176881acc41d6b._googlecast._tcp.local. (83)
08:43:18.046112 IP6 fe80::bff0:8a76:6922:be9a.mdns > ff02::fb.mdns: 0 SRV (QM)? bid-at200-e566f7781b617791f5176881acc41d6b._googlecast._tcp.local. (83)
08:43:18.046442 IP ip-192-168-75-66.ap-northeast-1.compute.internal.mdns > mdns.mcast.net.mdns: 0*- [0q] 1/0/1 (Cache flush) SRV e566f778-1b61-7791-f517-6881acc41d6b.local.:8009 0 0 (150)
08:43:18.047309 IP6 fe80::bff0:8a76:6922:be9a.mdns > ff02::fb.mdns: 0*- [0q] 1/0/1 (Cache flush) SRV e566f778-1b61-7791-f517-6881acc41d6b.local.:8009 0 0 (162)
08:43:18.415279 IP ip-192-168-75-233.ap-northeast-1.compute.internal.46802 > ec2-13-231-171-17.ap-northeast-1.compute.amazonaws.com.openvpn: UDP, length 115
08:43:18.462689 IP ec2-13-231-171-17.ap-northeast-1.compute.amazonaws.com.openvpn > ip-192-168-75-233.ap-northeast-1.compute.internal.46802: UDP, length 115
08:43:18.491179 IP ip-192-168-75-66.ap-northeast-1.compute.internal.mdns > mdns.mcast.net.mdns: 0 PTR (QM)? _googlecast._tcp.local. (40)
08:43:18.491180 IP6 fe80::bff0:8a76:6922:be9a.mdns > ff02::fb.mdns: 0 PTR (QM)? _googlecast._tcp.local. (40)
08:43:18.491639 IP ip-192-168-75-66.ap-northeast-1.compute.internal.mdns > mdns.mcast.net.mdns: 0*- [0q] 1/0/3 PTR BID-AT200-e566f7781b617791f5176881acc41d6b._googlecast._tcp.local. (369)
08:43:18.492281 IP6 fe80::bff0:8a76:6922:be9a.mdns > ff02::fb.mdns: 0*- [0q] 1/0/3 PTR BID-AT200-e566f7781b617791f5176881acc41d6b._googlecast._tcp.local. (381)
08:43:18.503689 IP ip-192-168-75-233.ap-northeast-1.compute.internal.46802 > ec2-13-231-171-17.ap-northeast-1.compute.amazonaws.com.openvpn: UDP, length 76
08:43:18.741754 IP ip-192-168-75-233.ap-northeast-1.compute.internal.46802 > ec2-13-231-171-17.ap-northeast-1.compute.amazonaws.com.openvpn: UDP, length 115
08:43:18.741954 IP ip-192-168-75-233.ap-northeast-1.compute.internal.46802 > ec2-13-231-171-17.ap-northeast-1.compute.amazonaws.com.openvpn: UDP, length 100
08:43:18.741979 IP ip-192-168-75-233.ap-northeast-1.compute.internal.46802 > ec2-13-231-171-17.ap-northeast-1.compute.amazonaws.com.openvpn: UDP, length 76
08:43:18.788699 IP ec2-13-231-171-17.ap-northeast-1.compute.amazonaws.com.openvpn > ip-192-168-75-233.ap-northeast-1.compute.internal.46802: UDP, length 76
08:43:18.788700 IP ec2-13-231-171-17.ap-northeast-1.compute.amazonaws.com.openvpn > ip-192-168-75-233.ap-northeast-1.compute.internal.46802: UDP, length 76
08:43:18.788912 IP ip-192-168-75-233.ap-northeast-1.compute.internal.46802 > ec2-13-231-171-17.ap-northeast-1.compute.amazonaws.com.openvpn: UDP, length 76
08:43:18.790551 IP ec2-13-231-171-17.ap-northeast-1.compute.amazonaws.com.openvpn > ip-192-168-75-233.ap-northeast-1.compute.internal.46802: UDP, length 76
08:43:20.973893 IP ip-192-168-75-1.ap-northeast-1.compute.internal > all-systems.mcast.net: igmp query v2
08:43:21.742402 IP ip-192-168-75-233.ap-northeast-1.compute.internal.46802 > ec2-13-231-171-17.ap-northeast-1.compute.amazonaws.com.openvpn: UDP, length 115
08:43:21.742452 IP ip-192-168-75-233.ap-northeast-1.compute.internal.46802 > ec2-13-231-171-17.ap-northeast-1.compute.amazonaws.com.openvpn: UDP, length 115
08:43:21.742697 IP ip-192-168-75-233.ap-northeast-1.compute.internal.46802 > ec2-13-231-171-17.ap-northeast-1.compute.amazonaws.com.openvpn: UDP, length 100
08:43:21.742730 IP ip-192-168-75-233.ap-northeast-1.compute.internal.46802 > ec2-13-231-171-17.ap-northeast-1.compute.amazonaws.com.openvpn: UDP, length 76
08:43:21.742979 IP ip-192-168-75-233.ap-northeast-1.compute.internal.46802 > ec2-13-231-171-17.ap-northeast-1.compute.amazonaws.com.openvpn: UDP, length 100
08:43:21.743009 IP ip-192-168-75-233.ap-northeast-1.compute.internal.46802 > ec2-13-231-171-17.ap-northeast-1.compute.amazonaws.com.openvpn: UDP, length 76
08:43:21.789448 IP ec2-13-231-171-17.ap-northeast-1.compute.amazonaws.com.openvpn > ip-192-168-75-233.ap-northeast-1.compute.internal.46802: UDP, length 76
08:43:21.789450 IP ec2-13-231-171-17.ap-northeast-1.compute.amazonaws.com.openvpn > ip-192-168-75-233.ap-northeast-1.compute.internal.46802: UDP, length 76
08:43:21.789451 IP ec2-13-231-171-17.ap-northeast-1.compute.amazonaws.com.openvpn > ip-192-168-75-233.ap-northeast-1.compute.internal.46802: UDP, length 76
08:43:21.789451 IP ec2-13-231-171-17.ap-northeast-1.compute.amazonaws.com.openvpn > ip-192-168-75-233.ap-northeast-1.compute.internal.46802: UDP, length 76
08:43:21.789748 IP ip-192-168-75-233.ap-northeast-1.compute.internal.46802 > ec2-13-231-171-17.ap-northeast-1.compute.amazonaws.com.openvpn: UDP, length 76
08:43:21.789775 IP ip-192-168-75-233.ap-northeast-1.compute.internal.46802 > ec2-13-231-171-17.ap-northeast-1.compute.amazonaws.com.openvpn: UDP, length 76
08:43:21.927834 IP ip-192-168-75-233.ap-northeast-1.compute.internal.46802 > ec2-13-231-171-17.ap-northeast-1.compute.amazonaws.com.openvpn: UDP, length 92
08:43:21.967982 IP ec2-13-231-171-17.ap-northeast-1.compute.amazonaws.com.openvpn > ip-192-168-75-233.ap-northeast-1.compute.internal.46802: UDP, length 127
08:43:23.303664 IP ip-192-168-75-233.ap-northeast-1.compute.internal.46802 > ec2-13-231-171-17.ap-northeast-1.compute.amazonaws.com.openvpn: UDP, length 76
08:43:23.347579 IP ec2-13-231-171-17.ap-northeast-1.compute.amazonaws.com.openvpn > ip-192-168-75-233.ap-northeast-1.compute.internal.46802: UDP, length 76
08:43:24.583709 IP ip-192-168-75-233.ap-northeast-1.compute.internal.46802 > ec2-13-231-171-17.ap-northeast-1.compute.amazonaws.com.openvpn: UDP, length 76
08:43:24.627587 IP ec2-13-231-171-17.ap-northeast-1.compute.amazonaws.com.openvpn > ip-192-168-75-233.ap-northeast-1.compute.internal.46802: UDP, length 76
08:43:26.415901 IP ip-192-168-75-233.ap-northeast-1.compute.internal.46802 > ec2-13-231-171-17.ap-northeast-1.compute.amazonaws.com.openvpn: UDP, length 122
08:43:26.415950 IP ip-192-168-75-233.ap-northeast-1.compute.internal.46802 > ec2-13-231-171-17.ap-northeast-1.compute.amazonaws.com.openvpn: UDP, length 115
08:43:26.461553 IP ec2-13-231-171-17.ap-northeast-1.compute.amazonaws.com.openvpn > ip-192-168-75-233.ap-northeast-1.compute.internal.46802: UDP, length 76
08:43:26.461554 IP ec2-13-231-171-17.ap-northeast-1.compute.amazonaws.com.openvpn > ip-192-168-75-233.ap-northeast-1.compute.internal.46802: UDP, length 115
08:43:26.503662 IP ip-192-168-75-233.ap-northeast-1.compute.internal.46802 > ec2-13-231-171-17.ap-northeast-1.compute.amazonaws.com.openvpn: UDP, length 76
08:43:26.565263 IP ec2-13-231-171-17.ap-northeast-1.compute.amazonaws.com.openvpn > ip-192-168-75-233.ap-northeast-1.compute.internal.46802: UDP, length 76
08:43:26.565264 IP ec2-13-231-171-17.ap-northeast-1.compute.amazonaws.com.openvpn > ip-192-168-75-233.ap-northeast-1.compute.internal.46802: UDP, length 122
08:43:26.565483 IP ip-192-168-75-233.ap-northeast-1.compute.internal.46802 > ec2-13-231-171-17.ap-northeast-1.compute.amazonaws.com.openvpn: UDP, length 76
08:43:27.701738 Loopback, skipCount 0,  invalid (256)
08:43:31.416661 IP ip-192-168-75-233.ap-northeast-1.compute.internal.46802 > ec2-13-231-171-17.ap-northeast-1.compute.amazonaws.com.openvpn: UDP, length 115
08:43:31.462019 IP ec2-13-231-171-17.ap-northeast-1.compute.amazonaws.com.openvpn > ip-192-168-75-233.ap-northeast-1.compute.internal.46802: UDP, length 115
08:43:31.503755 IP ip-192-168-75-233.ap-northeast-1.compute.internal.46802 > ec2-13-231-171-17.ap-northeast-1.compute.amazonaws.com.openvpn: UDP, length 76
08:43:32.416990 IP ip-192-168-75-233.ap-northeast-1.compute.internal.46802 > ec2-13-231-171-17.ap-northeast-1.compute.amazonaws.com.openvpn: UDP, length 115
08:43:32.417030 IP ip-192-168-75-233.ap-northeast-1.compute.internal.46802 > ec2-13-231-171-17.ap-northeast-1.compute.amazonaws.com.openvpn: UDP, length 115
08:43:32.417061 IP ip-192-168-75-233.ap-northeast-1.compute.internal.46802 > ec2-13-231-171-17.ap-northeast-1.compute.amazonaws.com.openvpn: UDP, length 115
08:43:32.460000 IP ec2-13-231-171-17.ap-northeast-1.compute.amazonaws.com.openvpn > ip-192-168-75-233.ap-northeast-1.compute.internal.46802: UDP, length 76
08:43:32.460001 IP ec2-13-231-171-17.ap-northeast-1.compute.amazonaws.com.openvpn > ip-192-168-75-233.ap-northeast-1.compute.internal.46802: UDP, length 76
08:43:32.460042 IP ec2-13-231-171-17.ap-northeast-1.compute.amazonaws.com.openvpn > ip-192-168-75-233.ap-northeast-1.compute.internal.46802: UDP, length 115
08:43:32.460043 IP ec2-13-231-171-17.ap-northeast-1.compute.amazonaws.com.openvpn > ip-192-168-75-233.ap-northeast-1.compute.internal.46802: UDP, length 115
08:43:32.460201 IP ip-192-168-75-233.ap-northeast-1.compute.internal.46802 > ec2-13-231-171-17.ap-northeast-1.compute.amazonaws.com.openvpn: UDP, length 76
08:43:32.461667 IP ec2-13-231-171-17.ap-northeast-1.compute.amazonaws.com.openvpn > ip-192-168-75-233.ap-northeast-1.compute.internal.46802: UDP, length 76
08:43:32.461696 IP ec2-13-231-171-17.ap-northeast-1.compute.amazonaws.com.openvpn > ip-192-168-75-233.ap-northeast-1.compute.internal.46802: UDP, length 115
08:43:32.461801 IP ip-192-168-75-233.ap-northeast-1.compute.internal.46802 > ec2-13-231-171-17.ap-northeast-1.compute.amazonaws.com.openvpn: UDP, length 76
08:43:32.503289 IP ip-192-168-75-233.ap-northeast-1.compute.internal.46802 > ec2-13-231-171-17.ap-northeast-1.compute.amazonaws.com.openvpn: UDP, length 76
08:43:33.417359 IP ip-192-168-75-233.ap-northeast-1.compute.internal.46802 > ec2-13-231-171-17.ap-northeast-1.compute.amazonaws.com.openvpn: UDP, length 115
08:43:33.417394 IP ip-192-168-75-233.ap-northeast-1.compute.internal.46802 > ec2-13-231-171-17.ap-northeast-1.compute.amazonaws.com.openvpn: UDP, length 115
08:43:33.461578 IP ec2-13-231-171-17.ap-northeast-1.compute.amazonaws.com.openvpn > ip-192-168-75-233.ap-northeast-1.compute.internal.46802: UDP, length 115
08:43:33.461685 IP ec2-13-231-171-17.ap-northeast-1.compute.amazonaws.com.openvpn > ip-192-168-75-233.ap-northeast-1.compute.internal.46802: UDP, length 115
08:43:33.461721 IP ip-192-168-75-233.ap-northeast-1.compute.internal.46802 > ec2-13-231-171-17.ap-northeast-1.compute.amazonaws.com.openvpn: UDP, length 76
08:43:33.503427 IP ip-192-168-75-233.ap-northeast-1.compute.internal.46802 > ec2-13-231-171-17.ap-northeast-1.compute.amazonaws.com.openvpn: UDP, length 76
08:43:33.543283 IP ip-192-168-75-233.ap-northeast-1.compute.internal.46802 > ec2-13-231-171-17.ap-northeast-1.compute.amazonaws.com.openvpn: UDP, length 76
08:43:33.583590 IP ec2-13-231-171-17.ap-northeast-1.compute.amazonaws.com.openvpn > ip-192-168-75-233.ap-northeast-1.compute.internal.46802: UDP, length 76
08:43:33.743792 IP ip-192-168-75-233.ap-northeast-1.compute.internal.46802 > ec2-13-231-171-17.ap-northeast-1.compute.amazonaws.com.openvpn: UDP, length 115
08:43:33.743966 IP ip-192-168-75-233.ap-northeast-1.compute.internal.46802 > ec2-13-231-171-17.ap-northeast-1.compute.amazonaws.com.openvpn: UDP, length 100
08:43:33.743986 IP ip-192-168-75-233.ap-northeast-1.compute.internal.46802 > ec2-13-231-171-17.ap-northeast-1.compute.amazonaws.com.openvpn: UDP, length 76
08:43:33.785718 IP ec2-13-231-171-17.ap-northeast-1.compute.amazonaws.com.openvpn > ip-192-168-75-233.ap-northeast-1.compute.internal.46802: UDP, length 76
08:43:33.786315 IP ec2-13-231-171-17.ap-northeast-1.compute.amazonaws.com.openvpn > ip-192-168-75-233.ap-northeast-1.compute.internal.46802: UDP, length 76
08:43:33.786390 IP ip-192-168-75-233.ap-northeast-1.compute.internal.46802 > ec2-13-231-171-17.ap-northeast-1.compute.amazonaws.com.openvpn: UDP, length 76
08:43:34.823342 IP ip-192-168-75-233.ap-northeast-1.compute.internal.46802 > ec2-13-231-171-17.ap-northeast-1.compute.amazonaws.com.openvpn: UDP, length 76
08:43:34.866026 IP ec2-13-231-171-17.ap-northeast-1.compute.amazonaws.com.openvpn > ip-192-168-75-233.ap-northeast-1.compute.internal.46802: UDP, length 76
08:43:37.725956 Loopback, skipCount 0,  invalid (256)
08:43:43.418552 IP ip-192-168-75-233.ap-northeast-1.compute.internal.46802 > ec2-13-231-171-17.ap-northeast-1.compute.amazonaws.com.openvpn: UDP, length 115
08:43:43.466141 IP ec2-13-231-171-17.ap-northeast-1.compute.amazonaws.com.openvpn > ip-192-168-75-233.ap-northeast-1.compute.internal.46802: UDP, length 115
08:43:43.466336 IP ip-192-168-75-233.ap-northeast-1.compute.internal.46802 > ec2-13-231-171-17.ap-northeast-1.compute.amazonaws.com.openvpn: UDP, length 76
08:43:43.745079 IP ip-192-168-75-233.ap-northeast-1.compute.internal.46802 > ec2-13-231-171-17.ap-northeast-1.compute.amazonaws.com.openvpn: UDP, length 115
08:43:43.745121 IP ip-192-168-75-233.ap-northeast-1.compute.internal.46802 > ec2-13-231-171-17.ap-northeast-1.compute.amazonaws.com.openvpn: UDP, length 115
08:43:43.745305 IP ip-192-168-75-233.ap-northeast-1.compute.internal.46802 > ec2-13-231-171-17.ap-northeast-1.compute.amazonaws.com.openvpn: UDP, length 100
08:43:43.745338 IP ip-192-168-75-233.ap-northeast-1.compute.internal.46802 > ec2-13-231-171-17.ap-northeast-1.compute.amazonaws.com.openvpn: UDP, length 76
08:43:43.745582 IP ip-192-168-75-233.ap-northeast-1.compute.internal.46802 > ec2-13-231-171-17.ap-northeast-1.compute.amazonaws.com.openvpn: UDP, length 100
08:43:43.745612 IP ip-192-168-75-233.ap-northeast-1.compute.internal.46802 > ec2-13-231-171-17.ap-northeast-1.compute.amazonaws.com.openvpn: UDP, length 76
08:43:43.783427 IP ip-192-168-75-233.ap-northeast-1.compute.internal.46802 > ec2-13-231-171-17.ap-northeast-1.compute.amazonaws.com.openvpn: UDP, length 76
08:43:43.789322 IP ec2-13-231-171-17.ap-northeast-1.compute.amazonaws.com.openvpn > ip-192-168-75-233.ap-northeast-1.compute.internal.46802: UDP, length 76
08:43:43.789497 IP ec2-13-231-171-17.ap-northeast-1.compute.amazonaws.com.openvpn > ip-192-168-75-233.ap-northeast-1.compute.internal.46802: UDP, length 76
08:43:43.789577 IP ip-192-168-75-233.ap-northeast-1.compute.internal.46802 > ec2-13-231-171-17.ap-northeast-1.compute.amazonaws.com.openvpn: UDP, length 76
08:43:43.790534 IP ec2-13-231-171-17.ap-northeast-1.compute.amazonaws.com.openvpn > ip-192-168-75-233.ap-northeast-1.compute.internal.46802: UDP, length 76
08:43:43.790536 IP ec2-13-231-171-17.ap-northeast-1.compute.amazonaws.com.openvpn > ip-192-168-75-233.ap-northeast-1.compute.internal.46802: UDP, length 76
08:43:43.790705 IP ip-192-168-75-233.ap-northeast-1.compute.internal.46802 > ec2-13-231-171-17.ap-northeast-1.compute.amazonaws.com.openvpn: UDP, length 76
08:43:43.823954 IP ec2-13-231-171-17.ap-northeast-1.compute.amazonaws.com.openvpn > ip-192-168-75-233.ap-northeast-1.compute.internal.46802: UDP, length 76
08:43:45.063470 IP ip-192-168-75-233.ap-northeast-1.compute.internal.46802 > ec2-13-231-171-17.ap-northeast-1.compute.amazonaws.com.openvpn: UDP, length 76
08:43:45.106321 IP ec2-13-231-171-17.ap-northeast-1.compute.amazonaws.com.openvpn > ip-192-168-75-233.ap-northeast-1.compute.internal.46802: UDP, length 76
08:43:46.419571 IP ip-192-168-75-233.ap-northeast-1.compute.internal.46802 > ec2-13-231-171-17.ap-northeast-1.compute.amazonaws.com.openvpn: UDP, length 115
08:43:46.464912 IP ec2-13-231-171-17.ap-northeast-1.compute.amazonaws.com.openvpn > ip-192-168-75-233.ap-northeast-1.compute.internal.46802: UDP, length 76
08:43:46.464944 IP ec2-13-231-171-17.ap-northeast-1.compute.amazonaws.com.openvpn > ip-192-168-75-233.ap-northeast-1.compute.internal.46802: UDP, length 115
08:43:46.507301 IP ip-192-168-75-233.ap-northeast-1.compute.internal.46802 > ec2-13-231-171-17.ap-northeast-1.compute.amazonaws.com.openvpn: UDP, length 76
08:43:47.750200 Loopback, skipCount 0,  invalid (256)
08:43:51.745652 IP ip-192-168-75-233.ap-northeast-1.compute.internal.46802 > ec2-13-231-171-17.ap-northeast-1.compute.amazonaws.com.openvpn: UDP, length 115
08:43:51.745717 IP ip-192-168-75-233.ap-northeast-1.compute.internal.46802 > ec2-13-231-171-17.ap-northeast-1.compute.amazonaws.com.openvpn: UDP, length 100
08:43:51.745734 IP ip-192-168-75-233.ap-northeast-1.compute.internal.46802 > ec2-13-231-171-17.ap-northeast-1.compute.amazonaws.com.openvpn: UDP, length 76
08:43:51.789626 IP ec2-13-231-171-17.ap-northeast-1.compute.amazonaws.com.openvpn > ip-192-168-75-233.ap-northeast-1.compute.internal.46802: UDP, length 76
08:43:51.789627 IP ec2-13-231-171-17.ap-northeast-1.compute.amazonaws.com.openvpn > ip-192-168-75-233.ap-northeast-1.compute.internal.46802: UDP, length 76
08:43:51.789815 IP ip-192-168-75-233.ap-northeast-1.compute.internal.46802 > ec2-13-231-171-17.ap-northeast-1.compute.amazonaws.com.openvpn: UDP, length 76
08:43:52.421090 IP ip-192-168-75-233.ap-northeast-1.compute.internal.46802 > ec2-13-231-171-17.ap-northeast-1.compute.amazonaws.com.openvpn: UDP, length 115
08:43:52.461880 IP ec2-13-231-171-17.ap-northeast-1.compute.amazonaws.com.openvpn > ip-192-168-75-233.ap-northeast-1.compute.internal.46802: UDP, length 115
08:43:52.462116 IP ip-192-168-75-233.ap-northeast-1.compute.internal.46802 > ec2-13-231-171-17.ap-northeast-1.compute.amazonaws.com.openvpn: UDP, length 76
08:43:54.023685 IP ip-192-168-75-233.ap-northeast-1.compute.internal.46802 > ec2-13-231-171-17.ap-northeast-1.compute.amazonaws.com.openvpn: UDP, length 76
08:43:54.066443 IP ec2-13-231-171-17.ap-northeast-1.compute.amazonaws.com.openvpn > ip-192-168-75-233.ap-northeast-1.compute.internal.46802: UDP, length 76
08:43:54.746347 IP ip-192-168-75-233.ap-northeast-1.compute.internal.46802 > ec2-13-231-171-17.ap-northeast-1.compute.amazonaws.com.openvpn: UDP, length 115
08:43:54.746429 IP ip-192-168-75-233.ap-northeast-1.compute.internal.46802 > ec2-13-231-171-17.ap-northeast-1.compute.amazonaws.com.openvpn: UDP, length 100
08:43:54.746442 IP ip-192-168-75-233.ap-northeast-1.compute.internal.46802 > ec2-13-231-171-17.ap-northeast-1.compute.amazonaws.com.openvpn: UDP, length 76
08:43:54.792314 IP ec2-13-231-171-17.ap-northeast-1.compute.amazonaws.com.openvpn > ip-192-168-75-233.ap-northeast-1.compute.internal.46802: UDP, length 76
08:43:54.792315 IP ec2-13-231-171-17.ap-northeast-1.compute.amazonaws.com.openvpn > ip-192-168-75-233.ap-northeast-1.compute.internal.46802: UDP, length 76
08:43:54.792506 IP ip-192-168-75-233.ap-northeast-1.compute.internal.46802 > ec2-13-231-171-17.ap-northeast-1.compute.amazonaws.com.openvpn: UDP, length 76
08:43:54.794109 IP ec2-13-231-171-17.ap-northeast-1.compute.amazonaws.com.openvpn > ip-192-168-75-233.ap-northeast-1.compute.internal.46802: UDP, length 76
08:43:55.303696 IP ip-192-168-75-233.ap-northeast-1.compute.internal.46802 > ec2-13-231-171-17.ap-northeast-1.compute.amazonaws.com.openvpn: UDP, length 76
08:43:55.346068 IP ec2-13-231-171-17.ap-northeast-1.compute.amazonaws.com.openvpn > ip-192-168-75-233.ap-northeast-1.compute.internal.46802: UDP, length 76
08:43:55.747069 IP ip-192-168-75-233.ap-northeast-1.compute.internal.46802 > ec2-13-231-171-17.ap-northeast-1.compute.amazonaws.com.openvpn: UDP, length 115
08:43:55.747275 IP ip-192-168-75-233.ap-northeast-1.compute.internal.46802 > ec2-13-231-171-17.ap-northeast-1.compute.amazonaws.com.openvpn: UDP, length 100
08:43:55.747293 IP ip-192-168-75-233.ap-northeast-1.compute.internal.46802 > ec2-13-231-171-17.ap-northeast-1.compute.amazonaws.com.openvpn: UDP, length 76
08:43:55.792024 IP ec2-13-231-171-17.ap-northeast-1.compute.amazonaws.com.openvpn > ip-192-168-75-233.ap-northeast-1.compute.internal.46802: UDP, length 76
08:43:55.792067 IP ec2-13-231-171-17.ap-northeast-1.compute.amazonaws.com.openvpn > ip-192-168-75-233.ap-northeast-1.compute.internal.46802: UDP, length 76
08:43:55.792262 IP ip-192-168-75-233.ap-northeast-1.compute.internal.46802 > ec2-13-231-171-17.ap-northeast-1.compute.amazonaws.com.openvpn: UDP, length 76
08:43:55.793397 IP ec2-13-231-171-17.ap-northeast-1.compute.amazonaws.com.openvpn > ip-192-168-75-233.ap-northeast-1.compute.internal.46802: UDP, length 76
08:43:56.839233 ARP, Request who-has ip-192-168-75-1.ap-northeast-1.compute.internal tell ip-192-168-75-233.ap-northeast-1.compute.internal, length 28
08:43:56.840578 ARP, Reply ip-192-168-75-1.ap-northeast-1.compute.internal is-at d0:96:fb:e7:bb:a2 (oui Unknown), length 46
08:43:57.773287 Loopback, skipCount 0,  invalid (256)
08:44:00.067448 IP ip-192-168-75-233.ap-northeast-1.compute.internal.46802 > ec2-13-231-171-17.ap-northeast-1.compute.amazonaws.com.openvpn: UDP, length 80
08:44:00.067477 IP ip-192-168-75-233.ap-northeast-1.compute.internal.46802 > ec2-13-231-171-17.ap-northeast-1.compute.amazonaws.com.openvpn: UDP, length 80
08:44:00.113658 IP ec2-13-231-171-17.ap-northeast-1.compute.amazonaws.com.openvpn > ip-192-168-75-233.ap-northeast-1.compute.internal.46802: UDP, length 96
08:44:00.113694 IP ec2-13-231-171-17.ap-northeast-1.compute.amazonaws.com.openvpn > ip-192-168-75-233.ap-northeast-1.compute.internal.46802: UDP, length 164
08:44:00.114166 IP ip-192-168-75-233.ap-northeast-1.compute.internal.46802 > ec2-13-231-171-17.ap-northeast-1.compute.amazonaws.com.openvpn: UDP, length 84
08:44:00.155272 IP ec2-13-231-171-17.ap-northeast-1.compute.amazonaws.com.openvpn > ip-192-168-75-233.ap-northeast-1.compute.internal.46802: UDP, length 84
08:44:00.155551 IP ip-192-168-75-233.ap-northeast-1.compute.internal.46802 > ec2-13-231-171-17.ap-northeast-1.compute.amazonaws.com.openvpn: UDP, length 76
08:44:00.231078 IP ip-192-168-75-233.ap-northeast-1.compute.internal.46802 > ec2-13-231-171-17.ap-northeast-1.compute.amazonaws.com.openvpn: UDP, length 475
08:44:00.273660 IP ec2-13-231-171-17.ap-northeast-1.compute.amazonaws.com.openvpn > ip-192-168-75-233.ap-northeast-1.compute.internal.46802: UDP, length 1350
08:44:00.273692 IP ec2-13-231-171-17.ap-northeast-1.compute.amazonaws.com.openvpn > ip-192-168-75-233.ap-northeast-1.compute.internal.46802: UDP, length 1350
08:44:00.273709 IP ec2-13-231-171-17.ap-northeast-1.compute.amazonaws.com.openvpn > ip-192-168-75-233.ap-northeast-1.compute.internal.46802: UDP, length 1062
08:44:00.273865 IP ip-192-168-75-233.ap-northeast-1.compute.internal.46802 > ec2-13-231-171-17.ap-northeast-1.compute.amazonaws.com.openvpn: UDP, length 76
08:44:00.273883 IP ip-192-168-75-233.ap-northeast-1.compute.internal.46802 > ec2-13-231-171-17.ap-northeast-1.compute.amazonaws.com.openvpn: UDP, length 76
08:44:00.273896 IP ip-192-168-75-233.ap-northeast-1.compute.internal.46802 > ec2-13-231-171-17.ap-northeast-1.compute.amazonaws.com.openvpn: UDP, length 76
08:44:00.274028 IP ip-192-168-75-233.ap-northeast-1.compute.internal.46802 > ec2-13-231-171-17.ap-northeast-1.compute.amazonaws.com.openvpn: UDP, length 82
08:44:00.274345 IP ip-192-168-75-233.ap-northeast-1.compute.internal.46802 > ec2-13-231-171-17.ap-northeast-1.compute.amazonaws.com.openvpn: UDP, length 134
08:44:00.276854 IP ip-192-168-75-233.ap-northeast-1.compute.internal.46802 > ec2-13-231-171-17.ap-northeast-1.compute.amazonaws.com.openvpn: UDP, length 162
08:44:00.276876 IP ip-192-168-75-233.ap-northeast-1.compute.internal.46802 > ec2-13-231-171-17.ap-northeast-1.compute.amazonaws.com.openvpn: UDP, length 234
08:44:00.316859 IP ec2-13-231-171-17.ap-northeast-1.compute.amazonaws.com.openvpn > ip-192-168-75-233.ap-northeast-1.compute.internal.46802: UDP, length 76
08:44:00.316892 IP ec2-13-231-171-17.ap-northeast-1.compute.amazonaws.com.openvpn > ip-192-168-75-233.ap-northeast-1.compute.internal.46802: UDP, length 155
08:44:00.316946 IP ec2-13-231-171-17.ap-northeast-1.compute.amazonaws.com.openvpn > ip-192-168-75-233.ap-northeast-1.compute.internal.46802: UDP, length 155
08:44:00.317006 IP ip-192-168-75-233.ap-northeast-1.compute.internal.46802 > ec2-13-231-171-17.ap-northeast-1.compute.amazonaws.com.openvpn: UDP, length 76
08:44:00.318968 IP ec2-13-231-171-17.ap-northeast-1.compute.amazonaws.com.openvpn > ip-192-168-75-233.ap-northeast-1.compute.internal.46802: UDP, length 140
08:44:00.319133 IP ip-192-168-75-233.ap-northeast-1.compute.internal.46802 > ec2-13-231-171-17.ap-northeast-1.compute.amazonaws.com.openvpn: UDP, length 107
08:44:00.360902 IP ec2-13-231-171-17.ap-northeast-1.compute.amazonaws.com.openvpn > ip-192-168-75-233.ap-northeast-1.compute.internal.46802: UDP, length 76
08:44:00.360921 IP ec2-13-231-171-17.ap-northeast-1.compute.amazonaws.com.openvpn > ip-192-168-75-233.ap-northeast-1.compute.internal.46802: UDP, length 76
08:44:00.494314 IP ec2-13-231-171-17.ap-northeast-1.compute.amazonaws.com.openvpn > ip-192-168-75-233.ap-northeast-1.compute.internal.46802: UDP, length 377
08:44:00.535671 IP ip-192-168-75-233.ap-northeast-1.compute.internal.46802 > ec2-13-231-171-17.ap-northeast-1.compute.amazonaws.com.openvpn: UDP, length 76
08:44:00.748192 IP ip-192-168-75-233.ap-northeast-1.compute.internal.46802 > ec2-13-231-171-17.ap-northeast-1.compute.amazonaws.com.openvpn: UDP, length 115
08:44:00.748227 IP ip-192-168-75-233.ap-northeast-1.compute.internal.46802 > ec2-13-231-171-17.ap-northeast-1.compute.amazonaws.com.openvpn: UDP, length 100
08:44:00.748241 IP ip-192-168-75-233.ap-northeast-1.compute.internal.46802 > ec2-13-231-171-17.ap-northeast-1.compute.amazonaws.com.openvpn: UDP, length 76
08:44:00.794622 IP ec2-13-231-171-17.ap-northeast-1.compute.amazonaws.com.openvpn > ip-192-168-75-233.ap-northeast-1.compute.internal.46802: UDP, length 76
08:44:00.794624 IP ec2-13-231-171-17.ap-northeast-1.compute.amazonaws.com.openvpn > ip-192-168-75-233.ap-northeast-1.compute.internal.46802: UDP, length 76
08:44:00.794906 IP ip-192-168-75-233.ap-northeast-1.compute.internal.46802 > ec2-13-231-171-17.ap-northeast-1.compute.amazonaws.com.openvpn: UDP, length 76
08:44:01.422325 IP ip-192-168-75-233.ap-northeast-1.compute.internal.46802 > ec2-13-231-171-17.ap-northeast-1.compute.amazonaws.com.openvpn: UDP, length 115
08:44:01.534136 IP ec2-13-231-171-17.ap-northeast-1.compute.amazonaws.com.openvpn > ip-192-168-75-233.ap-northeast-1.compute.internal.46802: UDP, length 115
08:44:01.534368 IP ip-192-168-75-233.ap-northeast-1.compute.internal.46802 > ec2-13-231-171-17.ap-northeast-1.compute.amazonaws.com.openvpn: UDP, length 76
08:44:02.422962 IP ip-192-168-75-233.ap-northeast-1.compute.internal.46802 > ec2-13-231-171-17.ap-northeast-1.compute.amazonaws.com.openvpn: UDP, length 115
08:44:02.534544 IP ec2-13-231-171-17.ap-northeast-1.compute.amazonaws.com.openvpn > ip-192-168-75-233.ap-northeast-1.compute.internal.46802: UDP, length 115
08:44:02.534782 IP ip-192-168-75-233.ap-northeast-1.compute.internal.46802 > ec2-13-231-171-17.ap-northeast-1.compute.amazonaws.com.openvpn: UDP, length 76
08:44:03.423715 IP ip-192-168-75-233.ap-northeast-1.compute.internal.46802 > ec2-13-231-171-17.ap-northeast-1.compute.amazonaws.com.openvpn: UDP, length 122
08:44:03.633721 IP ec2-13-231-171-17.ap-northeast-1.compute.amazonaws.com.openvpn > ip-192-168-75-233.ap-northeast-1.compute.internal.46802: UDP, length 122
08:44:03.633959 IP ip-192-168-75-233.ap-northeast-1.compute.internal.46802 > ec2-13-231-171-17.ap-northeast-1.compute.amazonaws.com.openvpn: UDP, length 76
08:44:04.263394 IP ip-192-168-75-233.ap-northeast-1.compute.internal.46802 > ec2-13-231-171-17.ap-northeast-1.compute.amazonaws.com.openvpn: UDP, length 76
08:44:04.298323 IP ec2-13-231-171-17.ap-northeast-1.compute.amazonaws.com.openvpn > ip-192-168-75-233.ap-northeast-1.compute.internal.46802: UDP, length 115
08:44:04.298324 IP ec2-13-231-171-17.ap-northeast-1.compute.amazonaws.com.openvpn > ip-192-168-75-233.ap-northeast-1.compute.internal.46802: UDP, length 100
08:44:04.298325 IP ec2-13-231-171-17.ap-northeast-1.compute.amazonaws.com.openvpn > ip-192-168-75-233.ap-northeast-1.compute.internal.46802: UDP, length 76
08:44:04.298529 IP ip-192-168-75-233.ap-northeast-1.compute.internal.46802 > ec2-13-231-171-17.ap-northeast-1.compute.amazonaws.com.openvpn: UDP, length 76
08:44:04.298545 IP ip-192-168-75-233.ap-northeast-1.compute.internal.46802 > ec2-13-231-171-17.ap-northeast-1.compute.amazonaws.com.openvpn: UDP, length 76
08:44:04.298640 IP ip-192-168-75-233.ap-northeast-1.compute.internal.46802 > ec2-13-231-171-17.ap-northeast-1.compute.amazonaws.com.openvpn: UDP, length 115
08:44:04.298794 IP ip-192-168-75-233.ap-northeast-1.compute.internal.46802 > ec2-13-231-171-17.ap-northeast-1.compute.amazonaws.com.openvpn: UDP, length 100
08:44:04.298812 IP ip-192-168-75-233.ap-northeast-1.compute.internal.46802 > ec2-13-231-171-17.ap-northeast-1.compute.amazonaws.com.openvpn: UDP, length 76
08:44:04.303434 IP ec2-13-231-171-17.ap-northeast-1.compute.amazonaws.com.openvpn > ip-192-168-75-233.ap-northeast-1.compute.internal.46802: UDP, length 76
08:44:04.406240 IP ec2-13-231-171-17.ap-northeast-1.compute.amazonaws.com.openvpn > ip-192-168-75-233.ap-northeast-1.compute.internal.46802: UDP, length 64
08:44:04.406241 IP ec2-13-231-171-17.ap-northeast-1.compute.amazonaws.com.openvpn > ip-192-168-75-233.ap-northeast-1.compute.internal.46802: UDP, length 64
08:44:04.406285 IP ec2-13-231-171-17.ap-northeast-1.compute.amazonaws.com.openvpn > ip-192-168-75-233.ap-northeast-1.compute.internal.46802: UDP, length 64
08:44:05.286888 IP ec2-13-231-171-17.ap-northeast-1.compute.amazonaws.com.openvpn > ip-192-168-75-233.ap-northeast-1.compute.internal.46802: UDP, length 115
08:44:05.286890 IP ec2-13-231-171-17.ap-northeast-1.compute.amazonaws.com.openvpn > ip-192-168-75-233.ap-northeast-1.compute.internal.46802: UDP, length 100
08:44:05.286891 IP ec2-13-231-171-17.ap-northeast-1.compute.amazonaws.com.openvpn > ip-192-168-75-233.ap-northeast-1.compute.internal.46802: UDP, length 76
08:44:05.287100 IP ip-192-168-75-233.ap-northeast-1.compute.internal.46802 > ec2-13-231-171-17.ap-northeast-1.compute.amazonaws.com.openvpn: UDP, length 76
08:44:05.287117 IP ip-192-168-75-233.ap-northeast-1.compute.internal.46802 > ec2-13-231-171-17.ap-northeast-1.compute.amazonaws.com.openvpn: UDP, length 76
08:44:05.287252 IP ip-192-168-75-233.ap-northeast-1.compute.internal.46802 > ec2-13-231-171-17.ap-northeast-1.compute.amazonaws.com.openvpn: UDP, length 115
08:44:05.287437 IP ip-192-168-75-233.ap-northeast-1.compute.internal.46802 > ec2-13-231-171-17.ap-northeast-1.compute.amazonaws.com.openvpn: UDP, length 100
08:44:05.287452 IP ip-192-168-75-233.ap-northeast-1.compute.internal.46802 > ec2-13-231-171-17.ap-northeast-1.compute.amazonaws.com.openvpn: UDP, length 76
08:44:05.399899 IP ec2-13-231-171-17.ap-northeast-1.compute.amazonaws.com.openvpn > ip-192-168-75-233.ap-northeast-1.compute.internal.46802: UDP, length 64
08:44:05.399931 IP ec2-13-231-171-17.ap-northeast-1.compute.amazonaws.com.openvpn > ip-192-168-75-233.ap-northeast-1.compute.internal.46802: UDP, length 64
08:44:05.399947 IP ec2-13-231-171-17.ap-northeast-1.compute.amazonaws.com.openvpn > ip-192-168-75-233.ap-northeast-1.compute.internal.46802: UDP, length 64
08:44:05.543303 IP ip-192-168-75-233.ap-northeast-1.compute.internal.46802 > ec2-13-231-171-17.ap-northeast-1.compute.amazonaws.com.openvpn: UDP, length 76
08:44:05.583306 IP ec2-13-231-171-17.ap-northeast-1.compute.amazonaws.com.openvpn > ip-192-168-75-233.ap-northeast-1.compute.internal.46802: UDP, length 76
08:44:07.795481 Loopback, skipCount 0,  invalid (256)
08:44:12.381258 IP ip-192-168-75-233.ap-northeast-1.compute.internal.46802 > ec2-13-231-171-17.ap-northeast-1.compute.amazonaws.com.openvpn: UDP, length 294
08:44:12.427353 IP ec2-13-231-171-17.ap-northeast-1.compute.amazonaws.com.openvpn > ip-192-168-75-233.ap-northeast-1.compute.internal.46802: UDP, length 76
08:44:12.706529 IP ec2-13-231-171-17.ap-northeast-1.compute.amazonaws.com.openvpn > ip-192-168-75-233.ap-northeast-1.compute.internal.46802: UDP, length 781
08:44:12.706773 IP ip-192-168-75-233.ap-northeast-1.compute.internal.46802 > ec2-13-231-171-17.ap-northeast-1.compute.amazonaws.com.openvpn: UDP, length 76
08:44:12.846639 IP ip-192-168-75-233.ap-northeast-1.compute.internal.46802 > ec2-13-231-171-17.ap-northeast-1.compute.amazonaws.com.openvpn: UDP, length 357
08:44:12.846717 IP ip-192-168-75-233.ap-northeast-1.compute.internal.46802 > ec2-13-231-171-17.ap-northeast-1.compute.amazonaws.com.openvpn: UDP, length 1350
08:44:12.846732 IP ip-192-168-75-233.ap-northeast-1.compute.internal.46802 > ec2-13-231-171-17.ap-northeast-1.compute.amazonaws.com.openvpn: UDP, length 1350
