19:49:32.020792 IP tatuya-latitudee6230.48658 > ec2-52-35-150-14.us-west-2.compute.amazonaws.com.https: Flags [S], seq 3061603201, win 64240, options [mss 1460,sackOK,TS val 2902940737 ecr 0,nop,wscale 7], length 0
19:49:32.234139 IP tatuya-latitudee6230.48672 > ec2-52-35-150-14.us-west-2.compute.amazonaws.com.https: Flags [S], seq 623236720, win 64240, options [mss 1460,sackOK,TS val 2902940950 ecr 0,nop,wscale 7], length 0
19:49:32.389062 Loopback, skipCount 0,  invalid (256)
19:49:32.396492 IP tatuya-latitudee6230.41048 > bns1.hananet.net.domain: 44403+ PTR? 14.150.35.52.in-addr.arpa. (43)
19:49:32.550292 IP bns1.hananet.net.domain > tatuya-latitudee6230.41048: 44403 1/0/0 PTR ec2-52-35-150-14.us-west-2.compute.amazonaws.com. (105)
19:49:33.408356 IP tatuya-latitudee6230.47056 > bns1.hananet.net.domain: 58227+ PTR? 82.163.220.210.in-addr.arpa. (45)
19:49:33.417229 IP bns1.hananet.net.domain > tatuya-latitudee6230.47056: 58227 1/0/0 PTR bns1.hananet.net. (75)
19:49:36.074135 IP tatuya-latitudee6230.48658 > ec2-52-35-150-14.us-west-2.compute.amazonaws.com.https: Flags [S], seq 3061603201, win 64240, options [mss 1460,sackOK,TS val 2902944790 ecr 0,nop,wscale 7], length 0
19:49:36.287468 IP tatuya-latitudee6230.48672 > ec2-52-35-150-14.us-west-2.compute.amazonaws.com.https: Flags [S], seq 623236720, win 64240, options [mss 1460,sackOK,TS val 2902945004 ecr 0,nop,wscale 7], length 0
19:49:37.554983 ARP, Request who-has tatuya-latitudee6230 tell _gateway, length 46
19:49:37.555014 ARP, Reply tatuya-latitudee6230 is-at f0:1f:af:2a:cd:d3 (oui Unknown), length 28
19:49:42.409298 Loopback, skipCount 0,  invalid (256)
19:49:44.180785 IP tatuya-latitudee6230.48658 > ec2-52-35-150-14.us-west-2.compute.amazonaws.com.https: Flags [S], seq 3061603201, win 64240, options [mss 1460,sackOK,TS val 2902952897 ecr 0,nop,wscale 7], length 0
19:49:44.394177 IP tatuya-latitudee6230.48672 > ec2-52-35-150-14.us-west-2.compute.amazonaws.com.https: Flags [S], seq 623236720, win 64240, options [mss 1460,sackOK,TS val 2902953110 ecr 0,nop,wscale 7], length 0
19:49:46.110590 IP tatuya-latitudee6230.57168 > nrt13s71-in-f2.1e100.net.https: Flags [P.], seq 141346108:141346147, ack 3926248921, win 493, options [nop,nop,TS val 3204935489 ecr 3751194601], length 39
19:49:46.110996 IP tatuya-latitudee6230.57168 > nrt13s71-in-f2.1e100.net.https: Flags [P.], seq 39:63, ack 1, win 493, options [nop,nop,TS val 3204935489 ecr 3751194601], length 24
19:49:46.111023 IP tatuya-latitudee6230.57168 > nrt13s71-in-f2.1e100.net.https: Flags [F.], seq 63, ack 1, win 493, options [nop,nop,TS val 3204935489 ecr 3751194601], length 0
19:49:46.155246 IP nrt13s71-in-f2.1e100.net.https > tatuya-latitudee6230.57168: Flags [.], ack 64, win 277, options [nop,nop,TS val 3751247641 ecr 3204935489], length 0
19:49:46.155634 IP nrt13s71-in-f2.1e100.net.https > tatuya-latitudee6230.57168: Flags [F.], seq 1, ack 64, win 277, options [nop,nop,TS val 3751247641 ecr 3204935489], length 0
19:49:46.155692 IP tatuya-latitudee6230.57168 > nrt13s71-in-f2.1e100.net.https: Flags [.], ack 2, win 493, options [nop,nop,TS val 3204935534 ecr 3751247641], length 0
19:49:46.581674 IP tatuya-latitudee6230.45776 > bns1.hananet.net.domain: 42117+ PTR? 2.222.251.142.in-addr.arpa. (44)
19:49:46.582774 IP bns1.hananet.net.domain > tatuya-latitudee6230.45776: 42117 1/0/0 PTR nrt13s71-in-f2.1e100.net. (82)
19:49:49.111960 IP tatuya-latitudee6230.40648 > 151.101.66.137.https: Flags [P.], seq 1360079149:1360079188, ack 3823902246, win 634, options [nop,nop,TS val 1151372241 ecr 2410076259], length 39
19:49:49.112476 IP tatuya-latitudee6230.40648 > 151.101.66.137.https: Flags [P.], seq 39:63, ack 1, win 634, options [nop,nop,TS val 1151372242 ecr 2410076259], length 24
19:49:49.112532 IP tatuya-latitudee6230.40648 > 151.101.66.137.https: Flags [F.], seq 63, ack 1, win 634, options [nop,nop,TS val 1151372242 ecr 2410076259], length 0
19:49:49.118977 IP 151.101.66.137.https > tatuya-latitudee6230.40648: Flags [.], ack 39, win 291, options [nop,nop,TS val 2410129292 ecr 1151372241], length 0
19:49:49.119465 IP 151.101.66.137.https > tatuya-latitudee6230.40648: Flags [.], ack 63, win 291, options [nop,nop,TS val 2410129292 ecr 1151372242], length 0
19:49:49.119468 IP 151.101.66.137.https > tatuya-latitudee6230.40648: Flags [P.], seq 1:25, ack 63, win 291, options [nop,nop,TS val 2410129292 ecr 1151372242], length 24
19:49:49.119469 IP 151.101.66.137.https > tatuya-latitudee6230.40648: Flags [F.], seq 25, ack 63, win 291, options [nop,nop,TS val 2410129292 ecr 1151372242], length 0
19:49:49.119617 IP tatuya-latitudee6230.40648 > 151.101.66.137.https: Flags [R], seq 1360079212, win 0, length 0
19:49:49.119650 IP tatuya-latitudee6230.40648 > 151.101.66.137.https: Flags [R], seq 1360079212, win 0, length 0
19:49:49.119766 IP 151.101.66.137.https > tatuya-latitudee6230.40648: Flags [.], ack 64, win 291, options [nop,nop,TS val 2410129292 ecr 1151372242], length 0
19:49:49.119833 IP tatuya-latitudee6230.40648 > 151.101.66.137.https: Flags [R], seq 1360079213, win 0, length 0
19:49:49.621743 IP tatuya-latitudee6230.50660 > bns1.hananet.net.domain: 40569+ PTR? 137.66.101.151.in-addr.arpa. (45)
19:49:49.622743 IP bns1.hananet.net.domain > tatuya-latitudee6230.50660: 40569 NXDomain 0/0/0 (45)
19:49:51.220764 ARP, Request who-has _gateway tell tatuya-latitudee6230, length 28
19:49:51.221272 ARP, Reply _gateway is-at d0:96:fb:e7:bb:a2 (oui Unknown), length 46
19:49:51.243709 IP tatuya-latitudee6230.40800 > 140.227.186.35.bc.googleusercontent.com.https: Flags [P.], seq 3327137858:3327137897, ack 4241712581, win 689, options [nop,nop,TS val 718379168 ecr 417369516], length 39
19:49:51.243864 IP tatuya-latitudee6230.55794 > 104.18.40.222.https: Flags [P.], seq 3719702457:3719702496, ack 1208198005, win 5777, options [nop,nop,TS val 473504217 ecr 463262018], length 39
19:49:51.244835 IP tatuya-latitudee6230.55794 > 104.18.40.222.https: Flags [P.], seq 39:63, ack 1, win 5777, options [nop,nop,TS val 473504218 ecr 463262018], length 24
19:49:51.244872 IP tatuya-latitudee6230.55794 > 104.18.40.222.https: Flags [F.], seq 63, ack 1, win 5777, options [nop,nop,TS val 473504218 ecr 463262018], length 0
19:49:51.245326 IP tatuya-latitudee6230.40800 > 140.227.186.35.bc.googleusercontent.com.https: Flags [P.], seq 39:63, ack 1, win 689, options [nop,nop,TS val 718379170 ecr 417369516], length 24
19:49:51.245350 IP tatuya-latitudee6230.40800 > 140.227.186.35.bc.googleusercontent.com.https: Flags [F.], seq 63, ack 1, win 689, options [nop,nop,TS val 718379170 ecr 417369516], length 0
19:49:51.256876 IP 140.227.186.35.bc.googleusercontent.com.https > tatuya-latitudee6230.40800: Flags [.], ack 64, win 489, options [nop,nop,TS val 417422685 ecr 718379168], length 0
19:49:51.256878 IP 140.227.186.35.bc.googleusercontent.com.https > tatuya-latitudee6230.40800: Flags [F.], seq 1, ack 64, win 489, options [nop,nop,TS val 417422685 ecr 718379168], length 0
19:49:51.257032 IP tatuya-latitudee6230.40800 > 140.227.186.35.bc.googleusercontent.com.https: Flags [.], ack 2, win 689, options [nop,nop,TS val 718379181 ecr 417422685], length 0
19:49:51.257507 IP 104.18.40.222.https > tatuya-latitudee6230.55794: Flags [.], ack 64, win 8, options [nop,nop,TS val 463315187 ecr 473504217], length 0
19:49:51.258052 IP 104.18.40.222.https > tatuya-latitudee6230.55794: Flags [F.], seq 1, ack 64, win 8, options [nop,nop,TS val 463315188 ecr 473504217], length 0
19:49:51.258135 IP tatuya-latitudee6230.55794 > 104.18.40.222.https: Flags [.], ack 2, win 5777, options [nop,nop,TS val 473504231 ecr 463315188], length 0
19:49:51.549181 IP lb-140-82-114-25-iad.github.com.https > tatuya-latitudee6230.53164: Flags [P.], seq 3493370532:3493370557, ack 1025032438, win 71, options [nop,nop,TS val 3979345486 ecr 4203718456], length 25
19:49:51.549639 IP tatuya-latitudee6230.53164 > lb-140-82-114-25-iad.github.com.https: Flags [P.], seq 1:30, ack 25, win 590, options [nop,nop,TS val 4203778457 ecr 3979345486], length 29
19:49:51.648446 IP tatuya-latitudee6230.59945 > bns1.hananet.net.domain: 21884+ PTR? 140.227.186.35.in-addr.arpa. (45)
19:49:51.726534 IP bns1.hananet.net.domain > tatuya-latitudee6230.59945: 21884 1/0/0 PTR 140.227.186.35.bc.googleusercontent.com. (98)
19:49:51.728077 IP tatuya-latitudee6230.48623 > bns1.hananet.net.domain: 41167+ PTR? 222.40.18.104.in-addr.arpa. (44)
19:49:51.729616 IP bns1.hananet.net.domain > tatuya-latitudee6230.48623: 41167 NXDomain 0/0/0 (44)
19:49:51.730951 IP tatuya-latitudee6230.33777 > bns1.hananet.net.domain: 35867+ PTR? 25.114.82.140.in-addr.arpa. (44)
19:49:51.744406 IP lb-140-82-114-25-iad.github.com.https > tatuya-latitudee6230.53164: Flags [.], ack 30, win 71, options [nop,nop,TS val 3979345681 ecr 4203778457], length 0
19:49:51.774719 IP bns1.hananet.net.domain > tatuya-latitudee6230.33777: 35867 1/0/0 PTR lb-140-82-114-25-iad.github.com. (89)
19:49:52.255288 IP tatuya-latitudee6230.41046 > 104.18.43.226.https: Flags [P.], seq 2212959173:2212959212, ack 786077551, win 690, options [nop,nop,TS val 1491944097 ecr 228195944], length 39
19:49:52.255414 IP tatuya-latitudee6230.49948 > 172.64.147.34.https: Flags [P.], seq 3934513941:3934513980, ack 1534391384, win 5915, options [nop,nop,TS val 2318997445 ecr 1260087819], length 39
19:49:52.255673 IP tatuya-latitudee6230.60338 > tb-in-f84.1e100.net.https: Flags [P.], seq 343306975:343307014, ack 1604853351, win 654, options [nop,nop,TS val 3553263287 ecr 3812611169], length 39
19:49:52.255977 IP tatuya-latitudee6230.56772 > 172.64.152.233.https: Flags [P.], seq 2818575102:2818575141, ack 2778995963, win 567, options [nop,nop,TS val 2385477703 ecr 2871805280], length 39
19:49:52.256478 IP tatuya-latitudee6230.60338 > tb-in-f84.1e100.net.https: Flags [P.], seq 39:63, ack 1, win 654, options [nop,nop,TS val 3553263288 ecr 3812611169], length 24
19:49:52.256510 IP tatuya-latitudee6230.60338 > tb-in-f84.1e100.net.https: Flags [F.], seq 63, ack 1, win 654, options [nop,nop,TS val 3553263288 ecr 3812611169], length 0
19:49:52.256944 IP tatuya-latitudee6230.41046 > 104.18.43.226.https: Flags [P.], seq 39:63, ack 1, win 690, options [nop,nop,TS val 1491944099 ecr 228195944], length 24
19:49:52.256967 IP tatuya-latitudee6230.41046 > 104.18.43.226.https: Flags [F.], seq 63, ack 1, win 690, options [nop,nop,TS val 1491944099 ecr 228195944], length 0
19:49:52.257479 IP tatuya-latitudee6230.49948 > 172.64.147.34.https: Flags [P.], seq 39:63, ack 1, win 5915, options [nop,nop,TS val 2318997447 ecr 1260087819], length 24
19:49:52.257491 IP tatuya-latitudee6230.49948 > 172.64.147.34.https: Flags [F.], seq 63, ack 1, win 5915, options [nop,nop,TS val 2318997447 ecr 1260087819], length 0
19:49:52.257843 IP tatuya-latitudee6230.56772 > 172.64.152.233.https: Flags [P.], seq 39:63, ack 1, win 567, options [nop,nop,TS val 2385477705 ecr 2871805280], length 24
19:49:52.257852 IP tatuya-latitudee6230.56772 > 172.64.152.233.https: Flags [F.], seq 63, ack 1, win 567, options [nop,nop,TS val 2385477705 ecr 2871805280], length 0
19:49:52.268795 IP 172.64.147.34.https > tatuya-latitudee6230.49948: Flags [.], ack 64, win 10, options [nop,nop,TS val 1260140996 ecr 2318997445], length 0
19:49:52.269364 IP 104.18.43.226.https > tatuya-latitudee6230.41046: Flags [.], ack 64, win 9, options [nop,nop,TS val 228249123 ecr 1491944097], length 0
19:49:52.269618 IP 172.64.147.34.https > tatuya-latitudee6230.49948: Flags [F.], seq 1, ack 64, win 10, options [nop,nop,TS val 1260140997 ecr 2318997445], length 0
19:49:52.269696 IP tatuya-latitudee6230.49948 > 172.64.147.34.https: Flags [.], ack 2, win 5915, options [nop,nop,TS val 2318997459 ecr 1260140997], length 0
19:49:52.270314 IP 104.18.43.226.https > tatuya-latitudee6230.41046: Flags [F.], seq 1, ack 64, win 9, options [nop,nop,TS val 228249124 ecr 1491944097], length 0
19:49:52.270383 IP tatuya-latitudee6230.41046 > 104.18.43.226.https: Flags [.], ack 2, win 690, options [nop,nop,TS val 1491944113 ecr 228249124], length 0
19:49:52.270975 IP 172.64.152.233.https > tatuya-latitudee6230.56772: Flags [.], ack 64, win 9, options [nop,nop,TS val 2871858457 ecr 2385477703], length 0
19:49:52.271462 IP 172.64.152.233.https > tatuya-latitudee6230.56772: Flags [F.], seq 1, ack 64, win 9, options [nop,nop,TS val 2871858458 ecr 2385477703], length 0
19:49:52.271541 IP tatuya-latitudee6230.56772 > 172.64.152.233.https: Flags [.], ack 2, win 567, options [nop,nop,TS val 2385477719 ecr 2871858458], length 0
19:49:52.342770 IP tb-in-f84.1e100.net.https > tatuya-latitudee6230.60338: Flags [.], ack 64, win 256, options [nop,nop,TS val 3812664346 ecr 3553263287], length 0
19:49:52.342771 IP tb-in-f84.1e100.net.https > tatuya-latitudee6230.60338: Flags [F.], seq 1, ack 64, win 256, options [nop,nop,TS val 3812664346 ecr 3553263287], length 0
19:49:52.342853 IP tatuya-latitudee6230.60338 > tb-in-f84.1e100.net.https: Flags [.], ack 2, win 654, options [nop,nop,TS val 3553263374 ecr 3812664346], length 0
19:49:52.429689 Loopback, skipCount 0,  invalid (256)
19:49:52.662015 IP tatuya-latitudee6230.57968 > bns1.hananet.net.domain: 22563+ PTR? 226.43.18.104.in-addr.arpa. (44)
19:49:52.663765 IP bns1.hananet.net.domain > tatuya-latitudee6230.57968: 22563 NXDomain 0/0/0 (44)
19:49:52.664852 IP tatuya-latitudee6230.49425 > bns1.hananet.net.domain: 6911+ PTR? 34.147.64.172.in-addr.arpa. (44)
19:49:52.665584 IP bns1.hananet.net.domain > tatuya-latitudee6230.49425: 6911 NXDomain 0/0/0 (44)
19:49:52.666528 IP tatuya-latitudee6230.48508 > bns1.hananet.net.domain: 11772+ PTR? 84.8.251.142.in-addr.arpa. (43)
19:49:52.680662 IP bns1.hananet.net.domain > tatuya-latitudee6230.48508: 11772 1/0/0 PTR tb-in-f84.1e100.net. (76)
19:49:52.681186 IP tatuya-latitudee6230.33283 > bns1.hananet.net.domain: 40709+ PTR? 233.152.64.172.in-addr.arpa. (45)
19:49:52.682702 IP bns1.hananet.net.domain > tatuya-latitudee6230.33283: 40709 NXDomain 0/0/0 (45)
19:49:53.256064 IP tatuya-latitudee6230.35372 > 104.18.87.42.https: Flags [P.], seq 3640761109:3640761148, ack 3163050320, win 532, options [nop,nop,TS val 440039721 ecr 3523458327], length 39
19:49:53.256174 IP tatuya-latitudee6230.39534 > 104.18.86.42.https: Flags [P.], seq 1342558698:1342558737, ack 4034070337, win 832, options [nop,nop,TS val 256625456 ecr 3023487153], length 39
19:49:53.256245 IP tatuya-latitudee6230.59482 > 104.18.86.42.https: Flags [P.], seq 1779114955:1779114994, ack 1210799022, win 674, options [nop,nop,TS val 256625456 ecr 2891506246], length 39
19:49:53.256310 IP tatuya-latitudee6230.55492 > nrt12s28-in-f3.1e100.net.https: Flags [P.], seq 1461077212:1461077251, ack 1064321333, win 589, options [nop,nop,TS val 453075984 ecr 3121265624], length 39
19:49:53.256992 IP tatuya-latitudee6230.39534 > 104.18.86.42.https: Flags [P.], seq 39:63, ack 1, win 832, options [nop,nop,TS val 256625457 ecr 3023487153], length 24
19:49:53.257026 IP tatuya-latitudee6230.39534 > 104.18.86.42.https: Flags [F.], seq 63, ack 1, win 832, options [nop,nop,TS val 256625457 ecr 3023487153], length 0
19:49:53.257522 IP tatuya-latitudee6230.59482 > 104.18.86.42.https: Flags [P.], seq 39:63, ack 1, win 674, options [nop,nop,TS val 256625458 ecr 2891506246], length 24
19:49:53.257532 IP tatuya-latitudee6230.59482 > 104.18.86.42.https: Flags [F.], seq 63, ack 1, win 674, options [nop,nop,TS val 256625458 ecr 2891506246], length 0
19:49:53.257652 IP tatuya-latitudee6230.55492 > nrt12s28-in-f3.1e100.net.https: Flags [P.], seq 39:63, ack 1, win 589, options [nop,nop,TS val 453075985 ecr 3121265624], length 24
19:49:53.257660 IP tatuya-latitudee6230.55492 > nrt12s28-in-f3.1e100.net.https: Flags [F.], seq 63, ack 1, win 589, options [nop,nop,TS val 453075985 ecr 3121265624], length 0
19:49:53.258032 IP tatuya-latitudee6230.35372 > 104.18.87.42.https: Flags [P.], seq 39:63, ack 1, win 532, options [nop,nop,TS val 440039723 ecr 3523458327], length 24
19:49:53.258040 IP tatuya-latitudee6230.35372 > 104.18.87.42.https: Flags [F.], seq 63, ack 1, win 532, options [nop,nop,TS val 440039723 ecr 3523458327], length 0
19:49:53.268692 IP 104.18.86.42.https > tatuya-latitudee6230.39534: Flags [.], ack 64, win 9, options [nop,nop,TS val 3023541330 ecr 256625456], length 0
19:49:53.268695 IP 104.18.87.42.https > tatuya-latitudee6230.35372: Flags [.], ack 64, win 9, options [nop,nop,TS val 3523511503 ecr 440039721], length 0
19:49:53.269048 IP 104.18.86.42.https > tatuya-latitudee6230.39534: Flags [F.], seq 1, ack 64, win 9, options [nop,nop,TS val 3023541330 ecr 256625456], length 0
19:49:53.269125 IP tatuya-latitudee6230.39534 > 104.18.86.42.https: Flags [.], ack 2, win 832, options [nop,nop,TS val 256625469 ecr 3023541330], length 0
19:49:53.269317 IP 104.18.87.42.https > tatuya-latitudee6230.35372: Flags [F.], seq 1, ack 64, win 9, options [nop,nop,TS val 3523511504 ecr 440039721], length 0
19:49:53.269389 IP tatuya-latitudee6230.35372 > 104.18.87.42.https: Flags [.], ack 2, win 532, options [nop,nop,TS val 440039735 ecr 3523511504], length 0
19:49:53.269854 IP 104.18.86.42.https > tatuya-latitudee6230.59482: Flags [.], ack 64, win 8, options [nop,nop,TS val 2891560423 ecr 256625456], length 0
19:49:53.270110 IP 104.18.86.42.https > tatuya-latitudee6230.59482: Flags [F.], seq 1, ack 64, win 8, options [nop,nop,TS val 2891560423 ecr 256625456], length 0
19:49:53.270177 IP tatuya-latitudee6230.59482 > 104.18.86.42.https: Flags [.], ack 2, win 674, options [nop,nop,TS val 256625470 ecr 2891560423], length 0
19:49:53.301825 IP nrt12s28-in-f3.1e100.net.https > tatuya-latitudee6230.55492: Flags [.], ack 64, win 273, options [nop,nop,TS val 3121318798 ecr 453075984], length 0
19:49:53.301828 IP nrt12s28-in-f3.1e100.net.https > tatuya-latitudee6230.55492: Flags [F.], seq 1, ack 64, win 273, options [nop,nop,TS val 3121318798 ecr 453075984], length 0
19:49:53.301981 IP tatuya-latitudee6230.55492 > nrt12s28-in-f3.1e100.net.https: Flags [.], ack 2, win 589, options [nop,nop,TS val 453076029 ecr 3121318798], length 0
19:49:53.675199 IP tatuya-latitudee6230.42416 > bns1.hananet.net.domain: 47950+ PTR? 42.87.18.104.in-addr.arpa. (43)
19:49:53.676843 IP bns1.hananet.net.domain > tatuya-latitudee6230.42416: 47950 NXDomain 0/0/0 (43)
19:49:53.677968 IP tatuya-latitudee6230.58606 > bns1.hananet.net.domain: 41419+ PTR? 42.86.18.104.in-addr.arpa. (43)
19:49:53.679631 IP bns1.hananet.net.domain > tatuya-latitudee6230.58606: 41419 NXDomain 0/0/0 (43)
19:49:53.680800 IP tatuya-latitudee6230.41360 > bns1.hananet.net.domain: 11323+ PTR? 99.174.217.172.in-addr.arpa. (45)
19:49:53.681608 IP bns1.hananet.net.domain > tatuya-latitudee6230.41360: 11323 1/0/0 PTR nrt12s28-in-f3.1e100.net. (83)
19:50:01.460798 IP tatuya-latitudee6230.48672 > ec2-52-35-150-14.us-west-2.compute.amazonaws.com.https: Flags [S], seq 623236720, win 64240, options [mss 1460,sackOK,TS val 2902970177 ecr 0,nop,wscale 7], length 0
19:50:01.460829 IP tatuya-latitudee6230.48658 > ec2-52-35-150-14.us-west-2.compute.amazonaws.com.https: Flags [S], seq 3061603201, win 64240, options [mss 1460,sackOK,TS val 2902970177 ecr 0,nop,wscale 7], length 0
19:50:02.052140 IP _gateway > all-systems.mcast.net: igmp query v2
19:50:02.449770 Loopback, skipCount 0,  invalid (256)
19:50:02.794961 IP tatuya-latitudee6230.37633 > bns1.hananet.net.domain: 45271+ PTR? 1.0.0.224.in-addr.arpa. (40)
19:50:02.805899 IP bns1.hananet.net.domain > tatuya-latitudee6230.37633: 45271 1/0/0 PTR all-systems.mcast.net. (75)
19:50:07.811831 ARP, Request who-has tatuya-latitudee6230 tell _gateway, length 46
19:50:07.811862 ARP, Reply tatuya-latitudee6230 is-at f0:1f:af:2a:cd:d3 (oui Unknown), length 28
19:50:12.469960 Loopback, skipCount 0,  invalid (256)
19:50:16.011149 IP tatuya-latitudee6230.45950 > bns1.hananet.net.domain: 9755+ A? ping.archlinux.org. (36)
19:50:16.011159 IP tatuya-latitudee6230.45950 > bns1.hananet.net.domain: 21479+ AAAA? ping.archlinux.org. (36)
19:50:16.012350 IP bns1.hananet.net.domain > tatuya-latitudee6230.45950: 9755 2/0/0 CNAME redirect.archlinux.org., A 95.216.195.133 (88)
19:50:16.012351 IP bns1.hananet.net.domain > tatuya-latitudee6230.45950: 21479 2/0/0 CNAME redirect.archlinux.org., AAAA 2a01:4f9:c010:2636::1 (100)
19:50:16.012837 IP tatuya-latitudee6230.58176 > redirect.archlinux.org.http: Flags [S], seq 1925508272, win 64240, options [mss 1460,sackOK,TS val 458542943 ecr 0,nop,wscale 7], length 0
19:50:16.290217 IP redirect.archlinux.org.http > tatuya-latitudee6230.58176: Flags [S.], seq 847965694, ack 1925508273, win 65160, options [mss 1460,sackOK,TS val 3500973174 ecr 458542943,nop,wscale 7], length 0
19:50:16.290278 IP tatuya-latitudee6230.58176 > redirect.archlinux.org.http: Flags [.], ack 1, win 502, options [nop,nop,TS val 458543220 ecr 3500973174], length 0
19:50:16.290410 IP tatuya-latitudee6230.58176 > redirect.archlinux.org.http: Flags [P.], seq 1:89, ack 1, win 502, options [nop,nop,TS val 458543221 ecr 3500973174], length 88: HTTP: GET /nm-check.txt HTTP/1.1
19:50:16.567952 IP redirect.archlinux.org.http > tatuya-latitudee6230.58176: Flags [.], ack 89, win 509, options [nop,nop,TS val 3500973452 ecr 458543221], length 0
19:50:16.568120 IP redirect.archlinux.org.http > tatuya-latitudee6230.58176: Flags [P.], seq 1:205, ack 89, win 509, options [nop,nop,TS val 3500973452 ecr 458543221], length 204: HTTP: HTTP/1.1 200 OK
19:50:16.568152 IP tatuya-latitudee6230.58176 > redirect.archlinux.org.http: Flags [.], ack 205, win 501, options [nop,nop,TS val 458543498 ecr 3500973452], length 0
19:50:16.568286 IP tatuya-latitudee6230.58176 > redirect.archlinux.org.http: Flags [F.], seq 89, ack 205, win 501, options [nop,nop,TS val 458543499 ecr 3500973452], length 0
19:50:16.568292 IP redirect.archlinux.org.http > tatuya-latitudee6230.58176: Flags [F.], seq 205, ack 89, win 509, options [nop,nop,TS val 3500973452 ecr 458543221], length 0
19:50:16.568307 IP tatuya-latitudee6230.58176 > redirect.archlinux.org.http: Flags [.], ack 206, win 501, options [nop,nop,TS val 458543499 ecr 3500973452], length 0
19:50:16.846211 IP redirect.archlinux.org.http > tatuya-latitudee6230.58176: Flags [.], ack 90, win 509, options [nop,nop,TS val 3500973730 ecr 458543499], length 0
19:50:16.981111 IP tatuya-latitudee6230.36233 > bns1.hananet.net.domain: 60297+ PTR? 133.195.216.95.in-addr.arpa. (45)
19:50:16.990061 IP bns1.hananet.net.domain > tatuya-latitudee6230.36233: 60297 1/0/0 PTR redirect.archlinux.org. (81)
19:50:17.958843 IP tatuya-latitudee6230.56530 > bns1.hananet.net.domain: 17772+ A? self.adblockultimate.net. (42)
19:50:17.958852 IP tatuya-latitudee6230.56530 > bns1.hananet.net.domain: 42080+ AAAA? self.adblockultimate.net. (42)
19:50:17.960267 IP bns1.hananet.net.domain > tatuya-latitudee6230.56530: 17772 1/0/0 A 52.35.150.14 (58)
19:50:17.960343 IP bns1.hananet.net.domain > tatuya-latitudee6230.56530: 42080 0/0/0 (42)
19:50:17.979616 IP tatuya-latitudee6230.47352 > ec2-52-35-150-14.us-west-2.compute.amazonaws.com.https: Flags [S], seq 102495352, win 64240, options [mss 1460,sackOK,TS val 2902986696 ecr 0,nop,wscale 7], length 0
19:50:18.230368 IP tatuya-latitudee6230.47354 > ec2-52-35-150-14.us-west-2.compute.amazonaws.com.https: Flags [S], seq 3307558615, win 64240, options [mss 1460,sackOK,TS val 2902986947 ecr 0,nop,wscale 7], length 0
19:50:18.230482 IP tatuya-latitudee6230.44690 > bns1.hananet.net.domain: 64469+ A? self.adblockultimate.net. (42)
19:50:18.231448 IP bns1.hananet.net.domain > tatuya-latitudee6230.44690: 64469 1/0/0 A 52.35.150.14 (58)
19:50:18.980788 IP tatuya-latitudee6230.47352 > ec2-52-35-150-14.us-west-2.compute.amazonaws.com.https: Flags [S], seq 102495352, win 64240, options [mss 1460,sackOK,TS val 2902987697 ecr 0,nop,wscale 7], length 0
19:50:19.247461 IP tatuya-latitudee6230.47354 > ec2-52-35-150-14.us-west-2.compute.amazonaws.com.https: Flags [S], seq 3307558615, win 64240, options [mss 1460,sackOK,TS val 2902987964 ecr 0,nop,wscale 7], length 0
19:50:19.997452 IP tatuya-latitudee6230.47352 > ec2-52-35-150-14.us-west-2.compute.amazonaws.com.https: Flags [S], seq 102495352, win 64240, options [mss 1460,sackOK,TS val 2902988714 ecr 0,nop,wscale 7], length 0
19:50:20.260769 IP tatuya-latitudee6230.47354 > ec2-52-35-150-14.us-west-2.compute.amazonaws.com.https: Flags [S], seq 3307558615, win 64240, options [mss 1460,sackOK,TS val 2902988977 ecr 0,nop,wscale 7], length 0
19:50:21.007475 IP tatuya-latitudee6230.47352 > ec2-52-35-150-14.us-west-2.compute.amazonaws.com.https: Flags [S], seq 102495352, win 64240, options [mss 1460,sackOK,TS val 2902989724 ecr 0,nop,wscale 7], length 0
19:50:21.274141 IP tatuya-latitudee6230.47354 > ec2-52-35-150-14.us-west-2.compute.amazonaws.com.https: Flags [S], seq 3307558615, win 64240, options [mss 1460,sackOK,TS val 2902989990 ecr 0,nop,wscale 7], length 0
19:50:22.020778 IP tatuya-latitudee6230.47352 > ec2-52-35-150-14.us-west-2.compute.amazonaws.com.https: Flags [S], seq 102495352, win 64240, options [mss 1460,sackOK,TS val 2902990737 ecr 0,nop,wscale 7], length 0
19:50:22.287477 IP tatuya-latitudee6230.47354 > ec2-52-35-150-14.us-west-2.compute.amazonaws.com.https: Flags [S], seq 3307558615, win 64240, options [mss 1460,sackOK,TS val 2902991004 ecr 0,nop,wscale 7], length 0
19:50:22.490257 Loopback, skipCount 0,  invalid (256)
19:50:23.034117 IP tatuya-latitudee6230.47352 > ec2-52-35-150-14.us-west-2.compute.amazonaws.com.https: Flags [S], seq 102495352, win 64240, options [mss 1460,sackOK,TS val 2902991750 ecr 0,nop,wscale 7], length 0
19:50:23.300755 IP tatuya-latitudee6230.47354 > ec2-52-35-150-14.us-west-2.compute.amazonaws.com.https: Flags [S], seq 3307558615, win 64240, options [mss 1460,sackOK,TS val 2902992017 ecr 0,nop,wscale 7], length 0
19:50:25.140762 IP tatuya-latitudee6230.47352 > ec2-52-35-150-14.us-west-2.compute.amazonaws.com.https: Flags [S], seq 102495352, win 64240, options [mss 1460,sackOK,TS val 2902993857 ecr 0,nop,wscale 7], length 0
19:50:25.354130 IP tatuya-latitudee6230.47354 > ec2-52-35-150-14.us-west-2.compute.amazonaws.com.https: Flags [S], seq 3307558615, win 64240, options [mss 1460,sackOK,TS val 2902994070 ecr 0,nop,wscale 7], length 0
19:50:29.194138 IP tatuya-latitudee6230.47352 > ec2-52-35-150-14.us-west-2.compute.amazonaws.com.https: Flags [S], seq 102495352, win 64240, options [mss 1460,sackOK,TS val 2902997910 ecr 0,nop,wscale 7], length 0
19:50:29.407478 IP tatuya-latitudee6230.47354 > ec2-52-35-150-14.us-west-2.compute.amazonaws.com.https: Flags [S], seq 3307558615, win 64240, options [mss 1460,sackOK,TS val 2902998124 ecr 0,nop,wscale 7], length 0
19:50:29.718876 IP 192.168.75.66.mdns > mdns.mcast.net.mdns: 0 PTR (QM)? _googlecast._tcp.local. (40)
19:50:29.719025 IP6 fe80::bff0:8a76:6922:be9a.mdns > ff02::fb.mdns: 0 PTR (QM)? _googlecast._tcp.local. (40)
19:50:29.719788 IP 192.168.75.66.mdns > mdns.mcast.net.mdns: 0*- [0q] 1/0/3 PTR BID-AT200-e566f7781b617791f5176881acc41d6b._googlecast._tcp.local. (369)
19:50:29.722164 IP6 fe80::bff0:8a76:6922:be9a.mdns > ff02::fb.mdns: 0*- [0q] 1/0/3 PTR BID-AT200-e566f7781b617791f5176881acc41d6b._googlecast._tcp.local. (381)
19:50:30.155030 IP tatuya-latitudee6230.47425 > bns1.hananet.net.domain: 51739+ PTR? 251.0.0.224.in-addr.arpa. (42)
19:50:30.166490 IP bns1.hananet.net.domain > tatuya-latitudee6230.47425: 51739 1/0/0 PTR mdns.mcast.net. (70)
19:50:30.167500 IP tatuya-latitudee6230.49343 > bns1.hananet.net.domain: 13608+ PTR? 66.75.168.192.in-addr.arpa. (44)
19:50:30.175480 IP bns1.hananet.net.domain > tatuya-latitudee6230.49343: 13608 NXDomain 0/1/0 (79)
19:50:30.176672 IP tatuya-latitudee6230.36324 > bns1.hananet.net.domain: 6153+ PTR? b.f.0.0.0.0.0.0.0.0.0.0.0.0.0.0.0.0.0.0.0.0.0.0.0.0.0.0.2.0.f.f.ip6.arpa. (90)
19:50:30.184503 IP bns1.hananet.net.domain > tatuya-latitudee6230.36324: 6153 NXDomain 0/1/0 (154)
19:50:30.285503 IP6 fe80::9a23:284f:96e4:234.mdns > ff02::fb.mdns: 0 PTR (QM)? a.9.e.b.2.2.9.6.6.7.a.8.0.f.f.b.0.0.0.0.0.0.0.0.0.0.0.0.0.8.e.f.ip6.arpa. (90)
19:50:30.285716 IP tatuya-latitudee6230.mdns > mdns.mcast.net.mdns: 0 PTR (QM)? a.9.e.b.2.2.9.6.6.7.a.8.0.f.f.b.0.0.0.0.0.0.0.0.0.0.0.0.0.8.e.f.ip6.arpa. (90)
19:50:30.287919 IP 192.168.75.66.mdns > mdns.mcast.net.mdns: 0*- [0q] 1/0/1 (Cache flush) PTR Android-2.local. (131)
19:50:30.288051 IP6 fe80::bff0:8a76:6922:be9a.mdns > ff02::fb.mdns: 0*- [0q] 1/0/1 (Cache flush) PTR Android-2.local. (131)
19:50:31.286954 IP6 fe80::9a23:284f:96e4:234.mdns > ff02::fb.mdns: 0 PTR (QM)? a.9.e.b.2.2.9.6.6.7.a.8.0.f.f.b.0.0.0.0.0.0.0.0.0.0.0.0.0.8.e.f.ip6.arpa. (90)
19:50:31.287147 IP tatuya-latitudee6230.mdns > mdns.mcast.net.mdns: 0 PTR (QM)? a.9.e.b.2.2.9.6.6.7.a.8.0.f.f.b.0.0.0.0.0.0.0.0.0.0.0.0.0.8.e.f.ip6.arpa. (90)
19:50:31.288824 IP 192.168.75.66.mdns > mdns.mcast.net.mdns: 0*- [0q] 1/0/1 (Cache flush) PTR Android-2.local. (131)
19:50:31.289011 IP6 fe80::bff0:8a76:6922:be9a.mdns > ff02::fb.mdns: 0*- [0q] 1/0/1 (Cache flush) PTR Android-2.local. (131)
19:50:32.511531 Loopback, skipCount 0,  invalid (256)
19:50:33.289359 IP6 fe80::9a23:284f:96e4:234.mdns > ff02::fb.mdns: 0 PTR (QM)? a.9.e.b.2.2.9.6.6.7.a.8.0.f.f.b.0.0.0.0.0.0.0.0.0.0.0.0.0.8.e.f.ip6.arpa. (90)
19:50:33.289552 IP tatuya-latitudee6230.mdns > mdns.mcast.net.mdns: 0 PTR (QM)? a.9.e.b.2.2.9.6.6.7.a.8.0.f.f.b.0.0.0.0.0.0.0.0.0.0.0.0.0.8.e.f.ip6.arpa. (90)
19:50:33.292082 IP 192.168.75.66.mdns > mdns.mcast.net.mdns: 0*- [0q] 1/0/1 (Cache flush) PTR Android-2.local. (131)
19:50:33.292385 IP6 fe80::bff0:8a76:6922:be9a.mdns > ff02::fb.mdns: 0*- [0q] 1/0/1 (Cache flush) PTR Android-2.local. (131)
19:50:35.172430 ARP, Request who-has tatuya-latitudee6230 tell _gateway, length 46
19:50:35.172459 ARP, Reply tatuya-latitudee6230 is-at f0:1f:af:2a:cd:d3 (oui Unknown), length 28
19:50:35.288500 IP6 fe80::9a23:284f:96e4:234.mdns > ff02::fb.mdns: 0 PTR (QM)? 4.3.2.0.4.e.6.9.f.4.8.2.3.2.a.9.0.0.0.0.0.0.0.0.0.0.0.0.0.8.e.f.ip6.arpa. (90)
19:50:35.288689 IP tatuya-latitudee6230.mdns > mdns.mcast.net.mdns: 0 PTR (QM)? 4.3.2.0.4.e.6.9.f.4.8.2.3.2.a.9.0.0.0.0.0.0.0.0.0.0.0.0.0.8.e.f.ip6.arpa. (90)
19:50:36.289695 IP6 fe80::9a23:284f:96e4:234.mdns > ff02::fb.mdns: 0 PTR (QM)? 4.3.2.0.4.e.6.9.f.4.8.2.3.2.a.9.0.0.0.0.0.0.0.0.0.0.0.0.0.8.e.f.ip6.arpa. (90)
19:50:36.289783 IP tatuya-latitudee6230.mdns > mdns.mcast.net.mdns: 0 PTR (QM)? 4.3.2.0.4.e.6.9.f.4.8.2.3.2.a.9.0.0.0.0.0.0.0.0.0.0.0.0.0.8.e.f.ip6.arpa. (90)
19:50:37.300804 IP tatuya-latitudee6230.47352 > ec2-52-35-150-14.us-west-2.compute.amazonaws.com.https: Flags [S], seq 102495352, win 64240, options [mss 1460,sackOK,TS val 2903006017 ecr 0,nop,wscale 7], length 0
19:50:37.514127 IP tatuya-latitudee6230.47354 > ec2-52-35-150-14.us-west-2.compute.amazonaws.com.https: Flags [S], seq 3307558615, win 64240, options [mss 1460,sackOK,TS val 2903006230 ecr 0,nop,wscale 7], length 0
19:50:42.420767 ARP, Request who-has _gateway tell tatuya-latitudee6230, length 28
19:50:42.421518 ARP, Reply _gateway is-at d0:96:fb:e7:bb:a2 (oui Unknown), length 46
19:50:42.531664 Loopback, skipCount 0,  invalid (256)
19:50:50.736609 IP tatuya-latitudee6230.57796 > ec2-52-35-150-14.us-west-2.compute.amazonaws.com.https: Flags [S], seq 2361581801, win 64240, options [mss 1460,sackOK,TS val 2903019453 ecr 0,nop,wscale 7], length 0
19:50:50.986757 IP tatuya-latitudee6230.57800 > ec2-52-35-150-14.us-west-2.compute.amazonaws.com.https: Flags [S], seq 30556596, win 64240, options [mss 1460,sackOK,TS val 2903019703 ecr 0,nop,wscale 7], length 0
19:50:51.548963 IP lb-140-82-114-25-iad.github.com.https > tatuya-latitudee6230.53164: Flags [P.], seq 25:51, ack 30, win 71, options [nop,nop,TS val 3979405486 ecr 4203778457], length 26
19:50:51.549315 IP tatuya-latitudee6230.53164 > lb-140-82-114-25-iad.github.com.https: Flags [P.], seq 30:60, ack 51, win 590, options [nop,nop,TS val 4203838457 ecr 3979405486], length 30
19:50:51.745832 IP lb-140-82-114-25-iad.github.com.https > tatuya-latitudee6230.53164: Flags [.], ack 60, win 71, options [nop,nop,TS val 3979405683 ecr 4203838457], length 0
19:50:51.754134 IP tatuya-latitudee6230.57796 > ec2-52-35-150-14.us-west-2.compute.amazonaws.com.https: Flags [S], seq 2361581801, win 64240, options [mss 1460,sackOK,TS val 2903020470 ecr 0,nop,wscale 7], length 0
19:50:51.994118 IP tatuya-latitudee6230.57800 > ec2-52-35-150-14.us-west-2.compute.amazonaws.com.https: Flags [S], seq 30556596, win 64240, options [mss 1460,sackOK,TS val 2903020710 ecr 0,nop,wscale 7], length 0
19:50:52.552995 Loopback, skipCount 0,  invalid (256)
19:50:52.767460 IP tatuya-latitudee6230.57796 > ec2-52-35-150-14.us-west-2.compute.amazonaws.com.https: Flags [S], seq 2361581801, win 64240, options [mss 1460,sackOK,TS val 2903021484 ecr 0,nop,wscale 7], length 0
19:50:53.007461 IP tatuya-latitudee6230.57800 > ec2-52-35-150-14.us-west-2.compute.amazonaws.com.https: Flags [S], seq 30556596, win 64240, options [mss 1460,sackOK,TS val 2903021724 ecr 0,nop,wscale 7], length 0
19:50:53.780785 IP tatuya-latitudee6230.57796 > ec2-52-35-150-14.us-west-2.compute.amazonaws.com.https: Flags [S], seq 2361581801, win 64240, options [mss 1460,sackOK,TS val 2903022497 ecr 0,nop,wscale 7], length 0
19:50:54.020811 IP tatuya-latitudee6230.57800 > ec2-52-35-150-14.us-west-2.compute.amazonaws.com.https: Flags [S], seq 30556596, win 64240, options [mss 1460,sackOK,TS val 2903022737 ecr 0,nop,wscale 7], length 0
19:50:54.794142 IP tatuya-latitudee6230.57796 > ec2-52-35-150-14.us-west-2.compute.amazonaws.com.https: Flags [S], seq 2361581801, win 64240, options [mss 1460,sackOK,TS val 2903023510 ecr 0,nop,wscale 7], length 0
19:50:55.034116 IP tatuya-latitudee6230.57800 > ec2-52-35-150-14.us-west-2.compute.amazonaws.com.https: Flags [S], seq 30556596, win 64240, options [mss 1460,sackOK,TS val 2903023750 ecr 0,nop,wscale 7], length 0
19:50:55.807443 IP tatuya-latitudee6230.57796 > ec2-52-35-150-14.us-west-2.compute.amazonaws.com.https: Flags [S], seq 2361581801, win 64240, options [mss 1460,sackOK,TS val 2903024524 ecr 0,nop,wscale 7], length 0
19:50:56.047551 IP tatuya-latitudee6230.57800 > ec2-52-35-150-14.us-west-2.compute.amazonaws.com.https: Flags [S], seq 30556596, win 64240, options [mss 1460,sackOK,TS val 2903024764 ecr 0,nop,wscale 7], length 0
19:50:57.994104 IP tatuya-latitudee6230.57796 > ec2-52-35-150-14.us-west-2.compute.amazonaws.com.https: Flags [S], seq 2361581801, win 64240, options [mss 1460,sackOK,TS val 2903026710 ecr 0,nop,wscale 7], length 0
19:50:58.207479 IP tatuya-latitudee6230.57800 > ec2-52-35-150-14.us-west-2.compute.amazonaws.com.https: Flags [S], seq 30556596, win 64240, options [mss 1460,sackOK,TS val 2903026924 ecr 0,nop,wscale 7], length 0
19:51:02.047463 IP tatuya-latitudee6230.57796 > ec2-52-35-150-14.us-west-2.compute.amazonaws.com.https: Flags [S], seq 2361581801, win 64240, options [mss 1460,sackOK,TS val 2903030764 ecr 0,nop,wscale 7], length 0
19:51:02.260826 IP tatuya-latitudee6230.57800 > ec2-52-35-150-14.us-west-2.compute.amazonaws.com.https: Flags [S], seq 30556596, win 64240, options [mss 1460,sackOK,TS val 2903030977 ecr 0,nop,wscale 7], length 0
19:51:02.297132 IP 49.75.1.47.45648 > tatuya-latitudee6230.9440: UDP, length 20
19:51:02.297208 IP tatuya-latitudee6230 > 49.75.1.47: ICMP host tatuya-latitudee6230 unreachable - admin prohibited filter, length 56
19:51:02.572199 Loopback, skipCount 0,  invalid (256)
19:51:02.581691 IP tatuya-latitudee6230.35024 > bns1.hananet.net.domain: 1260+ PTR? 47.1.75.49.in-addr.arpa. (41)
19:51:02.597196 IP bns1.hananet.net.domain > tatuya-latitudee6230.35024: 1260 NXDomain 0/1/0 (144)
19:51:07.605249 ARP, Request who-has tatuya-latitudee6230 tell _gateway, length 46
19:51:07.605265 ARP, Reply tatuya-latitudee6230 is-at f0:1f:af:2a:cd:d3 (oui Unknown), length 28
19:51:10.154097 IP tatuya-latitudee6230.57796 > ec2-52-35-150-14.us-west-2.compute.amazonaws.com.https: Flags [S], seq 2361581801, win 64240, options [mss 1460,sackOK,TS val 2903038870 ecr 0,nop,wscale 7], length 0
19:51:10.367459 IP tatuya-latitudee6230.57800 > ec2-52-35-150-14.us-west-2.compute.amazonaws.com.https: Flags [S], seq 30556596, win 64240, options [mss 1460,sackOK,TS val 2903039084 ecr 0,nop,wscale 7], length 0
19:51:11.789734 IP 49.75.1.47.45648 > tatuya-latitudee6230.9440: UDP, length 20
19:51:11.789800 IP tatuya-latitudee6230 > 49.75.1.47: ICMP host tatuya-latitudee6230 unreachable - admin prohibited filter, length 56
19:51:12.593378 Loopback, skipCount 0,  invalid (256)
19:51:15.274098 ARP, Request who-has _gateway tell tatuya-latitudee6230, length 28
19:51:15.275186 ARP, Reply _gateway is-at d0:96:fb:e7:bb:a2 (oui Unknown), length 46
19:51:22.613519 Loopback, skipCount 0,  invalid (256)
19:51:23.357618 IP tatuya-latitudee6230.55343 > bns1.hananet.net.domain: 36041+ A? self.adblockultimate.net. (42)
19:51:23.357634 IP tatuya-latitudee6230.55343 > bns1.hananet.net.domain: 60100+ AAAA? self.adblockultimate.net. (42)
19:51:23.358886 IP bns1.hananet.net.domain > tatuya-latitudee6230.55343: 36041 1/0/0 A 52.35.150.14 (58)
19:51:23.358887 IP bns1.hananet.net.domain > tatuya-latitudee6230.55343: 60100 0/0/0 (42)
19:51:23.379190 IP tatuya-latitudee6230.53178 > ec2-52-35-150-14.us-west-2.compute.amazonaws.com.https: Flags [S], seq 3797998187, win 64240, options [mss 1460,sackOK,TS val 2903052095 ecr 0,nop,wscale 7], length 0
19:51:23.629926 IP tatuya-latitudee6230.53180 > ec2-52-35-150-14.us-west-2.compute.amazonaws.com.https: Flags [S], seq 1298039030, win 64240, options [mss 1460,sackOK,TS val 2903052346 ecr 0,nop,wscale 7], length 0
19:51:23.630199 IP tatuya-latitudee6230.50534 > bns1.hananet.net.domain: 17227+ A? self.adblockultimate.net. (42)
19:51:23.631780 IP bns1.hananet.net.domain > tatuya-latitudee6230.50534: 17227 1/0/0 A 52.35.150.14 (58)
19:51:24.394117 IP tatuya-latitudee6230.53178 > ec2-52-35-150-14.us-west-2.compute.amazonaws.com.https: Flags [S], seq 3797998187, win 64240, options [mss 1460,sackOK,TS val 2903053110 ecr 0,nop,wscale 7], length 0
19:51:24.634104 IP tatuya-latitudee6230.53180 > ec2-52-35-150-14.us-west-2.compute.amazonaws.com.https: Flags [S], seq 1298039030, win 64240, options [mss 1460,sackOK,TS val 2903053350 ecr 0,nop,wscale 7], length 0
19:51:25.407443 IP tatuya-latitudee6230.53178 > ec2-52-35-150-14.us-west-2.compute.amazonaws.com.https: Flags [S], seq 3797998187, win 64240, options [mss 1460,sackOK,TS val 2903054124 ecr 0,nop,wscale 7], length 0
19:51:25.647462 IP tatuya-latitudee6230.53180 > ec2-52-35-150-14.us-west-2.compute.amazonaws.com.https: Flags [S], seq 1298039030, win 64240, options [mss 1460,sackOK,TS val 2903054364 ecr 0,nop,wscale 7], length 0
19:51:26.420784 IP tatuya-latitudee6230.53178 > ec2-52-35-150-14.us-west-2.compute.amazonaws.com.https: Flags [S], seq 3797998187, win 64240, options [mss 1460,sackOK,TS val 2903055137 ecr 0,nop,wscale 7], length 0
19:51:26.660800 IP tatuya-latitudee6230.53180 > ec2-52-35-150-14.us-west-2.compute.amazonaws.com.https: Flags [S], seq 1298039030, win 64240, options [mss 1460,sackOK,TS val 2903055377 ecr 0,nop,wscale 7], length 0
19:51:27.434120 IP tatuya-latitudee6230.53178 > ec2-52-35-150-14.us-west-2.compute.amazonaws.com.https: Flags [S], seq 3797998187, win 64240, options [mss 1460,sackOK,TS val 2903056150 ecr 0,nop,wscale 7], length 0
19:51:27.674122 IP tatuya-latitudee6230.53180 > ec2-52-35-150-14.us-west-2.compute.amazonaws.com.https: Flags [S], seq 1298039030, win 64240, options [mss 1460,sackOK,TS val 2903056390 ecr 0,nop,wscale 7], length 0
19:51:28.447468 IP tatuya-latitudee6230.53178 > ec2-52-35-150-14.us-west-2.compute.amazonaws.com.https: Flags [S], seq 3797998187, win 64240, options [mss 1460,sackOK,TS val 2903057164 ecr 0,nop,wscale 7], length 0
19:51:28.687456 IP tatuya-latitudee6230.53180 > ec2-52-35-150-14.us-west-2.compute.amazonaws.com.https: Flags [S], seq 1298039030, win 64240, options [mss 1460,sackOK,TS val 2903057404 ecr 0,nop,wscale 7], length 0
19:51:30.634123 IP tatuya-latitudee6230.53178 > ec2-52-35-150-14.us-west-2.compute.amazonaws.com.https: Flags [S], seq 3797998187, win 64240, options [mss 1460,sackOK,TS val 2903059350 ecr 0,nop,wscale 7], length 0
