20:01:09.834054 IP tatuya-latitudee6230.47372 > nrt12s47-in-f3.1e100.net.http: Flags [.], ack 3185009328, win 497, options [nop,nop,TS val 4176458567 ecr 1984863548], length 0
20:01:09.879532 IP nrt12s47-in-f3.1e100.net.http > tatuya-latitudee6230.47372: Flags [.], ack 1, win 261, options [nop,nop,TS val 1984873797 ecr 4176366694], length 0
20:01:10.342689 IP tatuya-latitudee6230.33439 > bns1.hananet.net.domain: 63758+ PTR? 195.42.251.142.in-addr.arpa. (45)
20:01:10.344343 IP bns1.hananet.net.domain > tatuya-latitudee6230.33439: 63758 1/0/0 PTR nrt12s47-in-f3.1e100.net. (83)
20:01:11.354928 IP tatuya-latitudee6230.51816 > bns1.hananet.net.domain: 63975+ PTR? 82.163.220.210.in-addr.arpa. (45)
20:01:11.356377 IP bns1.hananet.net.domain > tatuya-latitudee6230.51816: 63975 1/0/0 PTR bns1.hananet.net. (75)
20:01:13.914144 Loopback, skipCount 0,  invalid (256)
20:01:15.347033 ARP, Request who-has tatuya-latitudee6230 tell _gateway, length 46
20:01:15.347048 ARP, Reply tatuya-latitudee6230 is-at f0:1f:af:2a:cd:d3 (oui Unknown), length 28
20:01:16.141669 IP tatuya-latitudee6230.56603 > bns1.hananet.net.domain: 52440+ A? self.adblockultimate.net. (42)
20:01:16.141680 IP tatuya-latitudee6230.56603 > bns1.hananet.net.domain: 11220+ AAAA? self.adblockultimate.net. (42)
20:01:16.143524 IP bns1.hananet.net.domain > tatuya-latitudee6230.56603: 52440 1/0/0 A 52.35.150.14 (58)
20:01:16.143525 IP bns1.hananet.net.domain > tatuya-latitudee6230.56603: 11220 0/0/0 (42)
20:01:16.180166 IP tatuya-latitudee6230.56754 > ec2-52-35-150-14.us-west-2.compute.amazonaws.com.https: Flags [S], seq 3805589982, win 64240, options [mss 1460,sackOK,TS val 2903644896 ecr 0,nop,wscale 7], length 0
20:01:16.421010 IP tatuya-latitudee6230.55267 > bns1.hananet.net.domain: 35450+ PTR? 14.150.35.52.in-addr.arpa. (43)
20:01:16.430455 IP tatuya-latitudee6230.56770 > ec2-52-35-150-14.us-west-2.compute.amazonaws.com.https: Flags [S], seq 2791587469, win 64240, options [mss 1460,sackOK,TS val 2903645147 ecr 0,nop,wscale 7], length 0
20:01:16.430468 IP tatuya-latitudee6230.33161 > bns1.hananet.net.domain: 57671+ A? self.adblockultimate.net. (42)
20:01:16.432356 IP bns1.hananet.net.domain > tatuya-latitudee6230.33161: 57671 1/0/0 A 52.35.150.14 (58)
20:01:16.433324 IP bns1.hananet.net.domain > tatuya-latitudee6230.55267: 35450 1/0/0 PTR ec2-52-35-150-14.us-west-2.compute.amazonaws.com. (105)
20:01:17.194067 IP tatuya-latitudee6230.56754 > ec2-52-35-150-14.us-west-2.compute.amazonaws.com.https: Flags [S], seq 3805589982, win 64240, options [mss 1460,sackOK,TS val 2903645910 ecr 0,nop,wscale 7], length 0
20:01:17.434117 IP tatuya-latitudee6230.56770 > ec2-52-35-150-14.us-west-2.compute.amazonaws.com.https: Flags [S], seq 2791587469, win 64240, options [mss 1460,sackOK,TS val 2903646150 ecr 0,nop,wscale 7], length 0
20:01:18.207310 IP tatuya-latitudee6230.56754 > ec2-52-35-150-14.us-west-2.compute.amazonaws.com.https: Flags [S], seq 3805589982, win 64240, options [mss 1460,sackOK,TS val 2903646924 ecr 0,nop,wscale 7], length 0
20:01:18.447385 IP tatuya-latitudee6230.56770 > ec2-52-35-150-14.us-west-2.compute.amazonaws.com.https: Flags [S], seq 2791587469, win 64240, options [mss 1460,sackOK,TS val 2903647164 ecr 0,nop,wscale 7], length 0
20:01:19.220704 IP tatuya-latitudee6230.56754 > ec2-52-35-150-14.us-west-2.compute.amazonaws.com.https: Flags [S], seq 3805589982, win 64240, options [mss 1460,sackOK,TS val 2903647937 ecr 0,nop,wscale 7], length 0
20:01:19.460770 IP tatuya-latitudee6230.56770 > ec2-52-35-150-14.us-west-2.compute.amazonaws.com.https: Flags [S], seq 2791587469, win 64240, options [mss 1460,sackOK,TS val 2903648177 ecr 0,nop,wscale 7], length 0
20:01:20.073976 IP tatuya-latitudee6230.47372 > nrt12s47-in-f3.1e100.net.http: Flags [.], ack 1, win 497, options [nop,nop,TS val 4176468807 ecr 1984873797], length 0
20:01:20.111417 IP nrt12s47-in-f3.1e100.net.http > tatuya-latitudee6230.47372: Flags [.], ack 1, win 261, options [nop,nop,TS val 1984884029 ecr 4176366694], length 0
20:01:20.234131 IP tatuya-latitudee6230.56754 > ec2-52-35-150-14.us-west-2.compute.amazonaws.com.https: Flags [S], seq 3805589982, win 64240, options [mss 1460,sackOK,TS val 2903648950 ecr 0,nop,wscale 7], length 0
20:01:20.474063 IP tatuya-latitudee6230.56770 > ec2-52-35-150-14.us-west-2.compute.amazonaws.com.https: Flags [S], seq 2791587469, win 64240, options [mss 1460,sackOK,TS val 2903649190 ecr 0,nop,wscale 7], length 0
20:01:21.073094 IP tatuya-latitudee6230.48999 > bns1.hananet.net.domain: 38031+ A? incoming.telemetry.mozilla.org. (48)
20:01:21.073103 IP tatuya-latitudee6230.48999 > bns1.hananet.net.domain: 29827+ AAAA? incoming.telemetry.mozilla.org. (48)
20:01:21.074048 IP tatuya-latitudee6230.52498 > 123.208.120.34.bc.googleusercontent.com.https: Flags [P.], seq 4034419737:4034420031, ack 2597820528, win 501, options [nop,nop,TS val 2464429428 ecr 3239890770], length 294
20:01:21.074096 IP tatuya-latitudee6230.52498 > 123.208.120.34.bc.googleusercontent.com.https: Flags [P.], seq 294:1563, ack 1, win 501, options [nop,nop,TS val 2464429428 ecr 3239890770], length 1269
20:01:21.087208 IP bns1.hananet.net.domain > tatuya-latitudee6230.48999: 38031 2/0/0 CNAME telemetry-incoming.r53-2.services.mozilla.com., A 34.120.208.123 (123)
20:01:21.088112 IP 123.208.120.34.bc.googleusercontent.com.https > tatuya-latitudee6230.52498: Flags [.], ack 1563, win 324, options [nop,nop,TS val 3239947140 ecr 2464429428], length 0
20:01:21.090664 IP bns1.hananet.net.domain > tatuya-latitudee6230.48999: 29827 1/1/0 CNAME telemetry-incoming.r53-2.services.mozilla.com. (192)
20:01:21.223155 IP 123.208.120.34.bc.googleusercontent.com.https > tatuya-latitudee6230.52498: Flags [P.], seq 1:76, ack 1563, win 324, options [nop,nop,TS val 3239947276 ecr 2464429428], length 75
20:01:21.223157 IP 123.208.120.34.bc.googleusercontent.com.https > tatuya-latitudee6230.52498: Flags [P.], seq 76:147, ack 1563, win 324, options [nop,nop,TS val 3239947276 ecr 2464429428], length 71
20:01:21.223288 IP tatuya-latitudee6230.52498 > 123.208.120.34.bc.googleusercontent.com.https: Flags [.], ack 76, win 501, options [nop,nop,TS val 2464429577 ecr 3239947276], length 0
20:01:21.223315 IP tatuya-latitudee6230.52498 > 123.208.120.34.bc.googleusercontent.com.https: Flags [.], ack 147, win 501, options [nop,nop,TS val 2464429578 ecr 3239947276], length 0
20:01:21.223380 IP 123.208.120.34.bc.googleusercontent.com.https > tatuya-latitudee6230.52498: Flags [P.], seq 147:193, ack 1563, win 324, options [nop,nop,TS val 3239947276 ecr 2464429428], length 46
20:01:21.223409 IP tatuya-latitudee6230.52498 > 123.208.120.34.bc.googleusercontent.com.https: Flags [.], ack 193, win 501, options [nop,nop,TS val 2464429578 ecr 3239947276], length 0
20:01:21.224209 IP tatuya-latitudee6230.52498 > 123.208.120.34.bc.googleusercontent.com.https: Flags [P.], seq 1563:1609, ack 193, win 501, options [nop,nop,TS val 2464429578 ecr 3239947276], length 46
20:01:21.237214 IP 123.208.120.34.bc.googleusercontent.com.https > tatuya-latitudee6230.52498: Flags [.], ack 1609, win 324, options [nop,nop,TS val 3239947290 ecr 2464429578], length 0
20:01:21.247338 IP tatuya-latitudee6230.56754 > ec2-52-35-150-14.us-west-2.compute.amazonaws.com.https: Flags [S], seq 3805589982, win 64240, options [mss 1460,sackOK,TS val 2903649964 ecr 0,nop,wscale 7], length 0
20:01:21.487369 IP tatuya-latitudee6230.56770 > ec2-52-35-150-14.us-west-2.compute.amazonaws.com.https: Flags [S], seq 2791587469, win 64240, options [mss 1460,sackOK,TS val 2903650204 ecr 0,nop,wscale 7], length 0
20:01:21.488373 IP tatuya-latitudee6230.59423 > bns1.hananet.net.domain: 33093+ PTR? 123.208.120.34.in-addr.arpa. (45)
20:01:21.489560 IP bns1.hananet.net.domain > tatuya-latitudee6230.59423: 33093 1/0/0 PTR 123.208.120.34.bc.googleusercontent.com. (98)
20:01:23.274078 IP tatuya-latitudee6230.56754 > ec2-52-35-150-14.us-west-2.compute.amazonaws.com.https: Flags [S], seq 3805589982, win 64240, options [mss 1460,sackOK,TS val 2903651990 ecr 0,nop,wscale 7], length 0
20:01:23.700656 IP tatuya-latitudee6230.56770 > ec2-52-35-150-14.us-west-2.compute.amazonaws.com.https: Flags [S], seq 2791587469, win 64240, options [mss 1460,sackOK,TS val 2903652417 ecr 0,nop,wscale 7], length 0
20:01:23.934424 Loopback, skipCount 0,  invalid (256)
20:01:25.171619 IP tatuya-latitudee6230.41621 > bns1.hananet.net.domain: 9384+ A? github.com. (28)
20:01:25.171640 IP tatuya-latitudee6230.41621 > bns1.hananet.net.domain: 24668+ AAAA? github.com. (28)
20:01:25.172928 IP bns1.hananet.net.domain > tatuya-latitudee6230.41621: 24668 0/0/0 (28)
20:01:25.179400 IP bns1.hananet.net.domain > tatuya-latitudee6230.41621: 9384 1/0/0 A 20.200.245.247 (44)
20:01:25.244322 IP tatuya-latitudee6230.47850 > 20.200.245.247.https: Flags [S], seq 344842834, win 64240, options [mss 1460,sackOK,TS val 3159786921 ecr 0,nop,wscale 7], length 0
20:01:25.252157 IP 20.200.245.247.https > tatuya-latitudee6230.47850: Flags [S.], seq 485586797, ack 344842835, win 65535, options [mss 1436,sackOK,TS val 815955711 ecr 3159786921,nop,wscale 10], length 0
20:01:25.252249 IP tatuya-latitudee6230.47850 > 20.200.245.247.https: Flags [.], ack 1, win 502, options [nop,nop,TS val 3159786928 ecr 815955711], length 0
20:01:25.254531 IP tatuya-latitudee6230.47850 > 20.200.245.247.https: Flags [P.], seq 1:830, ack 1, win 502, options [nop,nop,TS val 3159786931 ecr 815955711], length 829
20:01:25.264131 IP 20.200.245.247.https > tatuya-latitudee6230.47850: Flags [P.], seq 1:2849, ack 830, win 67, options [nop,nop,TS val 815955723 ecr 3159786931], length 2848
20:01:25.264133 IP 20.200.245.247.https > tatuya-latitudee6230.47850: Flags [P.], seq 2849:3493, ack 830, win 67, options [nop,nop,TS val 815955723 ecr 3159786931], length 644
20:01:25.264215 IP tatuya-latitudee6230.47850 > 20.200.245.247.https: Flags [.], ack 2849, win 546, options [nop,nop,TS val 3159786940 ecr 815955723], length 0
20:01:25.264231 IP tatuya-latitudee6230.47850 > 20.200.245.247.https: Flags [.], ack 3493, win 568, options [nop,nop,TS val 3159786940 ecr 815955723], length 0
20:01:25.277224 IP tatuya-latitudee6230.47850 > 20.200.245.247.https: Flags [P.], seq 830:894, ack 3493, win 568, options [nop,nop,TS val 3159786953 ecr 815955723], length 64
20:01:25.277767 IP tatuya-latitudee6230.47850 > 20.200.245.247.https: Flags [P.], seq 894:1064, ack 3493, win 568, options [nop,nop,TS val 3159786954 ecr 815955723], length 170
20:01:25.277803 IP tatuya-latitudee6230.47850 > 20.200.245.247.https: Flags [P.], seq 1064:2598, ack 3493, win 568, options [nop,nop,TS val 3159786954 ecr 815955723], length 1534
20:01:25.285871 IP 20.200.245.247.https > tatuya-latitudee6230.47850: Flags [P.], seq 3493:3572, ack 1064, win 69, options [nop,nop,TS val 815955745 ecr 3159786953], length 79
20:01:25.285874 IP 20.200.245.247.https > tatuya-latitudee6230.47850: Flags [P.], seq 3572:3651, ack 1064, win 69, options [nop,nop,TS val 815955745 ecr 3159786953], length 79
20:01:25.286083 IP 20.200.245.247.https > tatuya-latitudee6230.47850: Flags [P.], seq 3651:3715, ack 1064, win 69, options [nop,nop,TS val 815955745 ecr 3159786953], length 64
20:01:25.288010 IP tatuya-latitudee6230.47850 > 20.200.245.247.https: Flags [.], ack 3715, win 568, options [nop,nop,TS val 3159786964 ecr 815955745], length 0
20:01:25.288064 IP tatuya-latitudee6230.47850 > 20.200.245.247.https: Flags [P.], seq 2598:2629, ack 3715, win 568, options [nop,nop,TS val 3159786964 ecr 815955745], length 31
20:01:25.289772 IP 20.200.245.247.https > tatuya-latitudee6230.47850: Flags [.], ack 2598, win 72, options [nop,nop,TS val 815955749 ecr 3159786954], length 0
20:01:25.338515 IP 20.200.245.247.https > tatuya-latitudee6230.47850: Flags [.], ack 2629, win 72, options [nop,nop,TS val 815955798 ecr 3159786964], length 0
20:01:25.544316 IP tatuya-latitudee6230.37815 > bns1.hananet.net.domain: 28807+ PTR? 247.245.200.20.in-addr.arpa. (45)
20:01:25.545633 IP bns1.hananet.net.domain > tatuya-latitudee6230.37815: 28807 NXDomain 0/0/0 (45)
20:01:25.607835 IP 20.200.245.247.https > tatuya-latitudee6230.47850: Flags [.], seq 3715:7987, ack 2629, win 72, options [nop,nop,TS val 815956067 ecr 3159786964], length 4272
20:01:25.607875 IP tatuya-latitudee6230.47850 > 20.200.245.247.https: Flags [.], ack 7987, win 635, options [nop,nop,TS val 3159787284 ecr 815956067], length 0
20:01:25.607933 IP 20.200.245.247.https > tatuya-latitudee6230.47850: Flags [P.], seq 7987:10205, ack 2629, win 72, options [nop,nop,TS val 815956067 ecr 3159786964], length 2218
20:01:25.607949 IP tatuya-latitudee6230.47850 > 20.200.245.247.https: Flags [.], ack 10205, win 659, options [nop,nop,TS val 3159787284 ecr 815956067], length 0
20:01:25.933874 IP tatuya-latitudee6230.60847 > bns1.hananet.net.domain: 30446+ A? sync-1-us-west1-g.sync.services.mozilla.com. (61)
20:01:25.933887 IP tatuya-latitudee6230.60847 > bns1.hananet.net.domain: 4586+ AAAA? sync-1-us-west1-g.sync.services.mozilla.com. (61)
20:01:25.934293 IP tatuya-latitudee6230.34736 > 140.227.186.35.bc.googleusercontent.com.https: Flags [P.], seq 4210292408:4210293023, ack 3119973572, win 494, options [nop,nop,TS val 719073859 ecr 2590259580], length 615
20:01:25.934322 IP tatuya-latitudee6230.34736 > 140.227.186.35.bc.googleusercontent.com.https: Flags [P.], seq 615:1567, ack 1, win 494, options [nop,nop,TS val 719073859 ecr 2590259580], length 952
20:01:25.934396 IP tatuya-latitudee6230.34736 > 140.227.186.35.bc.googleusercontent.com.https: Flags [P.], seq 1567:1616, ack 1, win 494, options [nop,nop,TS val 719073859 ecr 2590259580], length 49
20:01:25.935755 IP bns1.hananet.net.domain > tatuya-latitudee6230.60847: 30446 1/0/0 A 35.186.227.140 (77)
20:01:25.935756 IP bns1.hananet.net.domain > tatuya-latitudee6230.60847: 4586 0/0/0 (61)
20:01:25.952212 IP 140.227.186.35.bc.googleusercontent.com.https > tatuya-latitudee6230.34736: Flags [.], ack 1567, win 318, options [nop,nop,TS val 2590306761 ecr 719073859], length 0
20:01:25.956783 IP 140.227.186.35.bc.googleusercontent.com.https > tatuya-latitudee6230.34736: Flags [.], ack 1616, win 318, options [nop,nop,TS val 2590306766 ecr 719073859], length 0
20:01:26.114530 IP 140.227.186.35.bc.googleusercontent.com.https > tatuya-latitudee6230.34736: Flags [P.], seq 1:93, ack 1616, win 318, options [nop,nop,TS val 2590306924 ecr 719073859], length 92
20:01:26.114531 IP 140.227.186.35.bc.googleusercontent.com.https > tatuya-latitudee6230.34736: Flags [P.], seq 93:189, ack 1616, win 318, options [nop,nop,TS val 2590306924 ecr 719073859], length 96
20:01:26.114639 IP tatuya-latitudee6230.34736 > 140.227.186.35.bc.googleusercontent.com.https: Flags [.], ack 93, win 494, options [nop,nop,TS val 719074039 ecr 2590306924], length 0
20:01:26.114663 IP tatuya-latitudee6230.34736 > 140.227.186.35.bc.googleusercontent.com.https: Flags [.], ack 189, win 494, options [nop,nop,TS val 719074039 ecr 2590306924], length 0
20:01:26.114714 IP 140.227.186.35.bc.googleusercontent.com.https > tatuya-latitudee6230.34736: Flags [P.], seq 189:228, ack 1616, win 318, options [nop,nop,TS val 2590306924 ecr 719073859], length 39
20:01:26.114742 IP tatuya-latitudee6230.34736 > 140.227.186.35.bc.googleusercontent.com.https: Flags [.], ack 228, win 494, options [nop,nop,TS val 719074039 ecr 2590306924], length 0
20:01:26.115385 IP tatuya-latitudee6230.34736 > 140.227.186.35.bc.googleusercontent.com.https: Flags [P.], seq 1616:1655, ack 228, win 494, options [nop,nop,TS val 719074040 ecr 2590306924], length 39
20:01:26.126477 IP 140.227.186.35.bc.googleusercontent.com.https > tatuya-latitudee6230.34736: Flags [.], ack 1655, win 318, options [nop,nop,TS val 2590306936 ecr 719074040], length 0
20:01:26.555410 IP tatuya-latitudee6230.40794 > bns1.hananet.net.domain: 15614+ PTR? 140.227.186.35.in-addr.arpa. (45)
20:01:26.638628 IP bns1.hananet.net.domain > tatuya-latitudee6230.40794: 15614 1/0/0 PTR 140.227.186.35.bc.googleusercontent.com. (98)
20:01:26.898343 IP tatuya-latitudee6230.38282 > bns1.hananet.net.domain: 7043+ HTTPS? api.github.com. (32)
20:01:26.898585 IP tatuya-latitudee6230.40811 > bns1.hananet.net.domain: 43454+ A? api.github.com. (32)
20:01:26.898594 IP tatuya-latitudee6230.40811 > bns1.hananet.net.domain: 30113+ AAAA? api.github.com. (32)
20:01:26.908422 IP bns1.hananet.net.domain > tatuya-latitudee6230.38282: 7043 0/1/0 (116)
20:01:26.912340 IP bns1.hananet.net.domain > tatuya-latitudee6230.40811: 43454 1/0/0 A 20.200.245.245 (48)
20:01:26.912806 IP bns1.hananet.net.domain > tatuya-latitudee6230.40811: 30113 0/1/0 (116)
20:01:26.918601 IP tatuya-latitudee6230.54136 > bns1.hananet.net.domain: 41448+ HTTPS? avatars.githubusercontent.com. (47)
20:01:26.918777 IP tatuya-latitudee6230.35342 > bns1.hananet.net.domain: 36006+ A? avatars.githubusercontent.com. (47)
20:01:26.918787 IP tatuya-latitudee6230.35342 > bns1.hananet.net.domain: 21152+ AAAA? avatars.githubusercontent.com. (47)
20:01:26.926145 IP bns1.hananet.net.domain > tatuya-latitudee6230.54136: 41448 0/1/0 (129)
20:01:26.926833 IP bns1.hananet.net.domain > tatuya-latitudee6230.35342: 36006 4/0/0 A 185.199.111.133, A 185.199.109.133, A 185.199.108.133, A 185.199.110.133 (111)
20:01:26.927337 IP bns1.hananet.net.domain > tatuya-latitudee6230.35342: 21152 4/0/0 AAAA 2606:50c0:8002::154, AAAA 2606:50c0:8001::154, AAAA 2606:50c0:8000::154, AAAA 2606:50c0:8003::154 (159)
20:01:26.929852 IP tatuya-latitudee6230.46490 > cdn-185-199-111-133.github.com.https: Flags [S], seq 1193833893, win 64240, options [mss 1460,sackOK,TS val 713999500 ecr 0,nop,wscale 7], length 0
20:01:26.939074 IP tatuya-latitudee6230.47850 > 20.200.245.247.https: Flags [P.], seq 2629:3545, ack 10205, win 659, options [nop,nop,TS val 3159788615 ecr 815956067], length 916
20:01:26.946046 IP 20.200.245.247.https > tatuya-latitudee6230.47850: Flags [.], ack 3545, win 74, options [nop,nop,TS val 815957405 ecr 3159788615], length 0
20:01:27.062959 IP cdn-185-199-111-133.github.com.https > tatuya-latitudee6230.46490: Flags [S.], seq 781508859, ack 1193833894, win 65535, options [mss 1460,sackOK,TS val 22230471 ecr 713999500,nop,wscale 9], length 0
20:01:27.063019 IP tatuya-latitudee6230.46490 > cdn-185-199-111-133.github.com.https: Flags [.], ack 1, win 502, options [nop,nop,TS val 713999633 ecr 22230471], length 0
20:01:27.066828 IP tatuya-latitudee6230.46490 > cdn-185-199-111-133.github.com.https: Flags [P.], seq 1:1121, ack 1, win 502, options [nop,nop,TS val 713999637 ecr 22230471], length 1120
20:01:27.203238 IP cdn-185-199-111-133.github.com.https > tatuya-latitudee6230.46490: Flags [.], ack 1121, win 288, options [nop,nop,TS val 22230611 ecr 713999637], length 0
20:01:27.203845 IP cdn-185-199-111-133.github.com.https > tatuya-latitudee6230.46490: Flags [P.], seq 1:454, ack 1121, win 288, options [nop,nop,TS val 22230612 ecr 713999637], length 453
20:01:27.203982 IP tatuya-latitudee6230.46490 > cdn-185-199-111-133.github.com.https: Flags [.], ack 454, win 501, options [nop,nop,TS val 713999774 ecr 22230612], length 0
20:01:27.206772 IP tatuya-latitudee6230.46490 > cdn-185-199-111-133.github.com.https: Flags [P.], seq 1121:1185, ack 454, win 501, options [nop,nop,TS val 713999777 ecr 22230612], length 64
20:01:27.208293 IP tatuya-latitudee6230.46490 > cdn-185-199-111-133.github.com.https: Flags [P.], seq 1185:1355, ack 454, win 501, options [nop,nop,TS val 713999779 ecr 22230612], length 170
20:01:27.208328 IP tatuya-latitudee6230.46490 > cdn-185-199-111-133.github.com.https: Flags [P.], seq 1355:1686, ack 454, win 501, options [nop,nop,TS val 713999779 ecr 22230612], length 331
20:01:27.327397 IP tatuya-latitudee6230.56754 > ec2-52-35-150-14.us-west-2.compute.amazonaws.com.https: Flags [S], seq 3805589982, win 64240, options [mss 1460,sackOK,TS val 2903656044 ecr 0,nop,wscale 7], length 0
20:01:27.341176 IP cdn-185-199-111-133.github.com.https > tatuya-latitudee6230.46490: Flags [.], ack 1185, win 288, options [nop,nop,TS val 22230749 ecr 713999777], length 0
20:01:27.341180 IP cdn-185-199-111-133.github.com.https > tatuya-latitudee6230.46490: Flags [.], ack 1355, win 292, options [nop,nop,TS val 22230749 ecr 713999779], length 0
20:01:27.341293 IP cdn-185-199-111-133.github.com.https > tatuya-latitudee6230.46490: Flags [P.], seq 454:519, ack 1355, win 292, options [nop,nop,TS val 22230749 ecr 713999779], length 65
20:01:27.341295 IP cdn-185-199-111-133.github.com.https > tatuya-latitudee6230.46490: Flags [.], ack 1686, win 296, options [nop,nop,TS val 22230750 ecr 713999779], length 0
20:01:27.341463 IP tatuya-latitudee6230.46490 > cdn-185-199-111-133.github.com.https: Flags [P.], seq 1686:1717, ack 519, win 501, options [nop,nop,TS val 713999912 ecr 22230749], length 31
20:01:27.342844 IP cdn-185-199-111-133.github.com.https > tatuya-latitudee6230.46490: Flags [P.], seq 519:1117, ack 1686, win 296, options [nop,nop,TS val 22230751 ecr 713999779], length 598
20:01:27.343094 IP cdn-185-199-111-133.github.com.https > tatuya-latitudee6230.46490: Flags [P.], seq 1117:4005, ack 1686, win 296, options [nop,nop,TS val 22230751 ecr 713999779], length 2888
20:01:27.343100 IP cdn-185-199-111-133.github.com.https > tatuya-latitudee6230.46490: Flags [.], seq 4005:5449, ack 1686, win 296, options [nop,nop,TS val 22230751 ecr 713999779], length 1444
20:01:27.343206 IP tatuya-latitudee6230.46490 > cdn-185-199-111-133.github.com.https: Flags [.], ack 4005, win 546, options [nop,nop,TS val 713999913 ecr 22230751], length 0
20:01:27.343330 IP cdn-185-199-111-133.github.com.https > tatuya-latitudee6230.46490: Flags [P.], seq 5449:6893, ack 1686, win 296, options [nop,nop,TS val 22230751 ecr 713999779], length 1444
20:01:27.343338 IP cdn-185-199-111-133.github.com.https > tatuya-latitudee6230.46490: Flags [P.], seq 6893:9781, ack 1686, win 296, options [nop,nop,TS val 22230751 ecr 713999779], length 2888
20:01:27.343343 IP cdn-185-199-111-133.github.com.https > tatuya-latitudee6230.46490: Flags [P.], seq 9781:12669, ack 1686, win 296, options [nop,nop,TS val 22230751 ecr 713999779], length 2888
20:01:27.343400 IP tatuya-latitudee6230.46490 > cdn-185-199-111-133.github.com.https: Flags [.], ack 6893, win 591, options [nop,nop,TS val 713999914 ecr 22230751], length 0
20:01:27.343434 IP tatuya-latitudee6230.46490 > cdn-185-199-111-133.github.com.https: Flags [.], ack 9781, win 637, options [nop,nop,TS val 713999914 ecr 22230751], length 0
20:01:27.344350 IP tatuya-latitudee6230.46490 > cdn-185-199-111-133.github.com.https: Flags [.], ack 12669, win 624, options [nop,nop,TS val 713999915 ecr 22230751], length 0
20:01:27.347748 IP cdn-185-199-111-133.github.com.https > tatuya-latitudee6230.46490: Flags [P.], seq 12669:15557, ack 1686, win 296, options [nop,nop,TS val 22230756 ecr 713999779], length 2888
20:01:27.347800 IP tatuya-latitudee6230.46490 > cdn-185-199-111-133.github.com.https: Flags [.], ack 15557, win 682, options [nop,nop,TS val 713999918 ecr 22230756], length 0
20:01:27.352438 IP cdn-185-199-111-133.github.com.https > tatuya-latitudee6230.46490: Flags [P.], seq 15557:18445, ack 1686, win 296, options [nop,nop,TS val 22230761 ecr 713999779], length 2888
20:01:27.352488 IP tatuya-latitudee6230.46490 > cdn-185-199-111-133.github.com.https: Flags [.], ack 18445, win 698, options [nop,nop,TS val 713999923 ecr 22230761], length 0
20:01:27.357062 IP cdn-185-199-111-133.github.com.https > tatuya-latitudee6230.46490: Flags [P.], seq 18445:21333, ack 1686, win 296, options [nop,nop,TS val 22230765 ecr 713999779], length 2888
20:01:27.357123 IP tatuya-latitudee6230.46490 > cdn-185-199-111-133.github.com.https: Flags [.], ack 21333, win 698, options [nop,nop,TS val 713999927 ecr 22230765], length 0
20:01:27.361765 IP cdn-185-199-111-133.github.com.https > tatuya-latitudee6230.46490: Flags [P.], seq 21333:24221, ack 1686, win 296, options [nop,nop,TS val 22230770 ecr 713999779], length 2888
20:01:27.361812 IP tatuya-latitudee6230.46490 > cdn-185-199-111-133.github.com.https: Flags [.], ack 24221, win 698, options [nop,nop,TS val 713999932 ecr 22230770], length 0
20:01:27.366396 IP cdn-185-199-111-133.github.com.https > tatuya-latitudee6230.46490: Flags [P.], seq 24221:27109, ack 1686, win 296, options [nop,nop,TS val 22230775 ecr 713999779], length 2888
20:01:27.366443 IP tatuya-latitudee6230.46490 > cdn-185-199-111-133.github.com.https: Flags [.], ack 27109, win 698, options [nop,nop,TS val 713999937 ecr 22230775], length 0
20:01:27.371055 IP cdn-185-199-111-133.github.com.https > tatuya-latitudee6230.46490: Flags [P.], seq 27109:29997, ack 1686, win 296, options [nop,nop,TS val 22230779 ecr 713999779], length 2888
20:01:27.371140 IP tatuya-latitudee6230.46490 > cdn-185-199-111-133.github.com.https: Flags [.], ack 29997, win 698, options [nop,nop,TS val 713999941 ecr 22230779], length 0
20:01:27.375667 IP cdn-185-199-111-133.github.com.https > tatuya-latitudee6230.46490: Flags [P.], seq 29997:32885, ack 1686, win 296, options [nop,nop,TS val 22230784 ecr 713999779], length 2888
20:01:27.375715 IP tatuya-latitudee6230.46490 > cdn-185-199-111-133.github.com.https: Flags [.], ack 32885, win 698, options [nop,nop,TS val 713999946 ecr 22230784], length 0
20:01:27.380382 IP cdn-185-199-111-133.github.com.https > tatuya-latitudee6230.46490: Flags [P.], seq 32885:35773, ack 1686, win 296, options [nop,nop,TS val 22230789 ecr 713999779], length 2888
20:01:27.380503 IP tatuya-latitudee6230.46490 > cdn-185-199-111-133.github.com.https: Flags [.], ack 35773, win 698, options [nop,nop,TS val 713999951 ecr 22230789], length 0
20:01:27.384988 IP cdn-185-199-111-133.github.com.https > tatuya-latitudee6230.46490: Flags [P.], seq 35773:38661, ack 1686, win 296, options [nop,nop,TS val 22230793 ecr 713999779], length 2888
20:01:27.385039 IP tatuya-latitudee6230.46490 > cdn-185-199-111-133.github.com.https: Flags [.], ack 38661, win 698, options [nop,nop,TS val 713999955 ecr 22230793], length 0
20:01:27.389635 IP cdn-185-199-111-133.github.com.https > tatuya-latitudee6230.46490: Flags [P.], seq 38661:41549, ack 1686, win 296, options [nop,nop,TS val 22230798 ecr 713999779], length 2888
20:01:27.389687 IP tatuya-latitudee6230.46490 > cdn-185-199-111-133.github.com.https: Flags [.], ack 41549, win 698, options [nop,nop,TS val 713999960 ecr 22230798], length 0
20:01:27.475387 IP cdn-185-199-111-133.github.com.https > tatuya-latitudee6230.46490: Flags [P.], seq 41549:44437, ack 1717, win 296, options [nop,nop,TS val 22230884 ecr 713999912], length 2888
20:01:27.475484 IP tatuya-latitudee6230.46490 > cdn-185-199-111-133.github.com.https: Flags [.], ack 44437, win 698, options [nop,nop,TS val 714000046 ecr 22230884], length 0
20:01:27.477643 IP cdn-185-199-111-133.github.com.https > tatuya-latitudee6230.46490: Flags [P.], seq 44437:47325, ack 1717, win 296, options [nop,nop,TS val 22230886 ecr 713999913], length 2888
20:01:27.477770 IP tatuya-latitudee6230.46490 > cdn-185-199-111-133.github.com.https: Flags [.], ack 47325, win 743, options [nop,nop,TS val 714000048 ecr 22230886], length 0
20:01:27.481658 IP cdn-185-199-111-133.github.com.https > tatuya-latitudee6230.46490: Flags [P.], seq 47325:50213, ack 1717, win 296, options [nop,nop,TS val 22230890 ecr 713999913], length 2888
20:01:27.481688 IP tatuya-latitudee6230.46490 > cdn-185-199-111-133.github.com.https: Flags [.], ack 50213, win 788, options [nop,nop,TS val 714000052 ecr 22230890], length 0
20:01:27.485751 IP cdn-185-199-111-133.github.com.https > tatuya-latitudee6230.46490: Flags [P.], seq 50213:52430, ack 1717, win 296, options [nop,nop,TS val 22230894 ecr 713999915], length 2217
20:01:27.485785 IP tatuya-latitudee6230.46490 > cdn-185-199-111-133.github.com.https: Flags [.], ack 52430, win 823, options [nop,nop,TS val 714000056 ecr 22230894], length 0
20:01:27.488359 IP cdn-185-199-111-133.github.com.https > tatuya-latitudee6230.46490: Flags [P.], seq 52430:53513, ack 1717, win 296, options [nop,nop,TS val 22230897 ecr 713999918], length 1083
20:01:27.533979 IP tatuya-latitudee6230.46490 > cdn-185-199-111-133.github.com.https: Flags [.], ack 53513, win 845, options [nop,nop,TS val 714000104 ecr 22230897], length 0
20:01:27.567834 IP tatuya-latitudee6230.44468 > bns1.hananet.net.domain: 2040+ PTR? 133.111.199.185.in-addr.arpa. (46)
20:01:27.576847 IP bns1.hananet.net.domain > tatuya-latitudee6230.44468: 2040 1/0/0 PTR cdn-185-199-111-133.github.com. (90)
20:01:27.753984 IP tatuya-latitudee6230.56770 > ec2-52-35-150-14.us-west-2.compute.amazonaws.com.https: Flags [S], seq 2791587469, win 64240, options [mss 1460,sackOK,TS val 2903656470 ecr 0,nop,wscale 7], length 0
20:01:27.757571 IP 20.200.245.247.https > tatuya-latitudee6230.47850: Flags [.], seq 10205:13053, ack 3545, win 74, options [nop,nop,TS val 815958217 ecr 3159788615], length 2848
20:01:27.757623 IP tatuya-latitudee6230.47850 > 20.200.245.247.https: Flags [.], ack 13053, win 690, options [nop,nop,TS val 3159789434 ecr 815958217], length 0
20:01:27.757689 IP 20.200.245.247.https > tatuya-latitudee6230.47850: Flags [P.], seq 13053:17325, ack 3545, win 74, options [nop,nop,TS val 815958217 ecr 3159788615], length 4272
20:01:27.757742 IP 20.200.245.247.https > tatuya-latitudee6230.47850: Flags [P.], seq 17325:21597, ack 3545, win 74, options [nop,nop,TS val 815958217 ecr 3159788615], length 4272
20:01:27.757743 IP 20.200.245.247.https > tatuya-latitudee6230.47850: Flags [.], seq 21597:23021, ack 3545, win 74, options [nop,nop,TS val 815958217 ecr 3159788615], length 1424
20:01:27.757801 IP tatuya-latitudee6230.47850 > 20.200.245.247.https: Flags [.], ack 23021, win 617, options [nop,nop,TS val 3159789434 ecr 815958217], length 0
20:01:27.757817 IP 20.200.245.247.https > tatuya-latitudee6230.47850: Flags [P.], seq 23021:24445, ack 3545, win 74, options [nop,nop,TS val 815958217 ecr 3159788615], length 1424
20:01:27.765812 IP 20.200.245.247.https > tatuya-latitudee6230.47850: Flags [P.], seq 24445:27293, ack 3545, win 74, options [nop,nop,TS val 815958225 ecr 3159789434], length 2848
20:01:27.765815 IP 20.200.245.247.https > tatuya-latitudee6230.47850: Flags [P.], seq 27293:30141, ack 3545, win 74, options [nop,nop,TS val 815958225 ecr 3159789434], length 2848
20:01:27.765871 IP tatuya-latitudee6230.47850 > 20.200.245.247.https: Flags [.], ack 27293, win 690, options [nop,nop,TS val 3159789442 ecr 815958217], length 0
20:01:27.765947 IP 20.200.245.247.https > tatuya-latitudee6230.47850: Flags [P.], seq 30141:34413, ack 3545, win 74, options [nop,nop,TS val 815958225 ecr 3159789434], length 4272
20:01:27.765949 IP 20.200.245.247.https > tatuya-latitudee6230.47850: Flags [P.], seq 34413:38685, ack 3545, win 74, options [nop,nop,TS val 815958225 ecr 3159789434], length 4272
20:01:27.765950 IP 20.200.245.247.https > tatuya-latitudee6230.47850: Flags [P.], seq 38685:42957, ack 3545, win 74, options [nop,nop,TS val 815958225 ecr 3159789434], length 4272
20:01:27.765973 IP 20.200.245.247.https > tatuya-latitudee6230.47850: Flags [P.], seq 42957:47229, ack 3545, win 74, options [nop,nop,TS val 815958225 ecr 3159789434], length 4272
20:01:27.765988 IP tatuya-latitudee6230.47850 > 20.200.245.247.https: Flags [.], ack 30141, win 668, options [nop,nop,TS val 3159789442 ecr 815958225], length 0
20:01:27.766048 IP tatuya-latitudee6230.47850 > 20.200.245.247.https: Flags [.], ack 47229, win 544, options [nop,nop,TS val 3159789442 ecr 815958225], length 0
20:01:27.774039 IP 20.200.245.247.https > tatuya-latitudee6230.47850: Flags [P.], seq 47229:52925, ack 3545, win 74, options [nop,nop,TS val 815958233 ecr 3159789442], length 5696
20:01:27.774043 IP 20.200.245.247.https > tatuya-latitudee6230.47850: Flags [P.], seq 52925:58621, ack 3545, win 74, options [nop,nop,TS val 815958233 ecr 3159789442], length 5696
20:01:27.774117 IP tatuya-latitudee6230.47850 > 20.200.245.247.https: Flags [.], ack 52925, win 669, options [nop,nop,TS val 3159789450 ecr 815958233], length 0
20:01:27.774177 IP 20.200.245.247.https > tatuya-latitudee6230.47850: Flags [P.], seq 58621:64317, ack 3545, win 74, options [nop,nop,TS val 815958233 ecr 3159789442], length 5696
20:01:27.774189 IP 20.200.245.247.https > tatuya-latitudee6230.47850: Flags [P.], seq 64317:74285, ack 3545, win 74, options [nop,nop,TS val 815958233 ecr 3159789442], length 9968
20:01:27.774195 IP tatuya-latitudee6230.47850 > 20.200.245.247.https: Flags [.], ack 58621, win 690, options [nop,nop,TS val 3159789450 ecr 815958233], length 0
20:01:27.774225 IP tatuya-latitudee6230.47850 > 20.200.245.247.https: Flags [.], ack 64317, win 779, options [nop,nop,TS val 3159789450 ecr 815958233], length 0
20:01:27.774243 IP tatuya-latitudee6230.47850 > 20.200.245.247.https: Flags [.], ack 74285, win 935, options [nop,nop,TS val 3159789450 ecr 815958233], length 0
20:01:27.774255 IP 20.200.245.247.https > tatuya-latitudee6230.47850: Flags [P.], seq 74285:76610, ack 3545, win 74, options [nop,nop,TS val 815958233 ecr 3159789442], length 2325
20:01:27.774277 IP tatuya-latitudee6230.47850 > 20.200.245.247.https: Flags [.], ack 76610, win 971, options [nop,nop,TS val 3159789451 ecr 815958233], length 0
20:01:28.003427 IP tatuya-latitudee6230.52124 > bns1.hananet.net.domain: 8112+ HTTPS? github.githubassets.com. (41)
20:01:28.003499 IP tatuya-latitudee6230.57710 > bns1.hananet.net.domain: 19181+ HTTPS? avatars.githubusercontent.com. (47)
20:01:28.013616 IP bns1.hananet.net.domain > tatuya-latitudee6230.52124: 8112 0/1/0 (126)
20:01:28.015630 IP bns1.hananet.net.domain > tatuya-latitudee6230.57710: 19181 0/1/0 (129)
20:01:28.015719 IP tatuya-latitudee6230.39951 > bns1.hananet.net.domain: 46607+ A? github.githubassets.com. (41)
20:01:28.016838 IP tatuya-latitudee6230.36464 > bns1.hananet.net.domain: 11349+ A? avatars.githubusercontent.com. (47)
20:01:28.017547 IP bns1.hananet.net.domain > tatuya-latitudee6230.36464: 11349 4/0/0 A 185.199.110.133, A 185.199.108.133, A 185.199.109.133, A 185.199.111.133 (111)
20:01:28.019036 IP tatuya-latitudee6230.59550 > cdn-185-199-110-133.github.com.https: Flags [S], seq 1939366578, win 64240, options [mss 1460,sackOK,TS val 3704820035 ecr 0,nop,wscale 7], length 0
20:01:28.023380 IP bns1.hananet.net.domain > tatuya-latitudee6230.39951: 46607 4/0/0 A 185.199.108.154, A 185.199.110.154, A 185.199.109.154, A 185.199.111.154 (105)
20:01:28.025276 IP tatuya-latitudee6230.37530 > cdn-185-199-109-154.github.com.https: Flags [S], seq 929182724, win 64240, options [mss 1460,sackOK,TS val 2932923594 ecr 0,nop,wscale 7], length 0
20:01:28.066885 IP tatuya-latitudee6230.47850 > 20.200.245.247.https: Flags [P.], seq 3545:4636, ack 76610, win 971, options [nop,nop,TS val 3159789743 ecr 815958233], length 1091
20:01:28.073934 IP 20.200.245.247.https > tatuya-latitudee6230.47850: Flags [.], ack 4636, win 77, options [nop,nop,TS val 815958533 ecr 3159789743], length 0
20:01:28.159763 IP cdn-185-199-110-133.github.com.https > tatuya-latitudee6230.59550: Flags [S.], seq 3765880040, ack 1939366579, win 65535, options [mss 1396,sackOK,TS val 1174214261 ecr 3704820035,nop,wscale 9], length 0
20:01:28.159856 IP tatuya-latitudee6230.59550 > cdn-185-199-110-133.github.com.https: Flags [.], ack 1, win 502, options [nop,nop,TS val 3704820176 ecr 1174214261], length 0
20:01:28.162433 IP tatuya-latitudee6230.59550 > cdn-185-199-110-133.github.com.https: Flags [P.], seq 1:1121, ack 1, win 502, options [nop,nop,TS val 3704820179 ecr 1174214261], length 1120
20:01:28.163482 IP cdn-185-199-109-154.github.com.https > tatuya-latitudee6230.37530: Flags [S.], seq 3036898538, ack 929182725, win 65535, options [mss 1396,sackOK,TS val 1699320468 ecr 2932923594,nop,wscale 9], length 0
20:01:28.163533 IP tatuya-latitudee6230.37530 > cdn-185-199-109-154.github.com.https: Flags [.], ack 1, win 502, options [nop,nop,TS val 2932923733 ecr 1699320468], length 0
20:01:28.165769 IP tatuya-latitudee6230.37530 > cdn-185-199-109-154.github.com.https: Flags [P.], seq 1:1115, ack 1, win 502, options [nop,nop,TS val 2932923735 ecr 1699320468], length 1114
20:01:28.303526 IP cdn-185-199-110-133.github.com.https > tatuya-latitudee6230.59550: Flags [.], ack 1121, win 275, options [nop,nop,TS val 1174214405 ecr 3704820179], length 0
20:01:28.303829 IP cdn-185-199-110-133.github.com.https > tatuya-latitudee6230.59550: Flags [P.], seq 1:454, ack 1121, win 275, options [nop,nop,TS val 1174214405 ecr 3704820179], length 453
20:01:28.303863 IP tatuya-latitudee6230.59550 > cdn-185-199-110-133.github.com.https: Flags [.], ack 454, win 501, options [nop,nop,TS val 3704820320 ecr 1174214405], length 0
20:01:28.306659 IP cdn-185-199-109-154.github.com.https > tatuya-latitudee6230.37530: Flags [.], ack 1115, win 275, options [nop,nop,TS val 1699320611 ecr 2932923735], length 0
20:01:28.307021 IP tatuya-latitudee6230.59550 > cdn-185-199-110-133.github.com.https: Flags [P.], seq 1121:1185, ack 454, win 501, options [nop,nop,TS val 3704820323 ecr 1174214405], length 64
20:01:28.307119 IP cdn-185-199-109-154.github.com.https > tatuya-latitudee6230.37530: Flags [P.], seq 1:454, ack 1115, win 275, options [nop,nop,TS val 1699320612 ecr 2932923735], length 453
20:01:28.307144 IP tatuya-latitudee6230.37530 > cdn-185-199-109-154.github.com.https: Flags [.], ack 454, win 501, options [nop,nop,TS val 2932923876 ecr 1699320612], length 0
20:01:28.309028 IP tatuya-latitudee6230.59550 > cdn-185-199-110-133.github.com.https: Flags [P.], seq 1185:1355, ack 454, win 501, options [nop,nop,TS val 3704820325 ecr 1174214405], length 170
20:01:28.311368 IP tatuya-latitudee6230.37530 > cdn-185-199-109-154.github.com.https: Flags [P.], seq 1115:1179, ack 454, win 501, options [nop,nop,TS val 2932923881 ecr 1699320612], length 64
20:01:28.314690 IP tatuya-latitudee6230.37530 > cdn-185-199-109-154.github.com.https: Flags [P.], seq 1179:1349, ack 454, win 501, options [nop,nop,TS val 2932923884 ecr 1699320612], length 170
20:01:28.447669 IP cdn-185-199-110-133.github.com.https > tatuya-latitudee6230.59550: Flags [.], ack 1185, win 275, options [nop,nop,TS val 1174214549 ecr 3704820323], length 0
20:01:28.449497 IP cdn-185-199-110-133.github.com.https > tatuya-latitudee6230.59550: Flags [.], ack 1355, win 280, options [nop,nop,TS val 1174214551 ecr 3704820325], length 0
20:01:28.449567 IP cdn-185-199-110-133.github.com.https > tatuya-latitudee6230.59550: Flags [P.], seq 454:519, ack 1355, win 280, options [nop,nop,TS val 1174214551 ecr 3704820325], length 65
20:01:28.449660 IP tatuya-latitudee6230.59550 > cdn-185-199-110-133.github.com.https: Flags [P.], seq 1355:1386, ack 519, win 501, options [nop,nop,TS val 3704820466 ecr 1174214551], length 31
20:01:28.450821 IP cdn-185-199-109-154.github.com.https > tatuya-latitudee6230.37530: Flags [.], ack 1179, win 275, options [nop,nop,TS val 1699320755 ecr 2932923881], length 0
20:01:28.452723 IP cdn-185-199-109-154.github.com.https > tatuya-latitudee6230.37530: Flags [.], ack 1349, win 280, options [nop,nop,TS val 1699320757 ecr 2932923884], length 0
20:01:28.452724 IP cdn-185-199-109-154.github.com.https > tatuya-latitudee6230.37530: Flags [P.], seq 454:519, ack 1349, win 280, options [nop,nop,TS val 1699320757 ecr 2932923884], length 65
20:01:28.452868 IP tatuya-latitudee6230.37530 > cdn-185-199-109-154.github.com.https: Flags [P.], seq 1349:1380, ack 519, win 501, options [nop,nop,TS val 2932924022 ecr 1699320757], length 31
20:01:28.581182 IP tatuya-latitudee6230.41379 > bns1.hananet.net.domain: 6496+ PTR? 133.110.199.185.in-addr.arpa. (46)
20:01:28.589547 IP cdn-185-199-110-133.github.com.https > tatuya-latitudee6230.59550: Flags [.], ack 1386, win 280, options [nop,nop,TS val 1174214691 ecr 3704820466], length 0
20:01:28.592627 IP bns1.hananet.net.domain > tatuya-latitudee6230.41379: 6496 1/0/0 PTR cdn-185-199-110-133.github.com. (90)
20:01:28.592955 IP cdn-185-199-109-154.github.com.https > tatuya-latitudee6230.37530: Flags [.], ack 1380, win 280, options [nop,nop,TS val 1699320897 ecr 2932924022], length 0
20:01:28.593027 IP tatuya-latitudee6230.47956 > bns1.hananet.net.domain: 17858+ PTR? 154.109.199.185.in-addr.arpa. (46)
