23:28:15.773978 IP 172.67.219.41.https > tatuya-latitudee6230.40750: UDP, length 1200
23:28:15.773981 IP 172.67.219.41.https > tatuya-latitudee6230.40750: UDP, length 1200
23:28:15.773983 IP 172.67.219.41.https > tatuya-latitudee6230.40750: UDP, length 1200
23:28:15.773984 IP 172.67.219.41.https > tatuya-latitudee6230.40750: UDP, length 1200
23:28:15.773985 IP 172.67.219.41.https > tatuya-latitudee6230.40750: UDP, length 1200
23:28:15.773986 IP 172.67.219.41.https > tatuya-latitudee6230.40750: UDP, length 1200
23:28:15.773988 IP 172.67.219.41.https > tatuya-latitudee6230.40750: UDP, length 1200
23:28:15.773989 IP 172.67.219.41.https > tatuya-latitudee6230.40750: UDP, length 1200
23:28:15.774110 IP 172.67.219.41.https > tatuya-latitudee6230.40750: UDP, length 1200
23:28:15.774113 IP 172.67.219.41.https > tatuya-latitudee6230.40750: UDP, length 1200
23:28:15.774115 IP 172.67.219.41.https > tatuya-latitudee6230.40750: UDP, length 1200
23:28:15.774117 IP 172.67.219.41.https > tatuya-latitudee6230.40750: UDP, length 1200
23:28:15.774119 IP 172.67.219.41.https > tatuya-latitudee6230.40750: UDP, length 1200
23:28:15.774121 IP 172.67.219.41.https > tatuya-latitudee6230.40750: UDP, length 1200
23:28:15.774123 IP 172.67.219.41.https > tatuya-latitudee6230.40750: UDP, length 1200
23:28:15.774126 IP 172.67.219.41.https > tatuya-latitudee6230.40750: UDP, length 1200
23:28:15.774267 IP 172.67.219.41.https > tatuya-latitudee6230.40750: UDP, length 1200
23:28:15.774270 IP 172.67.219.41.https > tatuya-latitudee6230.40750: UDP, length 1200
23:28:15.774273 IP 172.67.219.41.https > tatuya-latitudee6230.40750: UDP, length 1200
23:28:15.774274 IP 172.67.219.41.https > tatuya-latitudee6230.40750: UDP, length 1200
23:28:15.774277 IP 172.67.219.41.https > tatuya-latitudee6230.40750: UDP, length 1200
23:28:15.774279 IP 172.67.219.41.https > tatuya-latitudee6230.40750: UDP, length 1200
23:28:15.774280 IP 172.67.219.41.https > tatuya-latitudee6230.40750: UDP, length 304
23:28:15.774679 IP 172.67.219.41.https > tatuya-latitudee6230.40750: UDP, length 1200
23:28:15.774682 IP 172.67.219.41.https > tatuya-latitudee6230.40750: UDP, length 1200
23:28:15.774684 IP 172.67.219.41.https > tatuya-latitudee6230.40750: UDP, length 1200
23:28:15.774685 IP 172.67.219.41.https > tatuya-latitudee6230.40750: UDP, length 1200
23:28:15.774688 IP 172.67.219.41.https > tatuya-latitudee6230.40750: UDP, length 1200
23:28:15.774690 IP 172.67.219.41.https > tatuya-latitudee6230.40750: UDP, length 1200
23:28:15.774692 IP 172.67.219.41.https > tatuya-latitudee6230.40750: UDP, length 1200
23:28:15.774695 IP 172.67.219.41.https > tatuya-latitudee6230.40750: UDP, length 1200
23:28:15.774801 IP 172.67.219.41.https > tatuya-latitudee6230.40750: UDP, length 1200
23:28:15.774803 IP 172.67.219.41.https > tatuya-latitudee6230.40750: UDP, length 1200
23:28:15.774806 IP 172.67.219.41.https > tatuya-latitudee6230.40750: UDP, length 1200
23:28:15.774808 IP 172.67.219.41.https > tatuya-latitudee6230.40750: UDP, length 1200
23:28:15.774810 IP 172.67.219.41.https > tatuya-latitudee6230.40750: UDP, length 1200
23:28:15.774813 IP 172.67.219.41.https > tatuya-latitudee6230.40750: UDP, length 1200
23:28:15.774815 IP 172.67.219.41.https > tatuya-latitudee6230.40750: UDP, length 1200
23:28:15.774816 IP 172.67.219.41.https > tatuya-latitudee6230.40750: UDP, length 1200
23:28:15.774948 IP 172.67.219.41.https > tatuya-latitudee6230.40750: UDP, length 1200
23:28:15.774952 IP 172.67.219.41.https > tatuya-latitudee6230.40750: UDP, length 1200
23:28:15.774954 IP 172.67.219.41.https > tatuya-latitudee6230.40750: UDP, length 1200
23:28:15.774957 IP 172.67.219.41.https > tatuya-latitudee6230.40750: UDP, length 1200
23:28:15.774960 IP 172.67.219.41.https > tatuya-latitudee6230.40750: UDP, length 1200
23:28:15.774964 IP 172.67.219.41.https > tatuya-latitudee6230.40750: UDP, length 1200
23:28:15.774966 IP 172.67.219.41.https > tatuya-latitudee6230.40750: UDP, length 1200
23:28:15.774970 IP 172.67.219.41.https > tatuya-latitudee6230.40750: UDP, length 1200
23:28:15.775067 IP 172.67.219.41.https > tatuya-latitudee6230.40750: UDP, length 1200
23:28:15.775069 IP 172.67.219.41.https > tatuya-latitudee6230.40750: UDP, length 1200
23:28:15.775072 IP 172.67.219.41.https > tatuya-latitudee6230.40750: UDP, length 1200
23:28:15.775074 IP 172.67.219.41.https > tatuya-latitudee6230.40750: UDP, length 1200
23:28:15.775075 IP 172.67.219.41.https > tatuya-latitudee6230.40750: UDP, length 1200
23:28:15.775078 IP 172.67.219.41.https > tatuya-latitudee6230.40750: UDP, length 1200
23:28:15.775080 IP 172.67.219.41.https > tatuya-latitudee6230.40750: UDP, length 1200
23:28:15.775083 IP 172.67.219.41.https > tatuya-latitudee6230.40750: UDP, length 1200
23:28:15.775270 IP 172.67.219.41.https > tatuya-latitudee6230.40750: UDP, length 1200
23:28:15.775274 IP 172.67.219.41.https > tatuya-latitudee6230.40750: UDP, length 1200
23:28:15.775276 IP 172.67.219.41.https > tatuya-latitudee6230.40750: UDP, length 1200
23:28:15.775278 IP 172.67.219.41.https > tatuya-latitudee6230.40750: UDP, length 1200
23:28:15.775280 IP 172.67.219.41.https > tatuya-latitudee6230.40750: UDP, length 1200
23:28:15.775282 IP 172.67.219.41.https > tatuya-latitudee6230.40750: UDP, length 1200
23:28:15.775284 IP 172.67.219.41.https > tatuya-latitudee6230.40750: UDP, length 1200
23:28:15.775286 IP 172.67.219.41.https > tatuya-latitudee6230.40750: UDP, length 1200
23:28:15.775379 IP 172.67.219.41.https > tatuya-latitudee6230.40750: UDP, length 1200
23:28:15.775382 IP 172.67.219.41.https > tatuya-latitudee6230.40750: UDP, length 1200
23:28:15.775383 IP 172.67.219.41.https > tatuya-latitudee6230.40750: UDP, length 1200
23:28:15.775386 IP 172.67.219.41.https > tatuya-latitudee6230.40750: UDP, length 1200
23:28:15.775388 IP 172.67.219.41.https > tatuya-latitudee6230.40750: UDP, length 1200
23:28:15.775392 IP 172.67.219.41.https > tatuya-latitudee6230.40750: UDP, length 1200
23:28:15.775394 IP 172.67.219.41.https > tatuya-latitudee6230.40750: UDP, length 1200
23:28:15.775396 IP 172.67.219.41.https > tatuya-latitudee6230.40750: UDP, length 418
23:28:15.778723 IP tatuya-latitudee6230.40750 > 172.67.219.41.https: UDP, length 49
23:28:16.051023 IP 172.67.219.41.https > tatuya-latitudee6230.40750: UDP, length 1200
23:28:16.051026 IP 172.67.219.41.https > tatuya-latitudee6230.40750: UDP, length 303
23:28:16.051364 IP 172.67.219.41.https > tatuya-latitudee6230.40750: UDP, length 1200
23:28:16.051366 IP 172.67.219.41.https > tatuya-latitudee6230.40750: UDP, length 1200
23:28:16.051368 IP 172.67.219.41.https > tatuya-latitudee6230.40750: UDP, length 1200
23:28:16.051369 IP 172.67.219.41.https > tatuya-latitudee6230.40750: UDP, length 1200
23:28:16.051461 IP 172.67.219.41.https > tatuya-latitudee6230.40750: UDP, length 1200
23:28:16.051463 IP 172.67.219.41.https > tatuya-latitudee6230.40750: UDP, length 1200
23:28:16.051464 IP 172.67.219.41.https > tatuya-latitudee6230.40750: UDP, length 1200
23:28:16.051466 IP 172.67.219.41.https > tatuya-latitudee6230.40750: UDP, length 1200
23:28:16.051468 IP 172.67.219.41.https > tatuya-latitudee6230.40750: UDP, length 1200
23:28:16.051469 IP 172.67.219.41.https > tatuya-latitudee6230.40750: UDP, length 1200
23:28:16.051471 IP 172.67.219.41.https > tatuya-latitudee6230.40750: UDP, length 1200
23:28:16.051473 IP 172.67.219.41.https > tatuya-latitudee6230.40750: UDP, length 1200
23:28:16.051505 IP tatuya-latitudee6230.40750 > 172.67.219.41.https: UDP, length 49
23:28:16.051523 IP 172.67.219.41.https > tatuya-latitudee6230.40750: UDP, length 1200
23:28:16.051524 IP 172.67.219.41.https > tatuya-latitudee6230.40750: UDP, length 1200
23:28:16.051525 IP 172.67.219.41.https > tatuya-latitudee6230.40750: UDP, length 1200
23:28:16.051526 IP 172.67.219.41.https > tatuya-latitudee6230.40750: UDP, length 1200
23:28:16.051526 IP 172.67.219.41.https > tatuya-latitudee6230.40750: UDP, length 1200
23:28:16.051527 IP 172.67.219.41.https > tatuya-latitudee6230.40750: UDP, length 1200
23:28:16.051528 IP 172.67.219.41.https > tatuya-latitudee6230.40750: UDP, length 1200
23:28:16.051631 IP 172.67.219.41.https > tatuya-latitudee6230.40750: UDP, length 1200
23:28:16.051633 IP 172.67.219.41.https > tatuya-latitudee6230.40750: UDP, length 1200
23:28:16.051634 IP 172.67.219.41.https > tatuya-latitudee6230.40750: UDP, length 1200
23:28:16.051636 IP 172.67.219.41.https > tatuya-latitudee6230.40750: UDP, length 1200
23:28:16.051647 IP 172.67.219.41.https > tatuya-latitudee6230.40750: UDP, length 1200
23:28:16.051648 IP 172.67.219.41.https > tatuya-latitudee6230.40750: UDP, length 1200
23:28:16.051649 IP 172.67.219.41.https > tatuya-latitudee6230.40750: UDP, length 1200
23:28:16.051650 IP 172.67.219.41.https > tatuya-latitudee6230.40750: UDP, length 1200
23:28:16.051685 IP 172.67.219.41.https > tatuya-latitudee6230.40750: UDP, length 1200
23:28:16.051686 IP 172.67.219.41.https > tatuya-latitudee6230.40750: UDP, length 1200
23:28:16.051686 IP 172.67.219.41.https > tatuya-latitudee6230.40750: UDP, length 1200
23:28:16.051687 IP 172.67.219.41.https > tatuya-latitudee6230.40750: UDP, length 1200
23:28:16.051688 IP 172.67.219.41.https > tatuya-latitudee6230.40750: UDP, length 1200
23:28:16.051689 IP 172.67.219.41.https > tatuya-latitudee6230.40750: UDP, length 1200
23:28:16.051865 IP 172.67.219.41.https > tatuya-latitudee6230.40750: UDP, length 1200
23:28:16.051867 IP 172.67.219.41.https > tatuya-latitudee6230.40750: UDP, length 1200
23:28:16.051869 IP 172.67.219.41.https > tatuya-latitudee6230.40750: UDP, length 1200
23:28:16.051871 IP 172.67.219.41.https > tatuya-latitudee6230.40750: UDP, length 1200
23:28:16.051882 IP 172.67.219.41.https > tatuya-latitudee6230.40750: UDP, length 1200
23:28:16.051883 IP 172.67.219.41.https > tatuya-latitudee6230.40750: UDP, length 1200
23:28:16.051883 IP 172.67.219.41.https > tatuya-latitudee6230.40750: UDP, length 1200
23:28:16.051884 IP 172.67.219.41.https > tatuya-latitudee6230.40750: UDP, length 1200
23:28:16.051922 IP 172.67.219.41.https > tatuya-latitudee6230.40750: UDP, length 1200
23:28:16.051923 IP 172.67.219.41.https > tatuya-latitudee6230.40750: UDP, length 1200
23:28:16.051924 IP 172.67.219.41.https > tatuya-latitudee6230.40750: UDP, length 1200
23:28:16.051925 IP 172.67.219.41.https > tatuya-latitudee6230.40750: UDP, length 1200
23:28:16.051926 IP 172.67.219.41.https > tatuya-latitudee6230.40750: UDP, length 1200
23:28:16.052103 IP 172.67.219.41.https > tatuya-latitudee6230.40750: UDP, length 1200
23:28:16.052104 IP 172.67.219.41.https > tatuya-latitudee6230.40750: UDP, length 1200
23:28:16.052105 IP 172.67.219.41.https > tatuya-latitudee6230.40750: UDP, length 1200
23:28:16.052106 IP 172.67.219.41.https > tatuya-latitudee6230.40750: UDP, length 1200
23:28:16.052107 IP 172.67.219.41.https > tatuya-latitudee6230.40750: UDP, length 1200
23:28:16.052108 IP 172.67.219.41.https > tatuya-latitudee6230.40750: UDP, length 1200
23:28:16.052108 IP 172.67.219.41.https > tatuya-latitudee6230.40750: UDP, length 1200
23:28:16.052109 IP 172.67.219.41.https > tatuya-latitudee6230.40750: UDP, length 1200
23:28:16.052155 IP 172.67.219.41.https > tatuya-latitudee6230.40750: UDP, length 1200
23:28:16.052155 IP 172.67.219.41.https > tatuya-latitudee6230.40750: UDP, length 1200
23:28:16.052156 IP 172.67.219.41.https > tatuya-latitudee6230.40750: UDP, length 1200
23:28:16.052157 IP 172.67.219.41.https > tatuya-latitudee6230.40750: UDP, length 1200
23:28:16.052376 IP 172.67.219.41.https > tatuya-latitudee6230.40750: UDP, length 1200
23:28:16.052377 IP 172.67.219.41.https > tatuya-latitudee6230.40750: UDP, length 1200
23:28:16.052377 IP 172.67.219.41.https > tatuya-latitudee6230.40750: UDP, length 1200
23:28:16.052378 IP 172.67.219.41.https > tatuya-latitudee6230.40750: UDP, length 1200
23:28:16.052379 IP 172.67.219.41.https > tatuya-latitudee6230.40750: UDP, length 1200
23:28:16.052380 IP 172.67.219.41.https > tatuya-latitudee6230.40750: UDP, length 1200
23:28:16.052380 IP 172.67.219.41.https > tatuya-latitudee6230.40750: UDP, length 1200
23:28:16.052381 IP 172.67.219.41.https > tatuya-latitudee6230.40750: UDP, length 1200
23:28:16.052416 IP 172.67.219.41.https > tatuya-latitudee6230.40750: UDP, length 1200
23:28:16.052417 IP 172.67.219.41.https > tatuya-latitudee6230.40750: UDP, length 1200
23:28:16.052417 IP 172.67.219.41.https > tatuya-latitudee6230.40750: UDP, length 1200
23:28:16.052418 IP 172.67.219.41.https > tatuya-latitudee6230.40750: UDP, length 1200
23:28:16.052419 IP 172.67.219.41.https > tatuya-latitudee6230.40750: UDP, length 1200
23:28:16.052419 IP 172.67.219.41.https > tatuya-latitudee6230.40750: UDP, length 1200
23:28:16.052420 IP 172.67.219.41.https > tatuya-latitudee6230.40750: UDP, length 1200
23:28:16.052609 IP 172.67.219.41.https > tatuya-latitudee6230.40750: UDP, length 1200
23:28:16.052610 IP 172.67.219.41.https > tatuya-latitudee6230.40750: UDP, length 1200
23:28:16.052611 IP 172.67.219.41.https > tatuya-latitudee6230.40750: UDP, length 1200
23:28:16.052612 IP 172.67.219.41.https > tatuya-latitudee6230.40750: UDP, length 1200
23:28:16.052612 IP 172.67.219.41.https > tatuya-latitudee6230.40750: UDP, length 1200
23:28:16.052613 IP 172.67.219.41.https > tatuya-latitudee6230.40750: UDP, length 1200
23:28:16.052614 IP 172.67.219.41.https > tatuya-latitudee6230.40750: UDP, length 1200
23:28:16.052614 IP 172.67.219.41.https > tatuya-latitudee6230.40750: UDP, length 1200
23:28:16.052647 IP 172.67.219.41.https > tatuya-latitudee6230.40750: UDP, length 908
23:28:16.053384 IP tatuya-latitudee6230.40750 > 172.67.219.41.https: UDP, length 49
23:28:16.318538 IP tatuya-latitudee6230.35522 > bit.ly.https: Flags [P.], seq 977014456:977014495, ack 595918020, win 501, options [nop,nop,TS val 4088868814 ecr 2598676133], length 39
23:28:16.318657 IP tatuya-latitudee6230.55852 > 64.120.110.173.https: Flags [P.], seq 3837021263:3837021302, ack 2617931420, win 614, options [nop,nop,TS val 2796484150 ecr 3085326030], length 39
23:28:16.328447 IP 172.67.219.41.https > tatuya-latitudee6230.40750: UDP, length 1200
23:28:16.328450 IP 172.67.219.41.https > tatuya-latitudee6230.40750: UDP, length 1200
23:28:16.328451 IP 172.67.219.41.https > tatuya-latitudee6230.40750: UDP, length 1200
23:28:16.328452 IP 172.67.219.41.https > tatuya-latitudee6230.40750: UDP, length 1200
23:28:16.328453 IP 172.67.219.41.https > tatuya-latitudee6230.40750: UDP, length 1200
23:28:16.328454 IP 172.67.219.41.https > tatuya-latitudee6230.40750: UDP, length 1200
23:28:16.328455 IP 172.67.219.41.https > tatuya-latitudee6230.40750: UDP, length 240
23:28:16.328456 IP 172.67.219.41.https > tatuya-latitudee6230.40750: UDP, length 1200
23:28:16.328570 IP 172.67.219.41.https > tatuya-latitudee6230.40750: UDP, length 1200
23:28:16.328572 IP 172.67.219.41.https > tatuya-latitudee6230.40750: UDP, length 1200
23:28:16.328575 IP 172.67.219.41.https > tatuya-latitudee6230.40750: UDP, length 1200
23:28:16.328577 IP 172.67.219.41.https > tatuya-latitudee6230.40750: UDP, length 1200
23:28:16.328579 IP 172.67.219.41.https > tatuya-latitudee6230.40750: UDP, length 1200
23:28:16.328582 IP 172.67.219.41.https > tatuya-latitudee6230.40750: UDP, length 1200
23:28:16.328584 IP 172.67.219.41.https > tatuya-latitudee6230.40750: UDP, length 1200
23:28:16.328586 IP 172.67.219.41.https > tatuya-latitudee6230.40750: UDP, length 1200
23:28:16.328717 IP 172.67.219.41.https > tatuya-latitudee6230.40750: UDP, length 1200
23:28:16.328720 IP 172.67.219.41.https > tatuya-latitudee6230.40750: UDP, length 1200
23:28:16.328722 IP 172.67.219.41.https > tatuya-latitudee6230.40750: UDP, length 1200
23:28:16.328724 IP 172.67.219.41.https > tatuya-latitudee6230.40750: UDP, length 1200
23:28:16.328726 IP 172.67.219.41.https > tatuya-latitudee6230.40750: UDP, length 1200
23:28:16.328728 IP 172.67.219.41.https > tatuya-latitudee6230.40750: UDP, length 1200
23:28:16.328730 IP 172.67.219.41.https > tatuya-latitudee6230.40750: UDP, length 1200
23:28:16.328732 IP 172.67.219.41.https > tatuya-latitudee6230.40750: UDP, length 1200
23:28:16.328834 IP 172.67.219.41.https > tatuya-latitudee6230.40750: UDP, length 1200
23:28:16.328837 IP 172.67.219.41.https > tatuya-latitudee6230.40750: UDP, length 1200
23:28:16.328839 IP 172.67.219.41.https > tatuya-latitudee6230.40750: UDP, length 1200
23:28:16.328841 IP 172.67.219.41.https > tatuya-latitudee6230.40750: UDP, length 1200
23:28:16.328843 IP 172.67.219.41.https > tatuya-latitudee6230.40750: UDP, length 1200
23:28:16.328846 IP 172.67.219.41.https > tatuya-latitudee6230.40750: UDP, length 1200
23:28:16.328849 IP 172.67.219.41.https > tatuya-latitudee6230.40750: UDP, length 1200
23:28:16.328850 IP 172.67.219.41.https > tatuya-latitudee6230.40750: UDP, length 1200
23:28:16.328971 IP 172.67.219.41.https > tatuya-latitudee6230.40750: UDP, length 1200
23:28:16.328974 IP 172.67.219.41.https > tatuya-latitudee6230.40750: UDP, length 1200
23:28:16.328976 IP 172.67.219.41.https > tatuya-latitudee6230.40750: UDP, length 1200
23:28:16.328978 IP 172.67.219.41.https > tatuya-latitudee6230.40750: UDP, length 1200
23:28:16.328980 IP 172.67.219.41.https > tatuya-latitudee6230.40750: UDP, length 1200
23:28:16.328983 IP 172.67.219.41.https > tatuya-latitudee6230.40750: UDP, length 1200
23:28:16.328986 IP 172.67.219.41.https > tatuya-latitudee6230.40750: UDP, length 1200
23:28:16.328989 IP 172.67.219.41.https > tatuya-latitudee6230.40750: UDP, length 1200
23:28:16.329088 IP 172.67.219.41.https > tatuya-latitudee6230.40750: UDP, length 1200
23:28:16.329092 IP 172.67.219.41.https > tatuya-latitudee6230.40750: UDP, length 1200
23:28:16.329095 IP 172.67.219.41.https > tatuya-latitudee6230.40750: UDP, length 1200
23:28:16.329097 IP 172.67.219.41.https > tatuya-latitudee6230.40750: UDP, length 1200
23:28:16.329142 IP 172.67.219.41.https > tatuya-latitudee6230.40750: UDP, length 1200
23:28:16.329146 IP 172.67.219.41.https > tatuya-latitudee6230.40750: UDP, length 1200
23:28:16.329150 IP 172.67.219.41.https > tatuya-latitudee6230.40750: UDP, length 1200
23:28:16.329152 IP 172.67.219.41.https > tatuya-latitudee6230.40750: UDP, length 939
23:28:16.329280 IP 172.67.219.41.https > tatuya-latitudee6230.40750: UDP, length 1200
23:28:16.329283 IP 172.67.219.41.https > tatuya-latitudee6230.40750: UDP, length 1200
23:28:16.329286 IP 172.67.219.41.https > tatuya-latitudee6230.40750: UDP, length 1200
23:28:16.329289 IP 172.67.219.41.https > tatuya-latitudee6230.40750: UDP, length 1200
23:28:16.329291 IP 172.67.219.41.https > tatuya-latitudee6230.40750: UDP, length 1200
23:28:16.329293 IP 172.67.219.41.https > tatuya-latitudee6230.40750: UDP, length 1200
23:28:16.329295 IP 172.67.219.41.https > tatuya-latitudee6230.40750: UDP, length 1200
23:28:16.329297 IP 172.67.219.41.https > tatuya-latitudee6230.40750: UDP, length 1200
23:28:16.329460 IP 172.67.219.41.https > tatuya-latitudee6230.40750: UDP, length 1200
23:28:16.329464 IP 172.67.219.41.https > tatuya-latitudee6230.40750: UDP, length 1200
23:28:16.329467 IP 172.67.219.41.https > tatuya-latitudee6230.40750: UDP, length 1200
23:28:16.329469 IP 172.67.219.41.https > tatuya-latitudee6230.40750: UDP, length 1200
23:28:16.329472 IP 172.67.219.41.https > tatuya-latitudee6230.40750: UDP, length 1200
23:28:16.329474 IP 172.67.219.41.https > tatuya-latitudee6230.40750: UDP, length 1200
23:28:16.329476 IP 172.67.219.41.https > tatuya-latitudee6230.40750: UDP, length 1200
23:28:16.329479 IP 172.67.219.41.https > tatuya-latitudee6230.40750: UDP, length 1200
23:28:16.329654 IP 172.67.219.41.https > tatuya-latitudee6230.40750: UDP, length 1200
23:28:16.329656 IP 172.67.219.41.https > tatuya-latitudee6230.40750: UDP, length 1200
23:28:16.329658 IP 172.67.219.41.https > tatuya-latitudee6230.40750: UDP, length 655
23:28:16.333491 IP tatuya-latitudee6230.40750 > 172.67.219.41.https: UDP, length 49
23:28:16.334193 IP tatuya-latitudee6230.55779 > bns1.hananet.net.domain: 29959+ PTR? 41.219.67.172.in-addr.arpa. (44)
23:28:16.352340 IP bns1.hananet.net.domain > tatuya-latitudee6230.55779: 29959 NXDomain 0/1/0 (139)
23:28:16.354183 IP tatuya-latitudee6230.49077 > bns1.hananet.net.domain: 61252+ PTR? 11.248.199.67.in-addr.arpa. (44)
23:28:16.355582 IP bit.ly.https > tatuya-latitudee6230.35522: Flags [.], ack 39, win 256, options [nop,nop,TS val 2598734385 ecr 4088868814], length 0
23:28:16.355656 IP bit.ly.https > tatuya-latitudee6230.35522: Flags [P.], seq 1:40, ack 39, win 256, options [nop,nop,TS val 2598734385 ecr 4088868814], length 39
23:28:16.363850 IP bns1.hananet.net.domain > tatuya-latitudee6230.49077: 61252 1/0/0 PTR bit.ly. (64)
23:28:16.364459 IP tatuya-latitudee6230.59270 > bns1.hananet.net.domain: 47783+ PTR? 173.110.120.64.in-addr.arpa. (45)
23:28:16.396151 IP tatuya-latitudee6230.35522 > bit.ly.https: Flags [.], ack 40, win 501, options [nop,nop,TS val 4088868891 ecr 2598734385], length 0
23:28:16.403282 IP 64.120.110.173.https > tatuya-latitudee6230.55852: Flags [.], ack 39, win 62, options [nop,nop,TS val 3085384259 ecr 2796484150], length 0
23:28:16.403284 IP 64.120.110.173.https > tatuya-latitudee6230.55852: Flags [P.], seq 1:40, ack 39, win 62, options [nop,nop,TS val 3085384259 ecr 2796484150], length 39
23:28:16.437197 IP bns1.hananet.net.domain > tatuya-latitudee6230.59270: 47783 NXDomain 0/1/0 (108)
23:28:16.446139 IP tatuya-latitudee6230.55852 > 64.120.110.173.https: Flags [.], ack 40, win 614, options [nop,nop,TS val 2796484277 ecr 3085384259], length 0
23:28:16.611318 IP 172.67.219.41.https > tatuya-latitudee6230.40750: UDP, length 1200
23:28:16.611321 IP 172.67.219.41.https > tatuya-latitudee6230.40750: UDP, length 1200
23:28:16.611323 IP 172.67.219.41.https > tatuya-latitudee6230.40750: UDP, length 1200
23:28:16.611324 IP 172.67.219.41.https > tatuya-latitudee6230.40750: UDP, length 1200
23:28:16.611325 IP 172.67.219.41.https > tatuya-latitudee6230.40750: UDP, length 1200
23:28:16.611326 IP 172.67.219.41.https > tatuya-latitudee6230.40750: UDP, length 1200
23:28:16.611327 IP 172.67.219.41.https > tatuya-latitudee6230.40750: UDP, length 1200
23:28:16.611328 IP 172.67.219.41.https > tatuya-latitudee6230.40750: UDP, length 1200
23:28:16.611464 IP 172.67.219.41.https > tatuya-latitudee6230.40750: UDP, length 1200
23:28:16.611465 IP 172.67.219.41.https > tatuya-latitudee6230.40750: UDP, length 1200
23:28:16.611737 IP tatuya-latitudee6230.40750 > 172.67.219.41.https: UDP, length 49
23:28:16.612048 IP 172.67.219.41.https > tatuya-latitudee6230.40750: UDP, length 1200
23:28:16.612051 IP 172.67.219.41.https > tatuya-latitudee6230.40750: UDP, length 1200
23:28:16.612052 IP 172.67.219.41.https > tatuya-latitudee6230.40750: UDP, length 1200
23:28:16.612053 IP 172.67.219.41.https > tatuya-latitudee6230.40750: UDP, length 1200
23:28:16.612055 IP 172.67.219.41.https > tatuya-latitudee6230.40750: UDP, length 1200
23:28:16.612056 IP 172.67.219.41.https > tatuya-latitudee6230.40750: UDP, length 1200
23:28:16.612057 IP 172.67.219.41.https > tatuya-latitudee6230.40750: UDP, length 1200
23:28:16.612058 IP 172.67.219.41.https > tatuya-latitudee6230.40750: UDP, length 1200
23:28:16.612143 IP 172.67.219.41.https > tatuya-latitudee6230.40750: UDP, length 1200
23:28:16.612145 IP 172.67.219.41.https > tatuya-latitudee6230.40750: UDP, length 1200
23:28:16.612147 IP 172.67.219.41.https > tatuya-latitudee6230.40750: UDP, length 1200
23:28:16.612148 IP 172.67.219.41.https > tatuya-latitudee6230.40750: UDP, length 1200
23:28:16.612150 IP 172.67.219.41.https > tatuya-latitudee6230.40750: UDP, length 1200
23:28:16.612152 IP 172.67.219.41.https > tatuya-latitudee6230.40750: UDP, length 1200
23:28:16.612154 IP 172.67.219.41.https > tatuya-latitudee6230.40750: UDP, length 1200
23:28:16.612155 IP 172.67.219.41.https > tatuya-latitudee6230.40750: UDP, length 1200
23:28:16.612206 IP 172.67.219.41.https > tatuya-latitudee6230.40750: UDP, length 1200
23:28:16.612207 IP 172.67.219.41.https > tatuya-latitudee6230.40750: UDP, length 1200
23:28:16.612207 IP 172.67.219.41.https > tatuya-latitudee6230.40750: UDP, length 1200
23:28:16.612208 IP 172.67.219.41.https > tatuya-latitudee6230.40750: UDP, length 1200
23:28:16.612209 IP 172.67.219.41.https > tatuya-latitudee6230.40750: UDP, length 1200
23:28:16.612209 IP 172.67.219.41.https > tatuya-latitudee6230.40750: UDP, length 1200
23:28:16.612210 IP 172.67.219.41.https > tatuya-latitudee6230.40750: UDP, length 1200
23:28:16.612211 IP 172.67.219.41.https > tatuya-latitudee6230.40750: UDP, length 1200
23:28:16.612242 IP 172.67.219.41.https > tatuya-latitudee6230.40750: UDP, length 1200
23:28:16.612243 IP 172.67.219.41.https > tatuya-latitudee6230.40750: UDP, length 1200
23:28:16.612244 IP 172.67.219.41.https > tatuya-latitudee6230.40750: UDP, length 1200
23:28:16.612245 IP 172.67.219.41.https > tatuya-latitudee6230.40750: UDP, length 1200
23:28:16.612245 IP 172.67.219.41.https > tatuya-latitudee6230.40750: UDP, length 1200
23:28:16.612520 IP 172.67.219.41.https > tatuya-latitudee6230.40750: UDP, length 1200
23:28:16.612533 IP 172.67.219.41.https > tatuya-latitudee6230.40750: UDP, length 1200
23:28:16.612534 IP 172.67.219.41.https > tatuya-latitudee6230.40750: UDP, length 1200
23:28:16.612535 IP 172.67.219.41.https > tatuya-latitudee6230.40750: UDP, length 1200
23:28:16.612535 IP 172.67.219.41.https > tatuya-latitudee6230.40750: UDP, length 1200
23:28:16.612537 IP 172.67.219.41.https > tatuya-latitudee6230.40750: UDP, length 1200
23:28:16.612537 IP 172.67.219.41.https > tatuya-latitudee6230.40750: UDP, length 1200
23:28:16.612538 IP 172.67.219.41.https > tatuya-latitudee6230.40750: UDP, length 1200
23:28:16.612573 IP 172.67.219.41.https > tatuya-latitudee6230.40750: UDP, length 1200
23:28:16.612574 IP 172.67.219.41.https > tatuya-latitudee6230.40750: UDP, length 1200
23:28:16.612575 IP 172.67.219.41.https > tatuya-latitudee6230.40750: UDP, length 1200
23:28:16.612576 IP 172.67.219.41.https > tatuya-latitudee6230.40750: UDP, length 1200
23:28:16.612577 IP 172.67.219.41.https > tatuya-latitudee6230.40750: UDP, length 1200
23:28:16.612578 IP 172.67.219.41.https > tatuya-latitudee6230.40750: UDP, length 1200
23:28:16.612579 IP 172.67.219.41.https > tatuya-latitudee6230.40750: UDP, length 1200
23:28:16.612579 IP 172.67.219.41.https > tatuya-latitudee6230.40750: UDP, length 1200
23:28:16.612617 IP 172.67.219.41.https > tatuya-latitudee6230.40750: UDP, length 1200
23:28:16.612618 IP 172.67.219.41.https > tatuya-latitudee6230.40750: UDP, length 1200
23:28:16.612619 IP 172.67.219.41.https > tatuya-latitudee6230.40750: UDP, length 1200
23:28:16.612620 IP 172.67.219.41.https > tatuya-latitudee6230.40750: UDP, length 1200
23:28:16.612621 IP 172.67.219.41.https > tatuya-latitudee6230.40750: UDP, length 1200
23:28:16.612621 IP 172.67.219.41.https > tatuya-latitudee6230.40750: UDP, length 1200
23:28:16.612622 IP 172.67.219.41.https > tatuya-latitudee6230.40750: UDP, length 1200
23:28:16.612623 IP 172.67.219.41.https > tatuya-latitudee6230.40750: UDP, length 1200
23:28:16.612654 IP 172.67.219.41.https > tatuya-latitudee6230.40750: UDP, length 47
23:28:16.613378 IP tatuya-latitudee6230.40750 > 172.67.219.41.https: UDP, length 49
23:28:16.759597 IP tatuya-latitudee6230.44034 > bns1.hananet.net.domain: 29034+ A? ping.archlinux.org. (36)
23:28:16.759615 IP tatuya-latitudee6230.44034 > bns1.hananet.net.domain: 23136+ AAAA? ping.archlinux.org. (36)
23:28:16.768507 IP bns1.hananet.net.domain > tatuya-latitudee6230.44034: 29034 2/0/0 CNAME redirect.archlinux.org., A 95.216.195.133 (75)
23:28:16.768510 IP bns1.hananet.net.domain > tatuya-latitudee6230.44034: 23136 2/0/0 CNAME redirect.archlinux.org., AAAA 2a01:4f9:c010:2636::1 (87)
23:28:16.885561 IP 172.67.219.41.https > tatuya-latitudee6230.40750: UDP, length 1200
23:28:16.885564 IP 172.67.219.41.https > tatuya-latitudee6230.40750: UDP, length 1200
23:28:16.885565 IP 172.67.219.41.https > tatuya-latitudee6230.40750: UDP, length 1200
23:28:16.885567 IP 172.67.219.41.https > tatuya-latitudee6230.40750: UDP, length 1200
23:28:16.885568 IP 172.67.219.41.https > tatuya-latitudee6230.40750: UDP, length 1200
23:28:16.885569 IP 172.67.219.41.https > tatuya-latitudee6230.40750: UDP, length 1200
23:28:16.885570 IP 172.67.219.41.https > tatuya-latitudee6230.40750: UDP, length 1200
23:28:16.885572 IP 172.67.219.41.https > tatuya-latitudee6230.40750: UDP, length 1200
23:28:16.885687 IP 172.67.219.41.https > tatuya-latitudee6230.40750: UDP, length 1200
23:28:16.885689 IP 172.67.219.41.https > tatuya-latitudee6230.40750: UDP, length 1200
23:28:16.885692 IP 172.67.219.41.https > tatuya-latitudee6230.40750: UDP, length 1200
23:28:16.885694 IP 172.67.219.41.https > tatuya-latitudee6230.40750: UDP, length 1200
23:28:16.885696 IP 172.67.219.41.https > tatuya-latitudee6230.40750: UDP, length 1200
23:28:16.885698 IP 172.67.219.41.https > tatuya-latitudee6230.40750: UDP, length 1200
23:28:16.885701 IP 172.67.219.41.https > tatuya-latitudee6230.40750: UDP, length 1200
23:28:16.885704 IP 172.67.219.41.https > tatuya-latitudee6230.40750: UDP, length 1200
23:28:16.885832 IP 172.67.219.41.https > tatuya-latitudee6230.40750: UDP, length 1200
23:28:16.885835 IP 172.67.219.41.https > tatuya-latitudee6230.40750: UDP, length 1200
23:28:16.885838 IP 172.67.219.41.https > tatuya-latitudee6230.40750: UDP, length 1200
23:28:16.885840 IP 172.67.219.41.https > tatuya-latitudee6230.40750: UDP, length 1200
23:28:16.885843 IP 172.67.219.41.https > tatuya-latitudee6230.40750: UDP, length 1200
23:28:16.885845 IP 172.67.219.41.https > tatuya-latitudee6230.40750: UDP, length 1200
23:28:16.885847 IP 172.67.219.41.https > tatuya-latitudee6230.40750: UDP, length 1200
23:28:16.885849 IP 172.67.219.41.https > tatuya-latitudee6230.40750: UDP, length 1200
23:28:16.885947 IP 172.67.219.41.https > tatuya-latitudee6230.40750: UDP, length 1200
23:28:16.885951 IP 172.67.219.41.https > tatuya-latitudee6230.40750: UDP, length 1200
23:28:16.885954 IP 172.67.219.41.https > tatuya-latitudee6230.40750: UDP, length 1200
23:28:16.885957 IP 172.67.219.41.https > tatuya-latitudee6230.40750: UDP, length 1200
23:28:16.885959 IP 172.67.219.41.https > tatuya-latitudee6230.40750: UDP, length 1200
23:28:16.885961 IP 172.67.219.41.https > tatuya-latitudee6230.40750: UDP, length 1200
23:28:16.885963 IP 172.67.219.41.https > tatuya-latitudee6230.40750: UDP, length 1200
23:28:16.885966 IP 172.67.219.41.https > tatuya-latitudee6230.40750: UDP, length 1200
23:28:16.886108 IP 172.67.219.41.https > tatuya-latitudee6230.40750: UDP, length 1200
23:28:16.886112 IP 172.67.219.41.https > tatuya-latitudee6230.40750: UDP, length 1200
23:28:16.886114 IP 172.67.219.41.https > tatuya-latitudee6230.40750: UDP, length 1200
23:28:16.886117 IP 172.67.219.41.https > tatuya-latitudee6230.40750: UDP, length 1200
23:28:16.886120 IP 172.67.219.41.https > tatuya-latitudee6230.40750: UDP, length 1200
23:28:16.886121 IP 172.67.219.41.https > tatuya-latitudee6230.40750: UDP, length 1200
23:28:16.886123 IP 172.67.219.41.https > tatuya-latitudee6230.40750: UDP, length 1200
23:28:16.886126 IP 172.67.219.41.https > tatuya-latitudee6230.40750: UDP, length 1200
23:28:16.886224 IP 172.67.219.41.https > tatuya-latitudee6230.40750: UDP, length 1200
23:28:16.886227 IP 172.67.219.41.https > tatuya-latitudee6230.40750: UDP, length 1200
23:28:16.886229 IP 172.67.219.41.https > tatuya-latitudee6230.40750: UDP, length 1200
23:28:16.886231 IP 172.67.219.41.https > tatuya-latitudee6230.40750: UDP, length 1200
23:28:16.886234 IP 172.67.219.41.https > tatuya-latitudee6230.40750: UDP, length 1200
23:28:16.886237 IP 172.67.219.41.https > tatuya-latitudee6230.40750: UDP, length 1200
23:28:16.886239 IP 172.67.219.41.https > tatuya-latitudee6230.40750: UDP, length 1200
23:28:16.886241 IP 172.67.219.41.https > tatuya-latitudee6230.40750: UDP, length 1200
23:28:16.886349 IP 172.67.219.41.https > tatuya-latitudee6230.40750: UDP, length 1200
23:28:16.886353 IP 172.67.219.41.https > tatuya-latitudee6230.40750: UDP, length 1200
23:28:16.886355 IP 172.67.219.41.https > tatuya-latitudee6230.40750: UDP, length 1200
23:28:16.886357 IP 172.67.219.41.https > tatuya-latitudee6230.40750: UDP, length 1200
23:28:16.886360 IP 172.67.219.41.https > tatuya-latitudee6230.40750: UDP, length 1200
23:28:16.886362 IP 172.67.219.41.https > tatuya-latitudee6230.40750: UDP, length 1200
23:28:16.886364 IP 172.67.219.41.https > tatuya-latitudee6230.40750: UDP, length 1200
23:28:16.886367 IP 172.67.219.41.https > tatuya-latitudee6230.40750: UDP, length 1200
23:28:16.886458 IP 172.67.219.41.https > tatuya-latitudee6230.40750: UDP, length 1200
23:28:16.886461 IP 172.67.219.41.https > tatuya-latitudee6230.40750: UDP, length 1200
23:28:16.886463 IP 172.67.219.41.https > tatuya-latitudee6230.40750: UDP, length 1200
23:28:16.886467 IP 172.67.219.41.https > tatuya-latitudee6230.40750: UDP, length 1200
23:28:16.886469 IP 172.67.219.41.https > tatuya-latitudee6230.40750: UDP, length 1200
23:28:16.886472 IP 172.67.219.41.https > tatuya-latitudee6230.40750: UDP, length 1200
23:28:16.886474 IP 172.67.219.41.https > tatuya-latitudee6230.40750: UDP, length 1200
23:28:16.886476 IP 172.67.219.41.https > tatuya-latitudee6230.40750: UDP, length 1200
23:28:16.886668 IP 172.67.219.41.https > tatuya-latitudee6230.40750: UDP, length 1200
23:28:16.886671 IP 172.67.219.41.https > tatuya-latitudee6230.40750: UDP, length 173
23:28:16.889915 IP tatuya-latitudee6230.40750 > 172.67.219.41.https: UDP, length 49
23:28:17.166218 IP 172.67.219.41.https > tatuya-latitudee6230.40750: UDP, length 1200
23:28:17.166222 IP 172.67.219.41.https > tatuya-latitudee6230.40750: UDP, length 1200
23:28:17.166223 IP 172.67.219.41.https > tatuya-latitudee6230.40750: UDP, length 1200
23:28:17.166225 IP 172.67.219.41.https > tatuya-latitudee6230.40750: UDP, length 1200
23:28:17.166226 IP 172.67.219.41.https > tatuya-latitudee6230.40750: UDP, length 1200
23:28:17.166237 IP 172.67.219.41.https > tatuya-latitudee6230.40750: UDP, length 1200
23:28:17.166238 IP 172.67.219.41.https > tatuya-latitudee6230.40750: UDP, length 1200
23:28:17.166238 IP 172.67.219.41.https > tatuya-latitudee6230.40750: UDP, length 1200
23:28:17.166288 IP 172.67.219.41.https > tatuya-latitudee6230.40750: UDP, length 1200
23:28:17.166288 IP 172.67.219.41.https > tatuya-latitudee6230.40750: UDP, length 1200
23:28:17.166289 IP 172.67.219.41.https > tatuya-latitudee6230.40750: UDP, length 1200
23:28:17.166290 IP 172.67.219.41.https > tatuya-latitudee6230.40750: UDP, length 1200
23:28:17.166290 IP 172.67.219.41.https > tatuya-latitudee6230.40750: UDP, length 1200
23:28:17.166291 IP 172.67.219.41.https > tatuya-latitudee6230.40750: UDP, length 1200
23:28:17.166292 IP 172.67.219.41.https > tatuya-latitudee6230.40750: UDP, length 1200
23:28:17.166292 IP 172.67.219.41.https > tatuya-latitudee6230.40750: UDP, length 1200
23:28:17.166321 IP 172.67.219.41.https > tatuya-latitudee6230.40750: UDP, length 1200
23:28:17.166322 IP 172.67.219.41.https > tatuya-latitudee6230.40750: UDP, length 1200
23:28:17.166323 IP 172.67.219.41.https > tatuya-latitudee6230.40750: UDP, length 1200
23:28:17.166323 IP 172.67.219.41.https > tatuya-latitudee6230.40750: UDP, length 1200
23:28:17.166325 IP 172.67.219.41.https > tatuya-latitudee6230.40750: UDP, length 1200
23:28:17.166326 IP 172.67.219.41.https > tatuya-latitudee6230.40750: UDP, length 1200
23:28:17.166327 IP 172.67.219.41.https > tatuya-latitudee6230.40750: UDP, length 1200
23:28:17.166328 IP 172.67.219.41.https > tatuya-latitudee6230.40750: UDP, length 1200
23:28:17.166351 IP 172.67.219.41.https > tatuya-latitudee6230.40750: UDP, length 1200
23:28:17.166352 IP 172.67.219.41.https > tatuya-latitudee6230.40750: UDP, length 1200
23:28:17.166353 IP 172.67.219.41.https > tatuya-latitudee6230.40750: UDP, length 1200
23:28:17.166355 IP 172.67.219.41.https > tatuya-latitudee6230.40750: UDP, length 1200
23:28:17.166355 IP 172.67.219.41.https > tatuya-latitudee6230.40750: UDP, length 1200
23:28:17.166356 IP 172.67.219.41.https > tatuya-latitudee6230.40750: UDP, length 1200
23:28:17.166357 IP 172.67.219.41.https > tatuya-latitudee6230.40750: UDP, length 1200
23:28:17.166357 IP 172.67.219.41.https > tatuya-latitudee6230.40750: UDP, length 1200
23:28:17.166398 IP 172.67.219.41.https > tatuya-latitudee6230.40750: UDP, length 1200
23:28:17.166399 IP 172.67.219.41.https > tatuya-latitudee6230.40750: UDP, length 1200
23:28:17.166400 IP 172.67.219.41.https > tatuya-latitudee6230.40750: UDP, length 1200
23:28:17.166400 IP 172.67.219.41.https > tatuya-latitudee6230.40750: UDP, length 1200
23:28:17.166720 IP 172.67.219.41.https > tatuya-latitudee6230.40750: UDP, length 1200
23:28:17.166724 IP 172.67.219.41.https > tatuya-latitudee6230.40750: UDP, length 1200
23:28:17.166726 IP 172.67.219.41.https > tatuya-latitudee6230.40750: UDP, length 1200
23:28:17.166727 IP 172.67.219.41.https > tatuya-latitudee6230.40750: UDP, length 1200
23:28:17.166729 IP 172.67.219.41.https > tatuya-latitudee6230.40750: UDP, length 1200
23:28:17.166730 IP 172.67.219.41.https > tatuya-latitudee6230.40750: UDP, length 1200
23:28:17.166732 IP 172.67.219.41.https > tatuya-latitudee6230.40750: UDP, length 1200
23:28:17.166763 IP 172.67.219.41.https > tatuya-latitudee6230.40750: UDP, length 1200
23:28:17.166848 IP 172.67.219.41.https > tatuya-latitudee6230.40750: UDP, length 1200
23:28:17.166849 IP 172.67.219.41.https > tatuya-latitudee6230.40750: UDP, length 1200
23:28:17.166850 IP 172.67.219.41.https > tatuya-latitudee6230.40750: UDP, length 1200
23:28:17.166851 IP 172.67.219.41.https > tatuya-latitudee6230.40750: UDP, length 1200
23:28:17.166853 IP 172.67.219.41.https > tatuya-latitudee6230.40750: UDP, length 1200
23:28:17.166854 IP 172.67.219.41.https > tatuya-latitudee6230.40750: UDP, length 1200
23:28:17.166855 IP 172.67.219.41.https > tatuya-latitudee6230.40750: UDP, length 1200
23:28:17.166856 IP 172.67.219.41.https > tatuya-latitudee6230.40750: UDP, length 1200
23:28:17.166920 IP 172.67.219.41.https > tatuya-latitudee6230.40750: UDP, length 1200
23:28:17.166921 IP 172.67.219.41.https > tatuya-latitudee6230.40750: UDP, length 1200
23:28:17.166923 IP 172.67.219.41.https > tatuya-latitudee6230.40750: UDP, length 1200
23:28:17.166924 IP 172.67.219.41.https > tatuya-latitudee6230.40750: UDP, length 1200
23:28:17.166925 IP 172.67.219.41.https > tatuya-latitudee6230.40750: UDP, length 1200
23:28:17.166926 IP 172.67.219.41.https > tatuya-latitudee6230.40750: UDP, length 1200
23:28:17.166927 IP 172.67.219.41.https > tatuya-latitudee6230.40750: UDP, length 1200
23:28:17.166929 IP 172.67.219.41.https > tatuya-latitudee6230.40750: UDP, length 1200
23:28:17.166975 IP 172.67.219.41.https > tatuya-latitudee6230.40750: UDP, length 1200
23:28:17.166977 IP 172.67.219.41.https > tatuya-latitudee6230.40750: UDP, length 1200
23:28:17.166978 IP 172.67.219.41.https > tatuya-latitudee6230.40750: UDP, length 1200
23:28:17.166979 IP 172.67.219.41.https > tatuya-latitudee6230.40750: UDP, length 1200
23:28:17.166980 IP 172.67.219.41.https > tatuya-latitudee6230.40750: UDP, length 1200
23:28:17.166981 IP 172.67.219.41.https > tatuya-latitudee6230.40750: UDP, length 593
23:28:17.168415 IP tatuya-latitudee6230.51104 > bns1.hananet.net.domain: 28905+ PTR? 82.163.220.210.in-addr.arpa. (45)
23:28:17.168891 IP tatuya-latitudee6230.40750 > 172.67.219.41.https: UDP, length 49
23:28:17.180310 IP bns1.hananet.net.domain > tatuya-latitudee6230.51104: 28905 1/0/0 PTR bns1.hananet.net. (75)
23:28:17.319329 IP tatuya-latitudee6230.54798 > 139.45.197.236.https: Flags [P.], seq 4082907246:4082907292, ack 1913383974, win 569, options [nop,nop,TS val 2606801193 ecr 4127890702], length 46
23:28:17.319715 IP tatuya-latitudee6230.34454 > 139.45.195.8.https: Flags [P.], seq 345084638:345084684, ack 725764323, win 569, options [nop,nop,TS val 1824160786 ecr 2495559033], length 46
23:28:17.352788 IP tatuya-latitudee6230.38422 > 146.75.50.133.http: Flags [.], ack 485594156, win 501, options [nop,nop,TS val 1465317245 ecr 856064162], length 0
