23:34:41.253409 IP lb-140-82-114-26-iad.github.com.https > tatuya-latitudee6230.45470: Flags [P.], seq 936376155:936376180, ack 382998762, win 70, options [nop,nop,TS val 2164061444 ecr 317694666], length 25
23:34:41.253510 IP tatuya-latitudee6230.45470 > lb-140-82-114-26-iad.github.com.https: Flags [.], ack 25, win 590, options [nop,nop,TS val 317754434 ecr 2164061444], length 0
23:34:41.253788 IP tatuya-latitudee6230.45470 > lb-140-82-114-26-iad.github.com.https: Flags [P.], seq 1:30, ack 25, win 590, options [nop,nop,TS val 317754434 ecr 2164061444], length 29
23:34:41.490691 IP lb-140-82-114-26-iad.github.com.https > tatuya-latitudee6230.45470: Flags [.], ack 30, win 70, options [nop,nop,TS val 2164061682 ecr 317754434], length 0
23:34:41.995124 IP tatuya-latitudee6230.33889 > bns1.hananet.net.domain: 57536+ PTR? 26.114.82.140.in-addr.arpa. (44)
23:34:41.996487 IP bns1.hananet.net.domain > tatuya-latitudee6230.33889: 57536 1/0/0 PTR lb-140-82-114-26-iad.github.com. (89)
23:34:43.007000 IP tatuya-latitudee6230.42357 > bns1.hananet.net.domain: 21346+ PTR? 82.163.220.210.in-addr.arpa. (45)
23:34:43.016209 IP bns1.hananet.net.domain > tatuya-latitudee6230.42357: 21346 1/0/0 PTR bns1.hananet.net. (75)
23:34:44.564154 Loopback, skipCount 0,  invalid (256)
23:34:46.513173 IP tatuya-latitudee6230.bootpc > _gateway.bootps: BOOTP/DHCP, Request from f0:1f:af:2a:cd:d3 (oui Unknown), length 298
23:34:46.522163 IP _gateway.bootps > tatuya-latitudee6230.bootpc: BOOTP/DHCP, Reply, length 300
23:34:46.758465 IP tatuya-latitudee6230.33116 > bns1.hananet.net.domain: 56762+ A? ping.archlinux.org. (36)
23:34:46.758496 IP tatuya-latitudee6230.33116 > bns1.hananet.net.domain: 6529+ AAAA? ping.archlinux.org. (36)
23:34:46.759586 IP bns1.hananet.net.domain > tatuya-latitudee6230.33116: 56762 2/0/0 CNAME redirect.archlinux.org., A 95.216.195.133 (88)
23:34:46.759588 IP bns1.hananet.net.domain > tatuya-latitudee6230.33116: 6529 2/0/0 CNAME redirect.archlinux.org., AAAA 2a01:4f9:c010:2636::1 (100)
23:34:46.760424 IP tatuya-latitudee6230.55558 > redirect.archlinux.org.http: Flags [S], seq 713110465, win 64240, options [mss 1460,sackOK,TS val 472013691 ecr 0,nop,wscale 7], length 0
23:34:47.006107 ARP, Request who-has tatuya-latitudee6230 tell _gateway, length 46
23:34:47.006141 ARP, Reply tatuya-latitudee6230 is-at f0:1f:af:2a:cd:d3 (oui Unknown), length 28
23:34:47.007553 IP tatuya-latitudee6230.48417 > bns1.hananet.net.domain: 22957+ HTTPS? github.com. (28)
23:34:47.016213 IP bns1.hananet.net.domain > tatuya-latitudee6230.48417: 22957 0/1/0 (112)
23:34:47.016897 IP tatuya-latitudee6230.41588 > bns1.hananet.net.domain: 27116+ A? github.com. (28)
23:34:47.026164 IP bns1.hananet.net.domain > tatuya-latitudee6230.41588: 27116 1/0/0 A 20.200.245.247 (44)
23:34:47.027496 IP tatuya-latitudee6230.37942 > 20.200.245.247.https: Flags [S], seq 4016002453, win 64240, options [mss 1460,sackOK,TS val 3172588704 ecr 0,nop,wscale 7], length 0
23:34:47.034945 IP 20.200.245.247.https > tatuya-latitudee6230.37942: Flags [S.], seq 3898260111, ack 4016002454, win 65535, options [mss 1436,sackOK,TS val 3917104274 ecr 3172588704,nop,wscale 10], length 0
23:34:47.035009 IP tatuya-latitudee6230.37942 > 20.200.245.247.https: Flags [.], ack 1, win 502, options [nop,nop,TS val 3172588711 ecr 3917104274], length 0
23:34:47.037159 IP tatuya-latitudee6230.37942 > 20.200.245.247.https: Flags [P.], seq 1:830, ack 1, win 502, options [nop,nop,TS val 3172588713 ecr 3917104274], length 829
23:34:47.041625 IP redirect.archlinux.org.http > tatuya-latitudee6230.55558: Flags [S.], seq 2593758739, ack 713110466, win 65160, options [mss 1460,sackOK,TS val 3514443868 ecr 472013691,nop,wscale 7], length 0
23:34:47.041704 IP tatuya-latitudee6230.55558 > redirect.archlinux.org.http: Flags [.], ack 1, win 502, options [nop,nop,TS val 472013972 ecr 3514443868], length 0
23:34:47.041885 IP tatuya-latitudee6230.55558 > redirect.archlinux.org.http: Flags [P.], seq 1:89, ack 1, win 502, options [nop,nop,TS val 472013972 ecr 3514443868], length 88: HTTP: GET /nm-check.txt HTTP/1.1
23:34:47.044845 IP 20.200.245.247.https > tatuya-latitudee6230.37942: Flags [P.], seq 1:2849, ack 830, win 67, options [nop,nop,TS val 3917104284 ecr 3172588713], length 2848
23:34:47.044847 IP 20.200.245.247.https > tatuya-latitudee6230.37942: Flags [P.], seq 2849:3493, ack 830, win 67, options [nop,nop,TS val 3917104284 ecr 3172588713], length 644
23:34:47.044908 IP tatuya-latitudee6230.37942 > 20.200.245.247.https: Flags [.], ack 2849, win 546, options [nop,nop,TS val 3172588721 ecr 3917104284], length 0
23:34:47.044925 IP tatuya-latitudee6230.37942 > 20.200.245.247.https: Flags [.], ack 3493, win 568, options [nop,nop,TS val 3172588721 ecr 3917104284], length 0
23:34:47.056304 IP tatuya-latitudee6230.37942 > 20.200.245.247.https: Flags [P.], seq 830:894, ack 3493, win 568, options [nop,nop,TS val 3172588732 ecr 3917104284], length 64
23:34:47.057088 IP tatuya-latitudee6230.37942 > 20.200.245.247.https: Flags [P.], seq 894:1064, ack 3493, win 568, options [nop,nop,TS val 3172588733 ecr 3917104284], length 170
23:34:47.060162 IP tatuya-latitudee6230.60935 > bns1.hananet.net.domain: 18498+ PTR? 133.195.216.95.in-addr.arpa. (45)
23:34:47.061408 IP bns1.hananet.net.domain > tatuya-latitudee6230.60935: 18498 1/0/0 PTR redirect.archlinux.org. (81)
23:34:47.061692 IP tatuya-latitudee6230.47238 > bns1.hananet.net.domain: 21876+ PTR? 247.245.200.20.in-addr.arpa. (45)
23:34:47.062493 IP 20.200.245.247.https > tatuya-latitudee6230.37942: Flags [P.], seq 3493:3572, ack 1064, win 69, options [nop,nop,TS val 3917104302 ecr 3172588732], length 79
23:34:47.062495 IP 20.200.245.247.https > tatuya-latitudee6230.37942: Flags [P.], seq 3572:3651, ack 1064, win 69, options [nop,nop,TS val 3917104302 ecr 3172588732], length 79
23:34:47.062604 IP 20.200.245.247.https > tatuya-latitudee6230.37942: Flags [P.], seq 3651:3715, ack 1064, win 69, options [nop,nop,TS val 3917104302 ecr 3172588732], length 64
23:34:47.063188 IP tatuya-latitudee6230.37942 > 20.200.245.247.https: Flags [.], ack 3715, win 568, options [nop,nop,TS val 3172588739 ecr 3917104302], length 0
23:34:47.063220 IP tatuya-latitudee6230.37942 > 20.200.245.247.https: Flags [P.], seq 1064:1095, ack 3715, win 568, options [nop,nop,TS val 3172588739 ecr 3917104302], length 31
23:34:47.072513 IP bns1.hananet.net.domain > tatuya-latitudee6230.47238: 21876 NXDomain 0/1/0 (134)
23:34:47.109296 IP 20.200.245.247.https > tatuya-latitudee6230.37942: Flags [.], ack 1095, win 69, options [nop,nop,TS val 3917104349 ecr 3172588739], length 0
23:34:47.115309 IP tatuya-latitudee6230.49978 > bns1.hananet.net.domain: 30606+ HTTPS? collector.github.com. (38)
23:34:47.115342 IP tatuya-latitudee6230.50715 > bns1.hananet.net.domain: 16253+ A? collector.github.com. (38)
23:34:47.115371 IP tatuya-latitudee6230.50715 > bns1.hananet.net.domain: 61301+ AAAA? collector.github.com. (38)
23:34:47.123908 IP bns1.hananet.net.domain > tatuya-latitudee6230.49978: 30606 1/1/0 CNAME glb-db52c2cf8be544.github.com. (155)
23:34:47.124078 IP bns1.hananet.net.domain > tatuya-latitudee6230.50715: 16253 2/0/0 CNAME glb-db52c2cf8be544.github.com., A 140.82.113.21 (87)
23:34:47.125175 IP bns1.hananet.net.domain > tatuya-latitudee6230.50715: 61301 1/1/0 CNAME glb-db52c2cf8be544.github.com. (158)
23:34:47.173650 IP tatuya-latitudee6230.58748 > bns1.hananet.net.domain: 34523+ A? github.com. (28)
23:34:47.173688 IP tatuya-latitudee6230.58748 > bns1.hananet.net.domain: 18596+ AAAA? github.com. (28)
23:34:47.175344 IP bns1.hananet.net.domain > tatuya-latitudee6230.58748: 34523 1/0/0 A 20.200.245.247 (44)
23:34:47.175510 IP bns1.hananet.net.domain > tatuya-latitudee6230.58748: 18596 0/0/0 (28)
23:34:47.190449 IP tatuya-latitudee6230.37942 > 20.200.245.247.https: Flags [P.], seq 1095:2705, ack 3715, win 568, options [nop,nop,TS val 3172588867 ecr 3917104349], length 1610
23:34:47.198336 IP 20.200.245.247.https > tatuya-latitudee6230.37942: Flags [.], ack 2519, win 72, options [nop,nop,TS val 3917104437 ecr 3172588867], length 0
23:34:47.200357 IP 20.200.245.247.https > tatuya-latitudee6230.37942: Flags [.], ack 2705, win 74, options [nop,nop,TS val 3917104439 ecr 3172588867], length 0
23:34:47.323551 IP redirect.archlinux.org.http > tatuya-latitudee6230.55558: Flags [.], ack 89, win 502, options [nop,nop,TS val 3514444208 ecr 472013972], length 0
23:34:47.323662 IP redirect.archlinux.org.http > tatuya-latitudee6230.55558: Flags [P.], seq 1:205, ack 89, win 502, options [nop,nop,TS val 3514444209 ecr 472013972], length 204: HTTP: HTTP/1.1 200 OK
23:34:47.323711 IP tatuya-latitudee6230.55558 > redirect.archlinux.org.http: Flags [.], ack 205, win 501, options [nop,nop,TS val 472014254 ecr 3514444209], length 0
23:34:47.323829 IP redirect.archlinux.org.http > tatuya-latitudee6230.55558: Flags [F.], seq 205, ack 89, win 502, options [nop,nop,TS val 3514444209 ecr 472013972], length 0
23:34:47.323977 IP tatuya-latitudee6230.55558 > redirect.archlinux.org.http: Flags [F.], seq 89, ack 206, win 501, options [nop,nop,TS val 472014254 ecr 3514444209], length 0
23:34:47.605654 IP redirect.archlinux.org.http > tatuya-latitudee6230.55558: Flags [.], ack 90, win 502, options [nop,nop,TS val 3514444490 ecr 472014254], length 0
23:34:47.611162 IP 20.200.245.247.https > tatuya-latitudee6230.37942: Flags [.], seq 3715:10835, ack 2705, win 74, options [nop,nop,TS val 3917104850 ecr 3172588867], length 7120
23:34:47.611250 IP tatuya-latitudee6230.37942 > 20.200.245.247.https: Flags [.], ack 10835, win 659, options [nop,nop,TS val 3172589287 ecr 3917104850], length 0
23:34:47.611303 IP 20.200.245.247.https > tatuya-latitudee6230.37942: Flags [.], seq 10835:17955, ack 2705, win 74, options [nop,nop,TS val 3917104850 ecr 3172588867], length 7120
23:34:47.611367 IP tatuya-latitudee6230.37942 > 20.200.245.247.https: Flags [.], ack 17955, win 607, options [nop,nop,TS val 3172589288 ecr 3917104850], length 0
23:34:47.618341 IP 20.200.245.247.https > tatuya-latitudee6230.37942: Flags [P.], seq 17955:22227, ack 2705, win 74, options [nop,nop,TS val 3917104857 ecr 3172589287], length 4272
23:34:47.618347 IP 20.200.245.247.https > tatuya-latitudee6230.37942: Flags [P.], seq 22227:26499, ack 2705, win 74, options [nop,nop,TS val 3917104857 ecr 3172589287], length 4272
23:34:47.618348 IP 20.200.245.247.https > tatuya-latitudee6230.37942: Flags [.], seq 26499:27923, ack 2705, win 74, options [nop,nop,TS val 3917104857 ecr 3172589287], length 1424
23:34:47.618415 IP tatuya-latitudee6230.37942 > 20.200.245.247.https: Flags [.], ack 22227, win 680, options [nop,nop,TS val 3172589295 ecr 3917104857], length 0
23:34:47.618465 IP 20.200.245.247.https > tatuya-latitudee6230.37942: Flags [P.], seq 27923:30771, ack 2705, win 74, options [nop,nop,TS val 3917104857 ecr 3172589287], length 2848
23:34:47.618544 IP tatuya-latitudee6230.37942 > 20.200.245.247.https: Flags [.], ack 30771, win 617, options [nop,nop,TS val 3172589295 ecr 3917104857], length 0
23:34:47.620466 IP 20.200.245.247.https > tatuya-latitudee6230.37942: Flags [P.], seq 30771:36467, ack 2705, win 74, options [nop,nop,TS val 3917104860 ecr 3172589288], length 5696
23:34:47.620469 IP 20.200.245.247.https > tatuya-latitudee6230.37942: Flags [P.], seq 36467:42163, ack 2705, win 74, options [nop,nop,TS val 3917104860 ecr 3172589288], length 5696
23:34:47.620527 IP tatuya-latitudee6230.37942 > 20.200.245.247.https: Flags [.], ack 36467, win 669, options [nop,nop,TS val 3172589297 ecr 3917104860], length 0
23:34:47.620554 IP 20.200.245.247.https > tatuya-latitudee6230.37942: Flags [P.], seq 42163:46435, ack 2705, win 74, options [nop,nop,TS val 3917104860 ecr 3172589288], length 4272
23:34:47.620618 IP tatuya-latitudee6230.37942 > 20.200.245.247.https: Flags [.], ack 46435, win 680, options [nop,nop,TS val 3172589297 ecr 3917104860], length 0
23:34:47.624233 IP 20.200.245.247.https > tatuya-latitudee6230.37942: Flags [P.], seq 46435:47784, ack 2705, win 74, options [nop,nop,TS val 3917104863 ecr 3172589295], length 1349
23:34:47.669370 IP tatuya-latitudee6230.37942 > 20.200.245.247.https: Flags [.], ack 47784, win 702, options [nop,nop,TS val 3172589346 ecr 3917104863], length 0
23:34:47.698380 IP tatuya-latitudee6230.60723 > bns1.hananet.net.domain: 47643+ HTTPS? github.githubassets.com. (41)
23:34:47.698396 IP tatuya-latitudee6230.49012 > bns1.hananet.net.domain: 51030+ A? github.githubassets.com. (41)
23:34:47.698408 IP tatuya-latitudee6230.49012 > bns1.hananet.net.domain: 19029+ AAAA? github.githubassets.com. (41)
23:34:47.698604 IP tatuya-latitudee6230.51591 > bns1.hananet.net.domain: 59261+ HTTPS? avatars.githubusercontent.com. (47)
23:34:47.698618 IP tatuya-latitudee6230.38643 > bns1.hananet.net.domain: 61639+ A? avatars.githubusercontent.com. (47)
23:34:47.698627 IP tatuya-latitudee6230.38643 > bns1.hananet.net.domain: 54213+ AAAA? avatars.githubusercontent.com. (47)
23:34:47.698678 IP tatuya-latitudee6230.34516 > bns1.hananet.net.domain: 3284+ HTTPS? github-cloud.s3.amazonaws.com. (47)
23:34:47.698776 IP tatuya-latitudee6230.44674 > bns1.hananet.net.domain: 48705+ A? github-cloud.s3.amazonaws.com. (47)
23:34:47.698781 IP tatuya-latitudee6230.44674 > bns1.hananet.net.domain: 54851+ AAAA? github-cloud.s3.amazonaws.com. (47)
23:34:47.698913 IP tatuya-latitudee6230.57623 > bns1.hananet.net.domain: 40803+ A? user-images.githubusercontent.com. (51)
23:34:47.698918 IP tatuya-latitudee6230.57623 > bns1.hananet.net.domain: 6241+ AAAA? user-images.githubusercontent.com. (51)
23:34:47.698952 IP tatuya-latitudee6230.49055 > bns1.hananet.net.domain: 28859+ HTTPS? user-images.githubusercontent.com. (51)
23:34:47.700631 IP bns1.hananet.net.domain > tatuya-latitudee6230.49012: 19029 0/0/0 (41)
23:34:47.700729 IP bns1.hananet.net.domain > tatuya-latitudee6230.38643: 61639 4/0/0 A 185.199.108.133, A 185.199.111.133, A 185.199.110.133, A 185.199.109.133 (111)
23:34:47.700730 IP bns1.hananet.net.domain > tatuya-latitudee6230.38643: 54213 4/0/0 AAAA 2606:50c0:8003::154, AAAA 2606:50c0:8002::154, AAAA 2606:50c0:8001::154, AAAA 2606:50c0:8000::154 (159)
23:34:47.707992 IP bns1.hananet.net.domain > tatuya-latitudee6230.49012: 51030 4/0/0 A 185.199.110.154, A 185.199.109.154, A 185.199.108.154, A 185.199.111.154 (105)
23:34:47.708238 IP bns1.hananet.net.domain > tatuya-latitudee6230.34516: 3284 2/1/0 CNAME s3-1-w.amazonaws.com., CNAME s3-w.us-east-1.amazonaws.com. (175)
23:34:47.708366 IP bns1.hananet.net.domain > tatuya-latitudee6230.51591: 59261 0/1/0 (129)
23:34:47.708554 IP bns1.hananet.net.domain > tatuya-latitudee6230.60723: 47643 0/1/0 (126)
23:34:47.709950 IP bns1.hananet.net.domain > tatuya-latitudee6230.44674: 48705 10/0/0 CNAME s3-1-w.amazonaws.com., CNAME s3-w.us-east-1.amazonaws.com., A 54.231.199.161, A 54.231.130.25, A 52.216.209.105, A 16.182.72.41, A 3.5.29.142, A 16.182.105.185, A 52.217.64.84, A 52.217.196.97 (225)
23:34:47.710111 IP bns1.hananet.net.domain > tatuya-latitudee6230.44674: 54851 2/1/0 CNAME s3-1-w.amazonaws.com., CNAME s3-w.us-east-1.amazonaws.com. (175)
23:34:47.710437 IP bns1.hananet.net.domain > tatuya-latitudee6230.57623: 40803 4/0/0 A 185.199.111.133, A 185.199.110.133, A 185.199.108.133, A 185.199.109.133 (115)
23:34:47.710438 IP bns1.hananet.net.domain > tatuya-latitudee6230.57623: 6241 4/0/0 AAAA 2606:50c0:8003::154, AAAA 2606:50c0:8000::154, AAAA 2606:50c0:8001::154, AAAA 2606:50c0:8002::154 (163)
23:34:47.711566 IP tatuya-latitudee6230.53966 > cdn-185-199-108-133.github.com.https: Flags [S], seq 563837899, win 64240, options [mss 1460,sackOK,TS val 2332664472 ecr 0,nop,wscale 7], length 0
23:34:47.712203 IP bns1.hananet.net.domain > tatuya-latitudee6230.49055: 28859 0/1/0 (133)
23:34:47.713151 IP tatuya-latitudee6230.50072 > cdn-185-199-110-154.github.com.https: Flags [S], seq 1928744082, win 64240, options [mss 1460,sackOK,TS val 396096795 ecr 0,nop,wscale 7], length 0
23:34:47.844200 IP cdn-185-199-110-154.github.com.https > tatuya-latitudee6230.50072: Flags [S.], seq 2749096981, ack 1928744083, win 65535, options [mss 1460,sackOK,TS val 1422230046 ecr 396096795,nop,wscale 9], length 0
23:34:47.844259 IP tatuya-latitudee6230.50072 > cdn-185-199-110-154.github.com.https: Flags [.], ack 1, win 502, options [nop,nop,TS val 396096926 ecr 1422230046], length 0
23:34:47.845851 IP tatuya-latitudee6230.50072 > cdn-185-199-110-154.github.com.https: Flags [P.], seq 1:1115, ack 1, win 502, options [nop,nop,TS val 396096928 ecr 1422230046], length 1114
23:34:47.851751 IP cdn-185-199-108-133.github.com.https > tatuya-latitudee6230.53966: Flags [S.], seq 200581609, ack 563837900, win 65535, options [mss 1396,sackOK,TS val 3050112848 ecr 2332664472,nop,wscale 9], length 0
23:34:47.851811 IP tatuya-latitudee6230.53966 > cdn-185-199-108-133.github.com.https: Flags [.], ack 1, win 502, options [nop,nop,TS val 2332664612 ecr 3050112848], length 0
23:34:47.853397 IP tatuya-latitudee6230.53966 > cdn-185-199-108-133.github.com.https: Flags [P.], seq 1:1121, ack 1, win 502, options [nop,nop,TS val 2332664614 ecr 3050112848], length 1120
23:34:47.979991 IP cdn-185-199-110-154.github.com.https > tatuya-latitudee6230.50072: Flags [.], ack 1115, win 288, options [nop,nop,TS val 1422230182 ecr 396096928], length 0
23:34:47.980245 IP cdn-185-199-110-154.github.com.https > tatuya-latitudee6230.50072: Flags [P.], seq 1:454, ack 1115, win 288, options [nop,nop,TS val 1422230182 ecr 396096928], length 453
23:34:47.980280 IP tatuya-latitudee6230.50072 > cdn-185-199-110-154.github.com.https: Flags [.], ack 454, win 501, options [nop,nop,TS val 396097062 ecr 1422230182], length 0
23:34:47.981231 IP tatuya-latitudee6230.50072 > cdn-185-199-110-154.github.com.https: Flags [P.], seq 1115:1179, ack 454, win 501, options [nop,nop,TS val 396097063 ecr 1422230182], length 64
23:34:47.981989 IP tatuya-latitudee6230.50072 > cdn-185-199-110-154.github.com.https: Flags [P.], seq 1179:1349, ack 454, win 501, options [nop,nop,TS val 396097064 ecr 1422230182], length 170
23:34:47.994966 IP cdn-185-199-108-133.github.com.https > tatuya-latitudee6230.53966: Flags [.], ack 1121, win 275, options [nop,nop,TS val 3050112991 ecr 2332664614], length 0
23:34:47.995381 IP cdn-185-199-108-133.github.com.https > tatuya-latitudee6230.53966: Flags [P.], seq 1:454, ack 1121, win 275, options [nop,nop,TS val 3050112991 ecr 2332664614], length 453
23:34:47.995420 IP tatuya-latitudee6230.53966 > cdn-185-199-108-133.github.com.https: Flags [.], ack 454, win 501, options [nop,nop,TS val 2332664756 ecr 3050112991], length 0
23:34:47.996098 IP tatuya-latitudee6230.53966 > cdn-185-199-108-133.github.com.https: Flags [P.], seq 1121:1185, ack 454, win 501, options [nop,nop,TS val 2332664756 ecr 3050112991], length 64
23:34:47.996842 IP tatuya-latitudee6230.53966 > cdn-185-199-108-133.github.com.https: Flags [P.], seq 1185:1355, ack 454, win 501, options [nop,nop,TS val 2332664757 ecr 3050112991], length 170
23:34:48.073632 IP tatuya-latitudee6230.37649 > bns1.hananet.net.domain: 10614+ PTR? 133.108.199.185.in-addr.arpa. (46)
23:34:48.083293 IP bns1.hananet.net.domain > tatuya-latitudee6230.37649: 10614 1/0/0 PTR cdn-185-199-108-133.github.com. (90)
23:34:48.084618 IP tatuya-latitudee6230.51957 > bns1.hananet.net.domain: 46169+ PTR? 154.110.199.185.in-addr.arpa. (46)
23:34:48.111878 IP cdn-185-199-110-154.github.com.https > tatuya-latitudee6230.50072: Flags [.], ack 1179, win 288, options [nop,nop,TS val 1422230314 ecr 396097063], length 0
23:34:48.113857 IP cdn-185-199-110-154.github.com.https > tatuya-latitudee6230.50072: Flags [.], ack 1349, win 292, options [nop,nop,TS val 1422230316 ecr 396097064], length 0
23:34:48.113858 IP cdn-185-199-110-154.github.com.https > tatuya-latitudee6230.50072: Flags [P.], seq 454:519, ack 1349, win 292, options [nop,nop,TS val 1422230316 ecr 396097064], length 65
23:34:48.114012 IP tatuya-latitudee6230.50072 > cdn-185-199-110-154.github.com.https: Flags [P.], seq 1349:1380, ack 519, win 501, options [nop,nop,TS val 396097196 ecr 1422230316], length 31
23:34:48.127320 IP bns1.hananet.net.domain > tatuya-latitudee6230.51957: 46169 1/0/0 PTR cdn-185-199-110-154.github.com. (90)
23:34:48.136805 IP cdn-185-199-108-133.github.com.https > tatuya-latitudee6230.53966: Flags [.], ack 1185, win 275, options [nop,nop,TS val 3050113133 ecr 2332664756], length 0
23:34:48.136894 IP cdn-185-199-108-133.github.com.https > tatuya-latitudee6230.53966: Flags [.], ack 1355, win 280, options [nop,nop,TS val 3050113133 ecr 2332664757], length 0
23:34:48.136894 IP cdn-185-199-108-133.github.com.https > tatuya-latitudee6230.53966: Flags [P.], seq 454:519, ack 1355, win 280, options [nop,nop,TS val 3050113133 ecr 2332664757], length 65
23:34:48.137022 IP tatuya-latitudee6230.53966 > cdn-185-199-108-133.github.com.https: Flags [P.], seq 1355:1386, ack 519, win 501, options [nop,nop,TS val 2332664897 ecr 3050113133], length 31
23:34:48.245885 IP cdn-185-199-110-154.github.com.https > tatuya-latitudee6230.50072: Flags [.], ack 1380, win 292, options [nop,nop,TS val 1422230448 ecr 396097196], length 0
23:34:48.276897 IP cdn-185-199-108-133.github.com.https > tatuya-latitudee6230.53966: Flags [.], ack 1386, win 280, options [nop,nop,TS val 3050113273 ecr 2332664897], length 0
23:34:48.425399 IP tatuya-latitudee6230.45470 > lb-140-82-114-26-iad.github.com.https: Flags [P.], seq 30:226, ack 25, win 590, options [nop,nop,TS val 317761606 ecr 2164061682], length 196
23:34:48.480635 IP tatuya-latitudee6230.37942 > 20.200.245.247.https: Flags [P.], seq 2705:3726, ack 47784, win 702, options [nop,nop,TS val 3172590157 ecr 3917104863], length 1021
23:34:48.488262 IP 20.200.245.247.https > tatuya-latitudee6230.37942: Flags [.], ack 3726, win 77, options [nop,nop,TS val 3917105727 ecr 3172590157], length 0
23:34:48.501477 IP tatuya-latitudee6230.37942 > 20.200.245.247.https: Flags [P.], seq 3726:3898, ack 47784, win 702, options [nop,nop,TS val 3172590178 ecr 3917105727], length 172
23:34:48.508251 IP 20.200.245.247.https > tatuya-latitudee6230.37942: Flags [.], ack 3898, win 80, options [nop,nop,TS val 3917105747 ecr 3172590178], length 0
23:34:48.511765 IP tatuya-latitudee6230.40273 > bns1.hananet.net.domain: 54178+ HTTPS? api.github.com. (32)
23:34:48.511904 IP tatuya-latitudee6230.34124 > bns1.hananet.net.domain: 57645+ A? api.github.com. (32)
23:34:48.511916 IP tatuya-latitudee6230.34124 > bns1.hananet.net.domain: 37392+ AAAA? api.github.com. (32)
23:34:48.520135 IP bns1.hananet.net.domain > tatuya-latitudee6230.40273: 54178 0/1/0 (116)
23:34:48.520256 IP bns1.hananet.net.domain > tatuya-latitudee6230.34124: 57645 1/0/0 A 20.200.245.245 (48)
23:34:48.520391 IP bns1.hananet.net.domain > tatuya-latitudee6230.34124: 37392 0/1/0 (116)
23:34:48.613716 IP lb-140-82-114-26-iad.github.com.https > tatuya-latitudee6230.45470: Flags [.], ack 226, win 72, options [nop,nop,TS val 2164068805 ecr 317761606], length 0
23:34:48.614253 IP lb-140-82-114-26-iad.github.com.https > tatuya-latitudee6230.45470: Flags [P.], seq 25:98, ack 226, win 72, options [nop,nop,TS val 2164068805 ecr 317761606], length 73
23:34:48.656105 IP tatuya-latitudee6230.45470 > lb-140-82-114-26-iad.github.com.https: Flags [.], ack 98, win 590, options [nop,nop,TS val 317761836 ecr 2164068805], length 0
23:34:48.778011 IP 20.200.245.247.https > tatuya-latitudee6230.37942: Flags [P.], seq 47784:52643, ack 3898, win 80, options [nop,nop,TS val 3917106017 ecr 3172590178], length 4859
23:34:48.778062 IP tatuya-latitudee6230.37942 > 20.200.245.247.https: Flags [.], ack 52643, win 778, options [nop,nop,TS val 3172590454 ecr 3917106017], length 0
23:34:48.814043 IP 20.200.245.247.https > tatuya-latitudee6230.37942: Flags [.], seq 52643:55491, ack 3898, win 80, options [nop,nop,TS val 3917106053 ecr 3172590454], length 2848
23:34:48.814132 IP tatuya-latitudee6230.37942 > 20.200.245.247.https: Flags [.], ack 55491, win 822, options [nop,nop,TS val 3172590490 ecr 3917106053], length 0
23:34:48.814181 IP 20.200.245.247.https > tatuya-latitudee6230.37942: Flags [P.], seq 55491:57483, ack 3898, win 80, options [nop,nop,TS val 3917106053 ecr 3172590454], length 1992
23:34:48.814234 IP tatuya-latitudee6230.37942 > 20.200.245.247.https: Flags [.], ack 57483, win 854, options [nop,nop,TS val 3172590490 ecr 3917106053], length 0
23:34:52.653401 IP tatuya-latitudee6230.51997 > bns1.hananet.net.domain: 57300+ A? sync-1-us-west1-g.sync.services.mozilla.com. (61)
23:34:52.653412 IP tatuya-latitudee6230.51997 > bns1.hananet.net.domain: 29402+ AAAA? sync-1-us-west1-g.sync.services.mozilla.com. (61)
23:34:52.654010 IP tatuya-latitudee6230.47104 > 140.227.186.35.bc.googleusercontent.com.https: Flags [P.], seq 2334993747:2334994366, ack 3310960334, win 611, options [nop,nop,TS val 731880578 ecr 124265137], length 619
23:34:52.654112 IP tatuya-latitudee6230.47104 > 140.227.186.35.bc.googleusercontent.com.https: Flags [P.], seq 619:1421, ack 1, win 611, options [nop,nop,TS val 731880578 ecr 124265137], length 802
23:34:52.654683 IP bns1.hananet.net.domain > tatuya-latitudee6230.51997: 57300 1/0/0 A 35.186.227.140 (77)
23:34:52.654685 IP bns1.hananet.net.domain > tatuya-latitudee6230.51997: 29402 0/0/0 (61)
23:34:52.670426 IP 140.227.186.35.bc.googleusercontent.com.https > tatuya-latitudee6230.47104: Flags [.], ack 619, win 307, options [nop,nop,TS val 124295692 ecr 731880578], length 0
23:34:52.672061 IP 140.227.186.35.bc.googleusercontent.com.https > tatuya-latitudee6230.47104: Flags [.], ack 1421, win 318, options [nop,nop,TS val 124295693 ecr 731880578], length 0
23:34:52.846666 IP 140.227.186.35.bc.googleusercontent.com.https > tatuya-latitudee6230.47104: Flags [P.], seq 1:93, ack 1421, win 318, options [nop,nop,TS val 124295868 ecr 731880578], length 92
23:34:52.848104 IP 140.227.186.35.bc.googleusercontent.com.https > tatuya-latitudee6230.47104: Flags [P.], seq 93:189, ack 1421, win 318, options [nop,nop,TS val 124295870 ecr 731880578], length 96
23:34:52.848244 IP 140.227.186.35.bc.googleusercontent.com.https > tatuya-latitudee6230.47104: Flags [P.], seq 189:228, ack 1421, win 318, options [nop,nop,TS val 124295870 ecr 731880578], length 39
23:34:52.848541 IP tatuya-latitudee6230.47104 > 140.227.186.35.bc.googleusercontent.com.https: Flags [.], ack 228, win 611, options [nop,nop,TS val 731880773 ecr 124295868], length 0
23:34:52.848633 IP tatuya-latitudee6230.47104 > 140.227.186.35.bc.googleusercontent.com.https: Flags [P.], seq 1421:1460, ack 228, win 611, options [nop,nop,TS val 731880773 ecr 124295868], length 39
23:34:52.858419 IP 140.227.186.35.bc.googleusercontent.com.https > tatuya-latitudee6230.47104: Flags [.], ack 1460, win 318, options [nop,nop,TS val 124295880 ecr 731880773], length 0
23:34:53.140965 IP tatuya-latitudee6230.33385 > bns1.hananet.net.domain: 51966+ PTR? 140.227.186.35.in-addr.arpa. (45)
23:34:53.221549 IP bns1.hananet.net.domain > tatuya-latitudee6230.33385: 51966 1/0/0 PTR 140.227.186.35.bc.googleusercontent.com. (98)
23:34:54.583529 Loopback, skipCount 0,  invalid (256)
23:34:55.367937 IP tatuya-latitudee6230.37942 > 20.200.245.247.https: Flags [P.], seq 3898:4953, ack 57483, win 854, options [nop,nop,TS val 3172597044 ecr 3917106053], length 1055
23:34:55.368005 IP tatuya-latitudee6230.37942 > 20.200.245.247.https: Flags [P.], seq 4953:5499, ack 57483, win 854, options [nop,nop,TS val 3172597044 ecr 3917106053], length 546
23:34:55.378557 IP 20.200.245.247.https > tatuya-latitudee6230.37942: Flags [.], ack 4953, win 83, options [nop,nop,TS val 3917112618 ecr 3172597044], length 0
23:34:55.380255 IP 20.200.245.247.https > tatuya-latitudee6230.37942: Flags [.], ack 5499, win 86, options [nop,nop,TS val 3917112619 ecr 3172597044], length 0
23:34:55.380258 IP 20.200.245.247.https > tatuya-latitudee6230.37942: Flags [P.], seq 57483:57531, ack 5499, win 86, options [nop,nop,TS val 3917112619 ecr 3172597044], length 48
23:34:55.380435 IP tatuya-latitudee6230.37942 > 20.200.245.247.https: Flags [.], ack 57531, win 854, options [nop,nop,TS val 3172597057 ecr 3917112619], length 0
23:34:55.706976 IP 20.200.245.247.https > tatuya-latitudee6230.37942: Flags [P.], seq 57531:62315, ack 5499, win 86, options [nop,nop,TS val 3917112946 ecr 3172597057], length 4784
23:34:55.707029 IP tatuya-latitudee6230.37942 > 20.200.245.247.https: Flags [.], ack 62315, win 928, options [nop,nop,TS val 3172597383 ecr 3917112946], length 0
23:34:55.725136 IP tatuya-latitudee6230.37942 > 20.200.245.247.https: Flags [P.], seq 5499:6881, ack 62315, win 928, options [nop,nop,TS val 3172597401 ecr 3917112946], length 1382
23:34:55.725209 IP tatuya-latitudee6230.37942 > 20.200.245.247.https: Flags [P.], seq 6881:7816, ack 62315, win 928, options [nop,nop,TS val 3172597401 ecr 3917112946], length 935
23:34:55.730261 IP 20.200.245.247.https > tatuya-latitudee6230.37942: Flags [.], ack 7816, win 91, options [nop,nop,TS val 3917112969 ecr 3172597401], length 0
23:34:55.730412 IP 20.200.245.247.https > tatuya-latitudee6230.37942: Flags [P.], seq 62315:62363, ack 7816, win 91, options [nop,nop,TS val 3917112970 ecr 3172597401], length 48
23:34:55.772773 IP tatuya-latitudee6230.37942 > 20.200.245.247.https: Flags [.], ack 62363, win 928, options [nop,nop,TS val 3172597449 ecr 3917112970], length 0
23:34:56.064612 IP 20.200.245.247.https > tatuya-latitudee6230.37942: Flags [.], seq 62363:65211, ack 7816, win 91, options [nop,nop,TS val 3917113304 ecr 3172597449], length 2848
23:34:56.064657 IP tatuya-latitudee6230.37942 > 20.200.245.247.https: Flags [.], ack 65211, win 973, options [nop,nop,TS val 3172597741 ecr 3917113304], length 0
23:34:56.064700 IP 20.200.245.247.https > tatuya-latitudee6230.37942: Flags [.], seq 65211:66635, ack 7816, win 91, options [nop,nop,TS val 3917113304 ecr 3172597449], length 1424
23:34:56.064718 IP tatuya-latitudee6230.37942 > 20.200.245.247.https: Flags [.], ack 66635, win 995, options [nop,nop,TS val 3172597741 ecr 3917113304], length 0
23:34:56.064776 IP 20.200.245.247.https > tatuya-latitudee6230.37942: Flags [P.], seq 66635:68722, ack 7816, win 91, options [nop,nop,TS val 3917113304 ecr 3172597449], length 2087
23:34:56.064794 IP tatuya-latitudee6230.37942 > 20.200.245.247.https: Flags [.], ack 68722, win 1028, options [nop,nop,TS val 3172597741 ecr 3917113304], length 0
23:34:56.072631 IP tatuya-latitudee6230.58124 > bns1.hananet.net.domain: 49943+ A? github-production-upload-manifest-file-7fdce7.s3.amazonaws.com. (80)
23:34:56.072645 IP tatuya-latitudee6230.58124 > bns1.hananet.net.domain: 34076+ AAAA? github-production-upload-manifest-file-7fdce7.s3.amazonaws.com. (80)
23:34:56.072777 IP tatuya-latitudee6230.47064 > bns1.hananet.net.domain: 48960+ HTTPS? github-production-upload-manifest-file-7fdce7.s3.amazonaws.com. (80)
23:34:56.080312 IP bns1.hananet.net.domain > tatuya-latitudee6230.58124: 49943 10/0/0 CNAME s3-1-w.amazonaws.com., CNAME s3-w.us-east-1.amazonaws.com., A 3.5.28.154, A 54.231.199.185, A 52.217.96.164, A 16.182.40.217, A 52.217.67.148, A 52.216.179.171, A 52.217.94.196, A 3.5.30.234 (258)
23:34:56.080382 IP bns1.hananet.net.domain > tatuya-latitudee6230.58124: 34076 2/1/0 CNAME s3-1-w.amazonaws.com., CNAME s3-w.us-east-1.amazonaws.com. (208)
23:34:56.080899 IP tatuya-latitudee6230.58988 > s3-1-w.amazonaws.com.https: Flags [S], seq 2761709088, win 64240, options [mss 1460,sackOK,TS val 2534078904 ecr 0,nop,wscale 7], length 0
23:34:56.080957 IP bns1.hananet.net.domain > tatuya-latitudee6230.47064: 48960 2/1/0 CNAME s3-1-w.amazonaws.com., CNAME s3-w.us-east-1.amazonaws.com. (208)
23:34:56.081453 IP tatuya-latitudee6230.58994 > s3-1-w.amazonaws.com.https: Flags [S], seq 156261997, win 64240, options [mss 1460,sackOK,TS val 2534078905 ecr 0,nop,wscale 7], length 0
23:34:56.181407 IP tatuya-latitudee6230.37949 > bns1.hananet.net.domain: 34633+ PTR? 154.28.5.3.in-addr.arpa. (41)
23:34:56.260654 IP bns1.hananet.net.domain > tatuya-latitudee6230.37949: 34633 1/0/0 PTR s3-1-w.amazonaws.com. (75)
23:34:56.267131 IP s3-1-w.amazonaws.com.https > tatuya-latitudee6230.58988: Flags [S.], seq 3913278849, ack 2761709089, win 57736, options [mss 1460,sackOK,TS val 1755211568 ecr 2534078904,nop,wscale 8], length 0
23:34:56.267301 IP tatuya-latitudee6230.58988 > s3-1-w.amazonaws.com.https: Flags [.], ack 1, win 502, options [nop,nop,TS val 2534079090 ecr 1755211568], length 0
23:34:56.268747 IP s3-1-w.amazonaws.com.https > tatuya-latitudee6230.58994: Flags [S.], seq 1384502325, ack 156261998, win 57736, options [mss 1460,sackOK,TS val 3550007011 ecr 2534078905,nop,wscale 8], length 0
23:34:56.268882 IP tatuya-latitudee6230.58994 > s3-1-w.amazonaws.com.https: Flags [.], ack 1, win 502, options [nop,nop,TS val 2534079092 ecr 3550007011], length 0
23:34:56.271798 IP tatuya-latitudee6230.58988 > s3-1-w.amazonaws.com.https: Flags [P.], seq 1:711, ack 1, win 502, options [nop,nop,TS val 2534079095 ecr 1755211568], length 710
23:34:56.274550 IP tatuya-latitudee6230.58994 > s3-1-w.amazonaws.com.https: Flags [P.], seq 1:711, ack 1, win 502, options [nop,nop,TS val 2534079098 ecr 3550007011], length 710
23:34:56.458681 IP s3-1-w.amazonaws.com.https > tatuya-latitudee6230.58988: Flags [.], ack 711, win 224, options [nop,nop,TS val 1755211760 ecr 2534079095], length 0
23:34:56.458878 IP s3-1-w.amazonaws.com.https > tatuya-latitudee6230.58988: Flags [P.], seq 1:161, ack 711, win 224, options [nop,nop,TS val 1755211761 ecr 2534079095], length 160
23:34:56.458976 IP tatuya-latitudee6230.58988 > s3-1-w.amazonaws.com.https: Flags [.], ack 161, win 501, options [nop,nop,TS val 2534079282 ecr 1755211761], length 0
23:34:56.459165 IP s3-1-w.amazonaws.com.https > tatuya-latitudee6230.58988: Flags [P.], seq 161:167, ack 711, win 224, options [nop,nop,TS val 1755211761 ecr 2534079095], length 6
23:34:56.459167 IP s3-1-w.amazonaws.com.https > tatuya-latitudee6230.58988: Flags [P.], seq 167:214, ack 711, win 224, options [nop,nop,TS val 1755211761 ecr 2534079095], length 47
23:34:56.459240 IP tatuya-latitudee6230.58988 > s3-1-w.amazonaws.com.https: Flags [.], ack 167, win 501, options [nop,nop,TS val 2534079282 ecr 1755211761], length 0
23:34:56.459266 IP tatuya-latitudee6230.58988 > s3-1-w.amazonaws.com.https: Flags [.], ack 214, win 501, options [nop,nop,TS val 2534079282 ecr 1755211761], length 0
23:34:56.459329 IP s3-1-w.amazonaws.com.https > tatuya-latitudee6230.58988: Flags [P.], seq 214:3070, ack 711, win 224, options [nop,nop,TS val 1755211761 ecr 2534079095], length 2856
23:34:56.459334 IP s3-1-w.amazonaws.com.https > tatuya-latitudee6230.58988: Flags [P.], seq 3070:5216, ack 711, win 224, options [nop,nop,TS val 1755211761 ecr 2534079095], length 2146
23:34:56.459394 IP tatuya-latitudee6230.58988 > s3-1-w.amazonaws.com.https: Flags [.], ack 3070, win 546, options [nop,nop,TS val 2534079283 ecr 1755211761], length 0
23:34:56.459422 IP tatuya-latitudee6230.58988 > s3-1-w.amazonaws.com.https: Flags [.], ack 5216, win 579, options [nop,nop,TS val 2534079283 ecr 1755211761], length 0
23:34:56.461657 IP s3-1-w.amazonaws.com.https > tatuya-latitudee6230.58994: Flags [.], ack 711, win 224, options [nop,nop,TS val 3550007204 ecr 2534079098], length 0
23:34:56.461935 IP s3-1-w.amazonaws.com.https > tatuya-latitudee6230.58994: Flags [P.], seq 1:161, ack 711, win 224, options [nop,nop,TS val 3550007204 ecr 2534079098], length 160
23:34:56.461994 IP tatuya-latitudee6230.58994 > s3-1-w.amazonaws.com.https: Flags [.], ack 161, win 501, options [nop,nop,TS val 2534079285 ecr 3550007204], length 0
23:34:56.462230 IP s3-1-w.amazonaws.com.https > tatuya-latitudee6230.58994: Flags [P.], seq 161:167, ack 711, win 224, options [nop,nop,TS val 3550007205 ecr 2534079098], length 6
23:34:56.462233 IP s3-1-w.amazonaws.com.https > tatuya-latitudee6230.58994: Flags [P.], seq 167:214, ack 711, win 224, options [nop,nop,TS val 3550007205 ecr 2534079098], length 47
23:34:56.462234 IP s3-1-w.amazonaws.com.https > tatuya-latitudee6230.58994: Flags [.], seq 214:1642, ack 711, win 224, options [nop,nop,TS val 3550007205 ecr 2534079098], length 1428
23:34:56.462292 IP tatuya-latitudee6230.58994 > s3-1-w.amazonaws.com.https: Flags [.], ack 167, win 501, options [nop,nop,TS val 2534079286 ecr 3550007205], length 0
23:34:56.462310 IP tatuya-latitudee6230.58994 > s3-1-w.amazonaws.com.https: Flags [.], ack 214, win 501, options [nop,nop,TS val 2534079286 ecr 3550007205], length 0
23:34:56.462323 IP tatuya-latitudee6230.58994 > s3-1-w.amazonaws.com.https: Flags [.], ack 1642, win 524, options [nop,nop,TS val 2534079286 ecr 3550007205], length 0
23:34:56.462450 IP s3-1-w.amazonaws.com.https > tatuya-latitudee6230.58994: Flags [P.], seq 1642:3070, ack 711, win 224, options [nop,nop,TS val 3550007205 ecr 2534079098], length 1428
23:34:56.462454 IP s3-1-w.amazonaws.com.https > tatuya-latitudee6230.58994: Flags [P.], seq 3070:5216, ack 711, win 224, options [nop,nop,TS val 3550007205 ecr 2534079098], length 2146
23:34:56.462511 IP tatuya-latitudee6230.58994 > s3-1-w.amazonaws.com.https: Flags [.], ack 3070, win 546, options [nop,nop,TS val 2534079286 ecr 3550007205], length 0
23:34:56.462529 IP tatuya-latitudee6230.58994 > s3-1-w.amazonaws.com.https: Flags [.], ack 5216, win 580, options [nop,nop,TS val 2534079286 ecr 3550007205], length 0
23:34:56.462595 IP s3-1-w.amazonaws.com.https > tatuya-latitudee6230.58988: Flags [P.], seq 5216:5502, ack 711, win 224, options [nop,nop,TS val 1755211764 ecr 2534079095], length 286
23:34:56.462596 IP s3-1-w.amazonaws.com.https > tatuya-latitudee6230.58988: Flags [P.], seq 5502:5560, ack 711, win 224, options [nop,nop,TS val 1755211764 ecr 2534079095], length 58
23:34:56.462633 IP tatuya-latitudee6230.58988 > s3-1-w.amazonaws.com.https: Flags [.], ack 5502, win 602, options [nop,nop,TS val 2534079286 ecr 1755211764], length 0
23:34:56.462649 IP tatuya-latitudee6230.58988 > s3-1-w.amazonaws.com.https: Flags [.], ack 5560, win 602, options [nop,nop,TS val 2534079286 ecr 1755211764], length 0
23:34:56.465634 IP s3-1-w.amazonaws.com.https > tatuya-latitudee6230.58994: Flags [P.], seq 5216:5502, ack 711, win 224, options [nop,nop,TS val 3550007208 ecr 2534079098], length 286
23:34:56.465636 IP s3-1-w.amazonaws.com.https > tatuya-latitudee6230.58994: Flags [P.], seq 5502:5560, ack 711, win 224, options [nop,nop,TS val 3550007208 ecr 2534079098], length 58
23:34:56.465681 IP tatuya-latitudee6230.58994 > s3-1-w.amazonaws.com.https: Flags [.], ack 5502, win 602, options [nop,nop,TS val 2534079289 ecr 3550007208], length 0
23:34:56.465711 IP tatuya-latitudee6230.58994 > s3-1-w.amazonaws.com.https: Flags [.], ack 5560, win 602, options [nop,nop,TS val 2534079289 ecr 3550007208], length 0
23:34:56.477099 IP tatuya-latitudee6230.58988 > s3-1-w.amazonaws.com.https: Flags [P.], seq 711:775, ack 5560, win 602, options [nop,nop,TS val 2534079300 ecr 1755211764], length 64
23:34:56.478050 IP tatuya-latitudee6230.58994 > s3-1-w.amazonaws.com.https: Flags [P.], seq 711:775, ack 5560, win 602, options [nop,nop,TS val 2534079301 ecr 3550007208], length 64
23:34:56.478646 IP tatuya-latitudee6230.58988 > s3-1-w.amazonaws.com.https: Flags [P.], seq 775:3671, ack 5560, win 602, options [nop,nop,TS val 2534079302 ecr 1755211764], length 2896
23:34:56.478666 IP tatuya-latitudee6230.58988 > s3-1-w.amazonaws.com.https: Flags [P.], seq 3671:6567, ack 5560, win 602, options [nop,nop,TS val 2534079302 ecr 1755211764], length 2896
23:34:56.478721 IP tatuya-latitudee6230.58988 > s3-1-w.amazonaws.com.https: Flags [P.], seq 6567:9463, ack 5560, win 602, options [nop,nop,TS val 2534079302 ecr 1755211764], length 2896
23:34:56.478736 IP tatuya-latitudee6230.58988 > s3-1-w.amazonaws.com.https: Flags [P.], seq 9463:12359, ack 5560, win 602, options [nop,nop,TS val 2534079302 ecr 1755211764], length 2896
23:34:56.478813 IP tatuya-latitudee6230.58988 > s3-1-w.amazonaws.com.https: Flags [.], seq 12359:13807, ack 5560, win 602, options [nop,nop,TS val 2534079302 ecr 1755211764], length 1448
