23:47:54.355563 IP tatuya-latitudee6230.33358 > we.love.servers.at.ioflood.net.https: Flags [P.], seq 2242950103:2242950561, ack 2573492720, win 28553, options [nop,nop,TS val 2476601286 ecr 3487470568], length 458
23:47:54.512164 IP we.love.servers.at.ioflood.net.https > tatuya-latitudee6230.33358: Flags [.], seq 1:8689, ack 458, win 501, options [nop,nop,TS val 3487473797 ecr 2476601286], length 8688
23:47:54.512229 IP tatuya-latitudee6230.33358 > we.love.servers.at.ioflood.net.https: Flags [.], ack 8689, win 28542, options [nop,nop,TS val 2476601442 ecr 3487473797], length 0
23:47:54.512548 IP we.love.servers.at.ioflood.net.https > tatuya-latitudee6230.33358: Flags [.], seq 8689:13033, ack 458, win 501, options [nop,nop,TS val 3487473797 ecr 2476601286], length 4344
23:47:54.512601 IP tatuya-latitudee6230.33358 > we.love.servers.at.ioflood.net.https: Flags [.], ack 13033, win 28553, options [nop,nop,TS val 2476601443 ecr 3487473797], length 0
23:47:54.512635 IP we.love.servers.at.ioflood.net.https > tatuya-latitudee6230.33358: Flags [P.], seq 13033:16406, ack 458, win 501, options [nop,nop,TS val 3487473797 ecr 2476601286], length 3373
23:47:54.512648 IP tatuya-latitudee6230.33358 > we.love.servers.at.ioflood.net.https: Flags [.], ack 16406, win 28553, options [nop,nop,TS val 2476601443 ecr 3487473797], length 0
23:47:54.513310 IP we.love.servers.at.ioflood.net.https > tatuya-latitudee6230.33358: Flags [.], seq 16406:19302, ack 458, win 501, options [nop,nop,TS val 3487473797 ecr 2476601286], length 2896
23:47:54.513333 IP tatuya-latitudee6230.33358 > we.love.servers.at.ioflood.net.https: Flags [.], ack 19302, win 28553, options [nop,nop,TS val 2476601444 ecr 3487473797], length 0
23:47:54.513369 IP we.love.servers.at.ioflood.net.https > tatuya-latitudee6230.33358: Flags [.], seq 19302:25094, ack 458, win 501, options [nop,nop,TS val 3487473797 ecr 2476601286], length 5792
23:47:54.513383 IP tatuya-latitudee6230.33358 > we.love.servers.at.ioflood.net.https: Flags [.], ack 25094, win 28542, options [nop,nop,TS val 2476601444 ecr 3487473797], length 0
23:47:54.514195 IP we.love.servers.at.ioflood.net.https > tatuya-latitudee6230.33358: Flags [.], seq 25094:29438, ack 458, win 501, options [nop,nop,TS val 3487473798 ecr 2476601286], length 4344
23:47:54.514235 IP tatuya-latitudee6230.33358 > we.love.servers.at.ioflood.net.https: Flags [.], ack 29438, win 28553, options [nop,nop,TS val 2476601444 ecr 3487473798], length 0
23:47:54.514267 IP we.love.servers.at.ioflood.net.https > tatuya-latitudee6230.33358: Flags [P.], seq 29438:32811, ack 458, win 501, options [nop,nop,TS val 3487473798 ecr 2476601286], length 3373
23:47:54.514283 IP tatuya-latitudee6230.33358 > we.love.servers.at.ioflood.net.https: Flags [.], ack 32811, win 28542, options [nop,nop,TS val 2476601445 ecr 3487473798], length 0
23:47:54.524756 IP we.love.servers.at.ioflood.net.https > tatuya-latitudee6230.33358: Flags [.], seq 32811:41499, ack 458, win 501, options [nop,nop,TS val 3487473810 ecr 2476601286], length 8688
23:47:54.524894 IP tatuya-latitudee6230.33358 > we.love.servers.at.ioflood.net.https: Flags [.], ack 41499, win 28542, options [nop,nop,TS val 2476601455 ecr 3487473810], length 0
23:47:54.525089 IP we.love.servers.at.ioflood.net.https > tatuya-latitudee6230.33358: Flags [.], seq 41499:45843, ack 458, win 501, options [nop,nop,TS val 3487473810 ecr 2476601286], length 4344
23:47:54.525118 IP tatuya-latitudee6230.33358 > we.love.servers.at.ioflood.net.https: Flags [.], ack 45843, win 28509, options [nop,nop,TS val 2476601455 ecr 3487473810], length 0
23:47:54.525162 IP we.love.servers.at.ioflood.net.https > tatuya-latitudee6230.33358: Flags [P.], seq 45843:49216, ack 458, win 501, options [nop,nop,TS val 3487473810 ecr 2476601286], length 3373
23:47:54.525185 IP tatuya-latitudee6230.33358 > we.love.servers.at.ioflood.net.https: Flags [.], ack 49216, win 28483, options [nop,nop,TS val 2476601455 ecr 3487473810], length 0
23:47:54.525894 IP we.love.servers.at.ioflood.net.https > tatuya-latitudee6230.33358: Flags [.], seq 49216:52112, ack 458, win 501, options [nop,nop,TS val 3487473810 ecr 2476601286], length 2896
23:47:54.525958 IP tatuya-latitudee6230.33358 > we.love.servers.at.ioflood.net.https: Flags [.], ack 52112, win 28553, options [nop,nop,TS val 2476601456 ecr 3487473810], length 0
23:47:54.526034 IP we.love.servers.at.ioflood.net.https > tatuya-latitudee6230.33358: Flags [.], seq 52112:57904, ack 458, win 501, options [nop,nop,TS val 3487473810 ecr 2476601286], length 5792
23:47:54.526051 IP tatuya-latitudee6230.33358 > we.love.servers.at.ioflood.net.https: Flags [.], ack 57904, win 28542, options [nop,nop,TS val 2476601456 ecr 3487473810], length 0
23:47:54.526834 IP we.love.servers.at.ioflood.net.https > tatuya-latitudee6230.33358: Flags [.], seq 57904:66592, ack 458, win 501, options [nop,nop,TS val 3487473810 ecr 2476601286], length 8688
23:47:54.526880 IP tatuya-latitudee6230.33358 > we.love.servers.at.ioflood.net.https: Flags [.], ack 66592, win 28542, options [nop,nop,TS val 2476601457 ecr 3487473810], length 0
23:47:54.527939 IP we.love.servers.at.ioflood.net.https > tatuya-latitudee6230.33358: Flags [.], seq 66592:75280, ack 458, win 501, options [nop,nop,TS val 3487473811 ecr 2476601286], length 8688
23:47:54.527964 IP tatuya-latitudee6230.33358 > we.love.servers.at.ioflood.net.https: Flags [.], ack 75280, win 28542, options [nop,nop,TS val 2476601458 ecr 3487473811], length 0
23:47:54.528518 IP we.love.servers.at.ioflood.net.https > tatuya-latitudee6230.33358: Flags [.], seq 75280:76728, ack 458, win 501, options [nop,nop,TS val 3487473812 ecr 2476601286], length 1448
23:47:54.528528 IP tatuya-latitudee6230.33358 > we.love.servers.at.ioflood.net.https: Flags [.], ack 76728, win 28553, options [nop,nop,TS val 2476601459 ecr 3487473812], length 0
23:47:54.528570 IP we.love.servers.at.ioflood.net.https > tatuya-latitudee6230.33358: Flags [.], seq 76728:82520, ack 458, win 501, options [nop,nop,TS val 3487473812 ecr 2476601286], length 5792
23:47:54.528575 IP tatuya-latitudee6230.33358 > we.love.servers.at.ioflood.net.https: Flags [.], ack 82520, win 28553, options [nop,nop,TS val 2476601459 ecr 3487473812], length 0
23:47:54.528626 IP we.love.servers.at.ioflood.net.https > tatuya-latitudee6230.33358: Flags [.], seq 82520:83968, ack 458, win 501, options [nop,nop,TS val 3487473812 ecr 2476601286], length 1448
23:47:54.529384 IP we.love.servers.at.ioflood.net.https > tatuya-latitudee6230.33358: Flags [.], seq 83968:89760, ack 458, win 501, options [nop,nop,TS val 3487473813 ecr 2476601286], length 5792
23:47:54.529398 IP tatuya-latitudee6230.33358 > we.love.servers.at.ioflood.net.https: Flags [.], ack 89760, win 28553, options [nop,nop,TS val 2476601460 ecr 3487473812], length 0
23:47:54.529437 IP we.love.servers.at.ioflood.net.https > tatuya-latitudee6230.33358: Flags [.], seq 89760:92656, ack 458, win 501, options [nop,nop,TS val 3487473813 ecr 2476601286], length 2896
23:47:54.529445 IP tatuya-latitudee6230.33358 > we.love.servers.at.ioflood.net.https: Flags [.], ack 92656, win 28553, options [nop,nop,TS val 2476601460 ecr 3487473813], length 0
23:47:54.530308 IP we.love.servers.at.ioflood.net.https > tatuya-latitudee6230.33358: Flags [.], seq 92656:97000, ack 458, win 501, options [nop,nop,TS val 3487473814 ecr 2476601286], length 4344
23:47:54.530316 IP tatuya-latitudee6230.33358 > we.love.servers.at.ioflood.net.https: Flags [.], ack 97000, win 28553, options [nop,nop,TS val 2476601461 ecr 3487473814], length 0
23:47:54.530365 IP we.love.servers.at.ioflood.net.https > tatuya-latitudee6230.33358: Flags [P.], seq 97000:98431, ack 458, win 501, options [nop,nop,TS val 3487473814 ecr 2476601286], length 1431
23:47:54.530394 IP tatuya-latitudee6230.33358 > we.love.servers.at.ioflood.net.https: Flags [.], ack 98431, win 28553, options [nop,nop,TS val 2476601461 ecr 3487473814], length 0
23:47:54.544784 IP we.love.servers.at.ioflood.net.https > tatuya-latitudee6230.33358: Flags [.], seq 98431:107119, ack 458, win 501, options [nop,nop,TS val 3487473830 ecr 2476601286], length 8688
23:47:54.544899 IP tatuya-latitudee6230.33358 > we.love.servers.at.ioflood.net.https: Flags [.], ack 107119, win 28542, options [nop,nop,TS val 2476601475 ecr 3487473830], length 0
23:47:54.545192 IP we.love.servers.at.ioflood.net.https > tatuya-latitudee6230.33358: Flags [.], seq 107119:111463, ack 458, win 501, options [nop,nop,TS val 3487473830 ecr 2476601286], length 4344
23:47:54.545270 IP tatuya-latitudee6230.33358 > we.love.servers.at.ioflood.net.https: Flags [.], ack 111463, win 28553, options [nop,nop,TS val 2476601475 ecr 3487473830], length 0
23:47:54.545303 IP we.love.servers.at.ioflood.net.https > tatuya-latitudee6230.33358: Flags [P.], seq 111463:114836, ack 458, win 501, options [nop,nop,TS val 3487473830 ecr 2476601286], length 3373
23:47:54.545790 IP tatuya-latitudee6230.33358 > we.love.servers.at.ioflood.net.https: Flags [.], ack 114836, win 28553, options [nop,nop,TS val 2476601476 ecr 3487473830], length 0
23:47:54.546044 IP we.love.servers.at.ioflood.net.https > tatuya-latitudee6230.33358: Flags [.], seq 114836:119180, ack 458, win 501, options [nop,nop,TS val 3487473830 ecr 2476601286], length 4344
23:47:54.546086 IP tatuya-latitudee6230.33358 > we.love.servers.at.ioflood.net.https: Flags [.], ack 119180, win 28553, options [nop,nop,TS val 2476601476 ecr 3487473830], length 0
23:47:54.546163 IP we.love.servers.at.ioflood.net.https > tatuya-latitudee6230.33358: Flags [.], seq 119180:123524, ack 458, win 501, options [nop,nop,TS val 3487473830 ecr 2476601286], length 4344
23:47:54.546212 IP tatuya-latitudee6230.33358 > we.love.servers.at.ioflood.net.https: Flags [.], ack 123524, win 28542, options [nop,nop,TS val 2476601476 ecr 3487473830], length 0
23:47:54.546865 IP we.love.servers.at.ioflood.net.https > tatuya-latitudee6230.33358: Flags [.], seq 123524:127868, ack 458, win 501, options [nop,nop,TS val 3487473830 ecr 2476601286], length 4344
23:47:54.546912 IP tatuya-latitudee6230.33358 > we.love.servers.at.ioflood.net.https: Flags [.], ack 127868, win 28553, options [nop,nop,TS val 2476601477 ecr 3487473830], length 0
23:47:54.546936 IP we.love.servers.at.ioflood.net.https > tatuya-latitudee6230.33358: Flags [.], seq 127868:132212, ack 458, win 501, options [nop,nop,TS val 3487473830 ecr 2476601286], length 4344
23:47:54.547006 IP tatuya-latitudee6230.33358 > we.love.servers.at.ioflood.net.https: Flags [.], ack 132212, win 28542, options [nop,nop,TS val 2476601477 ecr 3487473830], length 0
23:47:54.547736 IP we.love.servers.at.ioflood.net.https > tatuya-latitudee6230.33358: Flags [.], seq 132212:135108, ack 458, win 501, options [nop,nop,TS val 3487473831 ecr 2476601286], length 2896
23:47:54.547840 IP tatuya-latitudee6230.33358 > we.love.servers.at.ioflood.net.https: Flags [.], ack 135108, win 28553, options [nop,nop,TS val 2476601478 ecr 3487473831], length 0
23:47:54.547894 IP we.love.servers.at.ioflood.net.https > tatuya-latitudee6230.33358: Flags [.], seq 135108:140900, ack 458, win 501, options [nop,nop,TS val 3487473831 ecr 2476601286], length 5792
23:47:54.547931 IP tatuya-latitudee6230.33358 > we.love.servers.at.ioflood.net.https: Flags [.], ack 140900, win 28553, options [nop,nop,TS val 2476601478 ecr 3487473831], length 0
23:47:54.548638 IP we.love.servers.at.ioflood.net.https > tatuya-latitudee6230.33358: Flags [.], seq 140900:145244, ack 458, win 501, options [nop,nop,TS val 3487473832 ecr 2476601286], length 4344
23:47:54.548678 IP tatuya-latitudee6230.33358 > we.love.servers.at.ioflood.net.https: Flags [.], ack 145244, win 28553, options [nop,nop,TS val 2476601479 ecr 3487473832], length 0
23:47:54.548697 IP we.love.servers.at.ioflood.net.https > tatuya-latitudee6230.33358: Flags [.], seq 145244:149588, ack 458, win 501, options [nop,nop,TS val 3487473832 ecr 2476601286], length 4344
23:47:54.548759 IP tatuya-latitudee6230.33358 > we.love.servers.at.ioflood.net.https: Flags [.], ack 149588, win 28542, options [nop,nop,TS val 2476601479 ecr 3487473832], length 0
23:47:54.549517 IP we.love.servers.at.ioflood.net.https > tatuya-latitudee6230.33358: Flags [.], seq 149588:153932, ack 458, win 501, options [nop,nop,TS val 3487473833 ecr 2476601286], length 4344
23:47:54.549557 IP tatuya-latitudee6230.33358 > we.love.servers.at.ioflood.net.https: Flags [.], ack 153932, win 28553, options [nop,nop,TS val 2476601480 ecr 3487473833], length 0
23:47:54.549578 IP we.love.servers.at.ioflood.net.https > tatuya-latitudee6230.33358: Flags [.], seq 153932:158276, ack 458, win 501, options [nop,nop,TS val 3487473833 ecr 2476601286], length 4344
23:47:54.549602 IP tatuya-latitudee6230.33358 > we.love.servers.at.ioflood.net.https: Flags [.], ack 158276, win 28553, options [nop,nop,TS val 2476601480 ecr 3487473833], length 0
23:47:54.550382 IP we.love.servers.at.ioflood.net.https > tatuya-latitudee6230.33358: Flags [.], seq 158276:162620, ack 458, win 501, options [nop,nop,TS val 3487473834 ecr 2476601286], length 4344
23:47:54.550416 IP tatuya-latitudee6230.33358 > we.love.servers.at.ioflood.net.https: Flags [.], ack 162620, win 28553, options [nop,nop,TS val 2476601481 ecr 3487473834], length 0
23:47:54.550461 IP we.love.servers.at.ioflood.net.https > tatuya-latitudee6230.33358: Flags [P.], seq 162620:164051, ack 458, win 501, options [nop,nop,TS val 3487473834 ecr 2476601286], length 1431
23:47:54.550495 IP tatuya-latitudee6230.33358 > we.love.servers.at.ioflood.net.https: Flags [.], ack 164051, win 28553, options [nop,nop,TS val 2476601481 ecr 3487473834], length 0
23:47:54.562356 IP we.love.servers.at.ioflood.net.https > tatuya-latitudee6230.33358: Flags [.], seq 164051:171291, ack 458, win 501, options [nop,nop,TS val 3487473847 ecr 2476601286], length 7240
23:47:54.562449 IP tatuya-latitudee6230.33358 > we.love.servers.at.ioflood.net.https: Flags [.], ack 171291, win 28553, options [nop,nop,TS val 2476601493 ecr 3487473847], length 0
23:47:54.562541 IP we.love.servers.at.ioflood.net.https > tatuya-latitudee6230.33358: Flags [P.], seq 171291:180456, ack 458, win 501, options [nop,nop,TS val 3487473847 ecr 2476601286], length 9165
23:47:54.562610 IP tatuya-latitudee6230.33358 > we.love.servers.at.ioflood.net.https: Flags [.], ack 180456, win 28482, options [nop,nop,TS val 2476601493 ecr 3487473847], length 0
23:47:54.563147 IP we.love.servers.at.ioflood.net.https > tatuya-latitudee6230.33358: Flags [.], seq 180456:184800, ack 458, win 501, options [nop,nop,TS val 3487473848 ecr 2476601286], length 4344
23:47:54.563168 IP tatuya-latitudee6230.33358 > we.love.servers.at.ioflood.net.https: Flags [.], ack 184800, win 28553, options [nop,nop,TS val 2476601493 ecr 3487473848], length 0
23:47:54.563228 IP we.love.servers.at.ioflood.net.https > tatuya-latitudee6230.33358: Flags [.], seq 184800:189144, ack 458, win 501, options [nop,nop,TS val 3487473848 ecr 2476601286], length 4344
23:47:54.563240 IP tatuya-latitudee6230.33358 > we.love.servers.at.ioflood.net.https: Flags [.], ack 189144, win 28553, options [nop,nop,TS val 2476601493 ecr 3487473848], length 0
23:47:54.564000 IP we.love.servers.at.ioflood.net.https > tatuya-latitudee6230.33358: Flags [.], seq 189144:194936, ack 458, win 501, options [nop,nop,TS val 3487473848 ecr 2476601286], length 5792
23:47:54.564019 IP tatuya-latitudee6230.33358 > we.love.servers.at.ioflood.net.https: Flags [.], ack 194936, win 28553, options [nop,nop,TS val 2476601494 ecr 3487473848], length 0
23:47:54.564049 IP we.love.servers.at.ioflood.net.https > tatuya-latitudee6230.33358: Flags [P.], seq 194936:196861, ack 458, win 501, options [nop,nop,TS val 3487473848 ecr 2476601286], length 1925
23:47:54.564060 IP tatuya-latitudee6230.33358 > we.love.servers.at.ioflood.net.https: Flags [.], ack 196861, win 28553, options [nop,nop,TS val 2476601494 ecr 3487473848], length 0
23:47:54.564763 IP we.love.servers.at.ioflood.net.https > tatuya-latitudee6230.33358: Flags [.], seq 196861:201205, ack 458, win 501, options [nop,nop,TS val 3487473848 ecr 2476601286], length 4344
23:47:54.564777 IP tatuya-latitudee6230.33358 > we.love.servers.at.ioflood.net.https: Flags [.], ack 201205, win 28553, options [nop,nop,TS val 2476601495 ecr 3487473848], length 0
23:47:54.564815 IP we.love.servers.at.ioflood.net.https > tatuya-latitudee6230.33358: Flags [.], seq 201205:205549, ack 458, win 501, options [nop,nop,TS val 3487473848 ecr 2476601286], length 4344
23:47:54.564825 IP tatuya-latitudee6230.33358 > we.love.servers.at.ioflood.net.https: Flags [.], ack 205549, win 28553, options [nop,nop,TS val 2476601495 ecr 3487473848], length 0
23:47:54.565602 IP we.love.servers.at.ioflood.net.https > tatuya-latitudee6230.33358: Flags [.], seq 205549:206997, ack 458, win 501, options [nop,nop,TS val 3487473848 ecr 2476601286], length 1448
23:47:54.565658 IP we.love.servers.at.ioflood.net.https > tatuya-latitudee6230.33358: Flags [.], seq 206997:212789, ack 458, win 501, options [nop,nop,TS val 3487473848 ecr 2476601286], length 5792
23:47:54.565668 IP tatuya-latitudee6230.33358 > we.love.servers.at.ioflood.net.https: Flags [.], ack 212789, win 28553, options [nop,nop,TS val 2476601496 ecr 3487473848], length 0
23:47:54.565717 IP we.love.servers.at.ioflood.net.https > tatuya-latitudee6230.33358: Flags [.], seq 212789:214237, ack 458, win 501, options [nop,nop,TS val 3487473848 ecr 2476601286], length 1448
23:47:54.566494 IP we.love.servers.at.ioflood.net.https > tatuya-latitudee6230.33358: Flags [.], seq 214237:217133, ack 458, win 501, options [nop,nop,TS val 3487473850 ecr 2476601286], length 2896
23:47:54.566507 IP tatuya-latitudee6230.33358 > we.love.servers.at.ioflood.net.https: Flags [.], ack 217133, win 28553, options [nop,nop,TS val 2476601497 ecr 3487473848], length 0
23:47:54.566542 IP we.love.servers.at.ioflood.net.https > tatuya-latitudee6230.33358: Flags [.], seq 217133:221477, ack 458, win 501, options [nop,nop,TS val 3487473850 ecr 2476601286], length 4344
23:47:54.566553 IP tatuya-latitudee6230.33358 > we.love.servers.at.ioflood.net.https: Flags [.], ack 221477, win 28553, options [nop,nop,TS val 2476601497 ecr 3487473850], length 0
23:47:54.566607 IP we.love.servers.at.ioflood.net.https > tatuya-latitudee6230.33358: Flags [.], seq 221477:222925, ack 458, win 501, options [nop,nop,TS val 3487473850 ecr 2476601286], length 1448
23:47:54.567382 IP we.love.servers.at.ioflood.net.https > tatuya-latitudee6230.33358: Flags [.], seq 222925:227269, ack 458, win 501, options [nop,nop,TS val 3487473851 ecr 2476601286], length 4344
23:47:54.567393 IP tatuya-latitudee6230.33358 > we.love.servers.at.ioflood.net.https: Flags [.], ack 227269, win 28553, options [nop,nop,TS val 2476601498 ecr 3487473850], length 0
23:47:54.567432 IP we.love.servers.at.ioflood.net.https > tatuya-latitudee6230.33358: Flags [P.], seq 227269:229671, ack 458, win 501, options [nop,nop,TS val 3487473851 ecr 2476601286], length 2402
23:47:54.567443 IP tatuya-latitudee6230.33358 > we.love.servers.at.ioflood.net.https: Flags [.], ack 229671, win 28553, options [nop,nop,TS val 2476601498 ecr 3487473851], length 0
23:47:54.582434 IP we.love.servers.at.ioflood.net.https > tatuya-latitudee6230.33358: Flags [.], seq 229671:236911, ack 458, win 501, options [nop,nop,TS val 3487473868 ecr 2476601286], length 7240
23:47:54.582460 IP tatuya-latitudee6230.33358 > we.love.servers.at.ioflood.net.https: Flags [.], ack 236911, win 28553, options [nop,nop,TS val 2476601513 ecr 3487473868], length 0
23:47:54.582480 IP we.love.servers.at.ioflood.net.https > tatuya-latitudee6230.33358: Flags [.], seq 236911:238359, ack 458, win 501, options [nop,nop,TS val 3487473868 ecr 2476601286], length 1448
23:47:54.582880 IP we.love.servers.at.ioflood.net.https > tatuya-latitudee6230.33358: Flags [.], seq 238359:242703, ack 458, win 501, options [nop,nop,TS val 3487473868 ecr 2476601286], length 4344
23:47:54.582900 IP tatuya-latitudee6230.33358 > we.love.servers.at.ioflood.net.https: Flags [.], ack 242703, win 28553, options [nop,nop,TS val 2476601513 ecr 3487473868], length 0
23:47:54.582918 IP we.love.servers.at.ioflood.net.https > tatuya-latitudee6230.33358: Flags [P.], seq 242703:246076, ack 458, win 501, options [nop,nop,TS val 3487473868 ecr 2476601286], length 3373
23:47:54.582929 IP tatuya-latitudee6230.33358 > we.love.servers.at.ioflood.net.https: Flags [.], ack 246076, win 28553, options [nop,nop,TS val 2476601513 ecr 3487473868], length 0
23:47:54.583629 IP we.love.servers.at.ioflood.net.https > tatuya-latitudee6230.33358: Flags [.], seq 246076:250420, ack 458, win 501, options [nop,nop,TS val 3487473868 ecr 2476601286], length 4344
23:47:54.583645 IP tatuya-latitudee6230.33358 > we.love.servers.at.ioflood.net.https: Flags [.], ack 250420, win 28553, options [nop,nop,TS val 2476601514 ecr 3487473868], length 0
23:47:54.583681 IP we.love.servers.at.ioflood.net.https > tatuya-latitudee6230.33358: Flags [.], seq 250420:254764, ack 458, win 501, options [nop,nop,TS val 3487473868 ecr 2476601286], length 4344
23:47:54.583691 IP tatuya-latitudee6230.33358 > we.love.servers.at.ioflood.net.https: Flags [.], ack 254764, win 28553, options [nop,nop,TS val 2476601514 ecr 3487473868], length 0
23:47:54.584296 IP tatuya-latitudee6230.48387 > bns1.hananet.net.domain: 63959+ PTR? 250.53.163.148.in-addr.arpa. (45)
23:47:54.584517 IP we.love.servers.at.ioflood.net.https > tatuya-latitudee6230.33358: Flags [.], seq 254764:257660, ack 458, win 501, options [nop,nop,TS val 3487473868 ecr 2476601286], length 2896
23:47:54.584541 IP tatuya-latitudee6230.33358 > we.love.servers.at.ioflood.net.https: Flags [.], ack 257660, win 28553, options [nop,nop,TS val 2476601515 ecr 3487473868], length 0
23:47:54.584568 IP we.love.servers.at.ioflood.net.https > tatuya-latitudee6230.33358: Flags [.], seq 257660:263452, ack 458, win 501, options [nop,nop,TS val 3487473868 ecr 2476601286], length 5792
23:47:54.584592 IP tatuya-latitudee6230.33358 > we.love.servers.at.ioflood.net.https: Flags [.], ack 263452, win 28553, options [nop,nop,TS val 2476601515 ecr 3487473868], length 0
23:47:54.585405 IP we.love.servers.at.ioflood.net.https > tatuya-latitudee6230.33358: Flags [.], seq 263452:267796, ack 458, win 501, options [nop,nop,TS val 3487473869 ecr 2476601286], length 4344
23:47:54.585429 IP tatuya-latitudee6230.33358 > we.love.servers.at.ioflood.net.https: Flags [.], ack 267796, win 28553, options [nop,nop,TS val 2476601516 ecr 3487473869], length 0
23:47:54.585453 IP we.love.servers.at.ioflood.net.https > tatuya-latitudee6230.33358: Flags [.], seq 267796:272140, ack 458, win 501, options [nop,nop,TS val 3487473869 ecr 2476601286], length 4344
23:47:54.585464 IP tatuya-latitudee6230.33358 > we.love.servers.at.ioflood.net.https: Flags [.], ack 272140, win 28553, options [nop,nop,TS val 2476601516 ecr 3487473869], length 0
23:47:54.586281 IP we.love.servers.at.ioflood.net.https > tatuya-latitudee6230.33358: Flags [.], seq 272140:276484, ack 458, win 501, options [nop,nop,TS val 3487473870 ecr 2476601286], length 4344
23:47:54.586303 IP tatuya-latitudee6230.33358 > we.love.servers.at.ioflood.net.https: Flags [.], ack 276484, win 28553, options [nop,nop,TS val 2476601517 ecr 3487473870], length 0
23:47:54.586362 IP we.love.servers.at.ioflood.net.https > tatuya-latitudee6230.33358: Flags [.], seq 276484:280828, ack 458, win 501, options [nop,nop,TS val 3487473870 ecr 2476601286], length 4344
23:47:54.586374 IP tatuya-latitudee6230.33358 > we.love.servers.at.ioflood.net.https: Flags [.], ack 280828, win 28553, options [nop,nop,TS val 2476601517 ecr 3487473870], length 0
23:47:54.587150 IP we.love.servers.at.ioflood.net.https > tatuya-latitudee6230.33358: Flags [.], seq 280828:285172, ack 458, win 501, options [nop,nop,TS val 3487473871 ecr 2476601286], length 4344
23:47:54.587176 IP tatuya-latitudee6230.33358 > we.love.servers.at.ioflood.net.https: Flags [.], ack 285172, win 28553, options [nop,nop,TS val 2476601517 ecr 3487473871], length 0
23:47:54.587198 IP we.love.servers.at.ioflood.net.https > tatuya-latitudee6230.33358: Flags [.], seq 285172:289516, ack 458, win 501, options [nop,nop,TS val 3487473871 ecr 2476601286], length 4344
23:47:54.587253 IP tatuya-latitudee6230.33358 > we.love.servers.at.ioflood.net.https: Flags [.], ack 289516, win 28553, options [nop,nop,TS val 2476601517 ecr 3487473871], length 0
23:47:54.588065 IP we.love.servers.at.ioflood.net.https > tatuya-latitudee6230.33358: Flags [P.], seq 289516:295291, ack 458, win 501, options [nop,nop,TS val 3487473871 ecr 2476601286], length 5775
23:47:54.588080 IP tatuya-latitudee6230.33358 > we.love.servers.at.ioflood.net.https: Flags [.], ack 295291, win 28553, options [nop,nop,TS val 2476601518 ecr 3487473871], length 0
23:47:54.594942 IP bns1.hananet.net.domain > tatuya-latitudee6230.48387: 63959 1/0/0 PTR we.love.servers.at.ioflood.net. (89)
23:47:54.602976 IP we.love.servers.at.ioflood.net.https > tatuya-latitudee6230.33358: Flags [.], seq 295291:301083, ack 458, win 501, options [nop,nop,TS val 3487473888 ecr 2476601286], length 5792
23:47:54.603016 IP tatuya-latitudee6230.33358 > we.love.servers.at.ioflood.net.https: Flags [.], ack 301083, win 28553, options [nop,nop,TS val 2476601533 ecr 3487473888], length 0
23:47:54.603036 IP we.love.servers.at.ioflood.net.https > tatuya-latitudee6230.33358: Flags [.], seq 301083:303979, ack 458, win 501, options [nop,nop,TS val 3487473888 ecr 2476601286], length 2896
23:47:54.603099 IP tatuya-latitudee6230.33358 > we.love.servers.at.ioflood.net.https: Flags [.], ack 303979, win 28542, options [nop,nop,TS val 2476601533 ecr 3487473888], length 0
23:47:54.603392 IP we.love.servers.at.ioflood.net.https > tatuya-latitudee6230.33358: Flags [.], seq 303979:308323, ack 458, win 501, options [nop,nop,TS val 3487473888 ecr 2476601286], length 4344
23:47:54.603408 IP tatuya-latitudee6230.33358 > we.love.servers.at.ioflood.net.https: Flags [.], ack 308323, win 28553, options [nop,nop,TS val 2476601534 ecr 3487473888], length 0
23:47:54.603444 IP we.love.servers.at.ioflood.net.https > tatuya-latitudee6230.33358: Flags [P.], seq 308323:311696, ack 458, win 501, options [nop,nop,TS val 3487473888 ecr 2476601286], length 3373
23:47:54.603469 IP tatuya-latitudee6230.33358 > we.love.servers.at.ioflood.net.https: Flags [.], ack 311696, win 28553, options [nop,nop,TS val 2476601534 ecr 3487473888], length 0
23:47:54.604158 IP we.love.servers.at.ioflood.net.https > tatuya-latitudee6230.33358: Flags [.], seq 311696:316040, ack 458, win 501, options [nop,nop,TS val 3487473888 ecr 2476601286], length 4344
23:47:54.604173 IP tatuya-latitudee6230.33358 > we.love.servers.at.ioflood.net.https: Flags [.], ack 316040, win 28553, options [nop,nop,TS val 2476601534 ecr 3487473888], length 0
23:47:54.604208 IP we.love.servers.at.ioflood.net.https > tatuya-latitudee6230.33358: Flags [.], seq 316040:320384, ack 458, win 501, options [nop,nop,TS val 3487473888 ecr 2476601286], length 4344
23:47:54.604225 IP tatuya-latitudee6230.33358 > we.love.servers.at.ioflood.net.https: Flags [.], ack 320384, win 28542, options [nop,nop,TS val 2476601534 ecr 3487473888], length 0
23:47:54.605044 IP we.love.servers.at.ioflood.net.https > tatuya-latitudee6230.33358: Flags [.], seq 320384:324728, ack 458, win 501, options [nop,nop,TS val 3487473888 ecr 2476601286], length 4344
23:47:54.605055 IP tatuya-latitudee6230.33358 > we.love.servers.at.ioflood.net.https: Flags [.], ack 324728, win 28553, options [nop,nop,TS val 2476601535 ecr 3487473888], length 0
23:47:54.605094 IP we.love.servers.at.ioflood.net.https > tatuya-latitudee6230.33358: Flags [.], seq 324728:329072, ack 458, win 501, options [nop,nop,TS val 3487473888 ecr 2476601286], length 4344
23:47:54.605101 IP tatuya-latitudee6230.33358 > we.love.servers.at.ioflood.net.https: Flags [.], ack 329072, win 28553, options [nop,nop,TS val 2476601535 ecr 3487473888], length 0
23:47:54.605948 IP we.love.servers.at.ioflood.net.https > tatuya-latitudee6230.33358: Flags [.], seq 329072:334864, ack 458, win 501, options [nop,nop,TS val 3487473889 ecr 2476601286], length 5792
23:47:54.606004 IP tatuya-latitudee6230.33358 > we.love.servers.at.ioflood.net.https: Flags [.], ack 334864, win 28553, options [nop,nop,TS val 2476601536 ecr 3487473889], length 0
23:47:54.606041 IP we.love.servers.at.ioflood.net.https > tatuya-latitudee6230.33358: Flags [.], seq 334864:337760, ack 458, win 501, options [nop,nop,TS val 3487473889 ecr 2476601286], length 2896
23:47:54.606113 IP tatuya-latitudee6230.33358 > we.love.servers.at.ioflood.net.https: Flags [.], ack 337760, win 28553, options [nop,nop,TS val 2476601536 ecr 3487473889], length 0
23:47:54.606870 IP we.love.servers.at.ioflood.net.https > tatuya-latitudee6230.33358: Flags [.], seq 337760:343552, ack 458, win 501, options [nop,nop,TS val 3487473890 ecr 2476601286], length 5792
23:47:54.606967 IP tatuya-latitudee6230.33358 > we.love.servers.at.ioflood.net.https: Flags [.], ack 343552, win 28553, options [nop,nop,TS val 2476601537 ecr 3487473890], length 0
23:47:54.606992 IP we.love.servers.at.ioflood.net.https > tatuya-latitudee6230.33358: Flags [.], seq 343552:346448, ack 458, win 501, options [nop,nop,TS val 3487473890 ecr 2476601286], length 2896
23:47:54.607174 IP tatuya-latitudee6230.33358 > we.love.servers.at.ioflood.net.https: Flags [.], ack 346448, win 28542, options [nop,nop,TS val 2476601537 ecr 3487473890], length 0
23:47:54.607765 IP we.love.servers.at.ioflood.net.https > tatuya-latitudee6230.33358: Flags [.], seq 346448:355136, ack 458, win 501, options [nop,nop,TS val 3487473891 ecr 2476601286], length 8688
23:47:54.607877 IP tatuya-latitudee6230.33358 > we.love.servers.at.ioflood.net.https: Flags [.], ack 355136, win 28542, options [nop,nop,TS val 2476601538 ecr 3487473891], length 0
23:47:54.608602 IP we.love.servers.at.ioflood.net.https > tatuya-latitudee6230.33358: Flags [P.], seq 355136:360911, ack 458, win 501, options [nop,nop,TS val 3487473892 ecr 2476601286], length 5775
23:47:54.608641 IP tatuya-latitudee6230.33358 > we.love.servers.at.ioflood.net.https: Flags [.], ack 360911, win 28553, options [nop,nop,TS val 2476601539 ecr 3487473892], length 0
23:47:54.623611 IP we.love.servers.at.ioflood.net.https > tatuya-latitudee6230.33358: Flags [.], seq 360911:369599, ack 458, win 501, options [nop,nop,TS val 3487473909 ecr 2476601286], length 8688
23:47:54.623886 IP tatuya-latitudee6230.33358 > we.love.servers.at.ioflood.net.https: Flags [.], ack 369599, win 28542, options [nop,nop,TS val 2476601554 ecr 3487473909], length 0
23:47:54.624042 IP we.love.servers.at.ioflood.net.https > tatuya-latitudee6230.33358: Flags [P.], seq 369599:377316, ack 458, win 501, options [nop,nop,TS val 3487473909 ecr 2476601286], length 7717
23:47:54.624082 IP tatuya-latitudee6230.33358 > we.love.servers.at.ioflood.net.https: Flags [.], ack 377316, win 28542, options [nop,nop,TS val 2476601554 ecr 3487473909], length 0
23:47:54.624748 IP we.love.servers.at.ioflood.net.https > tatuya-latitudee6230.33358: Flags [.], seq 377316:383108, ack 458, win 501, options [nop,nop,TS val 3487473909 ecr 2476601286], length 5792
23:47:54.624787 IP tatuya-latitudee6230.33358 > we.love.servers.at.ioflood.net.https: Flags [.], ack 383108, win 28553, options [nop,nop,TS val 2476601555 ecr 3487473909], length 0
23:47:54.624860 IP we.love.servers.at.ioflood.net.https > tatuya-latitudee6230.33358: Flags [.], seq 383108:386004, ack 458, win 501, options [nop,nop,TS val 3487473909 ecr 2476601286], length 2896
23:47:54.624876 IP tatuya-latitudee6230.33358 > we.love.servers.at.ioflood.net.https: Flags [.], ack 386004, win 28553, options [nop,nop,TS val 2476601555 ecr 3487473909], length 0
23:47:54.625652 IP we.love.servers.at.ioflood.net.https > tatuya-latitudee6230.33358: Flags [.], seq 386004:394692, ack 458, win 501, options [nop,nop,TS val 3487473909 ecr 2476601286], length 8688
23:47:54.625744 IP tatuya-latitudee6230.33358 > we.love.servers.at.ioflood.net.https: Flags [.], ack 394692, win 28542, options [nop,nop,TS val 2476601556 ecr 3487473909], length 0
23:47:54.626500 IP we.love.servers.at.ioflood.net.https > tatuya-latitudee6230.33358: Flags [.], seq 394692:401932, ack 458, win 501, options [nop,nop,TS val 3487473910 ecr 2476601286], length 7240
23:47:54.626527 IP tatuya-latitudee6230.33358 > we.love.servers.at.ioflood.net.https: Flags [.], ack 401932, win 28553, options [nop,nop,TS val 2476601557 ecr 3487473910], length 0
23:47:54.626544 IP we.love.servers.at.ioflood.net.https > tatuya-latitudee6230.33358: Flags [.], seq 401932:403380, ack 458, win 501, options [nop,nop,TS val 3487473910 ecr 2476601286], length 1448
23:47:54.627374 IP we.love.servers.at.ioflood.net.https > tatuya-latitudee6230.33358: Flags [.], seq 403380:406276, ack 458, win 501, options [nop,nop,TS val 3487473911 ecr 2476601286], length 2896
23:47:54.627402 IP tatuya-latitudee6230.33358 > we.love.servers.at.ioflood.net.https: Flags [.], ack 406276, win 28553, options [nop,nop,TS val 2476601558 ecr 3487473910], length 0
23:47:54.627421 IP we.love.servers.at.ioflood.net.https > tatuya-latitudee6230.33358: Flags [.], seq 406276:412068, ack 458, win 501, options [nop,nop,TS val 3487473911 ecr 2476601286], length 5792
23:47:54.627474 IP tatuya-latitudee6230.33358 > we.love.servers.at.ioflood.net.https: Flags [.], ack 412068, win 28542, options [nop,nop,TS val 2476601558 ecr 3487473911], length 0
23:47:54.628239 IP we.love.servers.at.ioflood.net.https > tatuya-latitudee6230.33358: Flags [.], seq 412068:417860, ack 458, win 501, options [nop,nop,TS val 3487473912 ecr 2476601286], length 5792
23:47:54.628285 IP tatuya-latitudee6230.33358 > we.love.servers.at.ioflood.net.https: Flags [.], ack 417860, win 28553, options [nop,nop,TS val 2476601558 ecr 3487473912], length 0
23:47:54.628308 IP we.love.servers.at.ioflood.net.https > tatuya-latitudee6230.33358: Flags [.], seq 417860:420756, ack 458, win 501, options [nop,nop,TS val 3487473912 ecr 2476601286], length 2896
23:47:54.628346 IP tatuya-latitudee6230.33358 > we.love.servers.at.ioflood.net.https: Flags [.], ack 420756, win 28553, options [nop,nop,TS val 2476601559 ecr 3487473912], length 0
23:47:54.629135 IP we.love.servers.at.ioflood.net.https > tatuya-latitudee6230.33358: Flags [.], seq 420756:425100, ack 458, win 501, options [nop,nop,TS val 3487473913 ecr 2476601286], length 4344
23:47:54.629172 IP tatuya-latitudee6230.33358 > we.love.servers.at.ioflood.net.https: Flags [.], ack 425100, win 28553, options [nop,nop,TS val 2476601559 ecr 3487473913], length 0
23:47:54.629224 IP we.love.servers.at.ioflood.net.https > tatuya-latitudee6230.33358: Flags [P.], seq 425100:426531, ack 458, win 501, options [nop,nop,TS val 3487473913 ecr 2476601286], length 1431
23:47:54.629301 IP tatuya-latitudee6230.33358 > we.love.servers.at.ioflood.net.https: Flags [.], ack 426531, win 28553, options [nop,nop,TS val 2476601560 ecr 3487473913], length 0
23:47:54.643741 IP we.love.servers.at.ioflood.net.https > tatuya-latitudee6230.33358: Flags [.], seq 426531:435219, ack 458, win 501, options [nop,nop,TS val 3487473929 ecr 2476601286], length 8688
23:47:54.644022 IP tatuya-latitudee6230.33358 > we.love.servers.at.ioflood.net.https: Flags [.], ack 435219, win 28542, options [nop,nop,TS val 2476601574 ecr 3487473929], length 0
23:47:54.644161 IP we.love.servers.at.ioflood.net.https > tatuya-latitudee6230.33358: Flags [P.], seq 435219:442936, ack 458, win 501, options [nop,nop,TS val 3487473929 ecr 2476601286], length 7717
23:47:54.644212 IP tatuya-latitudee6230.33358 > we.love.servers.at.ioflood.net.https: Flags [.], ack 442936, win 28542, options [nop,nop,TS val 2476601574 ecr 3487473929], length 0
23:47:54.644872 IP we.love.servers.at.ioflood.net.https > tatuya-latitudee6230.33358: Flags [.], seq 442936:445832, ack 458, win 501, options [nop,nop,TS val 3487473929 ecr 2476601286], length 2896
23:47:54.644917 IP tatuya-latitudee6230.33358 > we.love.servers.at.ioflood.net.https: Flags [.], ack 445832, win 28553, options [nop,nop,TS val 2476601575 ecr 3487473929], length 0
23:47:54.644971 IP we.love.servers.at.ioflood.net.https > tatuya-latitudee6230.33358: Flags [.], seq 445832:451624, ack 458, win 501, options [nop,nop,TS val 3487473929 ecr 2476601286], length 5792
23:47:54.645015 IP tatuya-latitudee6230.33358 > we.love.servers.at.ioflood.net.https: Flags [.], ack 451624, win 28553, options [nop,nop,TS val 2476601575 ecr 3487473929], length 0
23:47:54.645734 IP we.love.servers.at.ioflood.net.https > tatuya-latitudee6230.33358: Flags [.], seq 451624:455968, ack 458, win 501, options [nop,nop,TS val 3487473929 ecr 2476601286], length 4344
23:47:54.645753 IP tatuya-latitudee6230.33358 > we.love.servers.at.ioflood.net.https: Flags [.], ack 455968, win 28553, options [nop,nop,TS val 2476601576 ecr 3487473929], length 0
23:47:54.645789 IP we.love.servers.at.ioflood.net.https > tatuya-latitudee6230.33358: Flags [.], seq 455968:460312, ack 458, win 501, options [nop,nop,TS val 3487473929 ecr 2476601286], length 4344
23:47:54.645800 IP tatuya-latitudee6230.33358 > we.love.servers.at.ioflood.net.https: Flags [.], ack 460312, win 28553, options [nop,nop,TS val 2476601576 ecr 3487473929], length 0
23:47:54.646609 IP we.love.servers.at.ioflood.net.https > tatuya-latitudee6230.33358: Flags [.], seq 460312:463208, ack 458, win 501, options [nop,nop,TS val 3487473930 ecr 2476601286], length 2896
23:47:54.646622 IP tatuya-latitudee6230.33358 > we.love.servers.at.ioflood.net.https: Flags [.], ack 463208, win 28553, options [nop,nop,TS val 2476601577 ecr 3487473930], length 0
23:47:54.646666 IP we.love.servers.at.ioflood.net.https > tatuya-latitudee6230.33358: Flags [.], seq 463208:467552, ack 458, win 501, options [nop,nop,TS val 3487473930 ecr 2476601286], length 4344
23:47:54.646677 IP tatuya-latitudee6230.33358 > we.love.servers.at.ioflood.net.https: Flags [.], ack 467552, win 28553, options [nop,nop,TS val 2476601577 ecr 3487473930], length 0
23:47:54.646721 IP we.love.servers.at.ioflood.net.https > tatuya-latitudee6230.33358: Flags [.], seq 467552:469000, ack 458, win 501, options [nop,nop,TS val 3487473930 ecr 2476601286], length 1448
23:47:54.647522 IP we.love.servers.at.ioflood.net.https > tatuya-latitudee6230.33358: Flags [.], seq 469000:473344, ack 458, win 501, options [nop,nop,TS val 3487473931 ecr 2476601286], length 4344
23:47:54.647540 IP tatuya-latitudee6230.33358 > we.love.servers.at.ioflood.net.https: Flags [.], ack 473344, win 28553, options [nop,nop,TS val 2476601578 ecr 3487473930], length 0
23:47:54.647603 IP we.love.servers.at.ioflood.net.https > tatuya-latitudee6230.33358: Flags [.], seq 473344:477688, ack 458, win 501, options [nop,nop,TS val 3487473931 ecr 2476601286], length 4344
23:47:54.647613 IP tatuya-latitudee6230.33358 > we.love.servers.at.ioflood.net.https: Flags [.], ack 477688, win 28553, options [nop,nop,TS val 2476601578 ecr 3487473931], length 0
23:47:54.648403 IP we.love.servers.at.ioflood.net.https > tatuya-latitudee6230.33358: Flags [.], seq 477688:484928, ack 458, win 501, options [nop,nop,TS val 3487473932 ecr 2476601286], length 7240
23:47:54.648421 IP tatuya-latitudee6230.33358 > we.love.servers.at.ioflood.net.https: Flags [.], ack 484928, win 28553, options [nop,nop,TS val 2476601579 ecr 3487473932], length 0
23:47:54.648440 IP we.love.servers.at.ioflood.net.https > tatuya-latitudee6230.33358: Flags [.], seq 484928:486376, ack 458, win 501, options [nop,nop,TS val 3487473932 ecr 2476601286], length 1448
23:47:54.649265 IP we.love.servers.at.ioflood.net.https > tatuya-latitudee6230.33358: Flags [P.], seq 486376:492151, ack 458, win 501, options [nop,nop,TS val 3487473933 ecr 2476601286], length 5775
23:47:54.649282 IP tatuya-latitudee6230.33358 > we.love.servers.at.ioflood.net.https: Flags [.], ack 492151, win 28553, options [nop,nop,TS val 2476601580 ecr 3487473932], length 0
